SEG_ID	Doc	Source	Tagged_Source	Target	MT	Tagged_Target	Error Category	Severity	Annotator_ID
4	doc61	Length of asylum process and duration of stay was found to be the most frequently cited factor for mental health difficulties in 9 out of 22 studies.		Se descubrió que la duración del proceso de asilo y la duración de la estancia eran los factores más citados para explicar las dificultades de salud mental en 9 de los 22 estudios.					5506982
5	doc61	Contrary to expectation, residency or legal status was posited as a marker for other explanatory variables, including loneliness, discrimination and communication or language problems, rather than being an explanatory variable itself.		Contrariamente a lo esperado, la residencia o la condición jurídica se planteó como un indicador de otras variables explicativas, como la soledad, la discriminación y los problemas de comunicación o lingüísticos, en lugar de ser una variable explicativa en sí misma.		Contrariamente a lo esperado, la residencia o la condición jurídica se planteó como un indicador de otras variables explicativas, como la soledad, la discriminación y los problemas de comunicación o <tag>lingüísticos</tag>, en lugar de ser una variable explicativa en sí misma.	Accuracy - Mistranslation	Minor	5506982
6	doc61	However, in line with previous findings and as hypothesised in this review, there were statistically significant correlations found between family life, family separation and mental health outcomes.		Sin embargo, de acuerdo con hallazgos previos y como se plantea en esta revisión, se encontraron correlaciones estadísticamente significativas entre la vida familiar, la separación familiar y los resultados de salud mental.					5506982
1	doc63	Fifty percent of muscle-invasive bladder cancer (MIBC) patients succumb from metastatic disease despite radical cystectomy (RC).		El cincuenta por ciento de los pacientes con cáncer de vejiga con invasión muscular (CVMI) sucumben por enfermedad metastásica a pesar de la cistectomía radical (CR).		El cincuenta por ciento de los pacientes con cáncer de vejiga con invasión muscular (<tag>CVMI</tag>) sucumben por enfermedad metastásica a pesar de la cistectomía radical (CR).	Terminology - Wrong term	Major	5506982
2	doc63	Neoadjuvant chemotherapy (NAC) and adjuvant chemotherapy (ACT) randomized clinical trials (RCT) investigated whether peri-operative chemotherapy improves survival.		Los ensayos clínicos aleatorizados (ECA) de quimioterapia neoadyuvante (NAC) y quimioterapia adyuvante (ACT) investigaron si la quimioterapia perioperatoria mejora la supervivencia.		Los ensayos clínicos aleatorizados (ECA) de quimioterapia neoadyuvante (<tag>NAC</tag>) y quimioterapia adyuvante (ACT) investigaron si la quimioterapia perioperatoria mejora la supervivencia.	Terminology - Wrong term	Critical	5506982
2	doc63	Neoadjuvant chemotherapy (NAC) and adjuvant chemotherapy (ACT) randomized clinical trials (RCT) investigated whether peri-operative chemotherapy improves survival.		Los ensayos clínicos aleatorizados (ECA) de quimioterapia neoadyuvante (NAC) y quimioterapia adyuvante (ACT) investigaron si la quimioterapia perioperatoria mejora la supervivencia.		Los ensayos clínicos aleatorizados (ECA) de quimioterapia neoadyuvante (NAC) y quimioterapia adyuvante (<tag>ACT</tag>) investigaron si la quimioterapia perioperatoria mejora la supervivencia.	Terminology - Wrong term	Critical	5506982
3	doc63	More recently, immune checkpoint inhibitors (ICI) are explored as peri-operative single agent, ICI-ICI or ICI-chemotherapy combinations.		Más recientemente, los inhibidores de puntos de control inmunitarios (ICI, por sus siglas en inglés) se exploran como agentes únicos perioperatorios, combinaciones ICI-ICI o ICI-quimioterapia.					5506982
4	doc63	Our goal is to provide the status of neoadjuvant and adjuvant treatment in MIBC.		Nuestro objetivo es proporcionar el estado del tratamiento neoadyuvante y adyuvante en CVMI.					5506982
5	doc63	The literature on NAC and ACT trials in MIBC was reviewed.		Se revisó la literatura sobre ensayos de NAC y ACT en CVMI.		Se revisó la literatura sobre ensayos de NAC y <tag>ACT</tag> en CVMI.	Terminology - Wrong term	Major	5506982
5	doc63	The literature on NAC and ACT trials in MIBC was reviewed.		Se revisó la literatura sobre ensayos de NAC y ACT en CVMI.		Se revisó la literatura sobre ensayos de <tag>NAC</tag> y ACT en CVMI.	Terminology - Wrong term	Major	5506982
6	doc63	Since the 1980s, NAC RCTs were performed in cisplatin-fit patients, mainly using cisplatin combination chemotherapy.		Desde la década de 1980, los ECA NAC se realizaron en pacientes aptos para cisplatino, principalmente mediante quimioterapia de combinación con cisplatino.		Desde la década de 1980, los ECA <tag>NAC</tag> se realizaron en pacientes aptos para cisplatino, principalmente mediante quimioterapia de combinación con cisplatino.	Terminology - Wrong term	Critical	5506982
7	doc63	Meta-analyses indicated a small, but significant 5% improvement in overall survival in T2-T4N0M0 MIBC patients.		Los metanálisis indicaron una mejoría pequeña, pero significativa, del 5 % en la supervivencia general en pacientes con CVMI T2-T4N0M0.					5506982
8	doc63	Mostly MVAC or gemcitabine-cisplatin (GC) regimens were used without clear benefit of one regimen over the other.		La mayoría de los regímenes de MVAC o gemcitabina-cisplatino (GC) se usaron sin un beneficio claro de un régimen sobre el otro.					5506982
9	doc63	NAC value in N+MIBC is not established and predictive value of associated~25-40% complete downstaging (pathologically confirmed complete regression, pCR) not unequivocally demonstrated.		El valor de NAC en el N+CVMI no está establecido y el valor predictivo de la reducción completa asociada (regresión completa confirmada patológicamente, PCR) no se ha demostrado de manera inequívoca.		El valor de <tag>NAC</tag> en el N+CVMI no está establecido y el valor predictivo de la reducción completa asociada (regresión completa confirmada patológicamente, PCR) no se ha demostrado de manera inequívoca.	Terminology - Wrong term	Major	5506982
9	doc63	NAC value in N+MIBC is not established and predictive value of associated~25-40% complete downstaging (pathologically confirmed complete regression, pCR) not unequivocally demonstrated.	NAC value in N+MIBC is not established and predictive value of <tag>associated~25-40%</tag> complete downstaging (pathologically confirmed complete regression, pCR) not unequivocally demonstrated.	El valor de NAC en el N+CVMI no está establecido y el valor predictivo de la reducción completa asociada (regresión completa confirmada patológicamente, PCR) no se ha demostrado de manera inequívoca.			Accuracy - Omission	Critical	5506982
10	doc63	Adjuvant cisplatin-based chemotherapy RCTs were smaller, some prematurely stopped for poor accrual, and underpowered to demonstrate clear statistical evidence for a 5% overall survival advantage in pT3-T4N1-3M0 MIBC.		Los ECA de quimioterapia adyuvante basada en cisplatino fueron más pequeños, algunos se interrumpieron prematuramente debido a una escasa participación, y no tuvieron la potencia suficiente para demostrar pruebas estadísticas claras de una ventaja de supervivencia global del 5 % en el CVMI pT3-T4N1-3M0.					5506982
11	doc63	Novel neoadjuvant immune checkpoint inhibitors, alone or with chemotherapy, phase 2 trials demonstrate down staging and encouraging clinical results.		Nuevos inhibidores neoadyuvantes del punto de control inmunitario, solos o con quimioterapia, los ensayos de fase 2 demuestran una estadificación descendente y resultados clínicos alentadores.					5506982
12	doc63	Neoadjuvant MVAC or GC in cT2-T4N0 MIBC patients fit for cisplatin is still recommended based on OS benefit shown in meta-analyses, butreal-world adherence to NAC is low as ~40-50% ofpatients are unfit for cisplatin.		La administración neoadyuvante de MVAC o GC en pacientes con CVMI cT2-T4N0 aptos para cisplatino se sigue recomendando por el beneficio en SG mostrado en los metaanálisis, pero la adherencia al NAC en el mundo real es baja, ya que ~40-50 % de los pacientes no son aptos para cisplatino.					5506982
13	doc63	The value of neoadjuvant treatment in node-positive MIBC is not clearly demonstrated requiring more accurate clinical staging and prospective studies.		El valor del tratamiento neoadyuvante en la CVMI con ganglios positivos no está claramente demostrado, lo que requiere una estadificación clínica más precisa y estudios prospectivos.					5506982
14	doc63	Adjuvant cisplatin-based chemotherapy may be considered in selected, chemo-naïve pT3-T4N+patients.		Se puede considerar la quimioterapia adyuvante basada en cisplatino en pacientes pT3-T4N+ seleccionados y sin tratamiento previo con quimioterapia.		Se puede considerar la quimioterapia adyuvante basada en cisplatino en <tag>pacientes pT3-T4N+ seleccionados y sin tratamiento previo con quimioterapia.</tag>	Terminology - Inconsistent use of terminology	Major	5658994
15	doc63	Results from prospective checkpoint inhibitor immunotherapy RCTs are needed before immunotherapy becomes a recommended alternative for peri-operative treatment.		Se necesitan resultados de ECA prospectivos de inmunoterapia con inhibidores de puntos de control antes de que la inmunoterapia se convierta en una alternativa recomendada para el tratamiento perioperatorio.					5658994
16	doc63	Molecular tumour subtyping will support selecting novel agents for neoadjuvant or adjuvant strategies.		La subtipificación de tumores moleculares apoyará la selección de nuevos agentes para estrategias neoadyuvantes o adyuvantes.					5658994
1	doc65	A child's disclosure of sexual victimization is a difficult experience for parents and has been associated with traumatization, disbelief, denial, self-blame, and clinical difficulties.		La revelación de un niño de la victimización sexual es una experiencia difícil para los padres y se ha asociado con traumatización, incredulidad, negación, culpa propia y dificultades clínicas.					5658994
2	doc65	To date, most studies on parents' responses have been quantitative assessments of the psychological impact of disclosure on parents.		Hasta la fecha, la mayoría de los estudios sobre las respuestas de los padres han sido evaluaciones cuantitativas del impacto psicológico de la revelación en los padres.					5658994
3	doc65	A paucity of research has qualitatively explored mothers' experiences of their child's disclosure of child sexual abuse (CSA) and fathers' experiences have been even further neglected.		Son pocas las investigaciones que han explorado cualitativamente las experiencias de las madres en relación con la revelación por parte de sus hijos del abuso sexual infantil (CSA) y las experiencias de los padres se han descuidado aún más.		Son pocas las investigaciones que han explorado cualitativamente las experiencias de las madres en relación con la revelación por parte de sus hijos del abuso sexual infantil (<tag>CSA</tag>) y las experiencias de los padres se han descuidado aún más.	Accuracy - Untranslated	Neutral	5658994
4	doc65	The current study seeks to characterize parents' experiences of their child's disclosure of CSA and to uncover the process-oriented nature of parental responses.		El estudio actual busca caracterizar las experiencias de los padres sobre la revelación de CSA de sus hijos y descubrir la naturaleza orientada al proceso de las respuestas de los padres.		El estudio actual busca caracterizar las experiencias de los padres sobre la revelación de <tag>CSA</tag> de sus hijos y descubrir la naturaleza orientada al proceso de las respuestas de los padres.	Accuracy - Untranslated	Neutral	5658994
4	doc65	The current study seeks to characterize parents' experiences of their child's disclosure of CSA and to uncover the process-oriented nature of parental responses.		El estudio actual busca caracterizar las experiencias de los padres sobre la revelación de CSA de sus hijos y descubrir la naturaleza orientada al proceso de las respuestas de los padres.		El estudio actual busca caracterizar las experiencias de los padres sobre la revelación de CSA de sus hijos y descubrir la <tag>naturaleza</tag> orientada al proceso de las respuestas de los padres.	Terminology - Wrong term	Minor	5658994
5	doc65	This qualitative study, using a grounded theory approach to analysis, involved interviews with 10 mothers and four fathers whose children (3-18 years) had experienced sexual abuse.		Este estudio cualitativo, utilizando un enfoque teórico fundamentado para el análisis, incluyó entrevistas con 10 madres y cuatro padres cuyos hijos (3-18 años) habían experimentado abuso sexual.					5658994
6	doc65	Three themes emerged from the analysis.		Del análisis surgieron tres temas.					5658994
7	doc65	The first theme-making sense of the abuse in retrospect-captured the process through which parents sought to make sense of their child's disclosure, focusing on why their child had not disclosed the abuse to them earlier, and how they had noticed something was wrong but misattributed their child's behavior to other factors.		El primer tema, el sentido del abuso en retrospectiva, capturó el proceso a través del cual los padres buscaron dar sentido a la revelación de su hijo, centrándose en por qué su hijo no les había revelado el abuso antes y cómo habían notado que algo andaba mal, pero atribuyeron erróneamente el comportamiento de su hijo a otros factores.		El primer tema, <tag>el sentido del abuso en retrospectiva</tag>, capturó el proceso a través del cual los padres buscaron dar sentido a la revelación de su hijo, centrándose en por qué su hijo no les había revelado el abuso antes y cómo habían notado que algo andaba mal, pero atribuyeron erróneamente el comportamiento de su hijo a otros factores.	Style - Non-fluent	Minor	5658994
8	doc65	The second theme-negotiating parental identity as protector-reflected how parents' identity as a protector was challenged, their perception of their world had been forever altered, and they now experienced themselves as hypervigilant and overprotective.		El segundo tema, la negociación de la identidad de los padres como protectores, reflejaba cómo se cuestionaba la identidad de los padres como protectores, su percepción del mundo se había alterado para siempre y ahora se sentían hipervigilantes y sobreprotectores.					5658994
9	doc65	The final theme-navigating the services-pertained to parents' struggle in navigating child protection and police services, and feelings of being isolated and alone.		El tema final, navegar por los servicios, se refería a la lucha de los padres para navegar por los servicios policiales y de protección infantil, y los sentimientos de estar aislados y solos.		El tema final, <tag>navegar por</tag> los servicios, se refería a la lucha de los padres para navegar por los servicios policiales y de protección infantil, y los sentimientos de estar aislados y solos.	Style - Non-fluent	Minor	5658994
9	doc65	The final theme-navigating the services-pertained to parents' struggle in navigating child protection and police services, and feelings of being isolated and alone.		El tema final, navegar por los servicios, se refería a la lucha de los padres para navegar por los servicios policiales y de protección infantil, y los sentimientos de estar aislados y solos.		El tema final, navegar por los servicios, se refería a la lucha de los padres para <tag>navegar</tag> por los servicios policiales y de protección infantil, y los sentimientos de estar aislados y solos.	Terminology - Wrong term	Minor	5658994
9	doc65	The final theme-navigating the services-pertained to parents' struggle in navigating child protection and police services, and feelings of being isolated and alone.		El tema final, navegar por los servicios, se refería a la lucha de los padres para navegar por los servicios policiales y de protección infantil, y los sentimientos de estar aislados y solos.		El tema final, navegar por los servicios, se refería a la lucha de los padres para navegar por los servicios policiales y de protección infantil, y <tag>los sentimientos</tag> de estar aislados y solos.	Accuracy - Mistranslation	Major	5658994
10	doc65	These findings highlight the need for empathy and parental support following child disclosure of sexual victimization.		Estos resultados ponen de relieve la necesidad de empatía y apoyo parental tras la revelación por parte del niño de la victimización sexual.		Estos resultados ponen de <tag>relieve</tag> la necesidad de empatía y apoyo parental tras la revelación por parte del niño de la victimización sexual.	Terminology - Wrong term	Minor	5658994
1	doc67	Japan Clinical Oncology Group (JCOG) 0212 (ClinicalTrials.gov NCT00190541) was a non-inferiority phase III trial of patients with clinical stage II-III rectal cancer without lateral pelvic lymph node enlargement.		El Japan Clinical Oncology Group (JCOG) 0212 (ClinicalTrials.gov NCT00190541) fue un ensayo de fase III de no inferioridad en pacientes con cáncer de recto en estadio clínico II-III sin agrandamiento de los ganglios linfáticos pélvicos laterales.		El Japan Clinical Oncology Group (JCOG) 0212 (ClinicalTrials.gov NCT00190541) fue un ensayo de fase III de no inferioridad en pacientes con cáncer de recto en <tag>estadio</tag> clínico II-III sin agrandamiento de los ganglios linfáticos pélvicos laterales.	Accuracy - Mistranslation	Critical	5658994
1	doc67	Japan Clinical Oncology Group (JCOG) 0212 (ClinicalTrials.gov NCT00190541) was a non-inferiority phase III trial of patients with clinical stage II-III rectal cancer without lateral pelvic lymph node enlargement.		El Japan Clinical Oncology Group (JCOG) 0212 (ClinicalTrials.gov NCT00190541) fue un ensayo de fase III de no inferioridad en pacientes con cáncer de recto en estadio clínico II-III sin agrandamiento de los ganglios linfáticos pélvicos laterales.		El Japan Clinical Oncology Group (JCOG) 0212 (ClinicalTrials.gov NCT00190541) fue un ensayo de fase III de no inferioridad en pacientes con cáncer de <tag>recto</tag> en estadio clínico II-III sin agrandamiento de los ganglios linfáticos pélvicos laterales.	Terminology - Wrong term	Neutral	5658994
1	doc67	Japan Clinical Oncology Group (JCOG) 0212 (ClinicalTrials.gov NCT00190541) was a non-inferiority phase III trial of patients with clinical stage II-III rectal cancer without lateral pelvic lymph node enlargement.		El Japan Clinical Oncology Group (JCOG) 0212 (ClinicalTrials.gov NCT00190541) fue un ensayo de fase III de no inferioridad en pacientes con cáncer de recto en estadio clínico II-III sin agrandamiento de los ganglios linfáticos pélvicos laterales.		<tag>El Japan Clinical Oncology Group</tag> (JCOG) 0212 (ClinicalTrials.gov NCT00190541) fue un ensayo de fase III de no inferioridad en pacientes con cáncer de recto en estadio clínico II-III sin agrandamiento de los ganglios linfáticos pélvicos laterales.	Accuracy - Mistranslation	Critical	5658994
2	doc67	The trial compared mesorectal excision (ME) with ME and lateral lymph node dissection (LLND), with a primary endpoint of recurrence-free survival (RFS).		El ensayo comparó la escisión mesorrectal (EM) con la EM y la disección lateral de ganglios linfáticos (DGLL), con un criterio de valoración primario de supervivencia sin recidiva (SSR).					5658994
3	doc67	The planned primary analysis at 5 years failed to confirm the non-inferiority of ME alone compared with ME and LLND.		El análisis primario previsto a los 5 años no pudo confirmar la no inferioridad de ME sola en comparación con ME y LLND.		El análisis primario previsto a los 5 años no pudo confirmar la no inferioridad de <tag>ME</tag> sola en comparación con ME y LLND.	Accuracy - Untranslated	Neutral	5658994
3	doc67	The planned primary analysis at 5 years failed to confirm the non-inferiority of ME alone compared with ME and LLND.		El análisis primario previsto a los 5 años no pudo confirmar la no inferioridad de ME sola en comparación con ME y LLND.		El análisis primario previsto a los 5 años no pudo confirmar la no inferioridad de ME <tag>sola</tag> en comparación con ME y LLND.	Style - Non-fluent	Neutral	5658994
4	doc67	The present study aimed to compare ME alone and ME with LLND using long-term follow-up data from JCOG0212.		El presente estudio tuvo como objetivo comparar ME solo y ME con LLND utilizando datos de seguimiento a largo plazo de JCOG0212.		El presente estudio tuvo como objetivo comparar <tag>ME</tag> solo y ME con LLND utilizando datos de seguimiento a largo plazo de JCOG0212.	Accuracy - Untranslated	Neutral	5658994
4	doc67	The present study aimed to compare ME alone and ME with LLND using long-term follow-up data from JCOG0212.		El presente estudio tuvo como objetivo comparar ME solo y ME con LLND utilizando datos de seguimiento a largo plazo de JCOG0212.		El presente estudio tuvo como objetivo comparar ME solo y <tag>ME</tag> con LLND utilizando datos de seguimiento a largo plazo de JCOG0212.	Accuracy - Untranslated	Neutral	5658994
4	doc67	The present study aimed to compare ME alone and ME with LLND using long-term follow-up data from JCOG0212.		El presente estudio tuvo como objetivo comparar ME solo y ME con LLND utilizando datos de seguimiento a largo plazo de JCOG0212.		El presente estudio tuvo como objetivo comparar ME solo y ME con <tag>LLND</tag> utilizando datos de seguimiento a largo plazo de JCOG0212.	Accuracy - Untranslated	Neutral	5658994
5	doc67	Patients with clinical stage II-III rectal cancer below the peritoneal reflection and no lateral pelvic lymph node enlargement were included in this study.		En este estudio se incluyeron pacientes con cáncer rectal en estadio clínico II-III por debajo de la reflexión peritoneal y sin agrandamiento de los ganglios linfáticos pélvicos laterales.		En este estudio se incluyeron pacientes con cáncer rectal en <tag>estadio</tag> clínico II-III por debajo de la reflexión peritoneal y sin agrandamiento de los ganglios linfáticos pélvicos laterales.	Terminology - Wrong term	Major	5658994
5	doc67	Patients with clinical stage II-III rectal cancer below the peritoneal reflection and no lateral pelvic lymph node enlargement were included in this study.		En este estudio se incluyeron pacientes con cáncer rectal en estadio clínico II-III por debajo de la reflexión peritoneal y sin agrandamiento de los ganglios linfáticos pélvicos laterales.		En este estudio se incluyeron pacientes con cáncer rectal en estadio clínico II-III por debajo <tag>de la reflexión</tag> peritoneal y sin agrandamiento de los ganglios linfáticos pélvicos laterales.	Terminology - Wrong term	Minor	5658994
6	doc67	After surgeons confirmed R0 resection by ME, patients were randomized to receive ME alone or ME with LLND.		Después de que los cirujanos confirmaron la resección R0 por EM, los pacientes fueron aleatorizados para recibir EM sola o EM con LLND.		Después de que los cirujanos confirmaron la resección R0 por EM, los pacientes fueron aleatorizados para recibir EM sola o EM con <tag>LLND</tag>.	Accuracy - Untranslated	Neutral	5658994
7	doc67	The primary endpoint was RFS.		El criterio de evaluación primario fue RFS.		El criterio de evaluación primario fue <tag>RFS</tag>.	Accuracy - Untranslated	Neutral	5658994
8	doc67	A total of 701 patients from 33 institutions were assigned to ME with LLND (351) or ME alone (350) between June 2003 and August 2010.		Un total de 701 pacientes de 33 instituciones fueron asignados a EM con LLND (351) o EM solo (350) entre junio de 2003 y agosto de 2010.					5658994
9	doc67	The 7-year RFS rate was 71.1 per cent for ME with LLND and 70·7 per cent for ME alone (hazard ratio (HR) 1·09, 95 per cent c.i. 0·84 to 1·42; non-inferiority P = 0·064).		La tasa de SSR a 7 años fue del 71,1 por ciento para EM con LLND y del 70,7 por ciento para EM sola (cociente de riesgos instantáneos (HR) 1,09, 95 por ciento c.i. 0,84 a 1,42; no inferioridad P = 0,064).		La tasa de SSR a 7 años fue del 71,1 por ciento para EM con <tag>LLND</tag> y del 70,7 por ciento para EM sola (cociente de riesgos instantáneos (HR) 1,09, 95 por ciento c.i. 0,84 a 1,42; no inferioridad P = 0,064).	Accuracy - Untranslated	Neutral	5658994
9	doc67	The 7-year RFS rate was 71.1 per cent for ME with LLND and 70·7 per cent for ME alone (hazard ratio (HR) 1·09, 95 per cent c.i. 0·84 to 1·42; non-inferiority P = 0·064).		La tasa de SSR a 7 años fue del 71,1 por ciento para EM con LLND y del 70,7 por ciento para EM sola (cociente de riesgos instantáneos (HR) 1,09, 95 por ciento c.i. 0,84 a 1,42; no inferioridad P = 0,064).		La tasa de SSR a 7 años fue del 71,1 por ciento para EM con LLND y del 70,7 por ciento para EM sola (cociente de riesgos instantáneos (HR) <tag>1,09</tag>, 95 por ciento c.i. 0,84 a 1,42; no inferioridad P = 0,064).	Accuracy - Mistranslation	Minor	5658994
9	doc67	The 7-year RFS rate was 71.1 per cent for ME with LLND and 70·7 per cent for ME alone (hazard ratio (HR) 1·09, 95 per cent c.i. 0·84 to 1·42; non-inferiority P = 0·064).		La tasa de SSR a 7 años fue del 71,1 por ciento para EM con LLND y del 70,7 por ciento para EM sola (cociente de riesgos instantáneos (HR) 1,09, 95 por ciento c.i. 0,84 a 1,42; no inferioridad P = 0,064).		La tasa de SSR a 7 años fue del 71,1 por ciento para EM con LLND y del 70,7 por ciento para EM sola (cociente de riesgos instantáneos (HR) 1,09, 95 por ciento c.i. 0,84 a <tag>1,42</tag>; no inferioridad P = 0,064).	Accuracy - Mistranslation	Minor	5658994
