SEG_ID	Doc	Source	Tagged_Source	Target	MT	Tagged_Target	Error Category	Severity	Annotator_ID
7	doc72	The predominant epidemiological profile of infant mortality in rural municipalities in Paraiba state was male gender (57.4%), brown skin color (61.1%), age from 0 to 7 days (52.4%), low birthweight (44%), and gestational age less than 37 weeks (43.2%).		El perfil epidemiológico de mortalidad infantil predominante en los municipios rurales del estado de Paraíba fue el género masculino (57,4 %), color de piel morena (61,1 %), edad de 0 a 7 días (52,4 %), bajo peso al nacer (44 %) y edad gestacional menos de 37 semanas (43,2 %).					5658994
8	doc72	Underlying cause of death was classified as avoidable death via interventions by the Brazilian Unified National Health System (65.2%).	Underlying cause of death was classified as avoidable death via interventions by the <tag>Brazilian</tag> Unified National Health System (65.2%).	La causa subyacente de muerte fue clasificada como muerte evitable a través de intervenciones del Sistema Único de Salud (65,2 %).			Accuracy - Omission	Neutral	5658994
9	doc72	The urban/rural typology adopted by the IBGE was better than the World Bank at classifying the municipalities in Paraiba state.		La tipología urbana/rural adoptada por el IBGE fue mejor que la del Banco Mundial para clasificar los municipios del estado de Paraíba.					5658994
10	doc72	This classification allowed studying the infant mortality profile in rural municipalities, which was similar to the overall profile, except for maternal schooling.		Esta clasificación permitió estudiar el perfil de mortalidad infantil en los municipios rurales, que era similar al perfil general, excepto por la escolaridad materna.					5658994
1	doc73	Introduction: Congenital hypothyroidism is a preventable cause of cognitive disability.		Introducción: El hipotiroidismo congénito es una causa prevenible de discapacidad cognitiva.					5658994
2	doc73	Due to the absence of symptoms and signs in the newborn, it is necessary to perform screening tests.		Debido a la ausencia de síntomas y signos en el recién nacido, es necesario realizar pruebas de detección.		Debido a la ausencia de síntomas y signos en el recién nacido, es necesario realizar pruebas de <tag>detección</tag>.	Accuracy - Mistranslation	Minor	5658994
3	doc73	Its incidence ranges between 1:2,500 and 1:6,000.		Su incidencia oscila entre 1:2.500 y 1:6.000.					5658994
4	doc73	Objective: To describe the anthropometric and demographic characteristics, as well as the cord TSH levels, serum TSH, and serum T4L levels of the positive patients during screening and patients with confirmed congenital hypothyroidism.		Objetivo: Describir las características antropométricas y demográficas, así como los niveles de TSH corduical, TSH sérica y T4L sérica de los pacientes positivos durante el cribado y pacientes con hipotiroidismo congénito confirmado.					5658994
5	doc73	Materials and methods: We conducted a retrospective observational study for 17 years based on the review of clinical laboratory and medical records to describe the demographic and anthropometric characteristics of the patients at the time of diagnosis.		Materiales y métodos: Realizamos un estudio observacional retrospectivo durante 17 años basado en la revisión de las historias clínicas y de laboratorio para describir las características demográficas y antropométricas de los pacientes en el momento del diagnóstico.					5658994
6	doc73	Results: We analyzed 41,494 newborns in the 17 years of follow-up; 217 (0.52%) were positive in the screening test and the diagnosis was confirmed by serum tests (TSH and free T4) in 19 cases (8.76%) for an incidence of one for every 2,183 live births;		Resultados: Se analizaron 41.494 recién nacidos en los 17 años de seguimiento; 217 (0,52 %) resultaron positivos en la prueba de tamizaje y el diagnóstico se confirmó mediante pruebas séricas (TSH y T4 libre) en 19 casos (8,76 %) para una incidencia de uno por cada 2.183 nacidos vivos;					5658994
7	doc73	78.95% of the children with congenital hypothyroidism were born full-term and the average gestational age was 37.3 weeks, similar to that of those with no congenital hypothyroidism.		El 78,95 % de los niños con hipotiroidismo congénito nacieron a término y la edad gestacional promedio fue de 37,3 semanas, similar a la de los niños sin hipotiroidismo congénito.					5658994
8	doc73	There was no difference in the average weight and height at birth between the children with the condition and those who did not have it.		No hubo diferencias en el peso y la estatura medios al nacer entre los niños con la enfermedad y los que no la padecían.		No hubo diferencias en el peso y la estatura <tag>medios</tag> al nacer entre los niños con la enfermedad y los que no la padecían.	Accuracy - Mistranslation	Neutral	5658994
9	doc73	TSH in the cord in the cases of congenital hypothyroidism was significantly higher than in the discarded cases.		La TSH en el cordón en los casos de hipotiroidismo congénito fue significativamente mayor que en los casos descartados.					5658994
10	doc73	Conclusions: The incidence of congenital hypothyroidism was similar to that found in the literature.		Conclusiones: La incidencia del hipotiroidismo congénito fue similar a la encontrada en la literatura.					5658994
11	doc73	There were no relevant clinical differences between confirmed and ruled out cases reflecting the relevance of neonatal screening.		No hubo diferencias clínicas relevantes entre los casos confirmados y los casos descartados, lo que refleja la relevancia del cribado neonatal.					5658994
