SEG_ID	Doc	Source	Tagged_Source	Target	MT	Tagged_Target	Error Category	Severity	Annotator_ID
5	doc13	A total of 260 participants were included: 100 healthy young students, 125 hypothyroid patients and 35 patients with bone and joint infections.		260 parte-hartzaile zeuden guztira: 100 ikasle gazte osasuntsu, hipotiroidismoa zeukaten 125 gaixo eta hezurretako eta artikulazioetako infekzioak zituzten 35 gaixo.					5684476
6	doc13	The prevalence of vitamin D (25(OH)D) sufficiency (≥ 30 ng/ml), insufficiency (21-29 ng/ml) and deficiency (≤20 ng/ml) was evaluated.		D bitaminaren (25(OH)D) egokitasunaren (≥ 30 ng/ml), gutxiegitasunaren (21-29 ng/ml) eta eskasiaren (≤20 ng/ml) prebalentzia ebaluatu zen.					5684476
7	doc13	While 15.4% of the studied subjects were vitamin D sufficient, 43.1% were insufficient and 41.5% were deficient.		Ikertutako pertsonen % 15,4k D bitamina maila egokia bazuten ere, % 43,1ek gutxiegi zeukaten eta % 41,5ek, eskasia.					5684476
8	doc13	The prevalence of vitamin D deficiency in the healthy student’s group was 21%, it increased to 49.6% in the group of patients with hypothyroidism and added up to 62.9% in the ones with bone and joint infections.		Ikasle osasuntsuen taldean, D bitaminaren eskasiaren prebalentzia % 21ekoa zen; hipotiroidismoak jotako gaixoen taldean, % 49,6ra igotzen zen, eta hezurretako eta artikulazioetako infekzioak zeuzkatenengan % 62,9raino iristen zen.					5684476
9	doc13	The research proved that only 22% of the healthy young people, 12.8% of the hypothyroid patients and 2.9% of the patients with bone and joint infection had sufficient levels of vitamin D.		Ikerketak frogatu egin zuen gazte osasuntsuen % 22k, hipotiroidismoa zeukaten gaixoen % 12,8k eta hezurretako eta artikulazioetako infekzioak zeuzkaten gaixoen % 2,9k soilik zeuzkatela D bitaminaren maila egokiak.		Ikerketak frogatu <tag>egin</tag> zuen gazte osasuntsuen % 22k, hipotiroidismoa zeukaten gaixoen % 12,8k eta hezurretako eta artikulazioetako infekzioak zeuzkaten gaixoen % 2,9k soilik zeuzkatela D bitaminaren maila egokiak.	Accuracy - Addition	Minor	5684476
10	doc13	The prevalence of deficient and insufficient vitamin D levels was very high in each study group, similar to those in previously published studies.		D bitaminaren eskasiaren eta gutxiegitasunaren prebalentzia oso handia izan zen ikerketako talde guztietan, aurretik argitaratutako beste ikerketetan gertatzen zen bezala.					5684476
11	doc13	Our data strongly suggest that vitamin D levels should be measured in the population at risk of vitamin D deficiency (such as patients with bone and joint infection and patients with hypothyroidism), and that vitamin D-enriched food should be promoted for the general population.		Gure datuek argi uzten dute D bitaminaren mailak neurtu beharko liratekeela eskasia izateko arriskua duten populazioetan (adibidez, hezurretako eta artikulazioetako infekzioak dituzten gaixoak eta hipotiroidismoa dutenak), eta biztanleria orokorraren artean D bitamina gehitu zaien elikagaiak sustatu behar direla.					5684476
1	doc14	Infection with the human T-cell lymphotropic virus in Spain - 30 years of evolution (1986-2016)		Giza T zelulen birus linfotrofikoak eragindako infekzioak Espainian: 30 urteko eboluzioa (1986-2016)					5684476
2	doc14	The Human Retroviruses are a group of viruses that infect vertebrates and that can result in disease.		Giza erretrobirusak ornodunak kutsatzen dituzten eta gaixotasunak eragin diezazkieketen birus talde bat dira.					5684476
3	doc14	The human T-cell lymphotropic virus (Human T-cell lymphotropic virus HTLV) belongs to the Retroviriade family and have been described to date, four variants phylogenetic relationships: HTLV-1, HTLV-2, HTLV-3 and HTLV-4.	The human T-cell lymphotropic virus (Human T-cell lymphotropic virus HTLV) belongs to the <tag>Retroviriade</tag> family and have been described to date, four variants phylogenetic relationships: HTLV-1, HTLV-2, HTLV-3 and HTLV-4.	Giza T zelulen birus linfotrofikoa (giza T zelulen birus linfotrofikoa, HTLV) Retroviridae familiakoa da, eta orain arte lau aldaera filogenetiko deskribatu dira: HTLV-1, HTLV-2, HTLV-3 eta HTLV-4.			Source errors	Minor	5684476
4	doc14	In the year 1986 was first analyzed the frequency of natural antibodies to the retrovirus HTLV-1 in Spain.		1986. urtean aztertu zen lehen aldiz HTLV-1 erretrobirusaren aurkako antigorputz naturalen maiztasuna Espainian.					5684476
5	doc14	During 30 years of study, 327 people have been found to be carriers of the infection.		30 urtetan zehar egindako ikerketetan, infekzioa daramaten 327 pertsona aurkitu dira.		30 urtetan zehar egindako ikerketetan, <tag>infekzioa daramaten</tag> 327 pertsona aurkitu dira.	Style - Non-fluent	Major	5684518
6	doc14	With regard to the HTLV-2 infection, in the year 1990 were detected the first 2 cases in Spain.		HTLV-2aren infekzioari dagokionez, 1990. urtean lehenengo 2 kasuak hauteman ziren Espainian.		HTLV-2aren infekzioari dagokionez, 1990. urtean lehenengo 2 <tag>kasuak</tag> hauteman ziren Espainian.	Linguistic Conventions - Grammar	Minor	5684476
7	doc14	Since then and until December 2016, 793 have been found.		Une horretatik 2016ko abendura arte, 793 aurkitu dira.					5684476
8	doc14	Up to the present, there is no evidence of the existence in the State, of infection by the retrovirus HTLV-3 and HTLV-4.		Orain arte, ez da aurkitu HTLV-3 eta HTLV-4 erretrobirusengatiko infekzioen frogarik Estatuan.					5684518
9	doc14	The HTLV infection constitutes a challenge that requires remain expectant.		HTLVagatiko infekzioa erronka bat da, eta beharrezkoa da adi egotea.		HTLVagatiko infekzioa erronka bat da, eta <tag>beharrezkoa da adi egotea</tag>.	Accuracy - Mistranslation	Minor	5684476
1	doc15	Leptospiras and health crisis in the estuary of Bilbao		Leptospirak eta osasun-krisia Bilboko itsasadarrean					5684476
2	doc15	The information in the media of Bilbao, explaining the existence of leptospirosis infections in several triathletes who had participated in a race in the Ría last May, has caused an intense controversy around the uses of the river course in Bilbao.		Joan den maiatzean itsasadarreko lasterketa batean parte hartu zuten triatleta batzuek leptospirosia zutela azaltzen zuen Bilboko komunikabideetako informazioak polemika handia eragin du Bilboko ibaiaren erabilerari buruz.		Joan den maiatzean itsasadarreko lasterketa <tag>batean</tag> parte hartu zuten triatleta batzuek leptospirosia zutela azaltzen zuen Bilboko komunikabideetako informazioak polemika handia eragin du Bilboko ibaiaren erabilerari buruz.	Accuracy - Mistranslation	Minor	5684476
2	doc15	The information in the media of Bilbao, explaining the existence of leptospirosis infections in several triathletes who had participated in a race in the Ría last May, has caused an intense controversy around the uses of the river course in Bilbao.		Joan den maiatzean itsasadarreko lasterketa batean parte hartu zuten triatleta batzuek leptospirosia zutela azaltzen zuen Bilboko komunikabideetako informazioak polemika handia eragin du Bilboko ibaiaren erabilerari buruz.		Joan den maiatzean itsasadarreko lasterketa batean parte hartu zuten triatleta batzuek leptospirosia zutela azaltzen zuen Bilboko komunikabideetako informazioak polemika handia eragin du Bilboko <tag>ibaiaren</tag> erabilerari buruz.	Accuracy - Mistranslation	Minor	5684476
1	doc16	Thalidomide can reduce refractory gastrointestinal bleeding from gastrointestinal arteriovenous malformation		Talidomidak gutxitu egin dezake urdail-hesteetako malformazio arteriobenosoek eragindako urdail-hesteetako odoljario errefraktarioa					5684476
2	doc16	Comparing to iron alone Thalidomide can reduce gastrointestinal bleeding (–67%), red blood cell transfusion (–37%), hospitalizations (–54%) and active gastrointestinal bleeding (–46%).		Burdinarekin alderatuta, talidomidak urdail-hesteetako odoljarioa (-% 67), globulu gorrien trasfusio-beharra (-% 37), ospitaleratzeak (-% 54) eta urdail-hesteetako odoljario aktiboa (-% 46) gutxi ditzake.		Burdinarekin alderatuta, <tag>talidomidak</tag> urdail-hesteetako odoljarioa (-% 67), globulu gorrien trasfusio-beharra (-% 37), ospitaleratzeak (-% 54) eta urdail-hesteetako odoljario aktiboa (-% 46) gutxi ditzake.	Linguistic Conventions - Grammar	Neutral	5684476
3	doc16	Because the number of patients is small further research is needed.		Gaixo kopurua txikia denez, gehiago ikertu behar da.					5684476
1	doc17	Canavan Disease (Aspartoacylase Deficiency): Report of the First Case in Basque Country and a Novel Mutation in Europe		Canavan gaixotasuna (aspartoazilasa-eskasia): Euskal Herriko lehenengo kasuaren eta Europako mutazio berri baten aurkezpena		Canavan gaixotasuna (aspartoazilasa-eskasia): <tag>Euskal Herriko</tag> lehenengo kasuaren eta Europako mutazio berri baten aurkezpena	Terminology - Wrong term	Minor	5684518
2	doc17	Canavan disease, a rare genetic and metabolic neurodegenerative disorder, occurs at early ages, causing visual, neurological alterations, and fatal consequences.		Canavan gaixotasuna, nahasmendu neurodegeneratibo genetiko eta metaboliko arraro bat, haurtzaroan gertatzen da, alterazio bisualak eta neurologikoak eragiten ditu, eta heriotza du ondorio.					5684518
3	doc17	There is no curative treatment, although lithium citrate is being investigated.		Ez dago hura sendatzen duen tratamendurik, litio zitratoa ikertzen ari den arren.		<tag>Ez dago hura sendatzen duen tratamendurik, litio zitratoa ikertzen ari den arren.</tag>	Style - Non-fluent	Neutral	5684518
4	doc17	The authors report the first case of Canavan disease in Basque Country associated to a novel mutation which is identified for the first time in Europe.		Egileek Euskal Herrian egon den Canavan gaixotasunaren lehenengo kasuaren berri eman dute, Europan lehenengo aldiz identifikatu den mutazio berri batekin loturik.					5684476
1	doc18	Taxus baccata intoxication		Taxus baccatagatiko intoxikazioa					5684476
2	doc18	Taxus baccata is one of the most poisonous trees in the world.		Taxus baccata munduko zuhaitz pozoitsuenetariko bat da.					5684518
3	doc18	It contains taxanes and toxic alkaloids: the most dangerous one is the taxine.		Taxanoak eta alkaloide toxikoak ditu: taxina da arriskutsuena.					5684518
4	doc18	It is a fairly common plant in our environment and could be extremely dangerous; however, yew poisoning is quite rare.		Gure inguruko landare nahiko arrunta da, eta oso arriskutsua izan daiteke; hala ere, nahiko arraroa da haginarekin pozoitzea.					5684518
5	doc18	Cases may occur by voluntary or accidental form.		Kasuak nahita edo nahi gabe gerta daitezke.					5684518
6	doc18	Therefore, the rapid orientation and diagnosis of suspected episodes are important, in order to treat it quickly.		Beraz, kasu susmagarrien orientazioa eta diagnostikoa azkar egitea garrantzitsua da, bizkor tratatzeko.					5684476
7	doc18	A man was transferred to the hospital with no symptoms after autolytic attempt by abundant yew leaves ingestion.		Gizon bat ospitalera ekarri zuten sintomarik gabe, hagin-hosto ugari irentsiz bere buruaz beste egiten saiatu zelako.					5684518
8	doc18	He presented respiratory alkalosis, reduced consciousness and ventricular tachycardia.		Arnas-alkalosia, konorte-galera eta takikardia bentrikularra zeuzkan.					5684579
9	doc18	He was treated urgently and fully recovered in a week.		Urgentziaz tratatu zuten eta astebetean guztiz sendatu zen.					5684476
10	doc18	There are no specific analytical alterations in this intoxication.		Ez dago alterazio analitiko zehatzik intoxikazio honetan.					5684518
11	doc18	Taxine compound analysis is not made in clinical laboratories.		Laborategi klinikoetan ez da egiten taxinaren konposatuen analisirik.					5684518
12	doc18	The final diagnosis was confirmed by the detection of 3,5-dimethoxyphenol (a taxine metabolite), by gas chromatography-mass spectrometry.		Behin betiko diagnostikoa 3,5-dimetoxifenola (taxinaren metabolito bat) detektatuz berretsi zen, gas-kromatografia eta masa-espektrometria eginez.					5684518
13	doc18	Samples were analyzed by the Institute of Toxicology.		Laginak Toxikologia Institutuan analizatu ziren.					5684518
1	doc19	Pregnancy and lactation-related breast pathology review		Haurdunaldiarekin eta edoskitzaroarekin erlazionatutako bular-patologien berrikuspena					5684518
2	doc19	The aim of this review is to discuss both the clinical and the radiological appearance, as well as the best therapeutic options, regarding the commonest breast-pathology related to pregnancy and lactation.		Berrikuspen honen helburua haurdunaldiarekin eta edoskitzaroarekin erlazionatutako bular-patologia ohikoenen aurkezpen klinikoa eta erradiologikoa azaltzea da, aukera terapeutiko hoberenez gain.					5684518
3	doc19	Important hormonal changes happen during pregnancy and lactation.		Haurdunaldian eta edoskitzaroan aldaketa hormonal garrantzitsuak gertatzen dira.					5684476
4	doc19	These variations will cause physiological changes on different body organs, including the breast tissue, where not only physiologic changes but also pathology can occur.		Gorabehera horiek aldaketa fisiologikoak eragingo dituzte gorputzeko hainbat organotan, bularreko ehunak barne, eta haietan, aldaketa fisiologikoak ez ezik, patologiak ere ager daitezke.					5684518
5	doc19	Breast-pathology related to pregnancy and breastfeeding is benign in most cases and needs no further study, galactocele, infectious mastitis, fibroadenoma and lactation-related adenoma being some of the commonest diagnoses.		Kasu gehienetan, haurdunaldiarekin eta edoskitzaroarekin erlazionatutako bular-patologiak onberak izaten dira; diagnostiko ohikoenak galaktozelea, maistitis infekziosoa, fibroadenoma eta edoskitzaroko adenoma dira, besteak beste.					5684518
6	doc19	It is mandatory for any radiologist to be familiar with these terms, since despite their benign nature some of them need to exclude malignancy during the diagnostic process.		Nahitaezkoa da erradiologo guztiek hitzok ezagutzea, izaera onbera badute ere, haietako batzuen diagnostiko-prozesuan gaiztoak ez direla egiaztatu behar baita.					5684518
7	doc19	Most of the cases are diagnosed in symptomatic patients, new-onset breast lump being the most frequent symptom.		Kasu gehienak paziente sintomatikoetan diagnostikatzen dira, eta sintomarik ohikoena bularrean agerpen berriko bulto bat da.					5684518
8	doc19	Breast ultrasound is the imaging modality of choice during these periods, while the other imaging techniques will be used on a second-time basis only when information provided by the ultrasound examination is insufficient.		Bularraren ekografia da epe horietan aukeratzen den irudi-modalitatea, eta irudiak ateratzeko beste teknikak bigarren kontsulta batean erabiliko dira, ekografia bidezko miaketan informazio gutxiegi lortu bada soilik.					5684476
9	doc19	Pregnancy-associated breast-cancer is the most frequent malignancy during pregnancy and breastfeeding. Despite not being as frequent as the previously mentioned benign pathology, its early diagnosis is essential in order to let the oncologic committee ensure the earliest and best medical attention for the patient.		Haurdunaldiarekin erlazionatutako bularreko minbizia da haurdunaldian eta edoskitzaroan gehien gertatzen den gaixotasun gaiztoa. Aurretik aipaturiko patologia onberak bezain ohikoa ez den arren, hura goiz diagnostikatzea ezinbestekoa da batzorde onkologikoari gaixoarentzako osasun-arreta azkarrena eta hoberena bermatzea ahalbidetzeko.					5684518
1	doc20	The latest steps in antidepressant treatment: present and future		Antidepresibo bidezko tratamenduaren azken urratsak: oraina eta etorkizuna					5684518
2	doc20	Depression is among the most common psychiatric diseases in today’s society, and its incidence is steadily increasing.		Egungo gizartean, gaixotasun psikiatriko arruntenetako bat da depresioa, eta haren intzidentzia etengabe igotzen ari da.					5684518
3	doc20	Many theories have attempted to explain depression’s origin and etiology, but various aspects of its neurobiology are still unknown.		Teoria asko saiatu dira depresioaren jatorria eta etiologia azaltzen, baina haren neurobiologiaren alderdi batzuk oraindik ez dira ezagutzen.					5684518
4	doc20	The most relevant hipotesis of depression are the monoaminergic, the neurotrophic and the neuroinflammatory, and this review discusses their origin, evidence and features, along with a few other theories’.		Depresioaren inguruko hipotesi garrantzitsuenak monoaminergikoa, neurotrofikoa eta neuroinflamatorioa dira, eta berrikuspen honek haien jatorriak, frogak eta ezaugarriak jorratzen ditu, baita beste teoria batzuenak ere.					5684476
5	doc20	In the past, antidepressant drug discovery happened by chance, and the study of effective substances at improving symptoms contributed greatly to the knowledge of the neurobiology of depression.		Iraganean, farmako antidepresiboak kasualitatez aurkitzen ziren, eta sintomak hobetzeko eraginkorrak ziren substantziak aztertzean lortu dira depresioaren neurobiologiari buruzko ezagutza asko.					5684518
6	doc20	Classical antidepressants constitute the base of the pharmacological treatment of depression: monoaminoxidase inhibitors, tricyclic antidepressants and monoamine reuptake inhibitors.		Antidepresibo klasikoak dira depresioaren tratamendu farmakologikoaren oinarria: monoaminooxidasaren inhibitzaileak, antidepresibo triziklikoak eta monoaminen birxurgapenaren inhibitzaileak.					5684518
7	doc20	Newer drugs, like trazodone and mirtazapine, possess a more complex pharmacodynamic profile.		Farmako berriagoek, hala nola trazodonak eta mirtazapinak, profil farmakodinamiko konplexuagoa dute.					5684518
8	doc20	With the aim to avoid their usual adverse effects, and to improve their effectiveness, alternative mechanisms have been explored. This research has resulted in the discovery of substances such as agomelatine, tianeptine and vortioxetine, but their use and efficacy are not very widespread.		Haien ohiko eragin desiragaitzak ekiditeko eta eraginkortasuna hobetzeko, mekanismo alternatiboak ikertu dira. Ikerketa horien ondorioz, agomelatina, tianeptina eta bortioxetina bezalako substantziak aurkitu dira, haien erabilera eta eraginkortasuna oso hedatuta ez dauden arren.					5684518
9	doc20	Nonetheless, ketamine has recently revolutionised the research of antidepressants, since it has proven to be a fast-acting, potent antidepressant, even in resistant cases, in addition to being safe and well-tolerated.		Ketaminak, berriz, antidepresiboen inguruko ikerketetan iraultza bat ekarri du duela gutxi, antidepresibo azkar eta eraginkorra dela frogatu baita, kasu erresistenteetan ere; gainera, segurua da eta ongi jasaten da.					5684476
10	doc20	Lastly, psychedelic substances have been known to improve symptoms of a variety of psychiatric diseases, including depression.		Azkenik, substantzia psikodelikoek hainbat gaixotasun psikiatrikoren sintomak hobetzen dituztela frogatu da, depresioa barne.					5684518
11	doc20	Specifically psilocybin has shown great prospects as an antidepressant in a number of studies. Despite its undeniable beneficial effects on depressed patients, its antidepressant mechanisms are not entirely clear, and research in the field is currently trending.		Haien artean, psilozibinak antidepresibo gisa potentzial handia daukala ikusi da hainbat ikerketatan. Paziente deprimituengan dituen onurak ukatu ezin badira ere, haren mekanismo antidepresiboak ez daude guztiz argi, eta horien inguruko ikerketa asko abian daude.					5684518
1	doc21	Effect of exercise on cognitive and physical function in institutionalized older adults with cognitive impairment: systematic review		Ariketa fisikoaren eragina kognizio-galera duten adindu instituzionalizatuen funtzio kognitiboan eta fisikoan: berrikuspen sistematikoa					5684518
2	doc21	In recent years, the prevalence of cognitive impairment has increased among the elderly, becoming one of the main reasons for suffering dependency and being institutionalized.		Azken urteotan, kognizio-galeraren prebalentziak gora egin du adinduen artean, eta mendekotasuna pairatzeko eta instituzionalizatua izateko arrazoi nagusietako bat bihurtu da.					5684518
3	doc21	Previously in the literature it has been reported that exercise induces improvements on cognitive and physical function in older adults with cognitive impairment.		Orain arteko literaturaren arabera, ariketa fisikoak kognizio-galera duten adinduen funtzio kognitiboa eta fisikoa hobetzen du.					5684518
4	doc21	However, there is no consensus regarding the appropriate exercise type to approach those improvements.		Haatik, ez dago adostasunik hobekuntza horiek lortzeko ariketa mota egokienaren inguruan.					5684518
5	doc21	Therefore, the main aim of the present study was to perform a systematic review regarding the effects of exercise on cognitive function of institutionalized older adults with cognitive impairment.		Beraz, ariketa fisikoak kognizio-galera duten adindu instituzionalizatuen funtzio kognitiboan daukan eraginaren berrikuspen sistematiko bat egitea da ikerketa honen helburu nagusia.					5684518
6	doc21	In addition, a second aim was to evaluate the effects of exercise in physical function.		Horretaz gain, ariketak funtzio fisikoan daukan eragina ebaluatzea da bigarren helburua.					5684476
7	doc21	To achieve this aim a systematic review of clinical trials was performed on the Pubmed database.		Xede horretarako, entsegu klinikoen berrikuspen sistematiko bat burutu da Pubmed datu-basea oinarri hartuta.					5684518
8	doc21	Methodological quality was assessed using the PEDro scale.		Kalitate metodologikoa PEDro eskalaren bidez ebaluatu da.					5684518
9	doc21	A total of 7 studies were analyzed.		7 ikerketa aztertu dira guztira.					5684518
10	doc21	In all the analyzed studies the intervention group performed aerobic or multicomponent exercises.		Aztertutako ikerketa guztietan, interbentzio-taldeak ariketa fisiko aerobikoak edo hainbat osagai zituzten ariketak egin zituen.					5684518
11	doc21	As regards to cognitive function while significant improvements were observed in 3 studies, in other 3 studies cognitive function did not change. Besides, a cognitive decline was observed in the intervention group in one study.		Funtzio kognitiboari dagokionez, 3 ikerketatan hobekuntzak ikusi baziren ere, beste 3 ikerketatan funtzio kognitiboa ez zen aldatu. Gainera, ikerketa bateko interbentzio-taldean beherakada kognitiboa ikusi zen.					5684518
12	doc21	Concerning physical function, results were heterogeneous.		Funtzio fisikoari dagokionez, askotariko emaitzak lortu ziren.					5684476
13	doc21	Exercise has a positive effect on cognitive function in older adults with cognitive impairment although the cognitive impairment level affects the proportion of its benefits.		Ariketa fisikoak efektu positiboa dauka kognizio-galera daukaten adinduen funtzio kognitiboan, baina kognizio-galeraren mailak onuren proportzioa mugatzen du.					5684518
14	doc21	Similarly, exercise seems to improve physical function although in most of the studies these results are not statistically significant.		Era berean, badirudi ariketa fisikoak funtzio fisikoa hobetzen duela, baina ikerketa gehienetan emaitza horiek ez dira estatistikoki esanguratsuak.					5684518
1	doc22	In urinary retention, bladder catheterization and fast decompression doesn ́t have more complication risk than gradual decompression		Gernu-erretentzioa dagoenean, maskuria zundatzeak eta deskonpresio azkarrak ez dauka pixkanakako deskonpresioak baino konplikazio-arrisku gehiagorik					5684518
2	doc22	When an acute urinary retention happens, making a catheterization and a fast decompression is a safe, fast and comfortable method.		Gernu-erretentzio akutua gertatzen denean, zundaketa eta deskonpresio azkarra egitea metodo seguru, azkar eta erosoa da.					5684518
3	doc22	About complications, there aren`t statistically significant differences between fast and gradual decompression.		Konplikazioen aldetik, ez dago ezberdintasun estatistikoki esanguratsurik deskonpresioa azkar edo pixkanaka egitearen artean.					5684518
1	doc23	Usual nursing diagnoses in patients who have suffered a stroke		Ohiko erizaintza-diagnostikoak iktusa pairatu duten pazienteengan					5684518
2	doc23	Stroke is defined as an acute disturbance of one or more brain functions, either permanent or transient, caused by a disturbance of cerebral circulation.		Iktusa garuneko zirkulazioaren etete batek eragindako garuneko funtzio baten edo batzuen etete akutua da, iraunkorra edo iragankorra.					5684518
3	doc23	Many of those who have suffered from this disease need help in the management of the disability and in the rehabilitation process.		Gaixotasun hori pairatu duten pertsona askok laguntza behar dute desgaitasuna kudeatzeko eta errehabilitazio-prozesuan.					5684518
4	doc23	Nurses have a role to play in this.		Erizainek eginkizun garrantzitsu bat daukate horretan.					5684518
5	doc23	This paper summarizes the most common nursing diagnoses that direct nursing interventions.		Artikulu honek erizainen interbentzioak zuzentzen dituzten erizaintza-diagnostiko arruntenak laburtzen ditu.					5684518
1	doc24	Coronavirus 19 Disease: tratment search and systematic review		Koronabirus 19 gaixotasuna: tratamenduaren bilaketa eta berrikuspen sistematikoa					5684518
2	doc24	The drugs studied do not accelerate the conversion of PCR from positive to negative.		Ikertutako farmakoek ez dute bizkortzen PCR positiboak negatibo bihurtzea.					5684518
1	doc25	Pharmaceutical-provision, which medicines will be paid and to what price?		Hornikuntza farmazeutikoa, zein sendagai ordainduko dira, eta zer preziotan?					5684579
