SEG_ID	Doc	Source	Tagged_Source	Target	MT	Tagged_Target	Error Category	Severity	Annotator_ID
2	doc25	The pharmaceutical-provision of the public health system includes the medications that will satisfy the populations` clinical needs and will be paid with public funds.		Osasun-sistema publikoaren farmakoen hornikuntzan biztanleriaren behar klinikoak aseko dituzten sendagaiak sartzen dira, eta diru publikoarekin ordainduko direnak.					5684476
3	doc25	In the southern Basque Country, different organizations will participate in the selection of these medicines.		Hego Euskal Herrian, erakunde ezberdinek parte hartuko dute sendagai horiek hautatzeko prozesuan.					5684476
4	doc25	The decisions of these organisations are public and can be consulted online on different websites.		Erakunde horien erabakiak publikoak dira, eta sareko webgune ezberdinetan kontsulta daitezke.					5684476
1	doc26	Feelings of loneliness, suffering beyond the symptoms of covid-19		Bakardade-sentimenduak, covid-19aren sintomez harago doan sufrimendua					5684476
2	doc26	Covid-19 is a cruel companion.		Covid-19a bidelagun krudela da.		Covid-19a <tag>bidelagun</tag> krudela da.	Terminology - Wrong term	Neutral	5684476
3	doc26	In addition to its symptoms and health effects, it has another effect, severe and incurable: loneliness.		Bere sintomez eta osasunean dauzkan ondorioez gain, beste efektu bat dauka, larria eta sendaezina: bakardadea.					5684476
4	doc26	The patient's loneliness and the loneliness of the family, because they can't be close to the patient.		Gaixoaren bakardadea eta familiarena, gaixoaren ondoan egon ezin delako.		Gaixoaren bakardadea eta familiarena, gaixoaren ondoan <tag>egon ezin delako</tag>.	Style - Non-fluent	Neutral	5684476
5	doc26	Many people have passed on alone.		Jende asko bakarrik hil da.					5684476
6	doc26	We have also suffered that loneliness, but we were able to heal the wounds.		Guk ere pairatu dugu bakardade hori, baina zauriak sendatu ahal izan ditugu.					5684579
1	doc27	Nicolás Achúcarro Lund: a biographical sketch of the first basque neuroscientist		Nicolás Achúcarro Lund: lehen euskal neurozientzialariaren laburpen biografiko bat					5684579
2	doc27	We wrote a brief biography of Nicolás Achúcarro Lund. Achúcarro was a medical doctor born in Bilbao.		Nicolás Achúcarro Lunden biografia labur bat idatzi dugu. Achúcarro Bilbon jaiotako mediku bat izan zen.					5684476
3	doc27	Many consider him the first Basque neuroscientist or, at least, the first neuroscientist of said region to have had an extensive international projection.		Askok lehen euskal neurozientzialaritzat hartzen dute edo, gutxienez, eskualde horretako nazioarteko entzute handia izan zuen lehenengo neurozientzialaria.					5684476
4	doc27	In this paper we look into different aspects and chapters of his life: his family, his first studies, his medical degree, the neuropsychiatric specialization, his American stage, his professional return to Spain, his illness and death, and his posthumous recognitions.		Artikulu honetan haren bizitzaren alderdi eta kapitulu ezberdinei erreparatzen diegu: haren familia, lehenengo ikasketak, medikuntza ikasketak, neuropsikiatriako espezializazioa, Ameriketako etapa, Espainiarako itzulera profesionala, gaixotasuna eta heriotza, eta hil ondoren jasotako gorespenak.		Artikulu honetan haren bizitzaren alderdi eta kapitulu ezberdinei erreparatzen diegu: haren familia, lehenengo ikasketak, <tag>medikuntza ikasketak</tag>, neuropsikiatriako espezializazioa, Ameriketako etapa, Espainiarako itzulera profesionala, gaixotasuna eta heriotza, eta hil ondoren jasotako gorespenak.	Terminology - Inconsistent use of terminology	Minor	5684476
4	doc27	In this paper we look into different aspects and chapters of his life: his family, his first studies, his medical degree, the neuropsychiatric specialization, his American stage, his professional return to Spain, his illness and death, and his posthumous recognitions.		Artikulu honetan haren bizitzaren alderdi eta kapitulu ezberdinei erreparatzen diegu: haren familia, lehenengo ikasketak, medikuntza ikasketak, neuropsikiatriako espezializazioa, Ameriketako etapa, Espainiarako itzulera profesionala, gaixotasuna eta heriotza, eta hil ondoren jasotako gorespenak.		Artikulu honetan haren bizitzaren alderdi eta kapitulu ezberdinei erreparatzen diegu: haren familia, lehenengo ikasketak, medikuntza ikasketak, neuropsikiatriako espezializazioa, Ameriketako etapa, Espainiarako itzulera profesionala, gaixotasuna eta heriotza, eta hil ondoren jasotako <tag>gorespenak</tag>.	Terminology - Wrong term	Minor	5684476
1	doc28	The american stage of Nicolás Achúcarro: histopathologist at Saint Elizabeths Hospital in Washington, D. C. (1908-1910)		Nicolás Achúcarroren Ameriketako etapa: Washington DCko Saint Elizabeths Ospitaleko histopatologoa (1908-1910)		Nicolás Achúcarroren Ameriketako etapa: <tag>Washington DCko</tag> Saint Elizabeths Ospitaleko histopatologoa (1908-1910)	Linguistic Conventions - Punctuation	Minor	5684476
2	doc28	In September 1908, the Basque neuropsychiatrist Nicolas Achúcarro moved from the Psychiatric Clinic of Munich to the Government Hospital for the Insane in Washington, D. C. with the task to organize and head the new histopathology laboratory.		1908ko irailean, Nicolás Achúcarro euskal neuropsikiatra Municheko Klinika Psikiatrikotik Washington DCko Gobernuaren Ospitale Psikiatrikora joan zen, histopatologia laborategi berria antolatzeko eta zuzentzeko lanarekin.					5684579
3	doc28	With an abundance of resources and full freedom to work, he launched the histopathological laboratory, and contributed a series of articles to the hospital Bulletin, which earned him a solid scientific reputation.		Baliabide ugarirekin eta lan egiteko askatasun osoarekin, laborategi histopatologikoa martxan jarri zuen, eta ospitaleko buletinean zenbait artikulu argitaratu zituen, ospe zientifiko sendoa irabaziz.					5684579
4	doc28	Achúcarro stayed in Washington until May 14, 1910, when he resigned his position and moved to Madrid, to work with Santiago Ramón y Cajal in his laboratory of biological research.		Achúcarro Washingtonen geratu zen 1910ko maiatzaren 14era arte, non bere postua utzi zuen eta Madrilera joan zen Santiago Ramón y Cajalekin lan egitera, haren ikerketa biologikoko laborategian.					5684579
5	doc28	Later, in September 1912, he was invited by the Fordham University of New York to teach in the International Extension Course in Medical and Nervous Diseases, together with the English neurologist Henry Head and the Swiss psychoanalyst Carl G. Jung, among other prominent figures.		Beranduago, 1912ko irailean, New Yorkeko Fordham Unibertsitateak Gaixotasun Mediko eta Nerbiosoei buruzko Nazioarteko Ikastaroan irakastera gonbidatu zuen, Henry Head neurologo ingelesarekin eta Carl G. Jung psikoanalista suitzarrarekin batera, beste pertsona ospetsu batzuen artean.					5684579
6	doc28	Drawing on the writings of Achúcarro, letters to his family, and the press of the time, this paper analyzes his work in the United States as well as his contributions to neuroscience before his untimely death in 1918 at the young age of 37.		Achúcarroren idazkietan, familiari bidalitako gutunetan eta garaiko prentsan oinarrituta, artikulu honek Estatu Batuetan egin zuen lana aztertzen du, baita neurozientzian egin zituen ekarpenak ere, 1918an hil egin zen arte, 37 urte baino ez zeuzkala.					5684579
1	doc29	Achucarro Basque Center for Neuroscience, knowledge to cure		Achucarro Basque Center for Neuroscience, ezagutu sendatzeko					5684579
2	doc29	The Basque Government and the University of the Basque Country (UPV/EHU) created the Achucarro research center in 2012 with the aim of fostering the development of neurosciences in Euskadi.		Eusko Jaurlaritzak eta Euskal Herriko Unibertsitateak (UPV/EHU) Achucarro ikerketa-zentroa ireki zuten 2012an Euskadin neurozientzien garapena sustatzeko.					5684579
3	doc29	Its main task is the study of the biology of glial cells in the healthy and diseased brain, being one of the few institutions specialized in this topic which has become currently very prominent and active.		Haren lan nagusia garun osasuntsu nahiz gaixoko zelula glialen biologia aztertzea da, gai horretan espezializatuta dagoen erakunde gutxietako bat izanik, gaur egun oso garrantzitsu eta aktibo bihurtu delarik.					5684579
4	doc29	The Center has strong translational emphasis (knowledge to cure), and its ultimate goal is the discovery of new treatments for the diseases of the nervous system.		Zentroak transferentziari garrantzi handia ematen dio (ezagutzetik sendatzera) eta haren helburu nagusia nerbio-sistemaren gaixotasunetarako tratamendu berriak aurkitzea da.					5684579
1	doc30	Hospital psychiatric care in Bizkaia.		Ospitaletako arreta psikiatrikoa Bizkaian.					5684579
2	doc30	From the Nuestra Señora de Gracia Hospital (Zaragoza) and the jail in Bilbao, to the Nicolás Achúcarro Neuropsychiatric Institute (currently Zamudio Hospital)		Nuestra Señora de Gracia Ospitaletik (Zaragoza) eta Bilboko espetxetik Nicolás Achúcarro Institutu Neuropsikiatrikora (egungo Zamudioko Ospitalea)					5684579
3	doc30	Historical tour of the origins and vicissitudes of hospital psychiatric care in Bizkaia, taking as a starting point the beginning of the 19th century and the terrible healthcare conditions of the time.		Bizkaiko ospitaleetako arreta psikiatrikoaren jatorriaren eta gorabeheren inguruko ibilbide historikoa, XIX. mendeko hasiera eta garai hartako osasun-arretaren baldintza tamalgarriak abiapuntu hartuta.					5684579
4	doc30	At first, the acutely alienated were barred from entering the then Achuri General Hospital, being sent to one of the prisons in Bilbao, along with beggars, criminals, and prostitutes.		Hasieran, ero akutuek debekatuta zeukaten garaiko Atxuriko Ospitale Nagusian sartzea, eta Bilboko espetxeetako batera bidaltzen zituzten, eskaleekin, gaizkileekin eta prostitutekin batera.					5684579
5	doc30	If their state of illness maintained, the absence of an institution for "insane" in the territory, forced the hospitalization in other provinces, far away from their family and friends, from which, sooner or later, they were totally uprooted given the long stays, even for decades.		Gaixo jarraitzen bazuten, eskualdean eroentzako" instituziorik ez zegoenez, beste probintzia batzuetan ospitaleratzera behartzen zituzten, senide eta lagunengandik urrun, non, lehenago edo beranduago, haiekiko harremana erabat galtzen baitzuten, egonaldiak oso luzeak baitziren, hamarkadetakoak."		Gaixo jarraitzen bazuten, eskualdean eroentzako" instituziorik ez zegoenez, beste probintzia batzuetan ospitaleratzera behartzen zituzten, senide eta lagunengandik urrun, non, lehenago edo beranduago, haiekiko harremana erabat galtzen baitzuten, egonaldiak oso luzeak baitziren, hamarkadetakoak.<tag>"</tag>	Linguistic Conventions - Punctuation	Neutral	5684579
6	doc30	A provincial madhouse was a long-standing aspiration, which finally never came to completion in its entirety, with partial responses such as the Bermeo hospital in 1900, or later the old spa of Zaldibar, “provisionally” dedicated to hospital purposes from 1923.		Luzaroan izan zuten eroetxe probintzial bat sortzeko asmoa, baina azkenean ez zen osorik gauzatu eta erantzun partzialak izan zituzten; adibidez, 1900eko Bermeoko ospitalea, edo beranduago Zaldibarreko bainuetxe zaharra, "behin-behineko" ospitale bihurtu zutena 1923tik aurrera.					5684579
7	doc30	Since then, there have been several attempts to take up the matter of the provincial madhouse, with some scandals and complaints even from outside, forming a surprising succession of multiple proposals and failed projects until the last third of the 20th century.		Horren ondoren, eroetxe probintzialaren arazoari erantzuteko zenbait saiakera egon ziren, kanpotik ere zetozen eskandalu eta kexekin, XX. mendeko azken herenera arte luzatu ziren hainbat proposamen eta huts egindako proiektuen segida harrigarria osatuz.					5684579
8	doc30	Among many others, the most ambitious project was the one promoted in the early 1930s, where a macro hospital complex was planned to welcome 1,300-1,500 patients and was finally transferred in 1951 to the Bishopric of Bilbao, for seminar purposes.		Beste askoren artean, proiektu handienetako bat 1930eko hamarkadaren hasieran bultzatu zena izan zen: 1300-1500 gaixorentzako makroospitale-konplexu bat planifikatu zen, eta azkenean, 1951ean, Bilboko Elizbarrutiari transferitu zioten, apaizgaitegi gisa erabiltzeko.					5684579
9	doc30	It was in the late 1960s that a new psychiatric clinic project materialized, the current Zamudio Hospital of the Bizkaia Mental Health Network, Osakidetza.		1960eko hamarkadaren amaieran gauzatu zen klinika psikiatriko berri bat eraikitzeko proiektu bat, egungo Bizkaiko Osasun Mentaleko Sareko Zamudioko Ospitalea, Osakidetza.					5684579
1	doc31	Stereotactic radiotherapy (SRS) of brain metastases		Garuneko metastasien erradioterapia estereotaktikoa (SRS)					5684579
2	doc31	A review is made of the local treatment modalities of brain metastases, either single or multiple (1 to 4, 5 to 10 metastases) that have been carried out during the last 30 years, highlighting the determining role of stereotactic radiosurgery as a single treatment modality.		Garuneko metastasiak, bakarrak edo anizkoitzak (metastasi 1etik 4ra, 5etik 10era) izan, tratatzeko azken 30 urteotan erabili diren tratamendu lokalen modalitateen berrikuspena egin da, erradiokirurgia estereotaktikoaren erabilerak tratamendu-modalitate bakar gisa izan duen paper garrantzitsua azpimarratuz.					5684579
1	doc32	Stereotactic radiotherapy (SBRT) of pulmonary oligometastases		Biriketako oligometastasien erradioterapia estereotaktikoa (SBRT)					5684579
2	doc32	A review of the local treatment options of the pulmonary oligometastatic disease is carried out, highlighting the determining role that the use of extracranial stereotactic radiotherapy (SBRT) in the local control of the disease is acquiring.		Biriketako gaixotasun oligometastatikoaren tratamendu lokalen aukeren berrikuspena egin da, erradiokirurgia estereotaktiko estrakranialaren (SBRT) erabilera gaixotasunaren kontrol lokalean lortzen ari den paper garrantzitsua azpimarratuz.					5684579
1	doc33	Urology: where do we come from and where are we going		Urologia: nondik gatozen eta nora goazen					5684579
2	doc33	In recent decades, urology as a specialty has gained great relevance outside of general surgery.		Azken hamarkadetan, urologia espezialitateak garrantzi handia lortu du kirurgia orokorraz kanpo.					5684579
3	doc33	This progress is a consequence of the high prevalence of urological diseases and their enormous economic and social impact; at the same time of significant technological innovations and medical therapies used to treat the pathologies of the genitourinary system.		Aurrerapen hori gaixotasun urologikoen prebalentzia handiaren eta haien eragin ekonomiko eta sozial izugarrien ondorioa da; baita aldi berean sistema urogenitaleko patologiak tratatzeko berrikuntza teknologiko esanguratsuak eta terapia medikoak izatearena ere.					5684579
1	doc34	New cardiac imaging techniques		Bihotzaren irudiak ateratzeko teknika berriak					5684579
2	doc34	This article discusses three advanced techniques that are used as a complement to classic tests such as the electrocardiogram and echocardiogram: three-dimensional echocardiography (3D), computerized axial tomography (CT) of the coronary arteries and cardiac magnetic resonance (MR).		Artikulu honek elektrokardiograma eta ekokardiograma bezalako proba klasikoen osagarri gisa erabiltzen diren hiru teknika aurreratu jorratzen ditu: hiru dimentsioko ekokardiografia (3D), arteria koronarioetako ordenagailu bidezko tomografia axiala (OTA) eta bihotzeko erresonantzia magnetikoa (EM).					5684579
1	doc35	Advances in interventional cardiology		Kardiologia interbentzionistako aurrerapenak					5684579
2	doc35	Interventional cardiology is a subspecialty that deals with the diagnosis and percutaneous treatment of heart disease.		Kardiologia interbentzionista bihotzeko gaixotasunen diagnostikoaz eta tratamendu perkutaneoaz arduratzen den azpiespezialitatea da.					5684579
3	doc35	The procedures are performed in a digitalized haemodynamic room that has the most advanced technology.		Teknologiarik aurreratuenak dauzkan hemodinamika-gela digitalizatu batean egiten dira prozedurak.					5684579
1	doc36	New steps in cardiac electrophysiology		Urrats berriak bihotzeko elektrofisiologian					5684579
2	doc36	The text discusses the areas of development of cardiac electrophysiology that have the greatest impact in routine clinical practice: navigation systems and ablation of arrhythmias, cordless cardiac stimulation, treatment of heart failure with devices, primary and secondary prevention of sudden death with defibrillators and surgery for arrhythmias.		Ohiko jardunbide klinikoan eraginik handiena duten bihotzeko elektrofisiologiaren garapen-arloak dira aztergai testuan: nabigazio-sistemak eta arritmien ablazioa, kablerik gabeko estimulazio kardiakoa, bihotzeko gutxiegitasuna gailuekin tratatzea, bat-bateko heriotzaren lehen eta bigarren mailako prebentzioa desfibriladoreren bidez eta arritmien kirurgia.					5684579
1	doc37	Epidemiological, clinical and microbiological research of genital herpes in the area of Bilbao		Herpes genitalaren ikerketa epidemiologiko, kliniko eta mikrobiologikoa Bilbo aldean					5684579
2	doc37	Genital herpes (GH) is a major public health problem.		Herpes genitala (HG) osasun publikoko arazo handia da.					5684579
3	doc37	According to the latest estimates of seroprevalence of WHO there were 500 million people worldwide with two types of herpes simplex virus (HSV) genital infection.		MOEaren azken seroprebalentzia-estimazioen arabera, munduan 500 milioi pertsonak baino gehiagok daukate bi motatako herpes simplex birusek (HSB) eragindako infekzio genitalen bat.					5684579
4	doc37	In recent decades there has been a clear increase of GH caused by HSV type 1, especially in young women.		Azken hamarkadetan 1 motako HSBak eragindako HGaren kasuek nabarmen gora egin dute, emakume gazteengan bereziki.					5684579
5	doc37	The objective of this study was to analyze the proportion of HSV types 1 and 2 in genital infections and the epidemiological, clinical and therapeutics characteristics of the patients with GH.		Ikerlan honen helburua infekzio genitaletan 1 eta 2 motetako HSBen proportzioa aztertzea zen, baita HGa daukaten gaixoen ezaugarri epidemiologiko, kliniko eta terapeutikoak ere.					5684579
6	doc37	Epidemiological retrospective study from STD clinic patients with GH of Bilbo-Basurto integrated health organization during years 2004–2015.		2004–2015 urteetan Bilbo-Basurtuko Erakunde Sanitario Integratuko STGen kliniketako GH-pazienteengan oinarrituriko ikerketa epidemiologiko erretrospektiboa.					5684579
7	doc37	According to the results obtained, the proportion of patients with GH increased during the study period, especially genital infections by HSV type 1.		Lortutako emaitzen arabera, HGa duten pazienteen proportzioak gora egin du ikertutako epean, batez ere 1 motako HSBak eragindako infekzio genitalak.					5684579
8	doc37	These infections were higher among young women, with first episode of GH and prior contact with a partner’s oral-labial herpes, homosexual men and oral sex.		Infekzio horiek altuagoak ziren emakume gazteen artean, HGaren lehenengo agerpena eta aurretik bikotekide baten aho-ezpainetako lesio herpetikoekin kontaktua izanik, gizon homosexualak eta sexu orala.					5684579
9	doc37	Sexual behaviors associated with HSV type 2 infection were prostitution and prior STD.		2 motako HSBaren infekzioarekin loturiko jokaera sexualak prostituzioa eta aurretik STGak eduki izana ziren.					5684579
10	doc37	An increase in the incidence of genital infections caused by HSV type 1 was found, especially in young women.		1 motako HBSak eragindako infekzio genitalen intzidentzia igo zela ikusi zen, gehienbat emakume gazteen artean.					5684579
11	doc37	To expand the obtained information, it would be interesting to conduct a seroprevalence study in the general population in our geographical area.		Lortutako informazioa sakontzeko, interesgarria izango litzateke gure eremu geografikoko biztanleria orokorrean seroprebalentzia-ikerketa bat egitea.					5684579
1	doc38	Surgical management of the thumb arthritis.		Erpuruko artrosiaren tratamendu kirurgikoa.					5684579
2	doc38	Personal experience and assessment of the different techniques.		Esperientzia pertsonala eta teknika ezberdinen azterketa.					5684579
3	doc38	Osteoarthritis of the thumb carpometacarpal (CMC) joint remains one of the main reasons for visiting a hand centre.		Erpuruko giltzadura karpometakarpianoaren (CMC) artrosia da eskuetarako zentro bat bisitatzeko arrazoi nagusietako bat.					5684579
4	doc38	Whenever the conservative treatment fails, the surgical approach will be offered.		Tratamendu kontserbatzaileak huts egiten duen bakoitzean, tratamendu kirurgikoa eskainiko da.					5684579
5	doc38	This treatment should be indicated individually for each patient, depending on various factors as the age, the degeneration degree, the functional demand and so on.		Tratamendu hau gaixo bakoitzari indibidualki gomendatu behar zaio, hainbat faktoreren arabera, hala nola adina, endekapen maila, eskari funtzionala, eta abar.					5684579
7	doc38	The average age of the patients was 53,89 years, with predominance of females (89,28%).		Gaixoen batez besteko adina 53,89 urtekoa zen; gehienak, emakumeak (% 89,28).					5684579
9	doc38	In 11 cases an arthroscopic arthroplasty was performed (ATK), in 11 patients a CMC fusion and in 5 a ligamentoplasty.		11 kasutan, artroplastia artroskopiko bat egin zen (ATK), 11 gaixotan CMCaren fusio bat eta 5etan, ligamentoplastia bat.					5684579
10	doc38	Out of the 112 patients, 63 patients have been controlled, with an average F-U of 19.5 months.		112 pazienteetatik, 63 kontrolatu dira, eta 19,5 hilabeteko segimendua egin zaie, batez beste.					5684579
12	doc38	Focus on the pain, assessed by the visual analog scale, the improvement was 5.62, 5.98, 6 and 6.33 points respectively, compared to the preoperative situation.		Minari dagokionez, eskala analogiko bisual bidez ebaluatuta, hobekuntza 5,62, 5,98, 6 eta 6,33 puntukoa izan zen, hurrenez hurren, ebakuntza aurreko egoerarekin alderatuta.					5684579
13	doc38	These outcomes confirm the usefulness of the suspension-interposition arthroplasty as an ideal technique for the common patient of CMC arthritis.		Emaitza horiek suspentsio-interposizio artroplastiaren erabilgarritasuna berresten dute, CMC artritisa daukan ohiko gaixoarentzako teknika egokiena izanik.					5684579
7	doc39	The law that regulates the different assisted reproduction treatments is Law 14/2006 of May 26, published in B.O.E.		Laguntza bidezko ugalketarako tratamendu ezberdinak arautzen dituen legea maiatzaren 26ko 14/2006 Legea da, BOEn argitaratua.					5684579
11	doc39	It is concluded that the percentage of cesareans and multiple pregnancies is higher in the pregnancies obtained by the different T.R.A. than in natural pregnancies and that the worst perinatal results are basically when the woman is over 40 and in multiple pregnancies.		Ondorioztatu da zesareen eta haurduntza anizkoitzen ehunekoa handiagoa dela laguntza bidezko ugalketarako tratamendu ezberdinei esker lortutako haurduntzetan haurduntza naturaletan baino, eta emaitza perinatal txarrenak emakumea 40 urtetik gorakoa denean eta haurduntza anizkoitza denean gertatzen direla.					5684579
1	doc40	How is the distribution of automatic external defibrillators in Euskadi?		Nolakoa da kanpoko desfibriladore automatikoen banaketa Euskadin?					5684579
3	doc40	Spanish legislation requires the placement of these devices in certain places with a large influx of public.		Espainiako legeriak jende asko ibiltzen den toki jakin batzuetan halako gailuak ipintzea eskatzen du.					5684579
4	doc40	With the present work we wanted to analyze what is its distribution in Euskadi, and if it was adjusted to the population of each of its provinces.		Lan honetan, Euskadin haien banaketa nola egin den aztertu nahi genuen, eta probintzia bakoitzeko biztanleriaren araberakoa den ala ez.					5684579
5	doc40	At the time of carrying out this study, a total of 1711 DEAs have been counted in Euskadi, although there is no homogeneous distribution between Vizcaya, Guipúzcoa and Álava.		Ikerlan hau egiteko unean, 1711 DEA zenbatu dira guztira Euskadin, banaketa Bizkaian, Gipuzkoan eta Araban homogeneoa ez den arren.					5684579
1	doc41	Stereotactic radiotherapy (SBRT) in localized non-small cell lung carcinoma (CNMP).		Erradioterapia estereotaktikoa (SBRT) biriketako kartzinoma ez-mikrozitiko (CNMP) lokalizatuan.					5684579
2	doc41	Stereotactic body radiation therapy (SBRT) has emerged as a treatment for early stage non-small cell lung cancer (NSCLC), particularly for patients who are unable to tolerate surgical resection, and possibly as an alternative to surgery for some appropriately selected patients.		Gorputzaren erradiazio estereotaktikoaren terapia (SBRT) biriketako kartzinoma ez-mikrozitiko (NSCLC) goiztiarraren tratamendu bilakatu da, bereziki erresekzio kirurgikoa jasan ezin duten gaixoentzako, eta kirurgiaren alternatiba izan daiteke ongi hautatutako gaixo batzuen kasuan.					5684579
