SEG_ID	Doc	Source	Tagged_Source	Target	MT	Tagged_Target	Error Category	Severity	Annotator_ID
5	doc59	Durante un'epidemia è presente un’incertezza di fondo, ogni giorno emergono nuovi dati e informazioni e ogni giorno si capisce (o si fraintende) qualcosa di più sul virus.		During an epidemic there is an underlying uncertainty, new data and information emerge every day, and every day something more is understood (or misunderstood) about the virus.					5683505
6	doc59	Una massiccia presenza di disinformazione COVID-19, in particolare sui social media è presente relativamente ai trattamenti, all'utilità di indossare la mascherina, ai casi COVID-19 per fascia di età, alle teorie complottiste; tutto queto ha aggiunto più confusione e incertezza per la popolazione.		A massive presence of COVID-19 disinformation, particularly on social media, is present in relation to treatments, the usefulness of wearing a mask, COVID-19 cases by age group, conspiracy theories; all of this has added more confusion and uncertainty for the population.					5683505
7	doc59	La salute pubblica deve proteggere la popolazione dalla disinformazione.		Public health must protect the population from misinformation.		Public health must protect <tag>the</tag> population from misinformation.	Linguistic Conventions - Grammar	Neutral	5683545
8	doc59	Sebbene nella pratica siano state messe in atto azioni per migliorare la compliance dei pazienti rispetto alla promozione della salute, non è chiara la relazione ontologica tra promozione della salute e alfabetizzazione sanitaria nel contesto della sanità pubblica.		Although in practice actions have been put in place to improve patient compliance with respect to health promotion, the ontological relationship between health promotion and health literacy in the context of public health is unclear.					5683505
1	doc6	Dissezione laterocervicale mediante approccio retroauricolare assistito da sistema VITOM-3D (RAND-3D): studio preclinico in cadaver lab.		Laterocervical dissection by VITOM-3D system-assisted retroauricular approach (RAND-3D): preclinical study in cadaver lab.					5683550
2	doc6	Il recente avvento della chirurgia esoscopica 3D ha consentito, nell’ambito della chirurgia cervico-cefalica, l’introduzione di interessanti innovazioni tecnologiche, risultanti in soluzioni tecniche applicabili anche alla chirurgia del collo, con l’obiettivo di rappresentare un’alternativa alla chirurgia robotica, minimizzando i costi della procedura.		The recent advent of 3D exoscopic surgery has allowed the introduction of interesting technological innovations in the field of neck and neck surgery, resulting in technical solutions that are also applicable to neck surgery, with the aim of representing an alternative to robotic surgery, by minimizing the costs of the procedure.		The recent advent of 3D exoscopic surgery has allowed the introduction of interesting technological innovations in the field of <tag>neck</tag> and neck surgery, resulting in technical solutions that are also applicable to neck surgery, with the aim of representing an alternative to robotic surgery, by minimizing the costs of the procedure.	Accuracy - Mistranslation	Critical	5683545
3	doc6	Sulla base di queste considerazioni abbiamo recentemente condotto uno studio pre-clinico nel nostro cadaver lab, focalizzato sull’esecuzione dello svuotamento linfonodale laterocervicale con approccio retroauricolare, valutando le applicazioni e l’utilità del Sistema Esoscopico 3D Storz nei vari steps dell’intervento.		Based on these considerations we have recently conducted a pre-clinical study in our cadaver lab, which is focused on the execution of laterocervical lymph node dissection with a retroauricular approach, by evaluating the applications and usefulness of the Storz 3D Exoscopic System in the various steps of the intervention.		Based on these considerations we have recently conducted a pre-clinical study in our cadaver lab, which is focused on the execution of laterocervical lymph node dissection with a retroauricular approach, by evaluating the applications and usefulness of the Storz 3D Exoscopic System in the various steps of the <tag>intervention.</tag>	Terminology - Wrong term	Neutral	5683550
4	doc6	Abbiamo coniato l’acronimo di RAND-3D (chirurgia esoscopica 3D) per descrivere l’impiego di questo tool ottico nell’esecuzione di tale procedura chirurgica.		We have coined the acronym RAND-3D (3D exoscopic surgery) to describe the use of this optical tool in performing this surgical procedure.		We have coined the acronym RAND-3D (3D exoscopic surgery) to describe the <tag>use</tag> of this optical tool in performing this surgical procedure.	Terminology - Wrong term	Minor	5683545
5	doc6	Il seguente studio condotto nel cadaver lab ha indicato che la tecnica RAND-3D rappresenta una valida alternativa per l’esecuzione dello svuotamento del collo con approccio retroauricolare.		The following study conducted in the cadaver lab indicated that the RAND-3D technique represents a valid alternative to performing a neck dissection with a retroauricular approach.		The following study conducted in the cadaver lab indicated that the RAND-3D technique represents a valid alternative <tag>to</tag> performing a neck dissection with a retroauricular approach.	Linguistic Conventions - Grammar	Major	5683545
5	doc6	Il seguente studio condotto nel cadaver lab ha indicato che la tecnica RAND-3D rappresenta una valida alternativa per l’esecuzione dello svuotamento del collo con approccio retroauricolare.		The following study conducted in the cadaver lab indicated that the RAND-3D technique represents a valid alternative to performing a neck dissection with a retroauricular approach.		The following study conducted in the cadaver lab indicated that the RAND-3D technique represents a valid alternative to performing a neck dissection <tag>with a</tag> retroauricular approach.	Linguistic Conventions - Grammar	Minor	5683545
6	doc6	Questa metodica, tecnicamente fattibile e sicura, permette una dissezione compartimentale, senza danno alle principali strutture vascolo-nervose cervicali.		This method, which is technically feasible and safe, allows a compartmental dissection, without damage to the main cervical vascular-nerve structures.					5683550
7	doc6	Questo approccio può essere impiegato in casi selezionati con un chiaro finalismo estetico, rappresentando una valida alternativa alle metodiche endoscopiche e robotiche.		This approach can be used in selected cases with a clear aesthetic finalism, and represents a valid alternative to endoscopic and robotic methods.					5683550
1	doc61	Nel mese di febbraio 2020 il primo caso di COVID-19 è arrivato in Canton Ticino.		In February 2020, the first case of COVID-19 arrived in the Ticino Canton.		In February 2020, the first case of COVID-19 <tag>arrived</tag> in the Ticino Canton.	Linguistic Conventions - Register	Minor	5683545
2	doc61	A partire da quel momento molte cose sono cambiate a grande velocità soprattutto nelle organizzazioni sanitarie e questi cambiamenti hanno avuto un forte impatto sulla professione infermieristica.		Since then, many things have changed at great speed, especially in healthcare organizations, and these changes have had a strong impact on the nursing profession.					5683550
3	doc61	L’obiettivo di questa ricerca era: Indagare i vissuti di infermieri che nei diversi livelli organizzativi si sono trovati confrontati con la pandemia COVID nel primo mese in cui si è manifestata.		The objective of this research was: To investigate the experiences of nurses at different organizational levels, who were confronted with the COVID pandemic in the first month it occurred.		The objective of this research <tag>was:</tag> To investigate the experiences of nurses at different organizational levels, who were confronted with the COVID pandemic in the first month it occurred.	Linguistic Conventions - Punctuation	Minor	5683545
3	doc61	L’obiettivo di questa ricerca era: Indagare i vissuti di infermieri che nei diversi livelli organizzativi si sono trovati confrontati con la pandemia COVID nel primo mese in cui si è manifestata.		The objective of this research was: To investigate the experiences of nurses at different organizational levels, who were confronted with the COVID pandemic in the first month it occurred.		The <tag>objective</tag> of this research was: To investigate the experiences of nurses at different organizational levels, who were confronted with the COVID pandemic in the first month it occurred.	Other	Neutral	5683545
3	doc61	L’obiettivo di questa ricerca era: Indagare i vissuti di infermieri che nei diversi livelli organizzativi si sono trovati confrontati con la pandemia COVID nel primo mese in cui si è manifestata.		The objective of this research was: To investigate the experiences of nurses at different organizational levels, who were confronted with the COVID pandemic in the first month it occurred.		The objective of this research was: To investigate the experiences of nurses at different organizational levels, who <tag>were confronted with</tag> the COVID pandemic in the first month it occurred.	Style - Non-fluent	Neutral	5683545
3	doc61	L’obiettivo di questa ricerca era: Indagare i vissuti di infermieri che nei diversi livelli organizzativi si sono trovati confrontati con la pandemia COVID nel primo mese in cui si è manifestata.		The objective of this research was: To investigate the experiences of nurses at different organizational levels, who were confronted with the COVID pandemic in the first month it occurred.		The objective of this research was: To investigate the experiences of nurses at different organizational levels, who were confronted with the COVID pandemic <tag>in the first month it occurred</tag>.	Style - Non-fluent	Minor	5683545
4	doc61	Ricerca Narrativa.		Narrative Research.					5683550
5	doc61	La raccolta dati è avvenuta coinvolgendo un campione composto da 20 infermieri che lavorano in contesti e ruoli diversi in Canton Ticino.		The data collection involved a sample of 20 nurses working in different contexts and roles in the Canton of Ticino.					5683550
6	doc61	Le narrazioni raccolte sono state analizzate attraverso un’analisi tematica del loro contenuto usando Nvivo 12®.		The collected narratives were analyzed through a thematic analysis of their content using Nvivo 12®.		The collected <tag>narratives</tag> were analyzed through a thematic analysis of their content using Nvivo 12®.	Terminology - Inconsistent use of terminology	Minor	5683550
7	doc61	L’analisi tematica delle narrazioni ha permesso di definire 26 temi e 6 macrotemi: Pandemia, Cosa cambia, Comunicazione, Emozioni/vissuti, Ruolo e immagine, Collaborazione interprofessionale.		The thematic analysis of the narratives made it possible to define 26 themes and 6 macro-themes: Pandemic, What Changes, Communication, Emotions/Experiences, Role and Image, Interprofessional Collaboration.		The thematic analysis of the narratives <tag>made it possible</tag> to define 26 themes and 6 macro-themes: Pandemic, What Changes, Communication, Emotions/Experiences, Role and Image, Interprofessional Collaboration.	Accuracy - Mistranslation	Neutral	5683550
8	doc61	I risultati di questa ricerca permettono di comprendere come un gruppo eterogeneo di infermieri ha vissuto il particolare periodo di manifestazione e diffusione della pandemia in Canton Ticino e quali riflessioni ne sono derivate.		The results of this research allow us to understand how a heterogeneous group of nurses experienced the particular period of manifestation and spread of the pandemic in Canton of Ticino and what reflections derived from it.		The results of this research allow <tag>us</tag> to understand how a heterogeneous group of nurses experienced the particular period of manifestation and spread of the pandemic in Canton of Ticino and what reflections derived from it.	Accuracy - Addition	Major	5683550
9	doc61	Alcuni aspetti evidenziati si possono confrontare con quanto presente nella letteratura internazionale sul tema per trovare vie di azione comuni per la leadership infermieristica che, nei diversi Paesi, si trova confrontata con il dover organizzare, gestire e sostenere i professionisti infermieri in questa e future pandemie.		A few of the highlighted aspects can be compared with what is present in the international literature on the topic to find common ways o action for the nursing leadership in different countries faced with having to organize, manage and support nursing professionals in this and future pandemics.		A few of the highlighted aspects can be compared with what is present in the international literature on the topic to find common ways <tag>o</tag> action for the nursing leadership in different countries faced with having to organize, manage and support nursing professionals in this and future pandemics.	Linguistic Conventions - Spelling	Neutral	5683550
10	doc61	I risultati di questa ricerca possono essere utilizzati sia a livello organizzativo che a livello formativo e possono rappresentare il punto di partenza per future ricerche.		The results of this research can be used both at an organizational and educational level and can represent the starting point for future research.					5683550
1	doc62	COVID-19 e olfatto: revisione critica della letteratura sulla valutazione olfattiva.		COVID-19 and sense of smell: critical review of the literature on olfactory evaluation.					5683545
2	doc62	Da dicembre 2019, in seguito alla comparsa in Cina di una nuova infezione da Coronavirus (COVID-19), si è assistito alla diffusione di una pandemia.		Since December 2019, a pandemic has been witnessed following the appearance of a new Coronavirus (COVID-19) infection in China.		Since December 2019, a pandemic has been witnessed following the <tag>appearance</tag> of a new Coronavirus (COVID-19) infection in China.	Accuracy - Mistranslation	Minor	5683524
2	doc62	Da dicembre 2019, in seguito alla comparsa in Cina di una nuova infezione da Coronavirus (COVID-19), si è assistito alla diffusione di una pandemia.	<tag>Da</tag> dicembre 2019, in seguito alla comparsa in Cina di una nuova infezione da Coronavirus (COVID-19), si è assistito alla diffusione di una pandemia.	Since December 2019, a pandemic has been witnessed following the appearance of a new Coronavirus (COVID-19) infection in China.				Minor	5683524
3	doc62	In un numero significativo di pazienti è stata riscontrata la comparsa di alterazioni dell’olfatto anche in assenza di altri sintomi tipici dell’infezione.		In a significant number of patients, the appearance of smell alterations was found even in the absence of other typical symptoms of the infection.		In a significant number of patients, <tag>the appearance</tag> of smell alterations was found even in the absence of other typical symptoms of the infection.	Terminology - Inconsistent use of terminology	Neutral	5683550
4	doc62	In questa revisione della letteratura sono stati inclusi gli articoli pubblicati da gennaio 2020 sull’alterazione olfattiva nei pazienti COVID-19 e in particolare i metodi utilizzati per la diagnosi.		In this literature review, articles have been included that were published on olfactory alteration in COVID-19 patients since January 2020 and specifically methods used for diagnosis.					5683550
5	doc62	L’analisi della letteratura ha mostrato che la diagnosi dell’alterazione olfattiva in questi pazienti è stata eseguita principalmente mediante questionari.		Literature analysis showed that the diagnosis of olfactory alteration in these patients was mainly made by means of questionnaires.					5683550
6	doc62	Pochi studi si sono basati sulla valutazione olfattiva mediante test psicofisici validati.		Few studies have been based on olfactory evaluation using validated psychophysical tests.					5683550
7	doc62	Sono emerse discrepanze tra l’alterazione olfattiva riportata nei questionari e la valutazione olfattiva eseguita mediante test psicofisici.		There were discrepancies between the olfactory change reported in the questionnaires and the olfactory assessment performed through psychophysical tests.		<tag>There were</tag> discrepancies between the olfactory change reported in the questionnaires and the olfactory assessment performed through psychophysical tests.	Terminology - Inconsistent use of terminology	Neutral	5683550
8	doc62	Ad oggi lo studio dell’olfatto nei pazienti COVID-19 è stato eseguito in maniera eterogenea e principalmente basata sui sintomi riferiti dai pazienti portando a risultati spesso contrastanti.		To date, the study of smell in COVID-19 patients has been performed in a heterogeneous manner and is mainly based on the symptoms reported by patients, often leading to conflicting results.					5683536
9	doc62	Gli autori suggeriscono di utilizzare test olfattivi psicofisici, semplici, validati e somministrabili anche in assenza di un operatore al fine di confermare l’alterazione olfattiva in questi pazienti che spesso sono in quarantena, isolati o ospedalizzati.		The authors suggest using psychophysical olfactory tests that are simple, validated and administrable even in the absence of an operator, in order to confirm the olfactory alteration in these patients who are often in quarantine, isolated or hospitalized.					5683536
1	doc67	Il trattamento orale dell’ipertiroidismo felino con farmaci tirostatici causa nel 10-20% dei gatti degli effetti collaterali gastrointestinali.		Oral treatment of feline hyperthyroidism with thyrostatic drugs causes gastrointestinal side effects in 10-20% of cats.					5683536
2	doc67	Attualmente sono approvate solo delle formulazioni orali anche se non tutti i gatti tollerano un medicamento per via orale.		Currently, only oral formulations are approved, although not all cats tolerate an oral medication.					5683536
3	doc67	Un’alternativa sarebbe una terapia transdermica che garantisce via dei nanovettori il trasporto del principio attivo attraversa la pelle.		An alternative would be a transdermal therapy, that ensures the transportation of the active ingredient through the skin via nanocarriers.					5683536
4	doc67	In questo studio pilota è stata studiata l’efficacia e la sicurezza di una nuova formulazione dermica con tiomazolo per il trattamento dell’iperdiroidismo nei felini.		This pivotal study investigated the efficacy and safety of a novel dermal formulation with thiomazole for the treatment of hyperthyroidism in cats.		This pivotal study investigated the efficacy and safety of a <tag>novel</tag> dermal formulation with thiomazole for the treatment of hyperthyroidism in cats.	Accuracy - Mistranslation	Major	5683536
5	doc67	Per la prima volta si sono utilizzati nanovettori anfifilici dendritici con nucleo a più gusci.		Dendritic amphiphilic nanovectors with a multi-shell core were used for the first time.					5683536
6	doc67	Sono stati presi in considerazione solo gatti con risultati clinici accertati e con un valore sierico T4 ≥ 4,0 µg/dl oppure con un valore T4 tra 3,0–4,0 µg/dl.		Only cats with established clinical findings and with a serum T4 value ≥ 4.0 µg/dl or with a T4 value between 3.0–4.0 µg/dl were considered.					5683536
7	doc67	La zona eutiroidea è stata definita con un valore T4 compreso tra ≥ 0,8 e ≤ 4,0 µg/dl.		The euthyroid zone was defined as a T4 value between ≥ 0.8 and ≤ 4.0 µg/dL.					5683536
8	doc67	Sono stati inclusi un totale di 24 gatti ipertiroidei e sono stati trattati con un unguento al tiomazolo durante 3 (24 gatti) a otto settimane (12 gatti).		A total of 24 hyperthyroid cats were included and were treated with thiomazole ointment during 3 (24 cats) to eight weeks (12 cats).					5683536
9	doc67	Il successo del trattamento dopo tre settimane era del 50% e dopo otto settimane del 41.7%.		Treatment success after three weeks was 50% and after eight weeks 41.7%.					5683536
10	doc67	I gatti che hanno raggiunto la zona eutiroidea avevano ricevuto dopo tre settimane una dose media di 1,09 mg/kg/d (0,68–1,7 mg/kg/d, 12/24) e dopo otto settimane 1,65 mg/kg/d (1,49-2,04 mg/kg/d, 5/12).		Cats that reached the euthyroid zone received a mean dose of 1.09 mg/kg/d (0.68–1.7 mg/kg/d, 12/24) after three weeks and 1.65 mg/kg/d (1.49–2.04 mg/kg/d, 5/12) after eight weeks.					5683536
11	doc67	Non sono stati rilevati effetti collaterali durante il periodo dello studio di tre a otto settimane.		No side effects were detected during the study period of three to eight weeks.					5683536
12	doc67	Le variazioni dei valori T4 tra gatti partner che vivevano nella stessa famiglia erano paragonabili a quelle di un gruppo di controllo indipendente.		Variations in T4 values between partner cats living in the same household were comparable to those of an independent control group.					5683536
13	doc67	L’unguento a base di tiomazolo con nanovettori è adatto al trattamento dell’ipertiroidismo felino.		Thiomazole ointment with nanovectors is suitable for the treatment of feline hyperthyroidism.					5683536
1	doc69	La soddisfazione materna rispetto all’assistenza ricevuta nel punto nascita è un indicatore della qualità dei servizi sanitari.		Maternal satisfaction with respect to the care received at the birthing point is an indicator of the quality of health services.					5683536
2	doc69	Valutare la soddisfazione materna in merito all’evento nascita, prendendo in esame alcune pratiche assistenziali e come sono state percepite dalle donne.		Assess maternal satisfaction with the birth event, taking some caregiving practices and how they were perceived by women into consideration.		Assess maternal satisfaction with the birth event, taking some caregiving practices and how they were perceived by women <tag>into consideration</tag>.	Accuracy - Addition	Neutral	5683524
3	doc69	È stato condotto uno studio osservazionale tra maggio e agosto 2018 tramite questionario online proposto a donne che avessero partorito negli ultimi 3 anni.		An observational study was conducted between May and August 2018 through an online questionnaire proposed to women who had given birth in the last 3 years.					5683524
4	doc69	I dati sono stati sottoposti ad analisi descrittiva e bivariata, considerando la soddisfazione come outcome.		The data were subjected to descriptive and bivariate analysis, considering satisfaction as the outcome.		<tag>The</tag> data were subjected to descriptive and bivariate analysis, considering satisfaction as the outcome.	Accuracy - Addition	Neutral	5683524
5	doc69	Il campione è costituito da 1229 donne.		The sample consists of 1229 women.					5683524
6	doc69	Circa il 73% ha partorito spontaneamente e rispettivamente nel 29,3% e 34,4% dei casi sono state praticate manovra di Kristeller ed episiotomia.		About 73% delivered spontaneously, and the Kristeller maneuver and episiotomy were performed in 29.3% and 34.4% of cases, respectively.					5683524
7	doc69	Tre donne su 10 lamentano un mancato coinvolgimento nelle decisioni assistenziali, il 13,9% afferma che il parto abbia influito negativamente sulla volontà di avere altri figli e il 19,8% non tornerebbe a partorire nella stessa struttura.		Three out of 10 women complain of a lack of involvement in assistance decisions, 13.9% say that the delivery has negatively affected the desire to have more children and 19.8% would not go back to give birth in the same facility.		Three out of 10 women complain <tag>of</tag> a lack of involvement in assistance decisions, 13.9% say that the delivery has negatively affected the desire to have more children and 19.8% would not go back to give birth in the same facility.	Accuracy - Mistranslation	Minor	5683524
8	doc69	Quattro donne su 10 sono soddisfatte solo in parte e il 6,4% non lo è affatto.		Four out of 10 women are only partially satisfied and 6.4% are not satisfied at all.					5683524
9	doc69	La soddisfazione è associata in modo statisticamente significativo alle variabili: età superiore a 25 anni, ambiente di travaglio sereno, atteggiamento cordiale del personale, personale rispettoso dei bisogni, rispetto della dignità, coinvolgimento nelle decisioni assistenziali, persona di fiducia durante travaglio e parto, parto vaginale, esperienza positiva del parto, episiotomia, manovra di Kristeller, contatto pelle-a-pelle, supporto per l’allattamento nel post partum, scelta di tornare al prossimo parto.		Satisfaction is statistically significantly associated with the variables: age over 25, a peaceful labor environment, friendly attitude of the staff, staff respectful of needs, respect of dignity, involvement in care decisions, a trusted person during labor and delivery, vaginal delivery, positive birth experience, episiotomy, Kristeller maneuver, skin-to-skin contact, support for breastfeeding in the postpartum period, choice to return for the next delivery.					5683524
10	doc69	È necessario attuare strategie finalizzate a garantire la centralità della triade madre-partner-bambino nell’evento nascita e rendere più efficiente l’allocazione delle risorse umane.		It is necessary to implement strategies aimed at ensuring the central role of the mother-partner-child triad in the birth event and making the allocation of human resources more efficient.					5683524
1	doc72	Il Web ed i social network svolgono un ruolo cruciale nella ricerca di informazioni sanitarie e nei livelli di alfabetizzazione sanitaria.		The web and social networks play a crucial role in finding health information and health literacy levels.		<tag>The</tag> web and social networks play a crucial role in finding health information and health literacy levels.	Accuracy - Addition	Major	5683524
