SEG_ID	Doc	Source	Tagged_Source	Target	MT	Tagged_Target	Error Category	Severity	Annotator_ID
4	doc80	Recentemente sono stati adottati diversi protocolli per garantire il minor rischio di contagio per il personale sanitario e i professionisti che gestiscono pazienti COVID-19 che necessitano di procedure chirurgiche urgenti o pianificate.		Several protocols have recently been adopted to ensure that healthcare professionals and professionals handling COVID-19 patients requiring urgent or planned surgical procedures are at the least risk of infection.		<tag>Several protocols have recently been adopted to ensure that healthcare professionals and professionals handling COVID-19 patients requiring urgent or planned surgical procedures are at the least risk of infection.</tag>	Style - Non-fluent	Minor	5683524
5	doc80	Tuttavia, l’entità di tale rischio non è stato ancora adeguatamente studiato.		However, the magnitude of such risk has not yet been adequately investigated.					5683505
6	doc80	Ad oggi, non sono disponibili informazioni sul rischio di contagio dal fluido peritoneale con il quale i chirurghi possono entrare in contatto durante la chirurgia addominale su pazienti COVID-19.		To date, there is no information available on the risk of contagion from the peritoneal fluid with which surgeons may come into contact during abdominal surgery on COVID-19 patients.					5683505
7	doc80	L’obiettivo del nostro studio è quello di ricercare la presenza dell’RNA virale del SARS-CoV-2 nel fluido peritoneale mediante campionamenti seriati in corso di intervento e nell’immediato post-operatorio.		The objective of our study is to investigate the presence of SARS-CoV-2 viral RNA in the peritoneal fluid through serial samples during surgery and in the immediate post-operative period.		The <tag>objective</tag> of our study is to investigate the presence of SARS-CoV-2 viral RNA in the peritoneal fluid through serial samples during surgery and in the immediate post-operative period.	Other	Neutral	5683545
8	doc80	Data l’urgente necessità di informazioni in merito a questo argomento, riportiamo i risultati sul primo paziente di tale studio.		Given the urgent need for information on this topic, we report the results on the first patient of this study.					5683524
9	doc80	CASO CLINICO: Presentiamo il caso di una donna di 80 anni con sintomi addominali (algie e diarrea) da circa due settimane e trattata a domicilio con antibiotici ad ampio spettro.		CLINICAL CASE: We present the case of an 80-year-old woman with abdominal symptoms (pain and diarrhea) for about two weeks, treated at home with broad-spectrum antibiotics.					5683524
10	doc80	Per la persistenza dei sintomi la paziente è stata ricoverata in ospedale dove gli esami hanno posto sospetto di malattia da COVID-19, confermata poi da tampone naso-faringeo mantenutosi positivo nei controlli successivi fino a 40 giorni dopo l’inizio dei sintomi.		Due to the persistence of symptoms, the patient was admitted to the hospital where tests led to suspect illness from COVID-19, which was later confirmed by nasopharyngeal swab that remained positive in subsequent follow-ups up to 40 days after the onset of symptoms.					5683505
11	doc80	Circa 3 giorni dopo la negativizzazione del tampone naso-faringeo la paziente ha sviluppato un quadro di addome acuto e shock settico con riscontro TC di perforazione intestinale che ha richiesto una laparotomia esplorativa urgente, senza evidenza di contaminazione peritoneale ma rivelando una piccola perforazione diverticolare.		About three days after the nasopharyngeal swab was negative, the patient developed a clinical picture of acute abdomen and septic shock with a CT finding of intestinal perforation that required an urgent exploratory laparotomy, without evidence of peritoneal contamination but revealing a small diverticular perforation.		About three days after <tag>the</tag> nasopharyngeal swab was negative, the patient developed a clinical picture of acute abdomen and septic shock with a CT finding of intestinal perforation that required an urgent exploratory laparotomy, without evidence of peritoneal contamination but revealing a small diverticular perforation.	Linguistic Conventions - Grammar	Major	5683545
12	doc80	Sono stati eseguiti 2 tamponi addominali per ricerca di COVID-19 in corso di intervento chirurgico ed un terzo tampone è stato eseguito il giorno successivo da liquido di drenaggio addominale, con esito negativo.		Two abdominal swabs were performed to search for COVID-19 during surgery and a third swab was performed the next day from abdominal drainage fluid, with negative results.					5683524
13	doc80	La paziente è deceduta in quinta giornata postoperatoria per insufficienza multiorganica.		The patient died on the fifth postoperative day from multi-organ failure.		The patient died on the fifth <tag>postoperative</tag> day from multi-organ failure.	Accuracy - Mistranslation	Major	5485595
14	doc80	Nonostante la manifestazione più frequente della malattia da COVID-19 sia respiratoria, sono state riportate presentazioni meno comuni con diarrea, nausea, vomito ed algie addominali.		Although the most frequent manifestation of illness from COVID-19 is respiratory, less common presentations with diarrhea, nausea, vomiting, and abdominal pain have been reported.		Although the most frequent manifestation of <tag>illness</tag> from COVID-19 is respiratory, less common presentations with diarrhea, nausea, vomiting, and abdominal pain have been reported.	Accuracy - Mistranslation	Major	5683524
14	doc80	Nonostante la manifestazione più frequente della malattia da COVID-19 sia respiratoria, sono state riportate presentazioni meno comuni con diarrea, nausea, vomito ed algie addominali.	Nonostante la manifestazione più frequente della malattia da COVID-19 sia respiratoria, sono state riportate <tag>presentazioni</tag> meno comuni con diarrea, nausea, vomito ed algie addominali.	Although the most frequent manifestation of illness from COVID-19 is respiratory, less common presentations with diarrhea, nausea, vomiting, and abdominal pain have been reported.				Major	5683524
15	doc80	Nel nostro caso la presenza di SARS COV-2 RNA non è stata identificata nei fluidi biologici, tuttavia rimane l’ipotesi di una diffusione sistemica della malattia con la possibilità di una tempesta infiammatoria, soprattutto per l’assenza di una peritonite evidenziabile al momento dell’intervento chirurgico.		In our case the presence of SARS COV-2 RNA was not identified in the biological fluids, however the hypothesis remains of a systemic spread of the disease with the possibility of an inflammatory storm, mainly due to the absence of a detectable peritonitis at the time of surgery.		In our case the presence of SARS COV-2 RNA was not identified in the biological fluids, however <tag>the hypothesis remains of a systemic spread</tag> of the disease with the possibility of an inflammatory storm, mainly due to the absence of a detectable peritonitis at the time of surgery.	Other	Neutral	5683550
16	doc80	Sarebbe importante valutare l’esistenza di un rischio variabile di contaminazione in corso di intervento chirurgico nei pazienti positivi, a seconda dei diversi stadi della malattia SARS COV-2.		It would be important to assess the existence of a variable risk of contamination during surgery in positive patients, depending on the different stages of SARS COV-2 disease.					5683524
17	doc80	Ciò potrebbe consentire di riconsiderare le norme sul rischio di contagio del personale sanitario durante l’intervento chirurgico.		This could make it possible to reconsider the rules on the risk of contagion of healthcare professionals during surgery.					5683524
18	doc80	Infatti, gli interventi chirurgici su pazienti positivi o sospetti sono resi più complessi per l’uso dei dispositivi che obbligano il chirurgo ad operare in condizioni non ideali rendendo le operazioni più complesse.		In fact, surgeries on positive or suspected patients are made more complex by the use of devices that force the surgeon to operate in non-ideal conditions, making the operations more complex.					5683524
1	doc83	Fattori di rischio per l’otite media effusiva nei bambini con ipertrofia adenoidea.		Risk factors for otitis media with effusion in children with adenoid hypertrophy.					5485595
2	doc83	Lo scopo di questo studio è determinare i fattori di rischio più importanti per l’otite media effusiva (OME) nei bambini con ipertrofia adenoidea. 539 pazienti sono stati sottoposti a chirurgia per ipertrofia adenoidea o ipertrofia adenoidea + OME, fra febbraio 2012 e febbraio 2018.		The purpose of this study is to determine the most important risk factors for otitis media with effusion (OME) in children with adenoid hypertrophy. 539 patients underwent surgery for adenoid hypertrophy or adenoid hypertrophy + OME between February 2012 and February 2018.					5485595
3	doc83	Sono stati valutati i dati circa la storia clinica neonatale e l’anamnesi remota, fattori ambientali, anamnesi familiare e lo status economico familiare.		Data on neonatal medical history and remote medical history, environmental factors, family history, and family economic status were evaluated.					5683524
4	doc83	I gruppi sono risultati omogenei per età e genere.		The groups were homogeneous in age and gender.					5683545
5	doc83	Dai nostri dati si evince che i fattori di rischio per l’OME sono la presenza di rinite allergica/atopica, tonsilliti ricorrenti, frequentazione dell’asilo nido, esposizione al fumo passivo, la presenza di 3 o più fratelli, la presenza di 4 o più persone conviventi.		Our data show that the risk factors for OME are the presence of allergic rhinitis/atopic rhinitis, recurrent tonsillitis, daycare attendance, exposure to secondhand smoke, the presence of three or more siblings, and the presence of four or more people living together.					5683524
6	doc83	La correzione di tali fattori di rischio modificabili potrebbe contribuire a diminuire le complicanze dell’OME nei bambini.		Correcting these modifiable risk factors may help decrease the complications of OME in children.					5485595
1	doc84	Questo studio è finalizzato a valutare i benefici dell’uso sistematico del modello epatico ex vivo e della tomografia computerizzata per la programmazione delle resezioni laparoscopiche di fegato nel suino eseguite dagli specializzandi programma dedicato alla formazione.		This study is aimed at assessing the benefits of the systematic use of the ex vivo hepatic model and computed tomography for programming laparoscopic liver resections in pigs performed by the trainee specialized programs.		This study is aimed at assessing the benefits of the systematic use of the ex vivo hepatic model and computed tomography for programming laparoscopic liver resections in pigs performed by the trainee specialized <tag>programs</tag>.	Linguistic Conventions - Grammar	Major	5683545
1	doc84	Questo studio è finalizzato a valutare i benefici dell’uso sistematico del modello epatico ex vivo e della tomografia computerizzata per la programmazione delle resezioni laparoscopiche di fegato nel suino eseguite dagli specializzandi programma dedicato alla formazione.		This study is aimed at assessing the benefits of the systematic use of the ex vivo hepatic model and computed tomography for programming laparoscopic liver resections in pigs performed by the trainee specialized programs.		This study is aimed at assessing the benefits of the systematic use of the <tag>ex vivo</tag> hepatic model and computed tomography for programming laparoscopic liver resections in pigs performed by the trainee specialized programs.	Linguistic Conventions - Punctuation	Neutral	5683545
1	doc84	Questo studio è finalizzato a valutare i benefici dell’uso sistematico del modello epatico ex vivo e della tomografia computerizzata per la programmazione delle resezioni laparoscopiche di fegato nel suino eseguite dagli specializzandi programma dedicato alla formazione.		This study is aimed at assessing the benefits of the systematic use of the ex vivo hepatic model and computed tomography for programming laparoscopic liver resections in pigs performed by the trainee specialized programs.		This study is aimed at assessing the benefits of the systematic use of the ex vivo <tag>hepatic</tag> model and computed tomography for programming laparoscopic liver resections in pigs performed by the trainee specialized programs.	Terminology - Wrong term	Minor	5683545
1	doc84	Questo studio è finalizzato a valutare i benefici dell’uso sistematico del modello epatico ex vivo e della tomografia computerizzata per la programmazione delle resezioni laparoscopiche di fegato nel suino eseguite dagli specializzandi programma dedicato alla formazione.		This study is aimed at assessing the benefits of the systematic use of the ex vivo hepatic model and computed tomography for programming laparoscopic liver resections in pigs performed by the trainee specialized programs.		This study is aimed at assessing the benefits of the systematic use of the ex vivo hepatic model and computed tomography for programming laparoscopic liver resections in pigs performed by the <tag>trainee specialized</tag> programs.	Terminology - Wrong term	Minor	5683545
2	doc84	Trenta specializzandi in chirurgia generale, facenti parte di un programma di formazione sono stati divisi in due gruppi: il primo che ha eseguito resezioni laparoscopiche del fegato senza fase di pianificazione e il secondo che ha sistematicamente utilizzato un tutorial interattivo per stabilire la strategia per la resezione da eseguire, seguito dalla dissezione epatica da banco, e poi la stessa resezione su un modello suino ex vivo.		30 specialists in general surgery participating in a training program were divided into two groups: the first that performed laparoscopic liver resections without a planning phase and the second that systematically used an interactive tutorial to establish the strategy for the resection to be performed, followed by tabletop liver dissection, and then the same resection on an ex vivo pig model.		30 <tag>specialists</tag> in general surgery participating in a training program were divided into two groups: the first that performed laparoscopic liver resections without a planning phase and the second that systematically used an interactive tutorial to establish the strategy for the resection to be performed, followed by tabletop liver dissection, and then the same resection on an ex vivo pig model.	Accuracy - Mistranslation	Major	5485595
3	doc84	Successivamente sono state eseguite procedure laparoscopiche su venti suini domestici anestetizzati.		Subsequently, laparoscopic procedures were performed on 20 anesthetized domestic pigs.					5683524
4	doc84	Tutte le squadre hanno completato con successo la procedura, senza dover convertire a laparotomia e senza l’intervento dei tutors.		All teams successfully completed the procedure, without having to convert to laparotomy and without the intervention of the tutors.					5683524
5	doc84	Il secondo gruppo è stato più veloce del primo gruppo su resezioni minori e maggiori (p = 0,0001).		The second group was faster than the first group on minor and major resections (p = 0.0001).					5683524
6	doc84	La perdita di sangue è risultata significativamente minore nel secondo gruppo (p = 0,005).		Blood loss was significantly less in the second group (p = 0.005).					5683524
7	doc84	I residenti hanno superato le nostre aspettative per quanto riguarda il tempo di intervento, la perdita di sangue e le conversioni a laparatomia, convalidando il nostro programma di formazione.		The residents exceeded our expectations in terms of intervention time, blood loss, and laparatomy conversions, validating our training program.					5683524
8	doc84	Il programma è stato aggiornato passo-passo puntando all’ideale, alla fine della fase 2b (esplorazione), quando i residenti concretizzano i benefici di questo modello.		The program was updated step-by-step aiming for the ideal at the end of phase 2b (exploration), when the residents realize the benefits of this model.		The program was updated step-by-step aiming for the <tag>ideal</tag> at the end of phase 2b (exploration), when the residents realize the benefits of this model.	Linguistic Conventions - Punctuation	Minor	5683524
9	doc84	La riduzione della perdita di sangue e della perdita di parenchima funzionale dimostra l’utilità di una fase di riscaldamento.		The reduction in blood loss and functional parenchyma loss demonstrates the usefulness of a warm-up phase.					5485595
10	doc84	CONCLUSIONE: la curva di apprendimento, aggiungendo i contributi dell’imaging anatomici al protocollo base consente una maggiore chiarezza prima dell’esecuzione delle resezioni laparoscopiche del fegato e migliora il nostro protocollo “passo dopo passo”.		CONCLUSION: adding the contributions of anatomical imaging to the basic protocol, the learning curve allows greater clarity before performing laparoscopic liver resections and improves our “step by step” protocol.					5683524
1	doc85	La malattia metastatica in oncologia testa-collo.		Metastatic disease in head and neck oncology.					5485595
2	doc85	Il distretto testa e collo rappresenta una delle più comuni sedi di insorgenza di malattie oncologiche, con una percentuale di disseminazioni metastatiche elevata tanto a livello loco-regionale quanto a distanza.		The head and neck district represents one of the most common sites of onset of oncological diseases, with a high percentage of metastatic dissemination both locally and remotely.					5683545
3	doc85	La prognosi di questi tumori è strettamente legata ad alcuni fattori principali: a) lo stadio della malattia; b) le recidive loco-regionali; c) le metastasi a distanza.		The prognosis of these tumors is closely linked to some main factors: a) the stage of the disease; b) loco-regional recurrence; c) distant metastases.					5485595
4	doc85	Nei tumori della testa e del collo le metastasi a distanza sono presenti in circa il 10% dei casi al momento della prima diagnosi e si rendono evidenti nel corso della malattia in un ulteriore 20%-30% dei casi.		In head and neck tumors, distant metastases are present in about 10% of cases at the time of the first diagnosis and become evident during the disease in a further 20%-30% of cases.					5683505
5	doc85	Quando una metastasi a distanza a partenza da un tumore della testa e del collo si rende evidente, la prognosi viene usualmente considerata infausta, con una sopravvivenza media stimabile intorno ai 10 mesi.		When a distant metastasis starting from a head and neck tumor becomes evident, the prognosis is usually considered poor, with an average survival estimated at around 10 months.					5485595
6	doc85	Scopo del presente lavoro è quello di fornire un up-todate aggiornato ed esaustivo in tema di metastasi a distanza in oncologia cervico-cefalica alla luce delle più recenti conoscenze.		The purpose of this work is to provide an updated and exhaustive update on the subject of distant metastases in head and neck oncology in the light of the most recent knowledge.		The purpose of this work is to provide an <tag>updated</tag> and exhaustive update on the subject of distant metastases in head and neck oncology in the light of the most recent knowledge.	Accuracy - Mistranslation	Major	5485595
7	doc85	Concetti di recente acquisizione quali l’assetto molecolare dei tumori, le possibili interazioni tra cellule tumorali e tessuti, le peculiarità della malattia oligometastatica, il ruolo dell’immunoterapia… stanno profondamente cambiando l’approccio terapeutico in questi pazienti, con interessanti ricadute in tema di controllo di malattia.		Recently acquired concepts such as the molecular structure of tumors, the possible interactions between tumor cells and tissues, the peculiarities of oligometastatic disease, the role of immunotherapy... are profoundly changing the therapeutic approach in these patients, with interesting repercussions in terms of disease control.					5485595
8	doc85	I primi capitoli sono dedicati alla storia naturale ed all’epidemiologia delle metastasi a distanza nei tumori della testa e del collo ed al loro inquadramento diagnostico anatomo-patologico e radiologico.		The first chapters are devoted to the natural history and epidemiology of distant metastases in head and neck tumors and their anatomo-pathologic and radiologic diagnostic framing.		The first chapters are devoted to the natural history and epidemiology of distant metastases in head and neck tumors and their anatomo-pathologic and radiologic diagnostic <tag>framing</tag>.	Terminology - Wrong term	Minor	5683545
9	doc85	Nei capitoli successivi vengono focalizzate le più rilevanti peculiarità cliniche con particolare attenzione agli argomenti di recente attualità quali le metastasi a distanza da tumori EBV ed HPV positivi ed il concetto di malattia oligometastatica.		In the following chapters, there is a focus on the most relevant clinical peculiarities with particular attention to recent topics such as distant metastases from EBV and HPV-positive tumors and the concept of oligometastatic disease.					5485595
10	doc85	Ampio spazio viene destinato alle varie opzioni terapeutiche con particolare attenzione al sempre più rilevante ruolo dell’immunoterapia ed allo sviluppo di nuove tecnologie terapeutiche.		Ample space is given to the various therapeutic options, with particular attention to the increasingly important role of immunotherapy and the development of new therapeutic technologies.		<tag>Ample</tag> space is given to the various therapeutic options, with particular attention to the increasingly important role of immunotherapy and the development of new therapeutic technologies.	Style - Non-fluent	Minor	5485595
11	doc85	In conclusione, vengono focalizzate le problematiche etico-cliniche legate al concetto di fragilità del paziente oncologico e le crescenti difficoltà di una sostenibile governance socio-economica.		In conclusion, there is a focus on the ethical-clinical issues related to the concept of the fragility of oncology patients and the increasing difficulties of sustainable socio-economic governance.					5683545
1	doc87	Il periodo degli studi universitari è considerato di estrema vulnerabilità per l'abuso di sostanze tra gli studenti infermieri; questo può determinare l’esercizio di una pratica clinica, durante il tirocinio, non sicura.		The undergraduate study period is considered extremely vulnerable for substance abuse among nursing students; this can result in unsafe clinical practice during the internship.					5485595
2	doc87	Lo scopo di questo studio è quello di indagare l’uso di sostanze tra gli studenti infermieri, con particolare attenzione all’abuso di alcol, droghe e tabacco.		The purpose of this study is to investigate substance use among student nurses, with a focus on alcohol, drug, and tobacco abuse.					5485595
3	doc87	Infine si vuole individuare il profilo socio-demografico di questi studenti. è stato utilizzato un disegno di studio longitudinale, basato su un campione di 254 studenti infermieri.		Lastly, we want to identify the socio-demographic profile of these students. A longitudinal study design was used, based on a sample of 254 nursing students.					5683550
4	doc87	Sono stati analizzati i dati della stessa coorte di studenti all’ingresso nel corso di studi (T0), alla fine del primo anno (T1), alla fine del secondo anno (T2) e alla fine del terzo anno (T3).		Data from the same cohort of students was analyzed at entry into the course (T0), at the end of the first year (T1), at the end of the second year (T2), and at the end of the third year (T3).		Data from the same cohort of students was analyzed <tag>at entry</tag> into the course (T0), at the end of the first year (T1), at the end of the second year (T2), and at the end of the third year (T3).	Accuracy - Mistranslation	Major	5485595
5	doc87	RISULTATI: vi è una diminuzione del numero di studenti che fumano regolarmente, un aumento di coloro che usano droghe per perdere il controllo e che abusano di alcol con una frequenza settimanale.		RESULTS: there is a decrease in the number of students who smoke regularly, an increase in those who use drugs to lose control and who abuse alcohol on a weekly basis.		RESULTS: there is a decrease in the number of students who smoke regularly, an increase in those who use drugs to lose control and <tag>who</tag> abuse alcohol on a weekly basis.	Linguistic Conventions - Grammar	Minor	5683545
6	doc87	CONCLUSIONE: il riconoscimento precoce degli studenti che abusano di sostanze può essere fondamentale per la loro salute, per il loro percorso accademico e per una pratica clinica sicura.		CONCLUSION: early recognition of students who abuse substances may be critical for their health, for their academic path, and for safe clinical practice.		CONCLUSION: early recognition of students who abuse substances may be <tag>critical</tag> for their health, for their academic path, and for safe clinical practice.	Terminology - Wrong term	Neutral	5683550
