SEG_ID	Doc	Source	Tagged_Source	Target	MT	Tagged_Target	Error Category	Severity	Annotator_ID
1	doc10	Diversi studi degli anni scorsi hanno esaminato le condizioni e le difficoltà in evoluzione nel settore veterinario.		Several past studies have examined the changing conditions and difficulties in the veterinary sector.					5683505
2	doc10	L’accesso garantito ai servizi di assistenza pubblica e privata è un prerequisito per un sistema di assistenza sanitaria orientato alla globalità (“One Health”).		Guaranteed access to public and private care services is a prerequisite for a globally oriented health care system ("One Health").					5683505
3	doc10	Nel presente studio è stato utilizzato per la prima volta un concetto multidimensionale di accessibilità alle offerte di cura per registrare e visualizzare la densità del sistema di assistenza veterinaria in Svizzera.		In this study, a multidimensional concept of accessibility to care offerings was used for the first time to record and visualize the density of the veterinary care system in Switzerland.		In this study, a multidimensional concept of accessibility to <tag>care</tag> offerings was used for the first time to record and visualize the density of the veterinary care system in Switzerland.	Terminology - Wrong term	Neutral	5683505
4	doc10	Gli indicatori tradizionali utilizzati per descrivere le strutture assistenziali si concentravano principalmente sulla disponibilità o sull’accessibilità.		Traditional indicators used to describe care facilities focused primarily on availability or accessibility.					5683505
5	doc10	Al fine di superare i limiti degli indicatori tradizionali, la metodologia nota come Floating-Catchment-Area-Methods (FCA) è stata sviluppata nella ricerca geografica dell’assistenza.		In order to overcome the limits of traditional indicators, the methodology known as Floating-Catchment-Area-Methods (FCA) was developed in geographical assistance research.		In order to overcome the limits of traditional indicators, the methodology known as Floating-Catchment-Area-Methods (FCA) was developed <tag>in geographical assistance research.</tag>	Accuracy - Mistranslation	Neutral	5683505
6	doc10	Il punto di forza dei metodi FCA sta nel fatto che essi producono un’accessibilità indipendente dai confini amministrativi e allo stesso tempo tengono conto della distanza spaziale e delle capacità disponibili.		The strength of FCA methods lies in the fact that they produce accessibility that is independent from administrative boundaries, and at the same time take into account spatial distance and available capacity.					5683505
7	doc10	Lo studio offre uno sguardo sulla densità delle cure veterinarie utilizzando i metodi FCA e includendo i sistemi di informazione geografica (GIS).		The study provides an insight into the density of veterinary care using FCA methods and including geographic information systems (GIS).					5683505
8	doc10	Come esempio ci si è serviti dei dati sui fornitori di servizi veterinari nel settore degli animali da compagnia e, dal lato della domanda, i dati sui cani e i gatti che vivono in Svizzera.		Data on veterinary service providers in the pet sector and, on the demand side, data on dogs and cats living in Switzerland were used as an example.					5683505
9	doc10	Il risultato ottenuto è una mappa interattiva della densità delle cure e della struttura dell’accessibilità spaziale per i fornitori e i consumatori di servizi veterinari.		The result is an interactive map of care density and a spatial accessibility structure for veterinary service providers and consumers.					5683505
10	doc10	Come previsto, l’elevata accessibilità territoriale si trova nei centri urbani e negli agglomerati dell’Altipiano.		As expected, high territorial accessibility is found in urban centers and agglomerations of the Plateau.					5683505
11	doc10	D’altro canto, l’accessibilità spaziale ai servizi veterinari per cani e gatti nelle aree periferiche è spesso molto più bassa.		On the other hand, spatial accessibility to veterinary services for dogs and cats in peripheral areas is often much lower.					5683505
12	doc10	A causa dei dati non disponibili per gli anni precedenti, per il momento si è dovuto rinunciare a diverse analisi.		Due to data not being available for previous years, several analyses had to be dropped for the time being.					5683505
13	doc10	Ad esempio, il modello potrebbe essere esteso a tutte le specie animali e a tutti i servizi medici.		For example, the model could be extended to all animal species and all medical services.					5683505
14	doc10	Inoltre, sarebbe anche possibile prevedere la densità delle cure e come ottimizzarle in futuro.		Furthermore, it would also be possible to predict the density of care and how to optimize it in the future.					5683505
15	doc10	Insieme agli operatori dei settori interessati, queste lacune potrebbero essere colmate con certezza e quindi il modello e i risultati che ne deriverebbero potrebbero essere ulteriormente differenziati.		Together with the operators in the sectors concerned, these gaps could certainly be filled and therefore the model and the results that would result could be further differentiated.					5683505
16	doc10	I risultati dovrebbero servire non solo agli attori delle catene di valore aggiunto interessate private, ma anche ai responsabili del servizio veterinario pubblico, alle autorità nazionali, agli organismi agricoli, alle università, ecc. come base per valutare le decisioni strategiche sulla questione della densità dell’offerta medica nel settore veterinario.		The results should serve not only private stakeholders in the value added chains concerned, but also those responsible for the public veterinary service, national authorities, agricultural bodies, universities, etc. as a basis for assessing strategic decisions on the issue of the density of the medical supply in the veterinary sector.					5683505
1	doc100	Il rapporto costo-efficacia dell’emicolectomia destra laparoscopica è tuttora oggetto di dibattito, ed un’analisi della letteratura attuale non consente di trarre conclusioni certe.		The cost-effectiveness ratio of laparoscopic right hemicolectomy is still the subject of debate, and an analysis of the current literature does not allow for certain conclusions to be drawn.					5683505
2	doc100	Il nostro studio ha l’obiettivo di comparare i costi clinici diretti ed indiretti dell’emicolectomia destra laparoscopica mediante due tipologie di anastomosi: anastomosi extracorporea (Extra Corporeal Anastomosis) ed anastomosi intracorporea (Intra Corporeal Anastomosis).		Our study aims to compare the direct and indirect clinical costs of laparoscopic right hemicolectomy by two types of anastomosis: extracorporeal anastomosis (Extra Corporeal Anastomosis) and intracorporeal anastomosis (Intra Corporeal Anastomosis).		Our study aims <tag>to</tag> compare the direct and indirect clinical costs of laparoscopic right hemicolectomy by two types of anastomosis: extracorporeal anastomosis (Extra Corporeal Anastomosis) and intracorporeal anastomosis (Intra Corporeal Anastomosis).	Other	Neutral	5683550
3	doc100	Retrospettivamente, dal Gennaio 2016 ad Aprile 2018, sono stati valutati tutti i pazienti sottoposti ad emicolectomia destra laparoscopica con anastomosi intracorporea ed extracorporea.		Retrospectively, from January 2016 to April 2018, all patients undergoing laparoscopic right hemicolectomy with intracorporeal and extracorporeal anastomosis were evaluated.					5683505
4	doc100	In base al tipo di anastomosi utilizzata i pazienti sono stati divisi in due gruppi: gruppo ECA e gruppo ICA.		Based on the type of anastomosis used, the patients were divided into two groups: ECA group and ICA group.					5683505
5	doc100	Trenta ECA e venti-nove ICA sono stati inclusi nello studio.		Thirty ECAs and twenty-nine ICAs were included in the study.					5683505
6	doc100	Il tempo operatorio è risultato significativamente più lungo nel gruppo ICA rispetto al gruppo ECA (p<0.001).		The operating time was significantly longer in the ICA group than in the ECA group (p<0.001).					5683505
7	doc100	Non ci sono state significative differenze per quanto riguarda la prima canalizzazione, le complicanze post operatorie ed il tasso di riammissione.		There were no significant differences in first channeling, postoperative complications and readmission rate.					5683545
8	doc100	I pazienti sottoposti ad anastomosi intracorporea (ICA) hanno avuto tempi di degenza ospedaliera ridotti se comparati ai pazienti sottoposti ad anastomosi extracorporea (5 vs 6; p < 0.022).		Patients undergoing intracorporeal anastomosis (ICA) had reduced hospital stays compared to patients undergoing extracorporeal anastomosis (5 vs 6; p < 0.022).					5683505
9	doc100	Considerando i costi diretti dei soli presidi chirurgici, il gruppo ICA è risultato più dispendioso rispetto al gruppo ECA		Considering the direct costs of surgical devices alone, the ICA group was more expensive than the ECA group					5683505
10	doc100	(1435.6 € vs 72 €). Tuttavia, il costo totale delle due procedure, considerando anche i costi di degenza, (14451.36 € nel gruppo ECA versus 14631.04 € nel gruppo ICA) risultano equivalent.		(€ 1435.6 vs € 72). However, the total cost of the two procedures, also considering the costs of hospitalization, (€ 14,451.36 in the ECA group versus € 14,631.04 in the ICA group) are equivalent.		(€ 1435.6 vs € 72). However, the total cost of the two procedures, also considering <tag>the costs of hospitalization</tag>, (€ 14,451.36 in the ECA group versus € 14,631.04 in the ICA group) are equivalent.	Style - Non-fluent	Minor	5683550
11	doc100	Le anastomosi extracorporea ed intracorporea risultano comparabili in termini di costi clinici ed outcome post-operatorio.		Extracorporeal and intracorporeal anastomoses are comparable in terms of clinical cost and postoperative outcome.					5683505
12	doc100	L’anastomosi intracorporea (ICA) implica costi più elevati ma una ospedalizzazione minore.		Intracorporeal anastomosis (ICA) involves higher costs but lower hospitalization.					5683505
13	doc100	L’anastomosi extracorporea sembra essere meno costosa in termini di presidi utilizzati, ma la più lunga degenza ospedaliera media determina un’aumento dei costi totali risultando in una non-inferiorità dell’una o dell’altro tecnica.		Extracorporeal anastomosis seems to be less expensive in terms of devices used, but the longer average hospital stay determines an increase in total costs resulting in one or the other technique not being inferior.		Extracorporeal anastomosis seems to be less expensive in terms of <tag>devices used</tag>, but the longer average hospital stay determines an increase in total costs resulting in one or the other technique not being inferior.	Linguistic Conventions - Grammar	Minor	5683550
1	doc11	Le complicanze peristomali sono spesso trascurate dai chirurghi.		Peristomal complications are often overlooked by surgeons.					5683545
2	doc11	Il nostro obiettivo era valutare le complicanze peristomali che si verificano entro 30 giorni dall’intervento chirurgico e identificare i fattori di rischio predittivi.		Our goal was to evaluate peristomal complications that occur within 30 days of surgery and identify predictive risk factors.					5683505
3	doc11	Nello studio sono stati inseriti tutti i pazienti che tra gennaio 2014 e giugno 2016 hanno ricevuto la creazione di una stomia nel nostro istituto, a meno che non siano deceduti oppure che siano stati persi al follow-up.		The study included all patients who received the creation of a stoma in our facility between January 2014 and June 2016, unless they died or were lost at follow-up.		The study included all patients who received the creation of a stoma in our facility between January 2014 and June 2016, unless they <tag>died</tag> or were lost at follow-up.	Linguistic Conventions - Register	Neutral	5683545
4	doc11	Le complicanze peristomali sono state analizzate retrospettivamente utilizzando un database fotografico, una scala validata per lesioni cutanee peristomali e il punteggio Clavien-Dindo e dunque classificate come assenti, lievi o rilevanti.		Peristomal complications were retrospectively analyzed using a photographic database, a validated scale for peristomal skin lesions, and the Clavien-Dindo score, and consequently classified as absent, mild or relevant.					5683505
5	doc11	Sono state eseguite analisi univariate e multivariate per identificare i fattori di rischio per a) incidenza di b) persistenza di rilevanti complicanze peristomali a 30 giorni postoperatori.		Univariate and multivariate analyses were performed to identify risk factors for a) incidence of b) persistence of significant peristomal complications at 30 postoperative days.					5683505
6	doc11	I pazienti inclusi nello studio sono stati 111: 16 pazienti (14%) avevano complicanze lievi e 65 pazienti (59%) complicanze rilevanti.		The patients included in the study were 111: 16 patients (14%) had minor complications and 65 patients (59%) had significant complications.					5683505
7	doc11	L’evento più comune è stata la separazione mucocutanea in 57 (51%) pazienti.		The most common event was mucocutaneous separation in 57 (51%) patients.					5683550
8	doc11	Complicanze erano ancora presenti a 30 giorni in 36 (32%) pazienti.		Complications were still present at 30 days in 36 (32%) patients.					5683505
9	doc11	La stomia a doppia canna (vs stoma terminale) è risultato un fattore di rischio indipendente per morbilità significativa (OR = 2.394 (IC 95% = 1.082- 5.293), p = 0,030).		Double-barrel stoma (vs. terminal stoma) was an independent risk factor for significant morbidity (OR = 2,394 (95% CI = 1,082- 5,293), p = 0.030).		Double-barrel stoma (vs. terminal stoma) <tag>was</tag> an independent risk factor for significant morbidity (OR = 2,394 (95% CI = 1,082- 5,293), p = 0.030).	Linguistic Conventions - Grammar	Major	5683550
10	doc11	La persistenza di complicanze rilevanti a 30 giorni era più probabilmente associata a un intervento chirurgico urgente (OR = 4.239 (IC 95% = 1.105-16.257), p = 0.035) e al punteggio ASA III / IV (OR = 5.963 (IC 95% = 1.447- 24.569), p = 0,013).		Persistence of major complications at 30 days was more likely to be associated with urgent surgery (OR = 4.239 (95% CI = 1.105-16.257), p = 0.035) and ASA III/IV score (OR = 5.963 (95% CI = 1.447- 24.569), p = 0.013).					5683505
11	doc11	Il sesso maschile (OR = 0,246 (IC 95% = 0,069-0,874), p = 0,030) e l’età superiore ai 70 anni (OR = 0,121 (IC 95% = 0,029-0,515), p = 0,004) sembrano essere protettivi.		The male gender (OR = 0.246 (95% CI = 0.069-0.874), p = 0.030) and an age over 70 years (OR = 0.121 (95% CI = 0.029-0.515), p = 0.004) appear to be protective.		<tag>The</tag> male gender (OR = 0.246 (95% CI = 0.069-0.874), p = 0.030) and an age over 70 years (OR = 0.121 (95% CI = 0.029-0.515), p = 0.004) appear to be protective.	Terminology - Inconsistent use of terminology	Minor	5683550
12	doc11	In conclusion, le complicanze peristomiche precoci sono comuni, generalmente lievi.		In conclusion, early peristomal complications are common and generally mild.					5683550
13	doc11	È più probabile che persistano oltre i 30 giorni nei pazienti operati in emergenza e con un punteggio ASA di III-IV.		They are more likely to persist beyond 30 days in emergency-operated patients and with an ASA score of III-IV.					5683550
1	doc12	Questo articolo considera il tema del "bene" all'interno della letteratura e nel lavoro clinico.		This article considers the topic of 'good' in literature and in clinical work.					5683545
2	doc12	Le forme più lievi del bene che sorgono a livello personale generano difese contro la vulnerabilità personale.		The mildest forms of good that arise on a personal level generate defenses against personal vulnerability.					5683550
3	doc12	Forme più potenti del bene, che l'Autore chiama “vero bene”, sorgono ad un livello archetipico e travolgono l’Io, generando paura, persino terrore.		More powerful forms of good, which the author calls "true good", arise at an archetypal level and overwhelm the ego, generating fear and even terror.					5683550
4	doc12	Il "vero bene" invoca difese contro la dissoluzione di un senso di Sé intatto.		The "true good" invokes defenses against the dissolution of an intact sense of Self.					5683550
5	doc12	Sia nella forma lieve che in quella intensa, il bene emergerà in ogni analisi, sfiderà i limiti sia del cliente che dell'analista, e toccherà il nucleo della relazione analitica.		In both mild and intense forms, the good will emerge in every analysis, it will challenge the limits of both the client and the analyst, and it will touch the core of the analytical relationship.					5683550
6	doc12	Richiede di essere riconosciuto.		It needs to be recognized.					5683550
7	doc12	All'interno di queste due categorie, l'Autore identifica cinque forme del bene che possono sorgere con intensità contenibili e incontenibili: la bellezza, l'intimità, il divenire, l'amore e l'incontro con il divino.		Within these two categories, the author identifies five forms of good that can arise with containable and uncontainable intensity: beauty, intimacy, becoming, love and encountering the divine.					5683550
8	doc12	L’esplorazione degli incontri con il bene nelle sue varie forme amplia la gamma dell'esperienza umana tollerabile - uno degli obiettivi fondamentali dell'analisi.		The exploration of encounters with the good in its various forms broadens the range of tolerable human experiences - one of the fundamental goals of the analysis.		The exploration <tag>of</tag> encounters with the good in its various forms broadens the range of tolerable human experiences - one of the fundamental goals of the analysis.	Linguistic Conventions - Punctuation	Neutral	5683550
9	doc12	Vivere il bene, o a volte soffrire il vero bene, favorisce l'individuazione e allo stesso tempo amplia l'accesso a esperienze di significato profondo, incluso il divino o il numinoso.		Living the good, or sometimes enduring the true good, fosters individuation and at the same time expands access to experiences of profound meaning, including the divine or the numinous.					5683550
1	doc14	Con una prova di fattibilità, sono stati calcolati gli anticorpi IgG specifici per PCV2 nel liquido testicolare del tessuto testicolare di suinetti di sette giorni castrati, per verificare lo stato di vaccinazione delle scrofe.		In a feasibility test, PCV2-specific IgG antibodies were calculated in the testicular fluid of the testicular tissue of seven days old castrated piglets to verify the vaccination status of sows.		In a feasibility test, PCV2-specific IgG antibodies were calculated in the <tag>testicular fluid of the testicular tissue</tag> of seven days old castrated piglets to verify the vaccination status of sows.	Style - Non-fluent	Neutral	5683545
1	doc14	Con una prova di fattibilità, sono stati calcolati gli anticorpi IgG specifici per PCV2 nel liquido testicolare del tessuto testicolare di suinetti di sette giorni castrati, per verificare lo stato di vaccinazione delle scrofe.		In a feasibility test, PCV2-specific IgG antibodies were calculated in the testicular fluid of the testicular tissue of seven days old castrated piglets to verify the vaccination status of sows.		In a feasibility test, PCV2-specific IgG antibodies were calculated in the testicular fluid of the testicular tissue of <tag>seven days old</tag> castrated piglets to verify the vaccination status of sows.	Linguistic Conventions - Punctuation	Minor	5683545
2	doc14	Dodici scrofe selezionate a caso sono state vaccinate due volte durante l’ultimo trimestre di gestazione con PCV2, mentre dieci hanno ricevuto il solo coadiuvante.		Twelve randomly selected sows were vaccinated with PCV2 twice during the last trimester of gestation, while ten received only the adjuvant.		Twelve randomly selected sows <tag>were vaccinated with PCV2</tag> twice during the last trimester of gestation, while ten received only the adjuvant.	Style - Non-fluent	Neutral	5683545
3	doc14	I titoli anticorpali specifici PCV2 del siero e del colostro delle scrofe sono stati comparati a quelli del siero e del liquido tissutale testicolare della loro discendenza maschile castrata.		The PCV2-specific antibody titres of serum and colostrum of sows were compared to those of serum and testicular tissue fluid of their castrated male offspring.		The PCV2-specific antibody titres <tag>of</tag> serum and colostrum of sows were compared to those of serum and testicular tissue fluid of their castrated male offspring.	Linguistic Conventions - Grammar	Minor	5683545
3	doc14	I titoli anticorpali specifici PCV2 del siero e del colostro delle scrofe sono stati comparati a quelli del siero e del liquido tissutale testicolare della loro discendenza maschile castrata.		The PCV2-specific antibody titres of serum and colostrum of sows were compared to those of serum and testicular tissue fluid of their castrated male offspring.		The PCV2-specific antibody titres of serum and colostrum of sows were compared to those <tag>of</tag> serum and testicular tissue fluid of their castrated male offspring.	Linguistic Conventions - Grammar	Minor	5683545
3	doc14	I titoli anticorpali specifici PCV2 del siero e del colostro delle scrofe sono stati comparati a quelli del siero e del liquido tissutale testicolare della loro discendenza maschile castrata.		The PCV2-specific antibody titres of serum and colostrum of sows were compared to those of serum and testicular tissue fluid of their castrated male offspring.		The PCV2-specific antibody titres of serum and colostrum <tag>of sows</tag> were compared to those of serum and testicular tissue fluid of their castrated male offspring.	Linguistic Conventions - Grammar	Neutral	5683545
4	doc14	Con 29250 unità ELISA (EU) nel siero e 65410 EU nel colostro, le scrofe vaccinate avevano titoli anticorpali IgG specifici per PCV2 significativamente più elevati rispetto ai titoli sierici (980 EU) e del colostro (2630 EU) delle scrofe di controllo.		With 29250 ELISA units (EU) in the serum and 65410 EU in the colostrum, vaccinated sows had significantly higher PCV2-specific IgG antibody titers than the serum (980 EU) and colostrum (2630 EU) titers of the control sows.		With 29250 ELISA units (EU) in the serum and 65410 EU in the colostrum, vaccinated sows had significantly higher PCV2-specific IgG antibody titers than the serum (980 EU) and colostrum (2630 EU) titers <tag>of the control sows.</tag>	Linguistic Conventions - Grammar	Neutral	5683545
5	doc14	I suinetti provenienti da scrofe vaccinate avevano concentrazioni di anticorpi significativamente più elevate con 9362 EU nel siero e 4022 EU nel liquido tissutale testicolare rispetto ai suinetti provenienti dalle scrofe di controllo trattate con coadiuvanti, che avevano 247 EU nel siero e 354 EU nel liquido tissutale testicolare.		The piglets from the vaccinated sows had significantly higher antibody concentrations with 9362 EU in the serum and 4022 EU in the testicular tissue fluid compared to the piglets from the adjuvant-treated control sows, which had 247 EU in the serum and 354 EU in the testicular tissue fluid.		The piglets from the vaccinated sows had significantly higher antibody concentrations <tag>with</tag> 9362 EU in the serum and 4022 EU in the testicular tissue fluid compared to the piglets from the adjuvant-treated control sows, which had 247 EU in the serum and 354 EU in the testicular tissue fluid.	Linguistic Conventions - Register	Neutral	5683545
5	doc14	I suinetti provenienti da scrofe vaccinate avevano concentrazioni di anticorpi significativamente più elevate con 9362 EU nel siero e 4022 EU nel liquido tissutale testicolare rispetto ai suinetti provenienti dalle scrofe di controllo trattate con coadiuvanti, che avevano 247 EU nel siero e 354 EU nel liquido tissutale testicolare.		The piglets from the vaccinated sows had significantly higher antibody concentrations with 9362 EU in the serum and 4022 EU in the testicular tissue fluid compared to the piglets from the adjuvant-treated control sows, which had 247 EU in the serum and 354 EU in the testicular tissue fluid.		The piglets from the vaccinated sows had significantly higher antibody concentrations with 9362 EU in the serum and 4022 EU in the testicular tissue fluid compared to the piglets from the adjuvant-treated control sows, which <tag>had</tag> 247 EU in the serum and 354 EU in the testicular tissue fluid.	Linguistic Conventions - Register	Neutral	5683545
6	doc14	È importante notare che è stata trovata una forte correlazione lineare tra gli anticorpi IgG specifici per PCV2 nel siero dei suinetti e nel loro liquido tissutale testicolare (rs = 0,9148).		It is important to note that a strong linear correlation was found between PCV2-specific IgG antibodies in piglet serum and testicular tissue fluid (rs = 0.9148).		It is important to note that a strong linear correlation <tag>was found</tag> between PCV2-specific IgG antibodies in piglet serum and testicular tissue fluid (rs = 0.9148).	Style - Non-fluent	Neutral	5683545
