SEG_ID	Doc	Source	Tagged_Source	Target	MT	Tagged_Target	Error Category	Severity	Annotator_ID
6	doc35	Queste hanno permesso di individuare dei criteri di pre-screening per semplificare la procedura di valutazione delle mascherine chirurgiche utilizzando metodi di valutazione dell’efficienza di filtrazione di polveri e di aerosol.		These allowed the identification of pre-screening criteria to simplify the evaluation procedure of surgical masks using methods to assess the efficiency of filtration of powders and aerosols.					5584747
7	doc35	In particolare, si è osservato che una efficienza di filtrazione polveri con diametro superiore a 650 nm (PFE>650) maggiore del 35% garantisce un livello di efficienza di filtrazione batterica (BFE) superiore al 95% mentre valori della BFE superiori al 98% sono ottenuti quando il valore della PFE>650 è superiore al 40%.	In particolare, si è osservato che <tag>una efficienza</tag> di filtrazione polveri con diametro superiore a 650 nm (PFE>650) maggiore del 35% garantisce un livello di efficienza di filtrazione batterica (BFE) superiore al 95% mentre valori della BFE superiori al 98% sono ottenuti quando il valore della PFE>650 è superiore al 40%.	Specifically, it was observed that a dust filtration efficiency greater than 650 nm in diameter (PFE>650), greater than 35 percent, ensures a bacterial filtration efficiency (BFE) level greater than 95 percent, while BFE values greater than 98 percent are obtained when the PFE>650 value is greater than 40 percent.			Accuracy - Omission	Minor	5584747
8	doc35	La misura della PFE è una misura estremamente più semplice rispetto alla prova di BFE che richiede tempo, specifiche attrezzature e metodi per la sua realizzazione.		The measurement of the PFE is an extremely simple measurement compared to the BFE test, which requires time, specific equipment and methods for its implementation.					5584747
9	doc35	Alcuni materiali provati hanno mostrato la possibilità di garantire elevate efficienze di filtrazione ma solo gli Spundonded-Meltblown-Spunbonded (SMS) che sono stratificazioni di tessuto non tessuto a diverse grammature di Meltblown, riescono a garantire contemporaneamente alte efficienze di filtrazione polveri con i valori di perdite di carico (respirabilità) richiesti per classificare una mascherina chirurgica come Tipo II/IIR secondo la normativa vigente.	Alcuni materiali provati hanno mostrato la possibilità di garantire elevate efficienze di filtrazione ma solo gli Spundonded-Meltblown-Spunbonded (SMS) che sono stratificazioni di tessuto non tessuto a diverse grammature di Meltblown, riescono a garantire contemporaneamente alte efficienze <tag>di filtrazione polveri</tag> con i valori di perdite di carico (respirabilità) richiesti per classificare una mascherina chirurgica come Tipo II/IIR secondo la normativa vigente.	Some tested materials have shown the ability of guaranteeing high filtration efficiencies, but only the Spundonded-Meltblown-Spunbonded (SMS) ones, which are non-woven fabric laminations at different Meltblown weights, can simultaneously guarantee high dust filtration efficiencies with the values of load drops (breathability) required to classify a surgical mask as Type II/IIR according to current legislation.			Accuracy - Omission	Minor	5584747
10	doc35	Infatti, i prodotti in tessuto fino ad ora analizzati non sono stati in grado di garantire contemporaneamente adeguati valori di BFE e di respirabilità.		In fact, the fabric products analyzed so far have not been able to guarantee adequate BFE and breathability values at the same time.					5584747
11	doc35	Al contrario, assemblati di Spunbond di adeguata grammatura e spessore potrebbero virtualmente verificare entrambi i requisiti e accreditarsi come possibili materiali per la produzione di maschere chirurgiche di Tipo I. Ulteriori studi saranno necessari per verificare la possibilità di ottenere mascherine chirurgiche a basso costo e che possano essere riutilizzate nell’ottica di una maggiore sostenibilità ambientale e di una maggiore sicurezza degli approvvigionamenti.		On the contrary, Spunbond assemblies of adequate weight and thickness could virtually verify both requirements and be accredited as possible materials for the production of Type I surgical masks. Further studies will be necessary to verify the possibility of obtaining low-cost surgical masks that can be reused with a view to greater environmental sustainability and greater security of supply.					5584747
1	doc37	Il mesotelioma peritoneale maligno è una patologia rara la cui diagnosi è resa particolarmente difficile dalla molteplicità delle possibili presentazioni cliniche e morfologiche.		Malignant peritoneal mesothelioma is a rare disease, the diagnosis of which is made particularly difficult by the diversity of the possible clinical and morphological presentations.					5584747
2	doc37	A differenza della patologia pleurica, questa sembra avere una minore correlazione con l’esposizione all’asbesto.	A differenza della patologia pleurica, questa sembra avere una minore correlazione con l’esposizione all’<tag>asbesto</tag>.	Unlike pleural disease, it seems to have a lower correlation with asbestos exposure.			Accuracy - Omission	Major	5584747
3	doc37	La prognosi è sfavorevole con una sopravvivenza media di 5.4 mesi.		The prognosis is poor with a median survival of 5.4 months.					5584747
4	doc37	Riportiamo un caso di mesotelioma peritoneale in un paziente di 73 anni con esposizione professionale all’asbesto.	Riportiamo un caso di mesotelioma peritoneale in un paziente di 73 anni con esposizione professionale all’<tag>asbesto</tag>.	We report a case of peritoneal mesothelioma in a 73-year-old patient with professional exposure to asbestos.			Accuracy - Omission	Major	5584747
5	doc37	La diagnosi è verosimilmente avvenuta dopo diversi inquadramenti clinici, che hanno compreso addominalgie attribuite ad IBD, poi non accertate istologicamente, e ad un’appendicite acuta.		The diagnosis was probably made after several clinical assessments, non-histologically ascertained abdominalgia attributed to IBD, and acute appendicitis.					5584747
6	doc37	Per ultimo il paziente è giunto alla nostra osservazione con un quadro subocclusivo che l’indagine TC attribuiva ad una verosimile carcinosi peritoneale a primitivo sconosciuto.	Per ultimo il paziente è giunto alla nostra osservazione con un quadro subocclusivo che <tag>l’indagine</tag> TC attribuiva ad una verosimile carcinosi peritoneale a primitivo sconosciuto.	Finally, the patient came to our observation with a subocclusive picture that the CT scan attributed to a probable peritoneal carcinomatosis with unknown primary tumor.			Accuracy - Omission	Major	5584747
7	doc37	La laparoscopia esplorativa, poi convertita in approccio laparotomico, ha mostrato un quadro di peritonite incapsulante che coinvolgeva estesamente l’intestino tenue.		Exploratory laparoscopy, subsequently converted to a laparotomic approach, showed a picture of encapsulating peritonitis involving the small intestine extensively.					5584747
8	doc37	È stata eseguita una resezione intestinale del tenue coinvolto ed una asportazione di un’area nodulare peri-splenica.		Intestinal resection of the interested small bowel and excision of a peri-splenic nodular area were performed.					5584747
9	doc37	L’esame istologico con l’integrazione di indagini immunoistochimiche ha permesso la diagnosi di mesotelioma peritoneale cistico maligno con istotipo bifasico che risulta essere il primo descritto in letteratura.		Histological examination with supplementation of immunohistochemical investigations allowed the diagnosis of malignant cystic peritoneal mesothelioma with biphasic histotype, which is the first one described in the literature.					5584747
10	doc37	Le aree cistiche avevano inizialmente fatto propendere per una diagnosi di mesotelioma multicistico benigno o di mesotelioma cistico con secondaria proliferazione miofibroblastica pseudosarcomatosa.		The cystic areas initially led to a diagnosis of benign multicystic mesothelioma or cystic mesothelioma with secondary pseudosarcomatous myofibroblastic proliferation.					5584747
11	doc37	Negli ultimi anni la prognosi di questa patologia ha trovato nell’utilizzo della chirurgia citoriduttiva e della chemioterapia intraperitoneale un miglioramento prognostico, queste nuove tecniche sono disponibili in centri di riferimento e trovano ad oggi indicazione solo in casi selezionati e in istotipi poco aggressivi.		In recent years the prognosis of this disease has found a prognostic improvement with the use of cytoreductive surgery and intraperitoneal chemotherapy, these new techniques are available in reference centers and today are only indicated in selected cases and in histotypes that are not very aggressive.					5584747
12	doc37	Il nostro paziente a causa dell’estensione della malattia, dell’istotipo non favorevole e dell’età avanzata è stato riferito al servizio di oncologia per il prosieguo delle cure.		Due to the extent of the disease, the unfavorable histotype and advanced age, our patient was referred to the oncology service for further treatment.					5584747
13	doc37	E’ stato sottoposto a chemioterapia con Pemetrexed e Cisplatino e dopo sei mesi presenta soddisfacenti condizioni cliniche generali e la TC di controllo non ha mostrato progressione di malattia.		He received chemotherapy with Pemetrexed and Cisplatin and after six months he is in satisfactory general medical conditions and control CT has not shown disease progression.					5584747
1	doc38	L’endometriosi perineale è la presenza di tessuto endometriale nella regione perineale.		Perineal endometriosis is the presence of endometrial tissue in the perineal region.					5584747
2	doc38	La diagnosi e il trattamento precoci sono importanti a causa del coinvolgimento dello sfintere anale in quasi la metà dei pazienti.		Early diagnosis and treatment is important due to the involvement of the anal sphincter in nearly half of patients.					5584747
3	doc38	L’ecografia endoanale è una tecnica affidabile nella valutazione dell’endometriosi perineale con coinvolgimento dello sfintere anale.		Endoanal ultrasonography is a reliable technique in the evaluation of perineal endometriosis with involvement of the anal sphincter.					5584747
4	doc38	Questo rapporto descrive la presentazione, l’indagine clinica e il trattamento chirurgico di un caso di endometriosi perineale Esso riguarda il caso di una paziente di 32 anni che presentava dolore ciclico e gonfiore di una vecchia cicatrice da episiotomia.		This report describes the presentation, clinical investigation, and surgical treatment of a case of perineal endometriosis. It concerns the case of a 32-year-old patient who presented with cyclic pain and swelling of an old episiotomy scar.					5584747
5	doc38	L’ecografia endoanale tridimensionale ha mostrato una lesione con il coinvolgimento dei muscoli dello sfintere anale esterno.		Three-dimensional endoanal ultrasonography showed a lesion involving the muscles of the outer anal sphincter.					5584747
6	doc38	La lesione è stata asportata completamente ed è stata eseguita la sfinteroplastica primaria di riparazione del difetto dello sfintere anale esterno.		The lesion was completely excised and primary sphincteroplasty repair of the external anal sphincter defect was performed.					5584747
7	doc38	Il referto anatomo-patologico definitivo è stato di endometriosi.		The final anatomical-pathological report was endometriosis.					5584747
8	doc38	Il periodo postoperatorio è decorso senza incidenti e non si osservava incontinenza anale.		The postoperative period went without incident and anal incontinence was not observed.					5584747
9	doc38	CONCLUSIONE: l’endometriosi perineale è una malattia rara e può coinvolgere i muscoli dello sfintere anale.		CONCLUSION: Perineal endometriosis is a rare disease and can involve the anal sphincter muscles.					5584747
10	doc38	L’escissione incompleta per proteggere gli sfinteri è associata a un’elevata recidiva, mentre un’escissione estesa può causare danni allo sfintere anale che possono causare incontinenza anale.		Incomplete excision to protect the sphincters is associated with high recurrence, while extended excision may cause damage to the anal sphincter and may cause anal incontinence.					5584747
11	doc38	L’ecografia endoanale può essere necessaria nella pianificazione chirurgica.		Endoanal ultrasonography may be needed in the surgical planning.					5584747
12	doc38	La sfinteroplastica primaria con escissione può essere necessaria nei casi di endometriosi perineale con coinvolgimento del muscolo sfintere anale esterno.		Primary sphincteroplasty with excision may be necessary in cases of perineal endometriosis involving the external anal sphincter muscle.					5584747
1	doc48	La pseudocisti pancreatica è una complicazione della pancreatite acuta e cronica, che richiede un trattamento in correlazione con le sue dimensioni, sintomatologia e effetto di massa sulle strutture adiacenti.		A pancreatic pseudocyst is a complication of acute and chronic pancreatitis, requiring treatment in correlation with its size, symptomatology and mass effect on adjacent structures.					5683505
2	doc48	Attualmente, il drenaggio della pseudocisti può essere effettuato all’interno dello stomaco o dell’intestino tenue attraverso un approccio endoscopico, laparoscopico o aperto.		Currently, the drainage of the pseudocyst can be performed within the stomach or small intestine through an endoscopic, laparoscopic, or open approach.					5683505
3	doc48	Viene qui presentata una tecnica chirurgica ibrida applicata su 3 pazienti portatori di una pseudocisti pancreatica, per il drenaggio con approccio laparoscopico assistito per via endoscopica.		A hybrid surgical technique applied to 3 patients carrying a pancreatic pseudocyst for endoscopic assisted laparoscopic drainage is presented here.					5683505
4	doc48	Si trattava in tutti i casi di psudocisti di grandi dimensioni formatesi a seguito di ripetuti episodi di pancreatite acuta, ed p stato deciso di procedere ad una pseudo- cisto-gastro-anastomosi meccanica eseguita per via laparoscopica-trans-gastrica attraverso un singolo trocar sotto guida endoscopica, senza perdite di sangue.	Si trattava in tutti i casi di psudocisti di grandi dimensioni formatesi a seguito di ripetuti episodi di pancreatite acuta, ed <tag>p</tag> stato deciso di procedere ad una pseudo- cisto-gastro-anastomosi meccanica eseguita per via laparoscopica-trans-gastrica attraverso un singolo trocar sotto guida endoscopica, senza perdite di sangue.	These were in all cases large pseudocysts formed as a result of repeated episodes of acute pancreatitis, and it was decided to proceed with mechanical pseudocystogastrotomy anastomosis performed laparoscopically and transgastrically through a single trocar under endoscopic guidance, without blood loss.				Minor	5683505
5	doc48	In tutti i casi è stata utilizzata l’ecografia laparoscopica per meglio facilitare la localizzazione sicura del futuro sito anastomotico.		In all cases, laparoscopic ultrasound was used to better facilitate the safe location of the future anastomotic site.					5683505
6	doc48	L’esame laparoscopico della cavità pseudocistica in due casi ha rivelato aree necrotiche che hanno richiesto la detersione.		Laparoscopic examination of the pseudocystic cavity in two cases revealed necrotic areas that required cleansing.					5683505
7	doc48	Senza insorgenza di complicanze i pazienti sono stati dimessi 4-6 giorni dopo l’intervento.		Without occurrence of complications, patients were discharged 4-6 days after surgery.					5683505
8	doc48	La tecnica descritta consente il drenaggio interno della pseudocisti pancreatica nello stomaco, unendo i vantaggi dell’endoscopia e della chirurgia mini-invasiva, superiori a quelli del drenaggio endoscopico, permettendo un’ampia comunicazione tra la pseudocisti e la cavità dello stomaco, riducendo il rischio di recidiva e la formazione di ascessi, con l’esplorazione della cavità pseudocistica e la rimozione dei tessuto necrotici.		The technique described allows the internal drainage of the pancreatic pseudocyst in the stomach, combining the advantages of endoscopy and mini-invasive surgery, which is superior to endoscopic drainage as it allows for extensive communication between the pseudocyst and the stomach cavity and reduces the risk of recurrence and the formation of abscesses, with the exploration of the pseudocystic cavity and the removal of necrotic tissues.		The technique described allows the internal drainage of the pancreatic pseudocyst in the stomach, combining the advantages of endoscopy and mini-invasive surgery, which <tag>is</tag> superior to endoscopic drainage as it allows for extensive communication between the pseudocyst and the stomach cavity and reduces the risk of recurrence and the formation of abscesses, with the exploration of the pseudocystic cavity and the removal of necrotic tissues.	Linguistic Conventions - Grammar	Major	5683505
8	doc48	La tecnica descritta consente il drenaggio interno della pseudocisti pancreatica nello stomaco, unendo i vantaggi dell’endoscopia e della chirurgia mini-invasiva, superiori a quelli del drenaggio endoscopico, permettendo un’ampia comunicazione tra la pseudocisti e la cavità dello stomaco, riducendo il rischio di recidiva e la formazione di ascessi, con l’esplorazione della cavità pseudocistica e la rimozione dei tessuto necrotici.		The technique described allows the internal drainage of the pancreatic pseudocyst in the stomach, combining the advantages of endoscopy and mini-invasive surgery, which is superior to endoscopic drainage as it allows for extensive communication between the pseudocyst and the stomach cavity and reduces the risk of recurrence and the formation of abscesses, with the exploration of the pseudocystic cavity and the removal of necrotic tissues.		The technique described allows the internal drainage of the pancreatic pseudocyst in the stomach, combining the advantages of endoscopy and mini-invasive surgery, which is superior to endoscopic <tag>drainage as</tag> it allows for extensive communication between the pseudocyst and the stomach cavity and reduces the risk of recurrence and the formation of abscesses, with the exploration of the pseudocystic cavity and the removal of necrotic tissues.	Linguistic Conventions - Punctuation	Critical	5683505
9	doc48	L’assistenza endoscopica rende possibile l’uso di un singolo trocar trans-gastrico, limitando la lesione della parete gastrica.		Endoscopic assistance makes it possible to use a single trans-gastric trocar, this way limiting gastric wall injury.					5683505
1	doc50	La sindrome dell’arteria mesenterica superiore (Superior mesenteric artery, SMA) rappresenta una rara causa di ostruzione dell’intestino tenue (small bowel obstruction, SBO).		Superior mesenteric artery (Superior mesenteric artery, SMA) syndrome represents a rare cause of small bowel obstruction (small bowel obstruction, SBO).					5683505
2	doc50	È una malattia complicata.		It is a complicated disease.					5683505
3	doc50	Il nostro obiettivo è quello di analizzare la diagnosi, la presentazione clinica, la gestione della sindrome dell’arteria mesenterica superiore e degli esiti postoperatori dopo duodenodigiunostomia laparoscopica.		Our goal is to analyze the diagnosis, clinical presentation, management of the superior mesenteric artery syndrome, and the postoperative outcomes after laparoscopic duodenojejunostomy.					5683505
4	doc50	Sono stati studiati 19 pazienti a cui è stata diagnosticata la sindrome dell’arteria mesenterica superiore tra gennaio 2010 e novembre 2017 presso l’ospedale universitario Afyon Health Sciences e che non hanno risposto al trattamento tradizionale.		We studied 19 patients who were diagnosed with superior mesenteric artery syndrome at Afyon Health Sciences University Hospital between January 2010 and November 2017, and who failed to respond to traditional treatment.					5587394
5	doc50	La loro età media era di 22,3 anni (17-31 anni): 6 uomini e 13 donne.		Their average age was 22.3 years (17-31 years): 6 men and 13 women.					5587394
6	doc50	Alla presentazione clinica 14 pazienti lamentavano una sindrome da sofferenza postprandiale, 3 una inspiegabile perdita di peso e 2 una GERD.		Upon presentation to the clinic, 14 patients complained of postprandial distress syndrome, three of unexplained weight loss, and 2 of GERD.					5587394
7	doc50	14 pazienti presentavano una dilatazione duodenale all’angio- Tac.		14 patients showed duodenal dilatation in the CAT angiography.					5587394
8	doc50	L’angolo aorto-mesenterico era in media di 10,6 mm.		The aortomesenteric angle averaged 10.6 mm.					5587394
9	doc50	La media della distanza tra l’aorta e la SMA era di 5,1 mm.		The average distance between the aorta and the SMA was 5.1 mm.					5587394
10	doc50	I tempi medi di degenza e di follow-up sono stati rispettivamente di 3,7 giorni e 40,2 mesi.		The average length of hospitalization and follow-up times were 3.7 days and 40.2 months, respectively.					5587394
11	doc50	Non è stata riscontrata morbilità o mortalità nei pazienti.		No morbidity or mortality was observed in the patients.					5587394
12	doc50	I punteggi CONUT riguardanti il 6° mese preoperatorio e il 6° e 12° mese postoperatorio erano rispettivamente di: 9,1;		The CONUT scores for the 6th pre-surgery month and the 6th and 12th post-surgery months were 9.1;					5683505
13	doc50	3,7 e 0,8.		3.7 and 0.8, respectively.					5587394
14	doc50	Dall’esperienza si conclude che la duodenodigiunostomia laparoscopica può essere eseguita in modo sicuro per i pazienti che non beneficiano del trattamento conservativo.		It was concluded from the experience that laparoscopic duodenojejunostomy can be performed safely for patients who do not benefit from conservative treatment.					5587394
1	doc52	Procedure ambulatoriali in laringologia.		Outpatient procedures in laryngology.					5683505
2	doc52	Lo sviluppo della fibrolaringoscopia transnasale, l’integrazione del canale operativo e l’avvento dell’alta definizione, associato ai miglioramenti della tecnologia laser, hanno permesso la diffusione delle procedure laringologiche eseguite ambulatorialmente.		The development of transnasal fiberoptic laryngoscopy, the integration of the operative channel, and the advent of high definition, associated with improvements in laser technology, have allowed the dissemination of laryngologic procedures performed on an outpatient basis.					5683505
3	doc52	Esistono 3 categorie di trattamenti: biopsie guidate dalla bioendoscopia, iniezioni endolaringee e chirurgia laser-assistita.		There are 3 categories of treatment: biopsies guided by endoscopy biopsy, endolaryngeal injections, and laser-assisted surgery.		There are 3 categories of treatment: <tag>biopsies guided by endoscopy biopsy</tag>, endolaryngeal injections, and laser-assisted surgery.	Linguistic Conventions - Character encoding	Major	5683545
4	doc52	26 pazienti sono stati sottoposti a trattamenti ambulatoriali presso la Clinica Otorinolaringoiatrica dell’IRCCS Policlinico San Martino di Genova, Italia.		26 patients underwent outpatient treatments at the Otorhinolaryngology Clinic of the San Martino IRCCS Polyclinic in Genoa, Italy.					5683505
5	doc52	Sono state eseguite 68 procedure: 60 per papillomatosi respiratoria ricorrente, 5 per paralisi unilaterale della corda vocale e 3 per leucoplachie glottiche.		68 procedures were performed: 60 for recurrent respiratory papillomatosis, 5 for unilateral vocal cord palsy, and 3 for glottic leukoplakia.					5683505
6	doc52	Tutte le procedure sono state eseguite posizionandosi dietro il paziente.		All the procedures were performed by positioning oneself behind the patient.					5683505
7	doc52	Per aumentare l’accuratezza della presa bioptica, abbiamo utilizzato la Narrow band imaging (NBI – Olympus Medical) o i-scan (Pentax Medical).		To increase the accuracy of the biopsy imaging, we used Narrow band imaging (NBI – Olympus Medical) or i-scan (Pentax Medical).					5683505
8	doc52	Le iniezioni endolaringee sono state eseguite con un ago flessibile da 25G.		The intravenous injections were performed with a flexible 25G needle.		The <tag>intravenous</tag> injections were performed with a flexible 25G needle.	Terminology - Wrong term	Major	5683505
9	doc52	Per eseguire la vaporizzazione delle lesioni papillomatose e per trattare le leleucoplachie selezionate è stato utilizzato il laser a fibra ibrido Opera Evo (Quanta system IEC/EN 60825-1:2007).		The Opera Evo hybrid fiber laser (Quanta system IEC/EN 60825-1:2007) was used to vaporize the papillomatous lesions and to treat the selected leleukoplakia.					5683505
10	doc52	Nessuna complicanza maggiore è incorsa durante le procedure.		No major complications arose during the procedures.					5683505
