SEG_ID	Doc	Source	Tagged_Source	Target	MT	Tagged_Target	Error Category	Severity	Annotator_ID
5	doc73	Les options de renforcement des systèmes de soins de santé primaires ont été identifiées par le biais d'une analyse de contenu thématique.		Options for strengthening primary health care systems were identified through a thematic content analysis.	TMT_run1				217670
6	doc73	Nous avons constaté que: (i) malgré le fardeau de plus en plus lourd des maladies non transmissibles, nombre de pays à faible et moyen revenu ne possédaient pas les fonds suffisants pour assurer des services de prévention; (ii) les professionnels de santé au sein des communautés manquaient fréquemment de ressources, de soutien et de formation; (iii) les frais non remboursables dépassaient 40% des dépenses de santé dans la moitié des pays étudiés, ce qui entraîne des inégalités; et enfin, (iv) les régimes d'assurance maladie étaient entravés par la fragmentation des systèmes publics et privés, le sous-financement, la corruption et la piètre mobilisation des travailleurs informels.		We found that: (i) despite the increasing burden of noncommunicable diseases, many low- and middle-income countries did not have sufficient funds to provide preventive services; (ii) community health professionals often lacked resources, support and training; (iii) non-reimbursable costs exceeded 40% of health expenditures in half of the countries studied, leading to inequalities; and finally, (iv) health insurance schemes were hampered by fragmentation of public and private systems, underfunding, corruption and poor mobilization of informal workers.	TMT_run1				217670
7	doc73	Dans 14 pays, le secteur privé n'était pratiquement soumis à aucune réglementation.		In 14 countries, the private sector was virtually unregulated.	TMT_run1				217670
8	doc73	Par ailleurs, l'engagement communautaire dans les soins de santé primaires était dérisoire dans les États où les services étaient majoritairement privatisés.		Furthermore, community involvement in primary health care was derisory in states where services were largely privatized.	TMT_run1				217670
9	doc73	Dans certains pays, la décentralisation avait débouché sur une fragmentation des soins de santé primaires.		In some countries, decentralization had led to fragmentation of primary health care.	TMT_run1				217670
10	doc73	Les performances se révélaient meilleures lorsque des avantages financiers avaient trait à la réglementation et à l'amélioration de la qualité, et l'implication était forte au sein de la communauté.		Performance was better when financial benefits related to regulation and quality improvement, and involvement in the community was strong.	TMT_run1				217670
11	doc73	Le processus d'élaboration des politiques devrait être accompagné des ressources nécessaires pour l'instauration d'un système de soins de santé primaires, et les gouvernements devraient accroître leurs dépenses en la matière d'au moins 1% du produit intérieur brut.		The policy-making process should be accompanied by the necessary resources for a primary health care system, and governments should increase spending on primary health care by at least 1% of gross domestic product.	TMT_run1				217670
12	doc73	Il est également impératif de définir des régimes de financement favorisant l'équité et de promouvoir la fiabilité de la gestion des soins de santé primaires.		It is also imperative to define financing regimes that promote equity and promote the reliability of primary health care management.	TMT_run1				217670
13	doc73	La contribution des systèmes de soins de santé primaires est essentielle à la progression vers une CMU à l'horizon 2030.		The contribution of primary health care systems is essential to progress towards UHC by 2030.	TMT_run1				217670
1	doc75	La reforme rurale du Zimbabwe a, à partir de l’année 2000, radicalement transformé la structure agraire, et avec celle-ci les petites villages dans les zones rurales.		Zimbabwe’s rural reform has, since 2000, radically transformed the agrarian structure, and with it small villages in rural areas.	TMT_run1				217670
2	doc75	Cet article explore trois parmi ces villages - Mvurwi, Chatsworth and Maphisa – en examinant les changements de population, de logement, de transport et d’activité commerciale entre 2000 et 2020.		This paper explores three of these villages - Mvurwi, Chatsworth and Maphisa - by examining changes in population, housing, transportation and commercial activity between 2000 and 2020.	TMT_run1				217670
3	doc75	Etudes de cas soulignent l’importance des réseaux et relations sociales entre les zones rurales et urbaines, associés aux nouveaux modèles de migration et à la croissance massive de l’économie parallèle.		Case studies highlight the importance of social networks and relationships between rural and urban areas, associated with new migration patterns and the massive growth of the informal economy.	TMT_run1				217670
4	doc75	En dépit de la manque d’investissement publique dans les infrastructures de base, les économies des petites villes étudiés a augmenté de manière considérable, avec un changement important dans les relations agraires, ce qui a généré des nouvelles activités économiques et des nouveaux emplois.		Despite the lack of public investment in basic infrastructure, the economies of these small towns studied grew considerably, with a significant change in agrarian relations, which generated new economic activities and new jobs.	TMT_run1				217670
5	doc75	Ceci suggère que, suite a des reformes rurales, viser un axe territorial (qui comprend des zones urbaines et rurales) offre du potentiel au développement économique locale.		This suggests that, following rural reforms, targeting a territorial axis (which includes urban and rural areas) offers potential for local economic development.	TMT_run1				217670
1	doc80	Neohexostoma gymnosardae n. sp. (Monogenea, Hexostomatidae), un parasite branchial de Gymnosarda unicolor (Valenciennes) (Teleostei, Scombridae) dans la mer de Chine méridionale. 		Neohexostoma gymnosardae n. sp. (Monogenea, Hexostomatidae), a branchial parasite of Gymnosarda unicolor (Valenciennes) (Teleostei, Scombridae) in the South China Sea.	TMT_run1				217670
2	doc80	La biodiversité parasitaire des poissons dans les récifs coralliens de la mer de Chine méridionale est encore incomplètement explorée.		The parasitic biodiversity of fish in coral reefs in the South China Sea is still incompletely explored.	TMT_run1	The parasitic biodiversity of fish in coral reefs in the South China Sea <tag>is still incompletely explored</tag>.	Style - Non-fluent	Neutral	217670
3	doc80	Nous décrivons ici une nouvelle espèce de Neohexostoma (Monogenea, Hexostomatidae) des filaments branchiaux du thon à dents de chien Gymnosarda unicolor (Scombridae), collecté au large du récif de Yongshu, mer de Chine méridionale.		A new species of Neohexostoma (Monogenea, Hexostomatidae) is described from the gill filaments of dog-toothed tuna Gymnosarda unicolor (Scombridae) collected off Yongshu Reef, South China Sea.	TMT_run1				217670
4	doc80	Neohexostoma gymnosardae n. sp. se distingue de ses congénères par les caractéristiques suivantes : (i) hapteur clairement séparé du corps proprement dit par un pédoncule fortement resserré, divisé dans sa marge postérieure en deux lobes symétriques, (ii) vagin armé de petites épines émoussées éparses, (iii) œufs attachés par leurs longs filaments polaires, (vi) œsophage avec plusieurs diverticules latéraux, (v) caeca intestinaux non fusionnés et s’étendant dans le hapteur.		Neohexostoma gymnosardae n. sp. is distinguished from its congeners by the following features: (i) a haptor clearly separated from the body proper by a strongly constricted peduncle, divided in its posterior margin into two symmetrical lobes, (ii) a vagina armed with scattered small blunt spines, (iii) eggs attached by their long polar filaments, (vi) an esophagus with several lateral diverticula, and (v) an unfused intestinal caeca extending into the haptor.	TMT_run1				217670
5	doc80	Nous présentons une analyse des relations de ce monogène basée sur des séquences partielles d’ADNr 28S.		We present an analysis of the relationships of this monogene based on partial 28S rDNA sequences.	TMT_run1				217670
6	doc80	Une clé d’identification des espèces de Neohexostoma est fournie.		A key to the species of Neohexostoma is provided.	TMT_run1	<tag>A key to the</tag> species of Neohexostoma is provided.	Accuracy - Mistranslation	Major	217670
7	doc80	Ceci est le premier membre du genre Neohexostoma connu pour parasiter une espèce de Gymnosarda.		This is the first member of the genus Neohexostoma known to parasitize a species of Gymnosarda.	TMT_run1				217670
1	doc81	RéSUMé: 		Abstract:	TMT_run1	<tag>Abstract</tag>:	Other	Neutral	217670
2	doc81	Au Canada et ailleurs dans le monde, la pandémie de COVID-19 a montré qu’il est important d’avoir des systèmes de santé publique fiables et réactifs.		In Canada and around the world, the COVID-19 pandemic has demonstrated the importance of reliable and responsive public health systems.	TMT_run1				217670
3	doc81	La pandémie nécessite un leadership décisif et une collaboration entre tous les secteurs de la société, éclairés par les meilleures preuves disponibles.		The pandemic requires decisive leadership and collaboration across all sectors of society, informed by the best available evidence.	TMT_run1				217670
4	doc81	Dans ce commentaire, nous faisons valoir que pour créer un système de santé publique robuste capable de relever les défis actuels et futurs, il faut privilégier des liens plus forts entre les praticiens de la santé publique et les milieux universitaires et y consacrer les investissements nécessaires.		In this commentary, we argue that in order to create a robust public health system capable of meeting current and future challenges, stronger links between public health practitioners and academia must be fostered and the necessary investments made.	TMT_run1				217670
5	doc81	Nous passons brièvement en revue les principales recommandations qui ont suivi la crise du SRAS, en particulier celles qui réclamaient le renforcement des liens entre les facultés de santé publique et les milieux de pratique au Canada.		We briefly review the key recommendations that followed the SARS crisis, particularly those that called for strengthened links between public health faculties and practice settings in Canada.	TMT_run1				217670
6	doc81	Nous proposons ensuite des mesures clés pour renforcer ces liens.		We then propose key actions to strengthen these linkages.	TMT_run1				217670
7	doc81	Faisant écho à d’autres appels à l’action liés à la COVID-19, qui préconisent un réinvestissement à long terme dans l’enseignement et la formation en santé publique, nous recommandons les mesures suivantes: 1) Améliorer la collaboration entre les programmes d’enseignement et les organismes de santé publique pour aborder les besoins des systèmes (p. ex. leur capacité d’appoint) et les inégalités persistantes en santé;		Echoing other calls for action related to COVID-19, which call for long-term reinvestment in public health education and training, we recommend the following actions: 1) Improve collaboration between education programs and public health agencies to address system needs (e.g. surge capacity) and persistent health inequalities;	TMT_run1				217670
8	doc81	2) Financer une initiative pancanadienne de formation en santé publique qui s’appuie sur un ensemble renouvelé de compétences en santé publique pour répondre aux besoins prioritaires en matière de formation (p. ex. le leadership axé sur l’équité); et 3) Préparer un groupe de dirigeants de santé publique agréés pouvant progresser dans les carrières de la santé publique, y compris des personnes qui exercent déjà la profession.		2) Fund a pan-Canadian public health training initiative that builds on a renewed set of public health competencies to address priority training needs (e.g. equity leadership); and 3) Develop a cadre of accredited public health leaders who can advance into public health careers, including those already in the profession.	TMT_run1				217670
1	doc82	Détection précoce du cancer de la prostate : résumé de ces dix dernières années.		Early detection of prostate cancer: a summary of the last ten years.	TMT_run1				217670
2	doc82	La détection précoce du cancer de la prostate reste un sujet d’incertitude pour le praticien généraliste.		Early detection of prostate cancer remains a subject of uncertainty for the general practitioner.	TMT_run1				217670
3	doc82	Le cancer de la prostate est la tumeur non cutanée la plus fréquemment diagnostiquée chez l’homme avec une proportion de 15 %. Bien que l’antigène spécifique de la prostate ait massivement contribué à l’identification à un stade curable depuis 25 ans, il est simultanément indispensable de ne pas surtraiter un cancer dont le taux de tumeurs indolentes est significatif.		Prostate cancer is the most frequently diagnosed non-cutaneous tumor in men with a proportion of 15%. Although prostate-specific antigen has massively contributed to the identification at a curable stage for 25 years, it is simultaneously indispensable not to overtreat a cancer with a significant rate of indolent tumors.	TMT_run1				217670
4	doc82	Dans ce contexte controversé, l’étude prospective randomisée de l’European Randomized Study of Screening for Prostate Cancer, et en particulier sa sous-population suédoise, a validé le bénéfice d’une détection précoce au cours de cette dernière décennie.		In this controversial context, the prospective randomized study of the European Randomized Study of Screening for Prostate Cancer, and in particular its Swedish subpopulation, has validated the benefit of early detection in the last decade.	TMT_run1				217670
5	doc82	En raison des options thérapeutiques variées et des potentiels effets secondaires de certaines d’entre elles, il est recommandé de ne pratiquer cette détection que chez les patients dûment informés.		Due to the varied treatment options and the potential side effects of some of them, it is recommended that this detection be performed only in duly informed patients.	TMT_run1				217670
1	doc84	RéSUMé: 		Abstract:	TMT_run1	<tag>Abstract</tag>:	Other	Neutral	217670
2	doc84	Pendant la pandémie, des résultats préliminaires sur l’effet protecteur du tabac sur la COVID-19 ont été largement diffusés dans le monde entier.		During the pandemic, preliminary results on the protective effect of tobacco on COVID-19 were widely disseminated worldwide.	TMT_run1				217670
3	doc84	Dans ce contexte, et en raison des questions de santé publique liées à ce sujet, un groupe multidisciplinaire ad hoc a été créé en réponse aux demandes des institutions de santé publique.		In this context, and due to public health issues related to this topic, an ad hoc multidisciplinary group was created in response to requests from public health institutions.	TMT_run1				217670
4	doc84	Les messages clés de ce commentaire sont les suivants : 1) La crise de la COVID-19 pourrait entraîner une augmentation de la consommation de tabac et une diminution de l’accès aux soins.		Key messages of this commentary are: 1) The COVID-19 crisis could lead to an increase in tobacco consumption and a decrease in access to care.	TMT_run1				217670
5	doc84	En conséquence, la morbidité et la mortalité liées au tabagisme pourraient augmenter dans les mois et les années à venir;		As a result, smoking-related morbidity and mortality could increase in the coming months and years;	TMT_run1				217670
6	doc84	2) Le tabagisme et les maladies liées au tabac sont des facteurs pronostiques de formes graves de la COVID-19; et 3) Hypothétiquement, les fumeurs, notamment en réduisant la fréquence et la durée des contacts sociaux, pourraient être moins susceptibles d’être contaminés.		2) Smoking and tobacco-related diseases are prognostic factors for severe forms of COVID-19; and 3) Hypothetically, smokers, particularly by reducing the frequency and duration of social contact, may be less likely to be contaminated.	TMT_run1				217670
7	doc84	En conclusion, même pendant et malgré la crise sanitaire due à la pandémie de la COVID-19, la lutte contre le tabagisme reste plus que jamais un défi.		In conclusion, even during and despite the health crisis due to the COVID-19 pandemic, tobacco control remains more than ever a challenge.	TMT_run1				217670
8	doc84	Les décideurs publics doivent être particulièrement vigilants pour assurer la cohérence des pratiques publiques, y compris le respect des principes de la Convention-cadre de l’OMS pour la lutte antitabac.		Public policy makers need to be particularly vigilant in ensuring consistency in public practice, including compliance with the principles of the WHO Framework Convention on Tobacco Control.	TMT_run1				217670
9	doc84	Il incombe également aux chercheurs et aux médias de communiquer avec prudence des résultats préliminaires susceptibles de générer des comportements individuels contre-productifs et d’être instrumentalisés à des fins commerciales.		It is also incumbent on researchers and the media to communicate with caution preliminary results that may generate counterproductive individual behaviour and be exploited for commercial purposes.	TMT_run1				217670
1	doc87	RéSUMé: 		Abstract:	TMT_run1				217670
2	doc87	Il existe de nombreuses preuves issues d’études in vitro, chez l’animal et chez l’humain qui montrent que le vaccin bacillaire de Calmette et Guérin (BCG) peut reprogrammer de manière épigénétique l’immunité naturelle et procurer ainsi une protection « hors-cible » contre des pathogènes autres que les mycobactéries.		There is extensive evidence from in vitro, animal and human studies showing that bacillary Calmette-Guérin (BCG) vaccine can epigenetically reprogram natural immunity and thus provide "off-target" protection against pathogens other than mycobacteria.	TMT_run1				217670
3	doc87	Ce processus a été appelé « immunité entraînée ». 		This process has been called "trained immunity".	TMT_run1				217670
4	doc87	Bien que des études écologiques récentes aient suggéré l’existence d’une association entre les politiques d’utilisation du BCG et la fréquence ou sévérité de la COVID-19 dans différents pays, l’interprétation de leurs résultats est difficile.		Although recent ecological studies have suggested an association between BCG use policies and the frequency or severity of COVID-19 in different countries, interpretation of their results is difficult.	TMT_run1				217670
5	doc87	Pour cette raison, une étude cas-témoin a été entreprise au Québec en vue de tester cette hypothèse.		For this reason, a case-control study was undertaken in Quebec to test this hypothesis.	TMT_run1				217670
6	doc87	Plusieurs essais cliniques de Phase III sont en cours, dont un au Canada, pour évaluer l’efficacité du BCG contre les infections causées par le SRAS-CoV-2 (résultats attendus en 2021).		Several Phase III clinical trials are underway, including one in Canada, to assess the efficacy of BCG against SARS-CoV-2 infections (expected 2021 results).	TMT_run1				217670
7	doc87	Dans le passé, le BCG a été utilisé à large échelle au Canada, mais actuellement, les indications sont limitées aux individus à haut risque et aux communautés dans lesquelles se produisent des éclosions de tuberculose, ainsi que pour le traitement du cancer de la vessie.		In the past, BCG has been used extensively in Canada, but currently indications are limited to high-risk individuals and communities in which tuberculosis outbreaks occur, as well as for the treatment of bladder cancer.	TMT_run1				217670
8	doc87	L’intérêt potentiel du BCG en tant que mesure intérimaire pour contrôler la COVID-19 fait l’objet de discussions intenses dans la communauté scientifique et cela pourrait être envisagé pour des populations vulnérables au Canada.		The potential interest of the BCG as an interim measure to control COVID-19 is the subject of intense discussion in the scientific community and could be considered for vulnerable populations in Canada.	TMT_run1				217670
9	doc87	Pour conclure, la vaccination avec le BCG devrait être placée sur l’agenda des organismes de recherche, des comités scientifiques consultatifs et des autorités de santé publique fédérale, provinciales et territoriales.		In conclusion, BCG vaccination should be placed on the agenda of research organizations, scientific advisory committees and federal, provincial and territorial public health authorities.	TMT_run1				217670
1	doc88	Artériofit : un programme recommandé en première intention pour le traitement de la claudication intermittente.		Arteriofit: a recommended first-line program for the treatment of intermittent claudication.	TMT_run1				217670
2	doc88	L’insuffisance artérielle des membres inférieurs est la troisième manifestation la plus fréquente de l’athérosclérose.		Arterial insufficiency of the lower limbs is the third most common manifestation of atherosclerosis.	TMT_run1				217670
3	doc88	Le nombre d’événements cardiovasculaires dans cette population est similaire à celui des malades coronariens.		The number of cardiovascular events in this population is similar to that of coronary heart disease patients.	TMT_run1				217670
4	doc88	La prise en charge consiste en un contrôle strict des facteurs de risque cardiovasculaires, un traitement pharmacologique optimal et l’entraînement supervisé à la marche.		Management consists of strict control of cardiovascular risk factors, optimal pharmacological treatment and supervised walking training.	TMT_run1				217670
5	doc88	L’entraînement supervisé est supérieur aux autres modalités d’exercices en termes d’augmentation du temps de marche, de la distance maximale de marche, de la distance de marche sans douleur et des scores de qualité de vie.		Supervised training is superior to other exercise modalities in terms of increased walking time, maximum walking distance, pain-free walking distance, and quality of life scores.	TMT_run1				217670
6	doc88	En association avec une revascularisation, les bénéfices sont majorés.		In combination with revascularisation, the benefits are increased.	TMT_run1				217670
7	doc88	En Suisse, des programmes fédéraux ont été créés sur ces bases et existent dans de nombreuses villes.		In Switzerland, federal programmes have been created on these bases and exist in many cities.	TMT_run1				217670
8	doc88	Ils sont méconnus et pourtant essentiels.		They are unknown and yet essential.	TMT_run1				217670
1	doc91	RéSUMé: 		Abstract:	TMT_run1	<tag>Abstract</tag>:	Other	Neutral	217670
2	doc91	La pandémie a mis en lumière la complexité des mesures de santé publique et de leurs effets collatéraux, l’intrication des phénomènes sanitaires, sociaux et politiques sous-jacents, ainsi que leur spécificité pour des communautés minoritaires marginalisées.		The pandemic highlighted the complexity of public health measures and their collateral effects, the interplay of underlying health, social and political phenomena, and their specificity for marginalized minority communities.	TMT_run1				217670
3	doc91	Fort de cette expérience, le présent commentaire souligne la pertinence d’élaborer des mécanismes de consultation qui tiennent compte de l’ensemble de la population en incluant les groupes minoritaires marginalisés, pour mieux informer les processus décisionnels en temps de pandémie.		Drawing on this experience, this commentary highlights the relevance of developing consultation mechanisms that are inclusive of the entire population, including marginalized minority groups, to better inform decision-making processes during a pandemic.	TMT_run1				217670
4	doc91	Dans un contexte de crise fluide, tout processus de consultation doit tenir compte des limites du possible et faire le deuil de l’exhaustivité au profit d’itérations répétées de dialogue, de médiation et de prises de décision au sujet de l’action.		In a context of fluid crisis, any consultation process must take into account the limits of what is possible and mourn completeness in favour of repeated iterations of dialogue, mediation and decision-making about action.	TMT_run1				217670
5	doc91	Il s’agit de créer des conditions propices à ce que les voix des personnes et groupes plus vulnérables soient entendus par les autorités publiques.		The aim is to create the conditions for the voices of the most vulnerable people and groups to be heard by public authorities.	TMT_run1				217670
6	doc91	Afin de nous préparer aux prochaines crises, il est nécessaire d’ores et déjà de développer des liens forts entre institutions publiques et communautés, tant majoritaires que minoritaires, afin de définir les mécanismes favorisant l’émergence d’une santé publique réellement inclusive, qui tienne compte de la santé physique, mentale et sociale de la population.		In order to prepare for future crises, it is already necessary to develop strong links between public institutions and communities, both majority and minority, in order to define the mechanisms favouring the emergence of a truly inclusive public health, which takes into account the physical, mental and social health of the population.	TMT_run1				217670
1	doc92	RéSUMé: 		Abstract:	TMT_run1	<tag>Abstract</tag>:	Other	Neutral	217670
