SEG_ID	Doc	Source	Tagged_Source	Target	MT	Tagged_Target	Error Category	Severity	Annotator_ID
3	doc24	Lorsqu’un médicament est cher, l’accès aux traitements pour un·e patient·e sans assurance avec des ressources limitées est une barrière qui peut conduire à renoncer aux soins pour des raisons économiques.		When a drug is expensive, access to treatment for an uninsured patient with limited resources is a barrier that leads to discontinuation of care for economic reasons.	TMT_run1				217670
4	doc24	Un buyers’ club est une structure dont l’objectif est d’apporter une aide logistique et/ou financière à un·e patient·e qui souhaite importer à titre personnel un médicament de qualité et efficace à des conditions économiquement plus favorables.		A buyers’ club is a structure whose objective is to provide logistical and/or financial assistance to a patient who wishes to import a quality and effective medicine on a personal basis under more favourable economic conditions.	TMT_run1				217670
5	doc24	L’achat du médicament se fait par internet.		The medicine is purchased on the internet.	TMT_run1				217670
1	doc25	Le mouvement canadienne d'accueil des réfugiés (2015-2016) a été l'un des exemples d'action collective les plus importants, visibles et efficaces de l'histoire récente du Canada.		The Canadian refugee movement (2015-2016) has been one of the most important, visible and effective examples of collective action in Canada's recent history.	TMT_run1	The Canadian refugee movement (2015-2016) has been one of the most important, <tag>visible and</tag> effective examples of collective action in Canada's recent history.	Linguistic Conventions - Punctuation	Minor	217670
2	doc25	Il avait une portée nationale et une initiation à la base.		It had a national scope and a grassroots orientation.	TMT_run1				217670
3	doc25	Il comprenait une grande variété de participants et utilisait activement les médias sociaux dans sa constitution.		It included a wide variety of participants and actively used social media in its constitution.	TMT_run1				217670
4	doc25	Cet article présente les résultats d'une étude de cas multi-méthodes qui cherche à expliquer comment les cadres d'action collective sont apparus dans le contexte du Mouvement canadien d'accueil des réfugiés; quels acteurs étaient impliqués dans leur articulation; et comment ils ont attiré les autres et généré une action collective et un effet humanitaire et politique.		This article presents the results of a multi-method case study that seeks to explain how frameworks for collective action emerged in the context of the Canadian Refugee Movement; which actors were involved in their articulation; and how they attracted others and generated collective action and humanitarian and political effect.	TMT_run1				217670
5	doc25	L'accent est mis sur les processus discursifs de construction de la solidarité à travers la différence tels qu'ils se déroulent dans l'environnement des médias sociaux.		Emphasis is placed on the discursive processes of building solidarity across difference as they take place in the social media environment.	TMT_run1				217670
6	doc25	Les pages d'événements Facebook appelant à des rassemblements en faveur des réfugiés syriens ont servi d'espace discursif qui a contribué à transformer le choc moral subi par les membres de différentes communautés morales en un processus de concertation des voix et de construction de cadres de solidarité et d'action collective à travers différences.		The Facebook event pages calling for rallies on behalf of Syrian refugees served as a discursive space that helped transform the moral shock experienced by members of different moral communities into a process of concerted voices and the construction of frameworks of solidarity and collective action through differences.	TMT_run1				217670
1	doc27	RéSUMé:		Abstract:	TMT_run1	<tag>Abstract</tag>:	Other	Neutral	217670
2	doc27	 OBJECTIFS:		OBJECTIVES： 	TMT_run1				217670
3	doc27	 La pandémie de COVID-19 perturbe profondément la vie quotidienne au Canada.		The COVID-19 pandemic is profoundly disrupting daily life in Canada.	TMT_run1				217670
4	doc27	Notre étude évalue les changements survenus dans les comportements de santé aux premiers stades de la pandémie et examine les disparités sociodémographiques associées à ces changements.		Our study assesses changes in health behaviours in the early stages of the pandemic and examines the sociodemographic disparities associated with these changes.	TMT_run1	Our study assesses changes in health <tag>behaviours</tag> in the early stages of the pandemic and examines the sociodemographic disparities associated with these changes.	Linguistic Conventions - Spelling	Minor	261860
5	doc27	MéTHODE:		Method:	TMT_run1	<tag>Method</tag>:	Other	Neutral	217670
6	doc27	 Nous analysons les données sur les adultes de 25 ans et plus (N = 4 383) tirées de la Série d’enquêtes sur les perspectives canadiennes 1 : Répercussions de la COVID-19 (SEPC-COVID) d’usage public.		We analyze data on adults 25 years of age and older (N = 4,383) from the Canadian Perspectives Series 1: Implications of COVID-19 (SEPC-COVID) for public use.	TMT_run1				217670
7	doc27	Des modèles de régression multinomiale permettent d’évaluer l’association entre les caractéristiques démographiques et socioéconomiques et les augmentations ou les diminutions de six comportements de santé : usage de l’alcool, du tabac et du cannabis, consommation d’aliments vides et temps passé devant la télévision et sur Internet.		Multinomial regression models were used to assess the association between demographic and socioeconomic characteristics and increases or decreases in six health behaviours: alcohol, tobacco and cannabis use, junk food consumption, and television and Internet time.	TMT_run1	Multinomial regression models were used to assess the association between demographic and socioeconomic characteristics and increases or decreases in six health <tag>behaviours</tag>: alcohol, tobacco and cannabis use, junk food consumption, and television and Internet time.	Linguistic Conventions - Spelling	Minor	217670
8	doc27	RéSULTATS: 		Results:	TMT_run1	<tag>Results</tag>:	Other	Neutral	261860
9	doc27	Nos constatations varient entre ces six comportements, mais dans l’ensemble, il y a eu une augmentation des comportements de santé négatifs : 14 % des Canadiens adultes ont dit avoir accru leur usage de l’alcool (IC de 95 % = 0,12, 0,15), 25 % ont accru leur consommation d’aliments vides (IC de 95 % = 0,23, 0,27), et plus de 60 % ont accru leur temps d’écran (62 %, IC de 95 % = 0,60, 0,65 pour la télévision et 66 %, IC de 95 % = 0,63, 0,68 pour Internet).		Our findings vary among these six behaviours, but overall there was an increase in negative health behaviours: 14% of adult Canadians reported increased alcohol use (95% CI = 0.12, 0.15), 25% increased their junk food consumption (95% CI = 0.23, 0.27), and more than 60% increased their screen time (62%, 95% CI = 0.60, 0.65 for television and 66%, 95% CI = 0.63, 0.68 for the Internet).	TMT_run1	Our findings vary among these six behaviours, but overall there was an increase in negative health <tag>behaviours</tag>: 14% of adult Canadians reported increased alcohol use (95% CI = 0.12, 0.15), 25% increased their junk food consumption (95% CI = 0.23, 0.27), and more than 60% increased their screen time (62%, 95% CI = 0.60, 0.65 for television and 66%, 95% CI = 0.63, 0.68 for the Internet).	Linguistic Conventions - Spelling	Minor	217670
10	doc27	Les jeunes adultes et les adultes nés au Canada étaient plus susceptibles d’avoir accru leurs comportements de santé négatifs que les adultes âgés et ceux ayant immigré au Canada.		Young adults and Canadian-born adults were more likely to increase their negative health behaviours than older adults and those who immigrated to Canada.	TMT_run1	Young adults and Canadian-born adults were more likely to increase their negative health <tag>behaviours</tag> than older adults and those who immigrated to Canada.	Linguistic Conventions - Spelling	Minor	217670
11	doc27	Les adultes ayant dit subir des contrecoups financiers de la COVID-19 étaient plus susceptibles d’avoir accru tous leurs comportements de santé négatifs (p. ex., pour la consommation accrue d’aliments vides, le rapport de risque relatif [RRR] = 1,81, IC de 95 % = 1,49, 2,20, comparativement au groupe n’ayant pas subi de contrecoups financiers).		Adults who reported financial impact of COVID-19 were more likely to have increased all of their negative health behaviours (e.g., for increased junk food consumption, relative hazard ratio [RRR] = 1.81, 95% CI = 1.49, 2.20, compared with the group without financial impact).	TMT_run1	Adults who reported financial impact of COVID-19 were more likely to have increased all of their negative health <tag>behaviours</tag> (e.g., for increased junk food consumption, relative hazard ratio [RRR] = 1.81, 95% CI = 1.49, 2.20, compared with the group without financial impact).	Linguistic Conventions - Spelling	Minor	217670
12	doc27	CONCLUSION: 		CONCLUSION:	TMT_run1				217670
13	doc27	Notre étude décrit la détérioration globale des comportements de santé aux premiers stades de la pandémie de COVID-19.		Our study describes the overall deterioration of health behaviors in the early stages of the COVID-19 pandemic.	TMT_run1				261860
14	doc27	Pour réduire les torts que cela peut causer à long terme à la santé de la population canadienne, il faut, selon les résultats, adapter les interventions, surtout aux jeunes Canadiens, et atténuer les contrecoups financiers de la pandémie, qui sont liés à des changements négatifs dans les comportements de santé.		To reduce the long-term harm to the health of Canadians, evidence suggests that interventions, especially for young Canadians, need to be tailored and that the financial impact of the pandemic, which is linked to negative changes in health behaviours, needs to be mitigated.	TMT_run1	To reduce the long-term harm to the health of Canadians, evidence suggests that interventions, especially for young Canadians, need to be tailored and that the financial impact of the pandemic, which is linked to negative changes in health <tag>behaviours</tag>, needs to be mitigated.	Linguistic Conventions - Spelling	Minor	217670
1	doc28	La pandémie COVID-19 a provoqué des perturbations rapides, vastes et importantes dans le travail et la vie de famille.		The COVID-19 pandemic caused rapid, widespread and significant disruptions in work and family life.	TMT_run1	The COVID-19 pandemic caused rapid, <tag>widespread and</tag> significant disruptions in work and family life.	Linguistic Conventions - Punctuation	Minor	217670
2	doc28	En conséquence, ces changements dramatiques peuvent avoir remodelé la division parentale du travail entre les sexes à court terme.		As a result, these dramatic changes may have reshaped the parental gender division of labour in the short term.	TMT_run1	As a result, these dramatic changes may have reshaped the parental gender division of <tag>labour</tag> in the short term.	Linguistic Conventions - Spelling	Minor	261860
3	doc28	À l'aide de données provenant de 1 234 parents canadiens vivant dans des relations de sexe différent, nous comparons les rapports rétrospectifs sur le partage perçu de la répartition des tâches ménagères et de garde d'enfants avant la déclaration de la pandémie aux évaluations de l'égalité par la suite.		Using data from 1,234 Canadian parents living in different sex relationships, we compare retrospective reports of perceived sharing of household and child care responsibilities prior to the declaration of the pandemic to equality assessments thereafter.	TMT_run1	Using data from 1,234 Canadian parents living in different <tag>sex</tag> relationships, we compare retrospective reports of perceived sharing of household and child care responsibilities prior to the declaration of the pandemic to equality assessments thereafter.	Accuracy - Mistranslation	Neutral	217670
4	doc28	En outre, nous décrivons les perceptions des changements dans l'engagement des pères dans ces tâches en général, par sexe des répondants et par conditions d'emploi avant et pendant la pandémie.		In addition, we describe perceptions of changes in fathers' involvement in these tasks in general, by gender of respondents and by conditions of employment before and during the pandemic.	TMT_run1				217670
5	doc28	Les résultats indiquent de petits changements vers une division du travail plus égalitaire au cours des premiers mois de «verrouillage», avec une participation accrue des pères aux travaux ménagers et à la garde des enfants, ce qui confirme l'hypothèse d'exposition aux besoins.		Results indicate small changes towards a more egalitarian division of labour during the first months of "lock-in", with increased involvement of fathers in housework and child care, confirming the assumption of exposure to needs.	TMT_run1	Results indicate small changes towards a more egalitarian division of <tag>labour</tag> during the first months of "lock-in", with increased involvement of fathers in housework and child care, confirming the assumption of exposure to needs.	Linguistic Conventions - Spelling	Minor	217670
5	doc28	Les résultats indiquent de petits changements vers une division du travail plus égalitaire au cours des premiers mois de «verrouillage», avec une participation accrue des pères aux travaux ménagers et à la garde des enfants, ce qui confirme l'hypothèse d'exposition aux besoins.		Results indicate small changes towards a more egalitarian division of labour during the first months of "lock-in", with increased involvement of fathers in housework and child care, confirming the assumption of exposure to needs.	TMT_run1	Results indicate small changes towards a more egalitarian division of labour during the first months of "lock-in", with increased involvement of fathers in housework and <tag>child care</tag>, confirming the assumption of exposure to needs.	Terminology - Wrong term	Minor	217670
6	doc28	Nous concluons en discutant des différences entre les sexes dans les rapports des parents et des implications potentielles pour l’égalité entre les sexes à long terme.		We conclude by discussing gender differences in parental relationships and potential implications for long-term gender equality.	TMT_run1				261860
1	doc29	La pédiatrie intégrative fait partie intégrante des soins pédiatriques en Suisse.		Integrative pediatrics is an integral part of pediatric care in Switzerland.	TMT_run1				217670
2	doc29	Basée sur l’évidence et l’expérience, la pédiatrie intégrative utilise des thérapies conventionnelles et complémentaires dans une approche interprofessionnelle, pour promouvoir de manière optimale le développement et la santé des enfants et adolescents.		Based on evidence and experience, integrative pediatrics uses conventional and complementary therapies in an interprofessional approach, to optimally promote the development and health of children and adolescents.	TMT_run1				261860
3	doc29	La Suisse dispose d’un niveau élevé de soins pédiatriques incluant la médecine complémentaire.		Switzerland has a high standard of paediatric care including complementary medicine.	TMT_run1	Switzerland has a high standard of <tag>paediatric</tag> care including complementary medicine.	Linguistic Conventions - Spelling	Minor	217670
4	doc29	De nombreux pédiatres et médecins de famille offrent une approche intégrative aux patients, basée sur des formations supplémentaires en médecine complémentaire, ce qui garantit une prise en charge large et compétente.		Many paediatricians and family physicians offer an integrative approach to patients, based on additional training in complementary medicine, which guarantees a broad and competent management.	TMT_run1	Many <tag>paediatricians</tag> and family physicians offer an integrative approach to patients, based on additional training in complementary medicine, which guarantees a broad and competent management.	Accuracy - Mistranslation	Neutral	217670
5	doc29	Le Groupe d’intérêt suisse pour la pédiatrie intégrative de la Société suisse de pédiatrie traite de toutes les questions relatives à la médecine complémentaire et l’approche intégrative en pédiatrie, y compris l’organisation des formations et la coordination de la recherche.		The Swiss Interest Group for Integrative Pediatrics of the Swiss Paediatric Society deals with all issues related to complementary medicine and integrative approach in paediatrics, including the organization of training and coordination of research.	TMT_run1	The Swiss Interest Group for Integrative Pediatrics of the Swiss <tag>Paediatric</tag> Society deals with all issues related to complementary medicine and integrative approach in paediatrics, including the organization of training and coordination of research.	Accuracy - Mistranslation	Minor	217670
5	doc29	Le Groupe d’intérêt suisse pour la pédiatrie intégrative de la Société suisse de pédiatrie traite de toutes les questions relatives à la médecine complémentaire et l’approche intégrative en pédiatrie, y compris l’organisation des formations et la coordination de la recherche.		The Swiss Interest Group for Integrative Pediatrics of the Swiss Paediatric Society deals with all issues related to complementary medicine and integrative approach in paediatrics, including the organization of training and coordination of research.	TMT_run1	The Swiss Interest Group for Integrative Pediatrics of the Swiss Paediatric Society deals with all issues related to complementary medicine and integrative approach in <tag>paediatrics</tag>, including the organization of training and coordination of research.	Accuracy - Mistranslation	Minor	217670
1	doc30	L’image du mois : Hydrocéphalie sévère chez un enfant avec dystrophie myotonique  congénitale.		Image of the month: Severe hydrocephalus in a child with congenital myotonic dystrophy.	TMT_run1				217670
2	doc30	Un jeune patient atteint de dystrophie myotonique congénitale, ou maladie de Steinert, présente, à l’âge de 4 mois et demi, un décrochage de son périmètre crânien et des signes d’hypertension intracrânienne.		A young patient with congenital myotonic dystrophy, or Steinert's disease, presents, at the age of 4 and a half months, a drop in his head circumference and signs of intracranial hypertension.	TMT_run1	A young patient with congenital myotonic dystrophy, or Steinert's disease, presents, at the age of 4 and a half months, a drop <tag>in his head</tag> circumference and signs of intracranial hypertension.	Style - Non-fluent	Neutral	261860
3	doc30	Le bilan radiologique révèle une hydrocéphalie majeure.		Radiological assessment reveals major hydrocephalus.	TMT_run1				217670
4	doc30	L’enfant évolue favorablement après dérivation ventriculopéritonéale.		The child develops favourably after ventriculoperitoneal shunt.	TMT_run1	The child develops <tag>favourably</tag> after ventriculoperitoneal shunt.	Linguistic Conventions - Spelling	Minor	217670
5	doc30	Alors que la ventriculomégalie est fréquente lors d’une dystrophie myotonique congénitale, l’hydrocéphalie avec signes d’hypertension intracrânienne est rare, d’où la nécessité d’un suivi régulier du périmètre crânien.		While ventriculomegaly is common in congenital myotonic dystrophy, hydrocephalus with signs of intracranial hypertension is rare, hence the need for regular head circumference monitoring.	TMT_run1				217670
1	doc31	Cas clinique. Une ostéomyélite aiguë néonatale, un diagnostic parfois fortuit qui peut changer une vie.		Clinical case. Acute neonatal osteomyelitis, a sometimes incidental diagnosis that can change a life.	TMT_run1	Clinical case. Acute neonatal osteomyelitis, a <tag>sometimes incidental</tag> diagnosis that can change a life.	Linguistic Conventions - Grammar	Major	217670
2	doc31	L’ostéomyélite aiguë néonatale est un diagnostic rare, mais qui doit être posé pour en diminuer les comorbidités.		Acute neonatal osteomyelitis is a rare diagnosis, but it must be made to decrease its comorbidities.	TMT_run1				261860
3	doc31	Le staphylocoque doré est le germe le plus souvent en cause.		Staphylococcus aureus is the most commonly implicated organism.	TMT_run1				217670
4	doc31	La difficulté diagnostique réside dans sa pauci-symptomatologie, en particulier chez le prématuré. 		The diagnostic difficulty lies in its pauci-symptomatology, especially in the premature infant.	TMT_run1				217670
5	doc31	La voie de contamination la plus fréquente est hématogène.		The most common route of contamination is hematogenous.	TMT_run1				217670
6	doc31	Les facteurs de risque inhérents à la prématurité sont le monitoring invasif, les prélèvements à répétition, le cathétérisme central prolongé, une réponse immunitaire immature et la durée d’hospitalisation.		Inherent risk factors for prematurity are invasive monitoring, repeated sampling, prolonged central catheterization, immature immune response and length of hospital stay.	TMT_run1				217670
7	doc31	Nous rapportons le cas d’une ostéomyélite secondaire à un sepsis à staphylocoque doré chez un prématuré né à 25 semaines et 3 jours d’aménorrhée.		We report the case of osteomyelitis secondary to Staphylococcus aureus sepsis in a premature infant born at 25 weeks and 3 days of amenorrhea.	TMT_run1				217670
8	doc31	Le diagnostic a été réalisé fortuitement sur une radiographie d’abdomen à blanc.		The diagnosis was made incidentally on a blank abdomen X-ray.	TMT_run1	The diagnosis was made incidentally on a <tag>blank</tag> abdomen X-ray.	Style - Non-fluent	Neutral	217670
9	doc31	La faible compliance parentale pour le suivi de l’enfant ne nous permet pas d’affirmer un futur sans séquelle, même si les éléments à notre disposition lors d’une consultation à 8 mois laissent penser une évolution favorable.		The low parental compliance for the follow-up of the child does not allow us to affirm a future without sequelae, even if the elements at our disposal during a consultation at 8 months suggest a favourable evolution.	TMT_run1	The low parental compliance for the follow-up of the child does not allow us to affirm a future without <tag>sequelae</tag>, even if the elements at our disposal during a consultation at 8 months suggest a favourable evolution.	Style - Non-fluent	Neutral	217670
10	doc31	L’ostéomyélite aiguë néonatale est un diagnostic difficile à poser, mais crucial pour le développement futur de l’enfant.		Acute neonatal osteomyelitis is a difficult diagnosis to make, but crucial for the future development of the child.	TMT_run1				217670
1	doc32	RéSUMé:		Abstract:	TMT_run1	<tag>Abstract</tag>:	Other	Neutral	217670
2	doc32	Depuis quelques mois, jamais nos concitoyens n’ont autant entendu parler de santé publique.		In recent months, our citizens have never heard so much about public health.	TMT_run1				217670
3	doc32	La pandémie de SARS-CoV-2 a mis en lumière le rôle essentiel de la santé publique pour la protection de la santé et a été un puissant révélateur de la capacité actuelle de la santé publique ainsi que des correctifs à apporter et des exigences à rencontrer dans le futur.		The SARS-CoV-2 pandemic highlighted the critical role of public health in protecting health and was a powerful indicator of current public health capacity as well as corrective actions and future requirements.	TMT_run1				217670
4	doc32	À cette fin, nous avons identifié plusieurs pistes pour redonner du pouvoir à la santé publique au Québec et s’assurer de cette façon qu’elle puisse contribuer de manière significative à la santé de la population.		To this end, we have identified several avenues for restoring power to public health in Quebec and ensuring that it can make a significant contribution to the health of the population.	TMT_run1				217670
5	doc32	Plus particulièrement, nous proposons que même si les réformes doivent continuer d’accroître son travail de protection de la santé, des efforts substantiels sont nécessaires pour renforcer ses systèmes de surveillance, de prévention, de promotion de la santé et de soins de première ligne pour qu’ils soient accessibles, efficaces et complets.		In particular, we propose that although reforms should continue to enhance its health protection work, substantial efforts are needed to strengthen its surveillance, prevention, health promotion and primary care systems so that they are accessible, effective and comprehensive.	TMT_run1				217670
1	doc33	Non-compaction du ventricule gauche : diagnostic et prise en charge.		Non-compaction of the left ventricle: diagnosis and management.	TMT_run1				217670
2	doc33	La non-compaction du ventricule gauche (NCVG) est une malformation congénitale caractérisée par la présence de trabéculations proéminentes et des récessus intertrabéculaires profonds.		Left ventricular noncompaction (LVNC) is a congenital malformation characterized by the presence of prominent trabeculae and deep intertrabecular recesses.	TMT_run1				217670
3	doc33	Bien que la NCVG puisse être diagnostiquée par l’échocardiographie ou l’imagerie par résonance magnétique (IRM) cardiaque, il n’y a actuellement pas de critère permettant un diagnostic formel.		Although LVNC can be diagnosed by echocardiography or cardiac magnetic resonance imaging (MRI), there are currently no criteria for a formal diagnosis.	TMT_run1				217670
