SEG_ID	Doc	Source	Tagged_Source	Target	MT	Tagged_Target	Error Category	Severity	Annotator_ID
5	doc72	В проанализированных источниках в 22% случаев отмечены выраженный тромбоз и тромбоэмболия ветвей легочной артерии, ассоциированная с тромбозом глубоких вен нижних конечностей.		In the analyzed sources in 22% of cases there was marked thrombosis and thromboembolism of pulmonary artery branches associated with thrombosis of deep veins of the lower extremities.	NeMo_run1	In the analyzed sources in 22% of cases there was marked thrombosis and thromboembolism of pulmonary artery branches associated with <tag>thrombosis of deep veins of the lower extremities.</tag>	Terminology - Inconsistent use of terminology	Neutral	501105
6	doc72	Во всех источниках литературы в почках выявлены острый некроз эпителия канальцев, расширение просвета канальцев и отек интерстиция.		In all literature sources, acute necrosis of tubular epithelium, dilated tubular lumen and interstitial edema were found in the kidneys.	NeMo_run1				501105
1	doc76	После сфинктеросохраняющей низкой передней резекции у значительной части больных раком прямой кишки отмечаются жалобы на проблемы эвакуации, а также удержание кишечного содержимого, объединенные в «синдром низкой передней резекции» (СНПР).		After sphincter-preserving low anterior resection, a significant proportion of patients with rectal cancer have complaints of evacuation problems, as well as retention of intestinal contents, combined into "low anterior resection syndrome" (LAPS).	NeMo_run1				501105
2	doc76	На сегодняшний день нет клинических рекомендаций по лечению и реабилитации больных с СНПР.		To date, there are no clinical recommendations for the treatment and rehabilitation of patients with SNCD.	NeMo_run1	To date, there are no clinical recommendations for the treatment and rehabilitation of patients with <tag>SNCD</tag>.	Linguistic Conventions - Spelling	Neutral	501105
3	doc76	Разработать программу реабилитации больных с СНПР.		To develop a rehabilitation program for patients with SNSD.	NeMo_run1	To develop a rehabilitation program for patients with <tag>SNSD</tag>.	Linguistic Conventions - Spelling	Neutral	501105
4	doc76	На первом этапе работы были обследованы и пролечены 29 больных с СНПР: 17 (58,6%) мужчин (средний возраст 61,5±9,5 года), 12 (41,4%) женщин (средний возраст 61,2±7,8 года).		At the first stage of the work, 29 patients with SNDS were examined and treated: 17 (58.6%) men (mean age 61.5 9.5 years), 12 (41.4%) women (mean age 61.2 7.8 years).	NeMo_run1	At the first stage of the work, 29 patients with <tag>SNDS</tag> were examined and treated: 17 (58.6%) men (mean age 61.5 9.5 years), 12 (41.4%) women (mean age 61.2 7.8 years).	Linguistic Conventions - Spelling	Neutral	501105
4	doc76	На первом этапе работы были обследованы и пролечены 29 больных с СНПР: 17 (58,6%) мужчин (средний возраст 61,5±9,5 года), 12 (41,4%) женщин (средний возраст 61,2±7,8 года).		At the first stage of the work, 29 patients with SNDS were examined and treated: 17 (58.6%) men (mean age 61.5 9.5 years), 12 (41.4%) women (mean age 61.2 7.8 years).	NeMo_run1	At the first stage of the work, 29 patients with SNDS were examined and treated: 17 (58.6%) men (mean age <tag>61.5 9.5</tag> years), 12 (41.4%) women (mean age 61.2 7.8 years).	Linguistic Conventions - Character encoding	Neutral	501105
4	doc76	На первом этапе работы были обследованы и пролечены 29 больных с СНПР: 17 (58,6%) мужчин (средний возраст 61,5±9,5 года), 12 (41,4%) женщин (средний возраст 61,2±7,8 года).		At the first stage of the work, 29 patients with SNDS were examined and treated: 17 (58.6%) men (mean age 61.5 9.5 years), 12 (41.4%) women (mean age 61.2 7.8 years).	NeMo_run1	At the first stage of the work, 29 patients with SNDS were examined and treated: 17 (58.6%) men (mean age 61.5 9.5 years), 12 (41.4%) women (mean age <tag>61.2 7.8</tag> years).	Linguistic Conventions - Character encoding	Neutral	501105
5	doc76	На 2-м этапе были обследованы и получали консервативное лечение 17 больных (средний возраст 61,4±12,7 года): 9 (52,9%) мужчин, 8 (47,1%) женщин.		At the 2nd stage, 17 patients (mean age 61.4 12.7 years) were examined and received conservative treatment: 9 (52.9%) men, 8 (47.1%) women.	NeMo_run1	At the 2nd stage, 17 patients (mean age <tag>61.4 12.7</tag> years) were examined and received conservative treatment: 9 (52.9%) men, 8 (47.1%) women.	Linguistic Conventions - Character encoding	Neutral	501105
6	doc76	Функциональное состояние низведенной кишки и запирательного аппарата оценивали с помощью методов аноректальной манометрии: сфинктерометрии и исследования резервуарной функции низведенной кишки до и после лечения (у 17 больных на втором этапе).		The functional state of the low intestine and the locking apparatus was assessed using anorectal manometry methods: sphincterometry and examination of the low intestine reservoir function before and after treatment (in 17 patients at the second stage).	NeMo_run1				501105
7	doc76	Пациентам был назначен курс 10-дневной консервативной реабилитации методом БОС-терапии стандартным протоколом на первом этапе и протоколом комплексной БОС-терапии на втором этапе, а также тибиальной нейромодуляции.		The patients were prescribed a course of 10-day conservative rehabilitation by the method of BFB therapy with the standard protocol at the first stage and the protocol of complex BFB therapy at the second stage, as well as tibial neuromodulation.	NeMo_run1				501105
8	doc76	Разработанный комплекс реабилитационных мероприятий привел к улучшению результатов лечения больных раком прямой кишки за счет повышения качества жизни после низкой передней резекции, снижая проявления СНПР на 47,8%.		The developed complex of rehabilitation measures led to the improvement of the results of treatment of patients with colorectal cancer due to the improvement of the quality of life after low anterior resection, reducing the manifestations of ANSD by 47.8%.	NeMo_run1	The developed complex of rehabilitation measures led to the improvement of the results of treatment of patients with colorectal cancer due to the improvement of the quality of life after low anterior resection, reducing the manifestations of <tag>ANSD</tag> by 47.8%.	Linguistic Conventions - Spelling	Neutral	501105
9	doc76	Устойчивые положительные результаты лечения сохранялись у 36,4% больных, положительная динамика от проведенного лечения, по данным шкалы СНПР, несколько снижалась у 54,5%, ухудшение показателей через 3—6 мес после консервативной реабилитации регистрировалось в 9,1% случаев.		Sustainable positive results of treatment remained in 36.4% of patients, positive dynamics from the treatment, according to the SNPP scale, slightly decreased in 54.5%, deterioration of indicators in 3 - 6 months after conservative rehabilitation was recorded in 9.1% of cases.	NeMo_run1	Sustainable positive results of treatment remained in 36.4% of patients, positive dynamics from the treatment, according to the <tag>SNPP</tag> scale, slightly decreased in 54.5%, deterioration of indicators in 3 - 6 months after conservative rehabilitation was recorded in 9.1% of cases.	Linguistic Conventions - Spelling	Neutral	501105
9	doc76	Устойчивые положительные результаты лечения сохранялись у 36,4% больных, положительная динамика от проведенного лечения, по данным шкалы СНПР, несколько снижалась у 54,5%, ухудшение показателей через 3—6 мес после консервативной реабилитации регистрировалось в 9,1% случаев.	Устойчивые положительные результаты лечения сохранялись у 36,4% больных, положительная динамика от проведенного лечения, по данным шкалы СНПР, несколько снижалась у 54,5%, ухудшение показателей через 3—6 <tag>мес</tag> после консервативной реабилитации регистрировалось в 9,1% случаев.	Sustainable positive results of treatment remained in 36.4% of patients, positive dynamics from the treatment, according to the SNPP scale, slightly decreased in 54.5%, deterioration of indicators in 3 - 6 months after conservative rehabilitation was recorded in 9.1% of cases.	NeMo_run1			Neutral	501105
10	doc76	Полученные данные позволили рекомендовать повторный курс лечения 63,6% пациентам.		The data obtained allowed to recommend a repeat course of treatment for 63.6% of patients.	NeMo_run1				501105
11	doc76	Авторами был модифицирован и оптимизирован специальный комплекс ЛФК для реабилитации больных как в лечебном учреждении, так и в домашних условиях.		The authors modified and optimized a special complex of physical therapy for the rehabilitation of patients both in a medical institution and at home.	NeMo_run1				501105
12	doc76	Приведенные упражнения направлены на улучшение функционального состояния мускулатуры тазового дна и сфинктерного аппарата.		These exercises are aimed at improving the functional state of pelvic floor muscles and sphincter apparatus.	NeMo_run1				501105
13	doc76	В реабилитационную программу больных с СНПР следует включать: 1) БОС-терапию (биофидбэк) для улучшения функции держания;		In the rehabilitation program of patients with SNCD should include: 1) BFB therapy (biofeedback) to improve retention function;	NeMo_run1	In the rehabilitation program of patients with <tag>SNCD</tag> should include: 1) BFB therapy (biofeedback) to improve retention function;	Linguistic Conventions - Spelling	Neutral	501105
14	doc76	2) БОС-терапию, направленную на улучшение резервуарной функции и чувствительности низведенной кишки к наполнению;		2) BOS therapy aimed at improving the reservoir function and sensitivity of the low intestine to filling;	NeMo_run1	2) <tag>BOS</tag> therapy aimed at improving the reservoir function and sensitivity of the low intestine to filling;	Linguistic Conventions - Spelling	Neutral	501105
15	doc76	3) тибиальную нейромодуляцию.		3) Tibial neuromodulation.	NeMo_run1				501105
16	doc76	Проведение этой программы может способствовать улучшению сократительной способности анального сфинктера и резервуарной функции низведенной кишки, а также появлению позыва на дефекацию.		This program can improve the contractility of the anal sphincter and the reservoir function of the low intestine, as well as the urge to defecate.	NeMo_run1				501105
1	doc77	Карцинома Меркеля (КМ) — редкая агрессивная нейроэндокринная опухоль кожи с высокой частотой рецидивирования и местного метастазирования.		Merkel carcinoma (CM) is a rare aggressive neuroendocrine tumor of the skin with a high frequency of recurrence and local metastasis.	NeMo_run1	<tag>Merkel carcinoma (CM)</tag> is a rare aggressive neuroendocrine tumor of the skin with a high frequency of recurrence and local metastasis.	Linguistic Conventions - Spelling	Neutral	501105
2	doc77	Средний возраст, при котором диагностируют КМ, составляет 75 лет.		The average age at which CM is diagnosed is 75 years.	NeMo_run1	The average age at which <tag>CM</tag> is diagnosed is 75 years.	Linguistic Conventions - Spelling	Neutral	501105
3	doc77	Выявление роли соматических мутаций и репараций ДНК в механизмах старения ставит вопрос об их непосредственной связи с процессами дифференцировки, возрастных особенностей иммунитета, программированной клеточной гибели и злокачественного роста.		Identification of the role of somatic mutations and DNA repairs in the mechanisms of aging raises the question of their direct relationship with the processes of differentiation, age-related features of immunity, programmed cell death and malignant growth.	NeMo_run1				501105
4	doc77	В этой связи сохраняется необходимость в проведении исследований, направленных на усовершенствование ранней диагностики и патогенетического лечения пожилых пациентов с КМ.		In this regard, there is still a need for research aimed at improving the early diagnosis and pathogenetic treatment of elderly patients with CM.	NeMo_run1	In this regard, there is still a need for research aimed at improving the early diagnosis and pathogenetic treatment of elderly patients with <tag>CM</tag>.	Linguistic Conventions - Spelling	Neutral	501105
1	doc79	В работе изучено влияние разных режимов ритмических экстремальных холодовых воздействий на состояние вегетативной регуляции сердечного ритма у молодых и старых крыс.		The influence of different modes of rhythmic extreme cold effects on the state of autonomic regulation of heart rate in young and old rats was studied.	NeMo_run1				501105
2	doc79	По данным спектрального анализа вариабельности сердечного ритма установлено, что у молодых крыс использование температурных режимов ритмических экстремальных холодовых воздействий, РЭХВ (–120 °С; 120 °С; –120 °С) и (–60 °С; –120 °С; –120 °С) значительно повышало адаптационные возможности организма за счет активации собственных гомеостатических регуляторных систем.		According to the spectral analysis of heart rate variability, it was found that in young rats the use of temperature regimes of rhythmic extreme cold effects, RECH (-120 C; 120 C; -120 C) and (-60 C; -120 C; -120 C) significantly increased the adaptive capacity of the body due to activation of its own homeostatic regulatory systems.	NeMo_run1	According to the spectral analysis of heart rate variability, it was found that in young rats the use of temperature regimes of rhythmic extreme cold effects, <tag>RECH</tag> (-120 C; 120 C; -120 C) and (-60 C; -120 C; -120 C) significantly increased the adaptive capacity of the body due to activation of its own homeostatic regulatory systems.	Linguistic Conventions - Spelling	Neutral	501105
2	doc79	По данным спектрального анализа вариабельности сердечного ритма установлено, что у молодых крыс использование температурных режимов ритмических экстремальных холодовых воздействий, РЭХВ (–120 °С; 120 °С; –120 °С) и (–60 °С; –120 °С; –120 °С) значительно повышало адаптационные возможности организма за счет активации собственных гомеостатических регуляторных систем.		According to the spectral analysis of heart rate variability, it was found that in young rats the use of temperature regimes of rhythmic extreme cold effects, RECH (-120 C; 120 C; -120 C) and (-60 C; -120 C; -120 C) significantly increased the adaptive capacity of the body due to activation of its own homeostatic regulatory systems.	NeMo_run1	According to the spectral analysis of heart rate variability, it was found that in young rats the use of temperature regimes of rhythmic extreme cold effects, RECH (<tag>-120 C; 120 C; -120 C</tag>) and (-60 C; -120 C; -120 C) significantly increased the adaptive capacity of the body due to activation of its own homeostatic regulatory systems.	Linguistic Conventions - Character encoding	Neutral	501105
2	doc79	По данным спектрального анализа вариабельности сердечного ритма установлено, что у молодых крыс использование температурных режимов ритмических экстремальных холодовых воздействий, РЭХВ (–120 °С; 120 °С; –120 °С) и (–60 °С; –120 °С; –120 °С) значительно повышало адаптационные возможности организма за счет активации собственных гомеостатических регуляторных систем.		According to the spectral analysis of heart rate variability, it was found that in young rats the use of temperature regimes of rhythmic extreme cold effects, RECH (-120 C; 120 C; -120 C) and (-60 C; -120 C; -120 C) significantly increased the adaptive capacity of the body due to activation of its own homeostatic regulatory systems.	NeMo_run1	According to the spectral analysis of heart rate variability, it was found that in young rats the use of temperature regimes of rhythmic extreme cold effects, RECH (-120 C; 120 C; -120 C) and (<tag>-60 C; -120 C; -120 C</tag>) significantly increased the adaptive capacity of the body due to activation of its own homeostatic regulatory systems.	Linguistic Conventions - Character encoding	Neutral	501105
3	doc79	При этом комбинированный режим РЭХВ (60 °С; 120 °С; 120 °С) оказался наиболее оптимальным для старых животных, поскольку его применение не сопровождалось чрезмерной активацией симпатикоадреналовой системы на ранних этапах экспериментальных исследований в отличие от режима (–120 °С; –120 °С; –120 °С).		At the same time, the combined mode of RECP (60 C; 120 C; 120 C) was the most optimal for old animals, since its use was not accompanied by excessive activation of the sympathetic-adrenal system at the early stages of experimental studies, in contrast to the mode (-120 C; -120 C; -120 C).	NeMo_run1	At the same time, the combined mode of RECP (<tag>60 C; 120 C; 120 C</tag>) was the most optimal for old animals, since its use was not accompanied by excessive activation of the sympathetic-adrenal system at the early stages of experimental studies, in contrast to the mode (-120 C; -120 C; -120 C).	Linguistic Conventions - Character encoding	Neutral	501105
3	doc79	При этом комбинированный режим РЭХВ (60 °С; 120 °С; 120 °С) оказался наиболее оптимальным для старых животных, поскольку его применение не сопровождалось чрезмерной активацией симпатикоадреналовой системы на ранних этапах экспериментальных исследований в отличие от режима (–120 °С; –120 °С; –120 °С).		At the same time, the combined mode of RECP (60 C; 120 C; 120 C) was the most optimal for old animals, since its use was not accompanied by excessive activation of the sympathetic-adrenal system at the early stages of experimental studies, in contrast to the mode (-120 C; -120 C; -120 C).	NeMo_run1	At the same time, the combined mode of RECP (60 C; 120 C; 120 C) was the most optimal for old animals, since its use was not accompanied by excessive activation of the sympathetic-adrenal system at the early stages of experimental studies, in contrast to the mode (<tag>-120 C; -120 C; -120 C</tag>).	Linguistic Conventions - Character encoding	Neutral	501105
4	doc79	Кроме того, использование данного режима охлаждения способствовало статистически значимому увеличению показателей общей мощности спектра нейрогуморальной регуляции не столько за счет повышения активности гуморально-метаболического звена регуляции, преобладание которого характерно для пожилого возраста, сколько благодаря увеличению тонуса вегетативных центров, причем парасимпатические влияния на миокард превалировали над симпатическими.		In addition, the use of this mode of cooling contributed to a statistically significant increase in the total power of the neurohumoral regulation spectrum not so much by increasing the activity of the humoral-metabolic regulation, the predominance of which is characteristic of the elderly, but by increasing the tone of vegetative centers, with parasympathetic effects on the myocardium prevailing over sympathetic ones.	NeMo_run1	In addition, the use of this mode of cooling contributed to a statistically significant increase in the total power of the neurohumoral regulation spectrum not so much by increasing the activity of the humoral-metabolic regulation, the predominance of which is characteristic of the elderly, but by increasing the <tag>tone</tag> of vegetative centers, with parasympathetic effects on the myocardium prevailing over sympathetic ones.	Terminology - Wrong term	Neutral	5569910
