SEG_ID	Doc	Source	Tagged_Source	Target	MT	Tagged_Target	Error Category	Severity	Annotator_ID
5	doc3	На этих основаниях обсуждены три положения: 1) люди пожилого возраста стали главными жертвами не только самого SARS-CoV-2, но и мер, предпринимаемых против его распространения;		Three points were discussed on these grounds: (1) older persons were the main victims not only of SARS-CoV-2 itself, but also of measures taken against its spread;	NeMo_run1	Three points were discussed on these grounds: (1) <tag>older persons</tag> were the main victims not only of SARS-CoV-2 itself, but also of measures taken against its spread;	Accuracy - Mistranslation	Minor	501100
6	doc3	2) при этом люди пожилого возраста не являются основными агентами распространения SARS-CoV-2;		2) The elderly are not the main agents of the spread of SARS-CoV-2;	NeMo_run1				501105
7	doc3	3) люди старшего возраста могут и должны быть включены в борьбу с пандемией и в преодоление её последствий, но не путем избирательной изоляции и других форм дискриминации.		3) Older people can and should be included in the fight against the pandemic and its consequences, but not through selective isolation and other forms of discrimination.	NeMo_run1				501105
8	doc3	Люди старше 65 лет составляют значительную часть населения и имеют не меньшее, чем граждане другого возраста, право на уважение и соблюдение их нужд и интересов, включая право на качество доступной жизни даже в экстремальных ситуациях.		People over the age of 65 constitute a significant proportion of the population and have the same right as citizens of other ages to have their needs and interests respected and observed, including the right to a quality of affordable life even in extreme situations.	NeMo_run1				501105
9	doc3	Перспективы полного контроля SARS-CoV-2 неясны.		Prospects for complete SARS-CoV-2 control are unclear.	NeMo_run1				501105
10	doc3	Поэтому всем, кто принимает решения относительно лиц старше 65 лет, надо иметь в виду, что в настоящее время, в отличие от средневековья, 65+ — это личное будущее практически для каждого.		Therefore, all those who make decisions about people over 65 years of age should bear in mind that at present, unlike the Middle Ages, 65 is a personal future for almost everyone.	NeMo_run1				501105
1	doc33	В работе представлены результаты одномоментного исследования минеральной плотности костной ткани (МПКТ) у 202 пациентов старше 90 лет, страдающих ИБС.		The paper presents the results of a single-stage study of bone mineral density (BMD) in 202 patients over 90 years of age suffering from CHD.	NeMo_run1				501105
2	doc33	Нормальные показатели МПКТ в поясничном отделе позвоночника отмечены у 40,9%, остеопороз — у 26,9%, остеопения — у 32,2% больных.		Normal BMD values in the lumbar spine were noted in 40.9%, osteoporosis - in 26.9%, osteopenia - in 32.2% of patients.	NeMo_run1				501105
3	doc33	Нормальные показатели МПКТ в проксимальном отделе бедра отмечены у 21,3%, остеопороз — у 39,9%, остеопения — у 38,8% больных.		Normal BMD values in the proximal part of the hip were observed in 21.3%, osteoporosis in 39.9%, osteopenia in 38.8% of patients.	NeMo_run1				501105
4	doc33	Выявлена отрицательная корреляция выраженности старческой астении, оцененной с помощью опросника «Возраст не помеха», и показателей МПКТ (r=0,26; р=0,01).		There was a negative correlation between the severity of senile asthenia, assessed using the questionnaire "Age is not a hindrance," and BMD indicators (r 0.26; p 0.01).	NeMo_run1	There was a negative correlation between the severity of senile asthenia, assessed using the questionnaire "Age is not a hindrance," and BMD indicators <tag>(r 0.26; p 0.01)</tag>.	Other	Neutral	501100
5	doc33	Обнаружена позитивная корреляция показателей МПКТ и функциональных способностей больных, оцененных с помощью индекса Бартел (r=0,44; p=0,000002) и шкалы IADL (r=0,36; p=0,00008).		There was a positive correlation between BMD and functional abilities of patients assessed by the Barthel index (r 0.44; p 0.000002) and the IADL scale (r 0.36; p 0.00008).	NeMo_run1				501105
6	doc33	Переломы в анамнезе были отмечены у 27,6% больных.		Historical fractures were observed in 27.6% of patients.	NeMo_run1	<tag>Historical fractures</tag> were observed in 27.6% of patients.	Terminology - Inconsistent use of terminology	Neutral	501105
1	doc34	Восстановление и оптимизация психофункционального состояния организма спортсмена являются актуальным направлением спортивной медицины.		Restoration and optimization of psychofunctional state of the athlete's body is an urgent direction of sports medicine.	NeMo_run1				501100
2	doc34	Интерес представляют методы, позволяющие быстро нивелировать психоэмоциональный и физический стресс, воздействуя на регуляторные системы.		Methods that allow to quickly level psycho-emotional and physical stress, acting on regulatory systems, are of interest.	NeMo_run1	Methods that <tag>allow to quickly</tag> level psycho-emotional and physical stress, acting on regulatory systems, are of interest.	Accuracy - Untranslated	Major	501100
3	doc34	К таким методам относится транскраниальная электростимуляция (ТЭС), применение которой в спорте требует апробации и научного обоснования.		Such methods include transcranial electrical stimulation (TES), the use of which in sports requires testing and scientific justification.	NeMo_run1				501105
4	doc34	Изучить влияние ТЭС, применяемой в тренировочном процессе, на психофункциональное состояние высококвалифицированных спортсменов различных видов спорта.		AIM To study the influence of TES used in the training process on the psychofunctional state of highly qualified athletes of various sports.	NeMo_run1	AIM To study the influence of TES used in the training process on the psychofunctional state <tag>of highly qualified athletes of</tag> various sports.	Style - Non-fluent	Neutral	501105
5	doc34	Обследованы 86 спортсменов в возрасте от 16 до 30 лет с квалификацией от кандидата в мастера спорта до мастера спорта международного класса циклических (легкая атлетика — 7 спортсменов, триатлон — 12), ациклических (тяжелая атлетика — 18) и ситуационных (карате — 22, регби — 27) видов спорта.		The study included 86 athletes aged from 16 to 30 years with the qualification from the candidate for the master of sports to the master of sports of the international class of cyclic (athletics - 7 athletes, triathlon - 12), acyclic (weightlifting - 18) and situational (karate - 22, rugby - 27) sports.	NeMo_run1				501105
6	doc34	Для обоснования эффектов применения ТЭС проводили исследование ЭЭГ, вариабельности сердечного ритма и психофизиологическое тестирование, эргоспирометрическое нагрузочное тестирование на тредмиле.		To substantiate the effects of TES, EEG, heart rate variability and psychophysiological testing, ergospirometric exercise testing on treadmill were performed.	NeMo_run1	To substantiate the effects of <tag>TES</tag>, EEG, heart rate variability and psychophysiological testing, ergospirometric exercise testing on treadmill were performed.	Terminology - Wrong term	Major	501100
7	doc34	Показано положительное влияние применения ТЭС, что обосновывается достоверным изменением физиологических и психофизиологических показателей.		The positive effect of TPP application is shown, which is justified by significant changes in physiological and psychophysiological parameters.	NeMo_run1	The positive effect of <tag>TPP</tag> application is shown, which is justified by significant changes in physiological and psychophysiological parameters.	Linguistic Conventions - Spelling	Neutral	501105
8	doc34	После курса из 7 процедур ТЭС у триатлонистов отмечалось повышение экономизации работы сердца, адаптационных и мобилизационных резервов организма, психофизиологических показателей.		After a course of 7 TES procedures, triathlonists noted an increase in the economy of the heart, adaptation and mobilization reserves of the body, psychophysiological indicators.	NeMo_run1				501105
9	doc34	Одна процедура ТЭС у легкоатлетов (по данным нагрузочного тестирования) способствовала оптимизации работоспособности и повышению функциональных возможностей миокарда, снижению энергозатрат в процессе выполнения работы.		One procedure of TES in athletes (according to exercise testing) contributed to the optimization of performance and increase of myocardial functional capabilities, reduction of energy consumption during the work.	NeMo_run1	One procedure of <tag>TES</tag> in athletes (according to exercise testing) contributed to the optimization of performance and increase of myocardial functional capabilities, reduction of energy consumption during the work.	Terminology - Wrong term	Major	501100
10	doc34	В период срочного восстановления ТЭС способствовала ускорению восстановления ЧСС, скорости потребления кислорода и выделения углекислого газа, гемодинамики.		During the period of urgent recovery, TPP contributed to the acceleration of heart rate recovery, oxygen consumption rate and carbon dioxide release, hemodynamics.	NeMo_run1	During the period of urgent recovery, <tag>TPP</tag> contributed to the acceleration of heart rate recovery, oxygen consumption rate and carbon dioxide release, hemodynamics.	Linguistic Conventions - Spelling	Neutral	501105
11	doc34	У спортсменов ациклических видов спорта применение одной процедуры было эффективно для оптимизации психофункционального состояния, снижения напряжения регуляторных процессов.		In athletes of acyclic sports, the use of one procedure was effective for optimizing the psychofunctional state, reducing the tension of regulatory processes.	NeMo_run1	<tag>In athletes of acyclic sports, the use of one procedure</tag> was effective for optimizing the psychofunctional state, reducing the tension of regulatory processes.	Linguistic Conventions - Grammar	Neutral	501100
12	doc34	После максимальных силовых упражнений ускорялись восстановительные процессы и повышалась работоспособность ЦНС.		After maximum strength exercises, the recovery processes accelerated and the performance of the CNS increased.	NeMo_run1				501105
13	doc34	У спортсменов ситуационных видов спорта (регби, карате) применение ТЭС способствовало снижению времени сенсомоторных реакций и повышению психической устойчивости, оптимизации функционального состояния мозга, экономизации работы сердца.		In athletes of situational sports (rugby, karate), the use of TES helped to reduce the time of sensorimotor reactions and increase mental stability, optimize the functional state of the brain, economize the work of the heart.	NeMo_run1				501105
14	doc34	Учитывая положительный эффект ТЭС, выразившийся в улучшении психофункционального состояния и работоспособности, ускорении процессов восстановления спортсменов после физической нагрузки, данный метод можно широко рекомендовать к использованию в качестве восстанавливающего и стимулирующего воздействия в медико-биологическом сопровождении в спорте высших достижений.		Given the positive effect of TES, expressed in the improvement of psychofunctional state and performance, acceleration of recovery processes of athletes after physical activity, this method can be widely recommended for use as a restorative and stimulating effect in medical and biological support in sports of higher achievements.	NeMo_run1	Given the positive effect of <tag>TES</tag>, expressed in the improvement of psychofunctional state and performance, acceleration of recovery processes of athletes after physical activity, this method can be widely recommended for use as a restorative and stimulating effect in medical and biological support in sports of higher achievements.	Terminology - Wrong term	Major	501100
1	doc35	Инсульт — одно из наиболее частых неврологических заболеваний с высокими распространенностью, инвалидизацией и смертностью, которое представляет собой актуальную медико-социальную проблему.		Stroke is one of the most common neurological diseases with high prevalence, disability and mortality, which is an urgent medical and social problem.	NeMo_run1	Stroke is one of the most common neurological diseases with high prevalence, disability and mortality, <tag>which</tag> is an urgent medical and social problem.	Accuracy - Mistranslation	Minor	501100
2	doc35	Клинически инсульт в зависимости от характера и локализации вызывает широкий спектр неврологических нарушений, включая двигательные, а также разнообразные когнитивные и нейропсихиатрические расстройства.		Clinically, stroke, depending on the nature and location, causes a wide range of neurological disorders, including motor, as well as a variety of cognitive and neuropsychiatric disorders.	NeMo_run1				501100
3	doc35	Ведение пациентов с цереброваскулярной патологией в условиях пандемии COVID-19 требует от врача соответствующих знаний и навыков.		The management of patients with cerebrovascular pathology in the context of the COVID-19 pandemic requires appropriate knowledge and skills from the doctor.	NeMo_run1				501105
4	doc35	Реабилитационные мероприятия по коррекции двигательных и когнитивных нарушений весьма разнообразны.		Rehabilitation measures for the correction of motor and cognitive disorders are very diverse.	NeMo_run1				501100
5	doc35	В качестве перспективного направления медикаментозной терапии рассматривается применение средств, стимулирующих продукцию нейротрофических факторов.		The use of drugs stimulating the production of neurotrophic factors is considered as a promising direction of drug therapy.	NeMo_run1				501105
6	doc35	Церебролизин способствует достоверному регрессу двигательных и когнитивных нарушений в остром и восстановительном периодах ишемического инсульта.		Cerebrolysin contributes to a significant regression of motor and cognitive impairment in the acute and recovery periods of ischemic stroke.	NeMo_run1				501100
7	doc35	На основании данных клинических исследований Церебролизин включен в рекомендации по реабилитации больных с инсультом в Канаде и Германии.		Based on clinical studies, Cerebrolysin is included in the recommendations for the rehabilitation of patients with stroke in Canada and Germany.	NeMo_run1	Based on clinical studies, Cerebrolysin is included in the recommendations for the rehabilitation of patients <tag>with stroke</tag> in Canada and Germany.	Linguistic Conventions - Grammar	Neutral	501105
1	doc36	Провести наукометрический анализ доказательных исследований физических методов лечения пациентов с последствиями спинномозговой травмы (ПСМТ).		To conduct a scientometric analysis of evidence-based studies of physical methods of treating patients with the consequences of spinal cord injury (PSMT).	NeMo_run1	To conduct a scientometric analysis of evidence-based studies of physical methods of treating patients with the consequences of spinal cord injury (<tag>PSMT</tag>).	Accuracy - Mistranslation	Major	501100
2	doc36	В статье представлены данные наукометрического анализа доказательных исследований, опубликованных в период с января 2014 по декабрь 2019 г. по применению лечебных физических факторов в реабилитации больных с ПСМТ.		The article presents the data of scientometric analysis of evidence-based studies published in the period from anuary 2014 to December 2019 on the use of therapeutic physical factors in the rehabilitation of patients with PSMT.	NeMo_run1	The article presents the data of scientometric analysis of evidence-based studies published in the period from anuary 2014 to December 2019 on the use of therapeutic physical factors in the rehabilitation of patients with <tag>PSMT</tag>.	Linguistic Conventions - Spelling	Neutral	501105
2	doc36	В статье представлены данные наукометрического анализа доказательных исследований, опубликованных в период с января 2014 по декабрь 2019 г. по применению лечебных физических факторов в реабилитации больных с ПСМТ.		The article presents the data of scientometric analysis of evidence-based studies published in the period from anuary 2014 to December 2019 on the use of therapeutic physical factors in the rehabilitation of patients with PSMT.	NeMo_run1	The article presents the data of scientometric analysis of evidence-based studies published in the period from <tag>anuary</tag> 2014 to December 2019 on the use of therapeutic physical factors in the rehabilitation of patients with PSMT.	Linguistic Conventions - Spelling	Neutral	501105
3	doc36	Выявлены группы эффективных технологий, включающие физические нагрузки, импульсную электротерапию и роботизированную механотерапию.		Groups of effective technologies including physical activity, pulse electrotherapy and robotic mechanotherapy were identified.	NeMo_run1				501105
4	doc36	Показаны значимые эффекты применяемых технологий у пациентов со спинальной травмой.		Significant effects of applied technologies in patients with spinal injury are shown.	NeMo_run1	Significant effects of applied technologies in patients with spinal injury <tag>are shown.</tag>	Linguistic Conventions - Grammar	Minor	501100
5	doc36	Определены перспективные группы физических методов лечения, требующие дополнительных доказательных исследований.		Perspective groups of physical methods of treatment requiring additional evidence-based research were identified.	NeMo_run1	Perspective <tag>groups of physical methods of treatment</tag> requiring additional evidence-based research were identified.	Style - Non-fluent	Neutral	5569910
6	doc36	Предложены рекомендации по применению лечебных физических факторов в лечении пациентов с ПСМТ.		Recommendations on the use of therapeutic physical factors in the treatment of patients with PSMT are proposed.	NeMo_run1	Recommendations on the use of therapeutic physical factors in the treatment of patients with <tag>PSMT</tag> are proposed.	Terminology - Wrong term	Neutral	501105
7	doc36	Выявлена тенденция к увеличению количества рандомизированных контролируемых исследований по оценке эффективности и расширению спектра технологий физической и реабилитационной медицины, используемых в реабилитации пациентов с ПСМТ.		There was a tendency to increase the number of randomized controlled trials to assess the effectiveness and expand the range of physical and rehabilitative medicine technologies used in the rehabilitation of patients with PSMT.	NeMo_run1	There was a tendency to increase the number of randomized controlled trials to assess the effectiveness and expand the range of physical and rehabilitative medicine technologies used in the rehabilitation of patients with <tag>PSMT</tag>.	Accuracy - Mistranslation	Major	501100
8	doc36	Для улучшения качества реабилитационных мероприятий у пациентов с ПСМТ необходим мониторинг технологий, обладающих доказанной эффективностью.		To improve the quality of rehabilitation measures in patients with PSMT, monitoring of technologies with proven effectiveness is necessary.	NeMo_run1	To improve the quality of rehabilitation measures in patients with <tag>PSMT,</tag> monitoring of technologies with proven effectiveness is necessary.	Accuracy - Mistranslation	Major	501100
8	doc36	Для улучшения качества реабилитационных мероприятий у пациентов с ПСМТ необходим мониторинг технологий, обладающих доказанной эффективностью.		To improve the quality of rehabilitation measures in patients with PSMT, monitoring of technologies with proven effectiveness is necessary.	NeMo_run1	To improve the quality of rehabilitation measures in patients with PSMT, monitoring of technologies with proven effectiveness <tag>is necessary</tag>.	Linguistic Conventions - Grammar	Minor	501100
