SEG_ID	Doc	Source	Tagged_Source	Target	MT	Tagged_Target	Error Category	Severity	Annotator_ID
3	doc52	В большинстве случаев НР были связаны с применением местного анестетика группы амидов лидокаина — 69 случаев (56,55% от общего числа случаев НР на МА), комбинированными препаратами, содержащими МА артикаин — 34 (27,87%) случая, единичные случаи НР — при использовании новокаина (9; 7,38%), бупивакаина (8; 6,56%) и мепивакаина (2; 1,64%).		In most cases, HP was associated with the use of local anesthetic group of lidocaine amides - 69 cases (56.55% of the total number of cases of HP on MA), combined drugs containing articaine MA - 34 (27.87%) cases, single cases of HP - with the use of novocaine (9; 7.38%), bupivacaine (8; 6.56%) and mepivacaine (2; 1.64%).	NeMo_run1	In most cases, HP was associated with the use of local anesthetic group of lidocaine amides - 69 cases (56.55% of the total number of cases of HP on MA), combined drugs containing articaine <tag>MA</tag> - 34 (27.87%) cases, single cases of HP - with the use of novocaine (9; 7.38%), bupivacaine (8; 6.56%) and mepivacaine (2; 1.64%).	Linguistic Conventions - Spelling	Neutral	501105
3	doc52	В большинстве случаев НР были связаны с применением местного анестетика группы амидов лидокаина — 69 случаев (56,55% от общего числа случаев НР на МА), комбинированными препаратами, содержащими МА артикаин — 34 (27,87%) случая, единичные случаи НР — при использовании новокаина (9; 7,38%), бупивакаина (8; 6,56%) и мепивакаина (2; 1,64%).		In most cases, HP was associated with the use of local anesthetic group of lidocaine amides - 69 cases (56.55% of the total number of cases of HP on MA), combined drugs containing articaine MA - 34 (27.87%) cases, single cases of HP - with the use of novocaine (9; 7.38%), bupivacaine (8; 6.56%) and mepivacaine (2; 1.64%).	NeMo_run1	In most cases, <tag>HP</tag> was associated with the use of local anesthetic group of lidocaine amides - 69 cases (56.55% of the total number of cases of HP on MA), combined drugs containing articaine MA - 34 (27.87%) cases, single cases of HP - with the use of novocaine (9; 7.38%), bupivacaine (8; 6.56%) and mepivacaine (2; 1.64%).	Linguistic Conventions - Spelling	Neutral	501105
3	doc52	В большинстве случаев НР были связаны с применением местного анестетика группы амидов лидокаина — 69 случаев (56,55% от общего числа случаев НР на МА), комбинированными препаратами, содержащими МА артикаин — 34 (27,87%) случая, единичные случаи НР — при использовании новокаина (9; 7,38%), бупивакаина (8; 6,56%) и мепивакаина (2; 1,64%).		In most cases, HP was associated with the use of local anesthetic group of lidocaine amides - 69 cases (56.55% of the total number of cases of HP on MA), combined drugs containing articaine MA - 34 (27.87%) cases, single cases of HP - with the use of novocaine (9; 7.38%), bupivacaine (8; 6.56%) and mepivacaine (2; 1.64%).	NeMo_run1	In most cases, HP was associated with the use of local anesthetic group of lidocaine amides - 69 cases (56.55% of the total number of cases of <tag>HP</tag> on MA), combined drugs containing articaine MA - 34 (27.87%) cases, single cases of HP - with the use of novocaine (9; 7.38%), bupivacaine (8; 6.56%) and mepivacaine (2; 1.64%).	Linguistic Conventions - Spelling	Neutral	501105
3	doc52	В большинстве случаев НР были связаны с применением местного анестетика группы амидов лидокаина — 69 случаев (56,55% от общего числа случаев НР на МА), комбинированными препаратами, содержащими МА артикаин — 34 (27,87%) случая, единичные случаи НР — при использовании новокаина (9; 7,38%), бупивакаина (8; 6,56%) и мепивакаина (2; 1,64%).		In most cases, HP was associated with the use of local anesthetic group of lidocaine amides - 69 cases (56.55% of the total number of cases of HP on MA), combined drugs containing articaine MA - 34 (27.87%) cases, single cases of HP - with the use of novocaine (9; 7.38%), bupivacaine (8; 6.56%) and mepivacaine (2; 1.64%).	NeMo_run1	In most cases, HP was associated with the use of local anesthetic group of lidocaine amides - 69 cases (56.55% of the total number of cases of HP on MA), combined drugs containing articaine MA - 34 (27.87%) cases, single cases of <tag>HP</tag> - with the use of novocaine (9; 7.38%), bupivacaine (8; 6.56%) and mepivacaine (2; 1.64%).	Linguistic Conventions - Spelling	Neutral	501105
4	doc52	Основными клиническими проявлениями НР были реакции гиперчувствительности немедленного типа (38 случаев), нарушения функции сердечно-сосудистой системы (29 случаев) и ЦНС (19 случаев).		The main clinical manifestations of HP were immediate hypersensitivity reactions (38 cases), cardiovascular dysfunction (29 cases) and CNS (19 cases).	NeMo_run1	The main clinical manifestations of <tag>HP</tag> were immediate hypersensitivity reactions (38 cases), cardiovascular dysfunction (29 cases) and CNS (19 cases).	Linguistic Conventions - Spelling	Neutral	501105
5	doc52	Отсутствие эффективности местных анестетиков наблюдалось у 13 (10,66%) пациентов.		Lack of efficacy of local anesthetics was observed in 13 (10.66%) patients.	NeMo_run1				501105
6	doc52	Изучение категории НР позволило выявить высокую частоту развития угрожающих жизни состояний при применении МА — 31 (25,4%) случай, что свидетельствует о серьезности НР и необходимости в отмене подозреваемого препарата и назначении медикаментозной терапии.		The study of the category of HP revealed a high incidence of life-threatening conditions in the use of MA - 31 (25.4%) cases, which indicates the seriousness of HP and the need to cancel the suspected drug and prescribe drug therapy.	NeMo_run1	The study of the category of <tag>HP</tag> revealed a high incidence of life-threatening conditions in the use of MA - 31 (25.4%) cases, which indicates the seriousness of HP and the need to cancel the suspected drug and prescribe drug therapy.	Linguistic Conventions - Spelling	Neutral	501105
6	doc52	Изучение категории НР позволило выявить высокую частоту развития угрожающих жизни состояний при применении МА — 31 (25,4%) случай, что свидетельствует о серьезности НР и необходимости в отмене подозреваемого препарата и назначении медикаментозной терапии.		The study of the category of HP revealed a high incidence of life-threatening conditions in the use of MA - 31 (25.4%) cases, which indicates the seriousness of HP and the need to cancel the suspected drug and prescribe drug therapy.	NeMo_run1	The study of the category of HP revealed a high incidence of life-threatening conditions in the use of <tag>MA</tag> - 31 (25.4%) cases, which indicates the seriousness of HP and the need to cancel the suspected drug and prescribe drug therapy.	Linguistic Conventions - Spelling	Neutral	501105
6	doc52	Изучение категории НР позволило выявить высокую частоту развития угрожающих жизни состояний при применении МА — 31 (25,4%) случай, что свидетельствует о серьезности НР и необходимости в отмене подозреваемого препарата и назначении медикаментозной терапии.		The study of the category of HP revealed a high incidence of life-threatening conditions in the use of MA - 31 (25.4%) cases, which indicates the seriousness of HP and the need to cancel the suspected drug and prescribe drug therapy.	NeMo_run1	The study of the category of HP revealed a high incidence of life-threatening conditions in the use of MA - 31 (25.4%) cases, which indicates the seriousness of <tag>HP</tag> and the need to cancel the suspected drug and prescribe drug therapy.	Linguistic Conventions - Spelling	Neutral	501105
7	doc52	Потребность в госпитализации или продлении сроков лечения в стационаре была наблюдалась в 7 (5,8%) случаях, а временная нетрудоспособность пациентов — в 5 (4,1%).		The need for hospitalization or prolongation of hospital treatment was observed in 7 (5.8%) cases, and temporary disability of patients - in 5 (4.1%).	NeMo_run1				501105
8	doc52	Особое внимание обращают 2 (1,6%) случая смертельного исхода в результате развития у пациентов анафилактического шока (1 случай) и нарушений ЦНС (судороги, развитие дыхательной недостаточности).		Particular attention is paid to 2 (1.6%) cases of death as a result of the development of anaphylactic shock in patients (1 case) and CNS disorders (seizures, development of respiratory failure).	NeMo_run1				501105
9	doc52	Высокая частота и тяжесть нежелательных последствий при применении местных анестетиков требуют от специалистов здравоохранения осуществления рационального выбора и строгого контроля безопасности пациентов при применении препаратов этой группы.		The high frequency and severity of adverse consequences in the use of local anesthetics require health professionals to exercise rational choice and strict control of the safety of patients when using drugs of this group.	NeMo_run1				501105
1	doc53	Представлен редкий случай декомпенсации хронической внутренней гидроцефалии у взрослого пациента.		A rare case of decompensation of chronic internal hydrocephalus in an adult patient is presented.	NeMo_run1				501105
2	doc53	У 35-летней женщины через 3 недели после купирования послеоперационного воспалительного процесса в ротовой полости, связанного с удалением зубов, остро развилась клиническая картина внутричерепной гипертензии.		In a 35-year-old woman, 3 weeks after stopping the postoperative inflammatory process in the oral cavity associated with tooth extraction, the clinical picture of intracranial hypertension developed acutely.	NeMo_run1				501105
3	doc53	Впервые выполненная магнитно-резонансная томография показала наличие выраженной внутренней гидроцефалии.		The first magnetic resonance imaging showed the presence of severe internal hydrocephalus.	NeMo_run1				5569910
4	doc53	Произведена цистерновентрикулостомия дна III желудочка, после чего состояние пациентки значительно улучшилось и стабилизировалось.		Cisternoventriculostomy of the bottom of the III ventricle was performed, after which the patient's condition significantly improved and stabilized.	NeMo_run1				501105
5	doc53	Существенного уменьшения размеров желудочков не произошло, как выяснилось при послеоперационном контроле и последующих томографических исследованиях.		There was no significant decrease in ventricular size, as it turned out during postoperative control and subsequent tomography studies.	NeMo_run1				501105
6	doc53	Таким образом, появилось предположение о декомпенсации хронической гидроцефалии, спровоцированной стоматологическим вмешательством, осложненным воспалительным процессом в ротовой полости.		Thus, there was a suggestion of decompensation of chronic hydrocephalus provoked by dental intervention complicated by inflammatory process in the oral cavity.	NeMo_run1				501105
7	doc53	В качестве патогенетического механизма можно рассматривать ухудшение венозного оттока от головного мозга и дестабилизацию процессов перемещения и всасывания цереброспинальной жидкости.		As a pathogenetic mechanism can be considered deterioration of venous outflow from the brain and destabilization of the processes of displacement and absorption of cerebrospinal fluid.	NeMo_run1				501105
1	doc54	Анапластическая карцинома щитовидной железы — агрессивная опухоль с высокой степенью злокачественности и склонностью к раннему метастазированию.		Anaplastic thyroid carcinoma is an aggressive tumor with a high degree of malignancy and a tendency to early metastasis.	NeMo_run1				5569910
2	doc54	В данной статье приведено редкое наблюдение, включая клинические, инструментальные, морфологические и аутопсийные данные, анапластической карциномы щитовидной железы IVB стадии у женщины 66 лет.		This article presents a rare observation, including clinical, instrumental, morphological and autopsy data, of anaplastic thyroid carcinoma IVB stage in a 66-year-old woman.	NeMo_run1				501105
1	doc55	Ревматические заболевания представляют собой серьезную медико-социальную проблему.		Rheumatic diseases are a serious medical and social problem.	NeMo_run1				5569910
2	doc55	Вариабельность механизмов развития этой группы заболеваний требует различных подходов: стратегии медикаментозной и немедикаментозной терапии в современной ревматологии призваны взаимно дополнять друг друга.		Variability of mechanisms of development of this group of diseases requires different approaches: strategies of drug and non-drug therapy in modern rheumatology are designed to complement each other.	NeMo_run1				501105
3	doc55	В рекомендациях EULAR использованию немедикаментозных методов лечения заболеваний суставов уделяется недостаточное внимание.		The EULAR recommendations give insufficient attention to the use of non-pharmacological methods for the treatment of joint diseases.	NeMo_run1				501105
4	doc55	Согласно данным современных исследований, наибольшую эффективность продемонстрировали мультидисциплинарные стратегии реабилитации, включающие помимо медикаментозной терапии образовательные программы, физические тренировки различной интенсивности, а также использование аппаратных методов реабилитации.	Согласно данным современных исследований, наибольшую эффективность продемонстрировали мультидисциплинарные стратегии реабилитации, <tag>включающие помимо медикаментозной терапии</tag> образовательные программы, физические тренировки различной интенсивности, а также использование аппаратных методов реабилитации.	According to current studies, multidisciplinary rehabilitation strategies, including educational programs, physical training of different intensity, as well as the use of hardware rehabilitation methods, have demonstrated the greatest effectiveness.	NeMo_run1		Accuracy - Omission	Minor	5569910
5	doc55	Аппаратная физиотерапия представляется оптимальной для лечения пациентов с ревматическими заболеваниями в связи с большей доступностью и меньшей стоимостью по сравнению с классической бальнео- и пелоидотерапией.		Hardware physiotherapy is optimal for treating patients with rheumatic diseases due to the greater availability and lower cost compared to classical balneotherapy and peloid therapy.	NeMo_run1				501105
6	doc55	При использовании магнитотерапии существуют также бо́льшая безопасность и меньшее количество противопоказаний к проведению процедур.		When using magnetic therapy, there is also greater safety and fewer contraindications to the procedures.	NeMo_run1				501105
7	doc55	Наиболее обоснованным при лечении заболеваний суставов является метод использования импульсных магнитных полей, поскольку чувствительность к ним биологических тканей наиболее высока.		The most reasonable method for the treatment of joint diseases is the use of pulsed magnetic fields, since the sensitivity of biological tissues to them is the highest.	NeMo_run1				501105
8	doc55	Клиническая эффективность применения импульсной магнитотерапии продемонстрирована в нескольких рандомизированных плацебо-контролируемых мультицентровых исследованиях.		Clinical efficacy of pulsed magnetic therapy has been demonstrated in several randomized placebo-controlled multicenter studies.	NeMo_run1				501105
9	doc55	На фоне проводимой терапии магнитным полем у пациентов отмечались статистически значимое уменьшение боли и скованности, улучшение функции суставов, что свидетельствует о целесообразности включения физического фактора в стратегию лечения ревматических заболеваний в комплексе с медикаментозной терапией.		On the background of magnetic field therapy, patients showed a statistically significant decrease in pain and stiffness, improvement of joint function, which indicates the expediency of including a physical factor in the strategy of treating rheumatic diseases in combination with drug therapy.	NeMo_run1				501105
1	doc57	Повысить эффективность лечения больных с функциональной дисфонией по гипотонусному типу при помощи физиотерапии, направленной на коррекцию вегетативных расстройств.		To increase the effectiveness of treatment of patients with functional dysphonia of the hypotonic type using physiotherapy aimed at correcting autonomic disorders.	NeMo_run1				501105
2	doc57	Обследование 42 пациентов в возрасте от 25 до 64 лет с нарушениями голосовой функции включало анамнестический анализ, объективное исследование ЛОР-органов по общепринятым методикам, видеостробоскопию гортани, акустический анализ голоса, цитологическое исследование мазков-перепечатков со слизистой оболочки гортани и определение функционального состояния вегетативной нервной системы.		The examination of 42 patients aged from 25 to 64 years with impaired vocal function included an anamnestic analysis, objective examination of ENT organs according to conventional methods, videostroboscopy of the larynx, acoustic analysis of the voice, cytological examination of smear reprints from the mucous membrane of the larynx and determination of the functional state of the autonomic nervous system.	NeMo_run1				5569910
3	doc57	Из 42 пациентов с расстройствами голоса у 10 клинико-физиологическое исследование состояния вегетативной нервной системы свидетельствовало о наличии вегетативной дисфункции (неадекватное вегетативное обеспечение деятельности).		Of the 42 patients with voice disorders, 10 clinical and physiological studies of the state of the autonomic nervous system indicated the presence of autonomic dysfunction (inadequate vegetative support of activity).	NeMo_run1				501105
4	doc57	У этих больных традиционное консервативное лечение оказалось малоэффективным.		In these patients, traditional conservative treatment was ineffective.	NeMo_run1	<tag>In these patients,</tag> traditional conservative treatment was ineffective.	Style - Non-fluent	Minor	5569910
5	doc57	Для коррекции вегетативных расстройств таким пациентам было применено акупунктурное воздействие, которое значительно улучшило результаты традиционного лечения.		To correct vegetative disorders, acupuncture was used in such patients, which significantly improved the results of traditional treatment.	NeMo_run1	To correct vegetative disorders, acupuncture was used in such patients, <tag>which</tag> significantly improved the results of traditional treatment.	Style - Non-fluent	Neutral	5569910
6	doc57	Полученные результаты свидетельствуют о повышении эффективности лечения при помощи физиотерапевтической коррекции состояния вегетативной нервной системы (рефлексотерапия с применением магнитно-инфракрасно-лазерного излучения и иглоукалывания).		The obtained results indicate an increase in the effectiveness of treatment with the help of physiotherapy correction of the autonomic nervous system (reflexotherapy using magnetic-infrared laser radiation and acupuncture).	NeMo_run1	The obtained results indicate an increase in the effectiveness of treatment <tag>with the help of</tag> physiotherapy correction of the autonomic nervous system (reflexotherapy using magnetic-infrared laser radiation and acupuncture).	Style - Non-fluent	Minor	5569910
