SEG_ID	Doc	Source	Tagged_Source	Target	MT	Tagged_Target	Error Category	Severity	Annotator_ID
1	doc10	Изучить возможности измерения внутриклеточного водородного показателя (pH) с помощью фосфорной магнитно-резонансной спектроскопии в глиобластомах, а также сравнить полученные данные со значениями внутриклеточного pH у здоровых добровольцев.		AIM To study the possibilities of measuring the intracellular hydrogen index (pH) using phosphoric magnetic resonance spectroscopy in glioblastomas and to compare the obtained data with the values of intracellular pH in healthy volunteers.	NeMo_run1	<tag>AIM</tag> To study the possibilities of measuring the intracellular hydrogen index (pH) using phosphoric magnetic resonance spectroscopy in glioblastomas and to compare the obtained data with the values of intracellular pH in healthy volunteers.	Linguistic Conventions - Register	Major	5000376
1	doc10	Изучить возможности измерения внутриклеточного водородного показателя (pH) с помощью фосфорной магнитно-резонансной спектроскопии в глиобластомах, а также сравнить полученные данные со значениями внутриклеточного pH у здоровых добровольцев.		AIM To study the possibilities of measuring the intracellular hydrogen index (pH) using phosphoric magnetic resonance spectroscopy in glioblastomas and to compare the obtained data with the values of intracellular pH in healthy volunteers.	NeMo_run1	AIM <tag>To</tag> study the possibilities of measuring the intracellular hydrogen index (pH) using phosphoric magnetic resonance spectroscopy in glioblastomas and to compare the obtained data with the values of intracellular pH in healthy volunteers.	Linguistic Conventions - Register	Minor	5000376
2	doc10	В исследование включены 10 пациентов в возрасте от 41 года до 67 лет с глиобластомами супратенториальной локализации.		The study included 10 patients aged from 41 to 67 years with supratentorial glioblastoma.	NeMo_run1				5000376
3	doc10	Полученные значения внутриклеточного pH ткани глиобластом сравнивали с pH тканей мозга здоровых добровольцев.		Obtained values of intracellular pH of glioblast tissue were compared with pH of brain tissues of healthy volunteers.	NeMo_run1				5000376
4	doc10	Выявлена тенденция к увеличению уровня внутриклеточного pH в опухолях по сравнению с уровнем pH здоровых тканей мозга.		There was a tendency to increase the level of intracellular pH in tumors compared to the pH level of healthy brain tissues.	NeMo_run1				5000376
5	doc10	Данные об изменениях внутриклеточного водородного показателя мозгового вещества в дальнейшем могут быть использованы в качестве потенциального маркера ранних патологических изменений, не визуализируемых при стандартном магнитно-резонансном томографическом исследовании, а также в оценке эффективности противоопухолевой терапии.		Data on changes in the intracellular hydrogen index of the brain matter can be further used as a potential marker of early pathological changes not visualized by standard magnetic resonance imaging, as well as in assessing the effectiveness of antitumor therapy.	NeMo_run1				5000376
1	doc11	Цель – анализ мировой литературы, посвященной проблеме лечения сочетания стеноза внутренней сонной артерии на экстракраниальном уровне и артериальной аневризмы головного мозга, а также демонстрация собственных результатов хирургического лечения пациентов с данной сочетанной патологией каротидного бассейна.		AIM To analyze the world literature devoted to the problem of treatment of the combination of stenosis of the internal carotid artery at the extracranial level and arterial cerebral aneurysm, as well as to demonstrate the results of surgical treatment of patients with this combined pathology of the carotid basin.	NeMo_run1	<tag>AIM</tag> To analyze the world literature devoted to the problem of treatment of the combination of stenosis of the internal carotid artery at the extracranial level and arterial cerebral aneurysm, as well as to demonstrate the results of surgical treatment of patients with this combined pathology of the carotid basin.	Linguistic Conventions - Register	Major	5000376
1	doc11	Цель – анализ мировой литературы, посвященной проблеме лечения сочетания стеноза внутренней сонной артерии на экстракраниальном уровне и артериальной аневризмы головного мозга, а также демонстрация собственных результатов хирургического лечения пациентов с данной сочетанной патологией каротидного бассейна.		AIM To analyze the world literature devoted to the problem of treatment of the combination of stenosis of the internal carotid artery at the extracranial level and arterial cerebral aneurysm, as well as to demonstrate the results of surgical treatment of patients with this combined pathology of the carotid basin.	NeMo_run1	AIM <tag>To</tag> analyze the world literature devoted to the problem of treatment of the combination of stenosis of the internal carotid artery at the extracranial level and arterial cerebral aneurysm, as well as to demonstrate the results of surgical treatment of patients with this combined pathology of the carotid basin.	Linguistic Conventions - Register	Minor	5000376
2	doc11	Материалы и методы.		SUBECTS AND METHODS	NeMo_run1	<tag>SUBECTS AND METHODS</tag>	Linguistic Conventions - Register	Minor	5000376
2	doc11	Материалы и методы.	Материалы и методы<tag>.</tag>	SUBECTS AND METHODS	NeMo_run1		Accuracy - Omission	Minor	5000376
3	doc11	С 2013 по 2019 гг. в клинике сочетанная патология бассейна внутренней сонной артерии (интракраниальная аневризма и стеноз внутренней сонной артерии на экстракраниальном уровне) выявлена у 35 из 1638 обследованных пациентов.		From 2013 to 2019, the combined pathology of the internal carotid artery basin (intracranial aneurysm and stenosis of the internal carotid artery at the extracranial level) was detected in 35 of the 1638 examined patients.	NeMo_run1				5000376
4	doc11	Мужчин было 10, женщин – 25.		There were 10 men and 25 women.	NeMo_run1				5000376
5	doc11	Средний возраст составил 66±7 лет.	Средний возраст составил <tag>66±7</tag> лет.	The average age was 66 7 years.	NeMo_run1		Accuracy - Omission	Minor	5000376
6	doc11	У всех 35 больных интракраниальная аневризма являлась асимптомной и была обнаружена при диагностике атеросклеротического поражения внутренней сонной артерии.		In all 35 patients, intracranial aneurysm was asymptomatic and was detected in the diagnosis of atherosclerotic lesions of the internal carotid artery.	NeMo_run1				501100
7	doc11	Оперированы 15 (43%) из 35 пациентов.		Fifteen (43%) of 35 patients were operated.	NeMo_run1	<tag>Fifteen (43%) of 35 patients were operated.</tag>	Locale Conventions - Number format	Neutral	501100
8	doc11	Двухэтапный хирургический подход применен в 2 случаях у пациентов с ипсилатеральным расположением аневризмы головного мозга и стеноза внутренней сонной артерии: 1 этапом клипирована артериальная аневризма, 2 этапом проведена каротидная эндартерэктомия.		A two-stage surgical approach was used in 2 cases in patients with ipsilateral location of cerebral aneurysm and stenosis of the internal carotid artery: 1 stage was clipped arterial aneurysm, 2 stage was carotid endarterectomy.	NeMo_run1	A two-stage surgical approach was used in 2 cases in patients with ipsilateral location of cerebral aneurysm and stenosis of the internal carotid artery: 1 stage <tag>was clipped</tag> arterial aneurysm, 2 stage was carotid endarterectomy.	Linguistic Conventions - Grammar	Minor	501100
8	doc11	Двухэтапный хирургический подход применен в 2 случаях у пациентов с ипсилатеральным расположением аневризмы головного мозга и стеноза внутренней сонной артерии: 1 этапом клипирована артериальная аневризма, 2 этапом проведена каротидная эндартерэктомия.		A two-stage surgical approach was used in 2 cases in patients with ipsilateral location of cerebral aneurysm and stenosis of the internal carotid artery: 1 stage was clipped arterial aneurysm, 2 stage was carotid endarterectomy.	NeMo_run1	A two-stage surgical approach was used in 2 cases in patients with ipsilateral location of cerebral aneurysm and stenosis of the internal carotid artery: 1 stage was clipped arterial aneurysm, 2 stage <tag>was carotid</tag> endarterectomy.	Linguistic Conventions - Grammar	Minor	501100
9	doc11	Выполнение только сосудистого этапа (каротидная эндартерэктомия или стентирование внутренней сонной артерии) осуществлено у 9 пациентов, только нейрохирургического этапа (клипирование аневризмы) – у 4 больных.		Only the vascular stage (carotid endarterectomy or stenting of the internal carotid artery) was performed in 9 patients, only the neurosurgical stage (aneurysm clipping) - in 4 patients.	NeMo_run1	Only the vascular stage (carotid endarterectomy or stenting of the internal carotid artery) was performed in 9 patients, only the neurosurgical stage (aneurysm clipping) <tag>-</tag> in 4 patients.	Linguistic Conventions - Punctuation	Minor	501100
10	doc11	Результаты.		RESULTS	NeMo_run1	<tag>RESULTS</tag>	Linguistic Conventions - Register	Neutral	501100
11	doc11	Частота встречаемости стеноза внутренней сонной артерии с артериальной аневризмой головного мозга, по нашим данным, составила 2,1%.		The incidence of stenosis of the internal carotid artery with arterial cerebral aneurysm, according to our data, amounted to 2.1%.	NeMo_run1	The incidence of <tag>stenosis of the internal carotid artery</tag> with arterial cerebral aneurysm, according to our data, amounted to 2.1%.	Other	Neutral	501100
12	doc11	В группе хирургического лечения в 1 случае (6,7%) после стентирования симптомного стеноза внутренней сонной артерии у пациентки с ипсилатеральной асимптомной аневризмой средней мозговой артерии интраоперационно развился 'малый' ишемический инсульт.		In the group of surgical treatment in 1 case (6.7%) after stenting of symptomatic stenosis of the internal carotid artery in a patient with ipsilateral asymptomatic aneurysm of the middle cerebral artery intraoperatively developed a 'small' ischemic stroke.	NeMo_run1	In the group of surgical treatment in 1 case (6.7%) after stenting of <tag>symptomatic stenosis of the internal carotid artery</tag> in a patient with ipsilateral asymptomatic aneurysm of the middle cerebral artery intraoperatively developed a 'small' ischemic stroke.	Other	Neutral	501100
13	doc11	Периоперационных разрывов аневризм и летальных исходов в оперируемой группе отмечено не было.		There were no perioperative aneurysm ruptures and fatal outcomes in the operated group.	NeMo_run1	There were no perioperative aneurysm ruptures and fatal outcomes in the <tag>operated group</tag>.	Terminology - Wrong term	Neutral	501100
13	doc11	Периоперационных разрывов аневризм и летальных исходов в оперируемой группе отмечено не было.		There were no perioperative aneurysm ruptures and fatal outcomes in the operated group.	NeMo_run1	There were no <tag>perioperative</tag> aneurysm ruptures and fatal outcomes in the operated group.	Other	Neutral	501100
14	doc11	Выводы.		CONCLUSION	NeMo_run1	<tag>CONCLUSION</tag>	Linguistic Conventions - Punctuation	Neutral	501105
15	doc11	Индивидуальный тактический подход к пациентам с сочетанием артериальной аневризмы головного мозга и стеноза внутренней сонной артерии на экстракраниальном уровне позволил на данном этапе работы избежать внутричерепных геморрагических осложнений и летальных исходов.		An individual tactical approach to patients with a combination of cerebral arterial aneurysm and internal carotid artery stenosis at the extracranial level made it possible at this stage to avoid intracranial hemorrhagic complications and fatal outcomes.	NeMo_run1				501100
16	doc11	Частота периоперационных ишемических церебральных событий составила 6,7%.		The frequency of perioperative ischemic cerebral events was 6.7%.	NeMo_run1				501105
17	doc11	Необходим дальнейший набор клинического материала для разработки оптимальной хирургической тактики при сочетанном поражении экстра- и интракраниального бассейна внутренней сонной артерии.		A further set of clinical material is needed to develop optimal surgical tactics for combined lesions of the extra- and intracranial basin of the internal carotid artery.	NeMo_run1				501105
1	doc14	Одним из ключевых механизмов старения является изменение гормональной регуляции, для эффективного воздействия на которую с целью продления жизни необходимо определение первопричины данных процессов.		One of the key mechanisms of aging is the change of hormonal regulation, for effective impact on which in order to prolong life it is necessary to determine the root cause of these processes.	NeMo_run1	One of the key mechanisms of aging is the change of hormonal <tag>regulation,</tag> for effective impact on which in order to prolong life it is necessary to determine the root cause of these processes.	Linguistic Conventions - Punctuation	Neutral	501105
2	doc14	В качестве молекулярных драйверов, управляющих динамикой уровня гормонов, могут служить транспозоны.		Transposons can serve as molecular drivers controlling the dynamics of hormone levels.	NeMo_run1				501100
3	doc14	Это связано с их использованием в качестве источников нуклеотидных последовательностей, воспринимающих специфические сигналы рибозимов, транскрипционных факторов, гормонов и их мессенджеров.		This is due to their use as sources of nucleotide sequences, perceiving specific signals of ribozymes, transcription factors, hormones and their messengers.	NeMo_run1				501100
4	doc14	В то же время, в эволюции транспозоны являются источниками рибозимов и белков, обладающих ДНК-связывающими доменами.		In evolution, however, transposons are sources of ribozymes and proteins with DNA-binding domains.	NeMo_run1	In evolution, however, transposons <tag>are sources</tag> of ribozymes and proteins with DNA-binding domains.	Linguistic Conventions - Grammar	Minor	501100
5	doc14	Начиная с деления зиготы, видоспецифический состав и распределение транспозонов в геноме могут использоваться как биологическая кодировка, необходимая для последовательной и специфической для типов клеток экспрессии генов.		Starting with zygote division, the species-specific composition and distribution of transposons in the genome can be used as a biological coding necessary for consistent and cell-specific gene expression.	NeMo_run1	Starting with zygote division, the species-specific composition and distribution of transposons in the <tag>genome can be</tag> used as a biological coding necessary for consistent and cell-specific gene expression.	Linguistic Conventions - Grammar	Major	501100
6	doc14	Сделано предположение, что гормональная регуляция является одним из компонентов сложной системы управления онтогенезом под влиянием мобильных элементов.		It is suggested that hormonal regulation is one of the components of a complex system of ontogenesis control under the influence of mobile elements.	NeMo_run1				501100
7	doc14	В качестве подтверждения приведены работы о роли транспозонов в управлении генами эндокринной системы, а также о влиянии гормонов на активность транспозонов.		As confirmation, the works on the role of transposons in the control of genes of the endocrine system, as well as the effect of hormones on the activity of transposons are presented.	NeMo_run1	As confirmation, the works on the role of transposons in the control of genes of the endocrine <tag>system,</tag> as well as the effect of hormones on the activity of transposons are presented.	Linguistic Conventions - Punctuation	Neutral	501105
8	doc14	Исследование этих взаимосвязей может иметь перспективы для разработки методов продления жизни, так как эпигенетические изменения под влиянием транспозонов носят обратимый характер.		The study of these relationships may have prospects for the development of methods of life extension, since epigenetic changes under the influence of transposons are reversible.	NeMo_run1	The study of these relationships may have prospects for the development of methods of life <tag>extension,</tag> since epigenetic changes under the influence of transposons are reversible.	Linguistic Conventions - Punctuation	Neutral	501105
1	doc15	Пандемия, вызванная вирусом SARS-CoV-2 (COVID-19), привлекла внимание к проблеме нейровоспаления как неотъемлемому компоненту вирусной инфекции.		The SARS-CoV-2 (COVID-19) pandemic has drawn attention to neuroinflammation as an integral component of viral infection.	NeMo_run1				501105
2	doc15	Острый нейровоспалительный ответ включает активацию резидентных тканевых макрофагов в ЦНС и последующее высвобождение разнообразных цитокинов и хемокинов, связанных с активацией окислительного стресса и отсроченным повреждением нейронов.		Acute neuro-inflammatory response includes activation of resident tissue macrophages in the CNS and subsequent release of various cytokines and chemokine associated with activation of oxidative stress and delayed neuronal damage.	NeMo_run1				501105
3	doc15	В связи с этим актуальным становится поиск лекарственных средств, обладающих опосредованным противовоспалительным действием.		In this regard, the search for drugs with mediated anti-inflammatory effects becomes relevant.	NeMo_run1				501105
4	doc15	С этой точки зрения заслуживает внимания дальнейшее изучение терапии пациентов с COVID-19 препаратом дипиридамол (Курантил), который, обладая противовирусным и противовоспалительным эффектами, способностью ингибировать активность острого воспаления и прогрессирования фиброза, является перспективным препаратом, особенно у пациентов с ранним повышением концентрации D-димера и выраженными проявлениями микроангиопатии.		From this point of view, further study of the treatment of patients with COVID-19 with dipyridamol (Curantil), which, having antiviral and anti-inflammatory effects, the ability to inhibit the activity of acute inflammation and the progression of fibrosis, is a promising drug, especially in patients with an early increase in the concentration of D-dimer and pronounced manifestations of microangiopathy, deserves attention.	NeMo_run1	From this point of view, further study of the treatment of patients with COVID-19 with dipyridamol (Curantil)<tag>, which,</tag> having antiviral and anti-inflammatory effects, the ability to inhibit the activity of acute inflammation and the progression of fibrosis, is a promising drug, especially in patients with an early increase in the concentration of D-dimer and pronounced manifestations of microangiopathy, deserves attention.	Linguistic Conventions - Punctuation	Neutral	501105
4	doc15	С этой точки зрения заслуживает внимания дальнейшее изучение терапии пациентов с COVID-19 препаратом дипиридамол (Курантил), который, обладая противовирусным и противовоспалительным эффектами, способностью ингибировать активность острого воспаления и прогрессирования фиброза, является перспективным препаратом, особенно у пациентов с ранним повышением концентрации D-димера и выраженными проявлениями микроангиопатии.		From this point of view, further study of the treatment of patients with COVID-19 with dipyridamol (Curantil), which, having antiviral and anti-inflammatory effects, the ability to inhibit the activity of acute inflammation and the progression of fibrosis, is a promising drug, especially in patients with an early increase in the concentration of D-dimer and pronounced manifestations of microangiopathy, deserves attention.	NeMo_run1	From this point of view, further study of the treatment of patients with COVID-19 with dipyridamol (Curantil), which, having antiviral and anti-inflammatory effects, the ability to inhibit the activity of acute inflammation and the progression of <tag>fibrosis,</tag> is a promising drug, especially in patients with an early increase in the concentration of D-dimer and pronounced manifestations of microangiopathy, deserves attention.	Linguistic Conventions - Punctuation	Neutral	501105
