SEG_ID	Doc	Source	Tagged_Source	Target	MT	Tagged_Target	Error Category	Severity	Annotator_ID
3	doc40	Participants were mothers and grandmothers from 136 three-generation households.		Participaron madres y abuelas de 136 hogares trigeneracionales.					5505645
4	doc40	Results from Actor-Partner Interdependence Mediation Modeling indicated that mothers' depressive symptoms were indirectly related to mother-child conflict/closeness through own parenting stress; grandmothers' depressive symptoms were indirectly related to grandmother-child conflict through own parenting stress.		Los resultados del modelo de mediación de interdependencia entre actores y parejas indicaron que los síntomas depresivos de las madres estaban relacionados indirectamente con el conflicto o la cercanía entre la madre y el hijo a través del estrés de la propia crianza; los síntomas depresivos de las abuelas estaban relacionados indirectamente con el conflicto entre la abuela y el hijo a través del estrés de la propia crianza.					5505645
5	doc40	Mothers' depressive symptoms were indirectly related to grandmothers' conflict with children through grandmothers' parenting stress, and grandmothers' depressive symptoms were indirectly related to mothers' conflict/closeness with children through mothers' parenting stress.		Los síntomas depresivos de las madres estaban indirectamente relacionados con el conflicto de las abuelas con los niños a través del estrés de crianza de las abuelas, y los síntomas depresivos de las abuelas estaban indirectamente relacionados con el conflicto o cercanía de las madres con los niños a través del estrés de crianza de las madres.					5505645
6	doc40	The relation between mothers' parenting stress and mother-child closeness was stronger than the relation between grandmothers' parenting stress and grandmother-child closeness.		La relación entre el estrés parental de las madres y la cercanía entre la madre y el hijo fue más fuerte que la relación entre el estrés parental de las abuelas y la cercanía entre la abuela y el hijo.					5505645
7	doc40	Findings highlight the implications of using a family system perspective and the dyadic approach in understanding and improving family functioning in Chinese three-generation households.		Los hallazgos destacan las implicaciones de usar una perspectiva de sistema familiar y el enfoque diádico para comprender y mejorar el funcionamiento familiar en hogares chinos de tres generaciones.					5505645
1	doc42	To investigate associations between functioning, community participation, and quality of life (QoL) and identify whether participation mediates the effects of functioning on QoL.		Investigar las asociaciones entre el funcionamiento, la participación comunitaria y la calidad de vida (CdV) e identificar si la participación media los efectos del funcionamiento sobre la CdV.					5505645
2	doc42	The caregivers of 435 children (211 females, 224 males; mean age 12y; SD 3y 11mo; age range 5-18y) with intellectual disability and autism spectrum disorder, cerebral palsy, Down syndrome, or Rett syndrome reported on their child's functioning (dependence for managing personal needs, mobility, communication, eye contact when speaking), frequency of participation, and QoL. Linear regression and mediation analyses were used to evaluate the relationships between child functioning, participation, and QoL. Children with greater dependency for managing personal needs and limited eye contact when speaking experienced poorer QoL. Less impaired functioning was associated with more frequent participation, which, in turn, was associated with a 3-point gain in QoL for each additional point in frequency of participation (coefficient=2.67, 95% confidence interval 1.56-3.78).		Los cuidadores de 435 niños (211 mujeres, 224 hombres; edad media 12 años; desviación estándar de 3 años y 11 meses; rango de edad 5-18 años) con discapacidad intelectual y trastorno del espectro autista, parálisis cerebral, síndrome de Down o síndrome de Rett facilitaron información sobre el funcionamiento de sus hijos (dependencia para gestionar necesidades personales, movilidad, comunicación, contacto visual al hablar), la frecuencia de participación y la CdV. Se utilizaron análisis de mediación y regresión lineal para evaluar las relaciones entre el funcionamiento, la participación y la CdV del niño. Los niños con mayor dependencia para gestionar sus necesidades personales y contacto visual limitado al hablar experimentaron una menor CdV. Un funcionamiento menos deteriorado se asoció con una participación más frecuente, lo que, a su vez, se asoció con una ganancia de 3 puntos en la calidad de vida por cada punto adicional en la frecuencia de participación (coeficiente = 2,67, intervalo de confianza del 95 %: 1,56-3,78).					5505645
3	doc42	The effect of impaired functioning on QoL was partially mediated by participation in children with greater dependency in managing personal needs and those with mildly impaired communication.		El efecto del deterioro del funcionamiento sobre la CdV estuvo parcialmente mediado por la participación en los niños con mayor dependencia en la gestión de las necesidades personales y en los que presentaban un deterioro leve de la comunicación.					5505645
4	doc42	Greater levels of impairments with poorer functioning, notably a high level of dependence, were associated with poorer QoL. Poorer QoL can be partly explained by less frequent community participation.		Los mayores niveles de deficiencias con peor funcionamiento, especialmente un alto nivel de dependencia, se asociaron a una peor CdV, que puede explicarse en parte por una participación menos frecuente en la comunidad.					5505645
1	doc45	To describe the clinical course of patients discharged from the emergency department (ED) with nonsevere coronavirus disease 2019 (COVID-19) and explore possible risk factors for later hospitalization.		Describir la evolución clínica de los pacientes dados de alta del servicio de urgencias con enfermedad no grave por coronavirus en 2019 (COVID-19) y explorar posibles factores de riesgo para una hospitalización posterior.					5505645
2	doc45	Patients with nonsevere COVID-19 who were discharged from the ED were included prospectively.		Los pacientes con COVID-19 no grave que fueron dados de alta del servicio de urgencias se incluyeron prospectivamente.					5505645
3	doc45	We explored risk factors for hospitalization after discharge.		Se exploraron los factores de riesgo para una hospitalización posterior al alta.					5505645
4	doc45	Seventy-four patients were included;		Se incluyeron 74 pacientes;					5505645
5	doc45	17 (23%) were hospitalized after discharge.		17 (23 %) fueron hospitalizados tras el alta.					5505645
6	doc45	Three (4%) of the 17 patients died.		Tres (4 %) de los 17 pacientes fallecieron.					5505645
7	doc45	Age, lymphopenia, a high Charlson Comorbidity Index, and a shorter delay between the onset of symptoms and the first visit to the ED were associated with hospitalization afterwards, although on multivariate analysis only time less than 6 days between symptom onset and the first ED visit was associated with later hospitalization (odds ratio, 4.62; 95% CI, 1.08-19.7).		La edad, la linfopenia, un índice de comorbilidad de Charlson alto y un retraso más corto entre el inicio de los síntomas y la primera visita al servicio de urgencias se asociaron con la hospitalización posterior, aunque en el análisis multivariado solo el tiempo inferior a 6 días entre el inicio de los síntomas y la primera visita al servicio de urgencias se asoció con una hospitalización posterior (cociente de probabilidades (OR) del 4,62; IC del 95 %, 1,08-19,7).					5505645
8	doc45	More than 20% of ED patients with nonsevere COVID-19 require hospitalization later.		Más del 20 % de los pacientes de urgencias con COVID-19 no grave requieren hospitalización posterior.					5505645
1	doc46	As a specific measure to prevent diabetes in Mexico, the authors suggest in this letter to the editor that the labeling of food products show the glycemic index, in order to promote healthy eating habits.		Como medida específica para prevenir la diabetes en México, los autores sugieren en esta carta al editor que el etiquetado de los productos alimenticios muestre el índice glucémico, con el fin de promover hábitos de alimentación saludable.					5505645
1	doc47	This study aimed to identify patients eligible for a 48-h stay after colorectal resection, to provide guidance for early discharge planning.		Este estudio tuvo como objetivo identificar a los pacientes aptos para una estancia de 48 horas después de la resección colorrectal, a fin de proporcionar orientación para planificar el alta temprana.					5505645
2	doc47	A bi-institutional retrospective cohort study was undertaken of consecutive patients undergoing major elective colorectal resection for benign or malignant pathology within a comprehensive enhanced recovery pathway between 2011 and 2017.		Se realizó un estudio de cohorte retrospectivo bi-institucional de pacientes consecutivos que se sometieron a una resección colorrectal mayor electiva por patología benigna o maligna dentro de una vía integral de recuperación mejorada entre 2011 y 2017.					5505645
3	doc47	Overall and severe (Clavien-Dindo grade IIIb or above) postoperative complication and readmission rates were compared between patients who were discharged within 48 h and those who had hospital stay of 48 h or more.		Se compararon las tasas de complicaciones postoperatorias globales y graves (Clavien-Dindo grado IIIb o superior) y de reingresos entre los pacientes que fueron dados de alta en 48 h y los que tuvieron una estancia hospitalaria de 48 h o superior.					5505645
4	doc47	Multinominal logistic regression analysis was performed to ascertain significant factors associated with a short hospital stay (less than 48 h).		Se realizó un análisis de regresión logística multinominal para determinar los factores significativos asociados a una estancia hospitalaria corta (inferior a 48 h).					5505645
5	doc47	In total, 686 of 5122 patients (13·4 per cent) were discharged within 48 h.		En total, 686 de 5122 pacientes (13,4 %) fueron dados de alta en 48 h.					5505645
6	doc47	Independent factors favouring a short hospital stay were age below 60 years (odds ratio (OR) 1·34; P = 0·002), ASA grade less than III (OR 1·42; P = 0·003), restrictive fluid management (less than 3000 ml on day of surgery: OR 1·46; P < 0·001), duration of surgery less than 180 min (OR 1·89; P < 0·001), minimally invasive approach (OR 1·92; P < 0·001) and wound contamination grade below III (OR 4·50; P < 0·001), whereas cancer diagnosis (OR 0·55; P < 0·001) and malnutrition		Los factores independientes que favorecieron una estancia hospitalaria corta fueron la edad inferior a 60 años (cociente de probabilidades (OR) de 1,34; P = 0,002), grado de AAS inferior a III (OR 1,42; P = 0,003), manejo restrictivo de líquidos (inferior a 3000 ml el día de la cirugía: OR 1,46; P<0,001), duración de la cirugía inferior a 180 min (OR 1,89; P<0,001), abordaje mínimamente invasivo (OR 1,92; P<0,001) y grado de contaminación de la herida inferior a III (OR 4,50; P < 0,001), mientras que diagnóstico de cáncer (OR 0,55; P<0,001) y desnutrición					5505645
7	doc47	(BMI below 18 kg/m Early discharge of selected patients is safe and does not increase postoperative morbidity or readmission rates.		(IMC por debajo de 18 kg/m). El alta temprana de los pacientes seleccionados es segura y no aumenta la morbilidad postoperatoria o las tasas de readmisión.					5505645
8	doc47	In these patients, outpatient colorectal surgery should be feasible on a large scale with logistical optimization.		En estos pacientes, la cirugía colorrectal ambulatoria debería ser factible a gran escala con una optimización logística.					5505645
