SEG_ID	Doc	Source	Tagged_Source	Target	MT	Tagged_Target	Error Category	Severity	Annotator_ID
16	doc21	Sensitivity and specificity with 95% confidence intervals (CIs) were reported for each study.		Se observaron sensibilidad y especificidad con intervalos de confianza (IC) del 95 % para cada estudio.					5505645
17	doc21	This information has been displayed as coupled forest plots and summary receiver operating characteristic (SROC) plots, displaying the sensitivity-specificity points for each study.		Esta información se ha mostrado en forma de diagramas de bosque y diagramas de características operativas del receptor resumidas (SROC), que muestran los puntos de sensibilidad-especificidad para cada estudio.					5505645
18	doc21	We estimated diagnostic accuracy using hierarchical summary receiver operating characteristic (HSROC) methods.		La exactitud diagnóstica se calculó mediante métodos de características operativas del receptor de resumen jerárquico (HSROC).					5505645
19	doc21	We reported sensitivities at fixed values of specificity (median 0.78, upper quartile 0.90).		Se observaron sensibilidades a valores fijos de especificidad (media de 0,78, cuartil superior 0,90).					5505645
20	doc21	We included a total of 133 studies, 55 did not report data in the 2 x 2 format and could not be included in the meta-analysis.		Se incluyeron un total de 133 estudios, 55 no presentaban datos en formato 2 x 2 y no pudieron ser incluidos en el metaanálisis.					5505645
21	doc21	79 studies which provided 114 datasets and evaluated 21,283 tooth surfaces were included in the meta-analysis.		Se incluyeron en el metaanálisis 79 estudios que proporcionaron 114 conjuntos de datos y evaluaron 21 283 superficies dentarias.					5505645
22	doc21	There was a high risk of bias for the participant selection domain.		Hubo un alto riesgo de sesgo en el ámbito de la selección de participantes.					5505645
23	doc21	The index test, reference standard, and flow and timing domains all showed a high proportion of studies to be at low risk of bias.		La prueba de índice, el estándar de referencia y los dominios de flujo y temporización mostraron que una alta proporción de estudios tuvo bajo riesgo de sesgo.					5505645
24	doc21	Concerns regarding the applicability of the evidence were high or unclear for all domains, the highest proportion being seen in participant selection.		Las preocupaciones con respecto a la aplicabilidad de la evidencia fueron altas o poco claras para todos los dominios, y la proporción más alta se observó en el ámbito de selección de los participantes.					5505645
25	doc21	Selective participant recruitment, poorly defined diagnostic thresholds, and in vitro studies being non-generalisable to the clinical scenario of a routine dental examination were the main reasons for these findings.		La captación selectiva de participantes, los umbrales diagnósticos mal definidos y el hecho de que los estudios in vitro no sean generalizables al escenario clínico de un examen dental rutinario fueron las principales razones de estos resultados.					5505645
26	doc21	The dominance of in vitro studies also means that the information on how the results of these devices are used to support diagnosis, as opposed to pure detection, was extremely limited.		El predominio de los estudios in vitro también significa que la información sobre cómo se utilizan los resultados de estos dispositivos para respaldar el diagnóstico, en contraposición a la mera detección, era extremadamente limitada.					5505645
27	doc21	There was substantial variability in the results which could not be explained by the different devices or dentition or other sources of heterogeneity that we investigated.		Hubo una variabilidad considerable en los resultados que no pudo explicarse por los diferentes dispositivos o dentición u otras fuentes de heterogeneidad que investigamos.					5505645
28	doc21	The diagnostic odds ratio (DOR) was 14.12 (95% CI 11.17 to 17.84).		La relación de probabilidades diagnósticas (diagnostic odds ratio, DOR) fue del 14,12 (IC del 95 %: de 11,17 a 17,84).					5505645
29	doc21	The estimated sensitivity, at a fixed median specificity of 0.78, was 0.70 (95% CI 0.64 to 0.75).		La sensibilidad estimada, con una especificidad media fija de 0,78, fue de 0,70 (IC del 95 %: de 0,64 a 0,75).					5505645
30	doc21	In a hypothetical cohort of 1000 tooth sites or surfaces, with a prevalence of enamel caries of 57%, obtained from the included studies, the estimated sensitivity of 0.70 and specificity of 0.78 would result in 171 missed tooth sites or surfaces with enamel caries (false negatives) and 95 incorrectly classed as having early caries (false positives).		En una cohorte hipotética de 1000 casos o superficies dentales, con una prevalencia de caries del esmalte del 57 %, obtenida de los estudios incluidos, la sensibilidad estimada de 0,70 y la especificidad de 0,78 darían lugar a 171 huecos o superficies dentales omitidos con caries del esmalte (falsos negativos) y 95 clasificados incorrectamente como caries tempranas (falsos positivos).					5505645
31	doc21	We used meta-regression to compare the accuracy of the different devices for red fluorescence (84 datasets, 14,514 tooth sites), blue fluorescence (21 datasets, 3429 tooth sites), and green fluorescence (9 datasets, 3340 tooth sites) devices.		Se utilizó la metarregresión para comparar la exactitud de los diferentes dispositivos para los dispositivos de fluorescencia roja (84 conjuntos de datos, 14 514 huecos dentales), fluorescencia azul (21 conjuntos de datos, 3429 huecos dentales) y fluorescencia verde (9 conjuntos de datos, 3340 huecos dentales).					5505645
32	doc21	Initially, we allowed threshold, shape, and accuracy to vary according to device type by including covariates in the model.		Inicialmente, permitimos que el umbral, la forma y la precisión variaran según el tipo de dispositivo al incluir covariables en el modelo.					5505645
33	doc21	Allowing consistency of shape, removal of the covariates for accuracy had only a negligible effect		Al permitir la consistencia de la forma, la eliminación de las covariables para mayor precisión solo tuvo un efecto insignificante.					5505645
34	doc21	(Chi There is considerable variation in the performance of these fluorescence-based devices that could not be explained by the different wavelengths of the devices assessed, participant, or study characteristics.		(Chi Existe una variación considerable en el rendimiento de estos dispositivos basados en la fluorescencia que no podría explicarse por las diferentes longitudes de onda de los dispositivos evaluados, los participantes ni las características del estudio.					5506982
35	doc21	Blue and green fluorescence-based devices appeared to outperform red fluorescence-based devices but this difference was not supported by the results of a formal statistical comparison.		Los dispositivos basados en fluorescencia azul y verde parecieron superar a los dispositivos basados en fluorescencia roja, pero esta diferencia no fue respaldada por los resultados de una comparación estadística formal.					5505645
36	doc21	The evidence base was considerable, but we were only able to include 79 studies out of 133 in the meta-analysis as estimates of sensitivity or specificity values or both could not be extracted or derived.		La base de evidencia fue considerable, pero solo fue posible incluir 79 estudios de 133 en el metanálisis, ya que no fue posible extraer ni derivar las estimaciones de los valores de sensibilidad o especificidad, o ambas.					5505645
37	doc21	In terms of applicability, any future studies should be carried out in a clinical setting, where difficulties of caries assessment within the oral cavity include plaque, staining, and restorations.		En términos de aplicabilidad, cualquier estudio futuro debe llevarse a cabo en un entorno clínico, donde las dificultades de la evaluación de caries dentro de la cavidad oral incluyen placa, tinción y empastes.					5505645
38	doc21	Other considerations include the potential of fluorescence devices to be used in combination with other technologies and comparative diagnostic accuracy studies.		Otras consideraciones incluyen el potencial de los dispositivos de fluorescencia para ser utilizados en combinación con otras tecnologías y estudios comparativos de precisión diagnóstica.					5505645
1	doc23	The transition to parenthood is perceived as a stressful life event, when parents experience an immense change of their psychological focus and a reorientation of roles and responsibilities in the family system.		La transición a la paternidad se percibe como un acontecimiento vital estresante, cuando los padres experimentan un cambio inmenso en su enfoque psicológico y una reorientación de los roles y responsabilidades en el sistema familiar.					5505645
2	doc23	This process may be even more challenging in the presence of a parental eating disorder history.		Este proceso puede ser aún más difícil en presencia de antecedentes de trastornos alimentarios en los padres.					5505645
3	doc23	This paper reviews the impact of parental eating disorders on the parents, the couple relationship, and their child during the perinatal period.		Este documento aborda el impacto de los trastornos alimentarios parentales en los padres, la relación de pareja y su hijo durante el período perinatal.					5505645
4	doc23	A parental eating disorder is associated with more negative expectations of parental efficacy as well as specific difficulties in couple communication over the child's feeding, shape, and weight.		Un trastorno de la alimentación parental se asocia con expectativas más negativas de la eficacia de los padres, así como dificultades específicas en la comunicación de la pareja sobre la alimentación, la forma y el peso del niño.					5505645
5	doc23	Providers who better understand the effects of an eating disorder on parental functioning can more effectively intervene early on.		Los proveedores que comprenden mejor los efectos de un trastorno alimentario en el funcionamiento de los padres pueden intervenir de manera más efectiva desde el principio.					5505645
6	doc23	We also present couple- or parent-based, empirically supported interventions for adults with eating disorders and their partners in the prenatal and postnatal periods: Uniting Couples in the treatment of Anorexia Nervosa (UCAN) and Uniting couples In the Treatment of Eating disorders (UNITE) both enhance recovery from the eating disorder through a couple-based intervention; the Maudsley Model of Treatment for Adults with Anorexia Nervosa (MANTRA) incorporates the support of partners, when appropriate;		También presentamos intervenciones basadas en la pareja o los padres, con respaldo empírico para adultos con trastornos alimentarios y sus parejas en los períodos prenatal y postnatal: unir parejas en el tratamiento de la anorexia nerviosa (UCAN) y unir parejas en el tratamiento de los trastornos alimentarios (UNITE) mejoran la recuperación del trastorno alimentario a través de una intervención basada en la pareja; el modelo Maudsley de tratamiento para adultos con anorexia nerviosa (MANTRA) incorpora el apoyo de parejas, cuando sea oportuno.					5505645
7	doc23	Parent-Based Prevention (PBP) focuses on improving parental functioning and reducing risk of negative parental and child outcomes.		La prevención basada en los padres (PBP) se centra en mejorar el funcionamiento de los padres y reducir el riesgo de resultados negativos para los padres y los niños.					5505645
8	doc23	Finally, we discuss the clinical implications of addressing parental eating disorders and encourage more research on these families.		Por último, se tratan las implicaciones clínicas de abordar los trastornos alimentarios parentales y se anima a investigar más sobre estas familias.					5505645
1	doc24	This study aimed to describe the estimated means for weight, height, and body mass index (BMI) according to two imputation methods, using data from Vigitel (Risk and Protective Factors Surveillance System for Chronic Non-Communicable Diseases Through Telephone Interview).		Este estudio tuvo como objetivo describir las medias estimadas para el peso, la altura y el índice de masa corporal (IMC) según dos métodos de imputación, utilizando datos de Vigitel (sistema de vigilancia de factores de protección para enfermedades crónicas no transmisibles a través de una entrevista telefónica).					5505645
2	doc24	This was a cross-sectional study that used secondary data from the Vigitel survey from 2006 to 2017.		Se trató de un estudio transversal que utilizó datos secundarios de la encuesta Vigitel del 2006 al 2017.					5505645
3	doc24	The two imputation methods used in the study were hot deck and Predictive Mean Matching (PMM).		Los dos métodos de imputación utilizados en el estudio fueron la imputación de cubierta inmediata y la coincidencia de media predictiva (PMM).					5505645
4	doc24	The weight and height variables imputed by hot deck were provided by Vigitel.		Las variables de peso y altura imputadas por la imputación de cubierta inmediata fueron proporcionadas por Vigitel.		Las variables de peso y altura <tag>imputadas por la imputación</tag> de cubierta inmediata fueron proporcionadas por Vigitel.	Style - Non-fluent	Minor	5505645
5	doc24	Two models were conducted with PMM: (i) explanatory variables - city, sex, age in years, race/color, and schooling; (ii) explanatory variables - city, sex, and age in years.		Se realizaron dos modelos con PMM: (i) variables explicativas: ciudad, sexo, edad en años, raza/color y escolaridad; (ii) variables explicativas: ciudad, sexo y edad en años.					5505645
6	doc24	Weight and height were the outcome variables in the two models.		El peso y la altura fueron las variables de resultado en los dos modelos.					5505645
7	doc24	PMM combines linear regression and random selection of the value for imputation.		El método PMM combina la regresión lineal y selección aleatoria del valor para la imputación.					5505645
8	doc24	Linear prediction is used as a measure of distance between the missing value and the possible donors, thereby creating the virtual space with the candidate cases for yielding the value for imputation.		La predicción lineal se utiliza como una medida de la distancia entre el valor que falta y los posibles donantes, creando así el espacio virtual con los casos candidatos para producir el valor para la imputación.					5505645
9	doc24	One of the candidates from the pool is randomly selected, and its value is assigned to the missing unit.		Se selecciona al azar uno de los candidatos del grupo y se asigna su valor a la unidad que falta.					5505645
10	doc24	BMI was calculated by dividing weight in kilograms by height squared.		El IMC se calculó dividiendo el peso en kilogramos por la altura al cuadrado.					5505645
11	doc24	The result shows the means and standard deviations for weight, height, and BMI according to imputation method and year.		El resultado muestra las medias y las desviaciones típicas del peso, la altura y el IMC según el método de imputación y el año.					5505645
12	doc24	The estimates used the survey module from Stata, which considers the sampling effects.		Las estimaciones utilizaron el módulo de encuestas de Stata, que considera los efectos de muestreo.					5505645
13	doc24	The mean values for weight, height, and BMI estimated by hot deck and PMM were similar.		Los valores medios de peso, altura e IMC estimados por la imputación de cubierta inmediata y PMM fueron similares.					5505645
14	doc24	The results with the Vigitel data suggest the applicability of PMM to the set of health surveys.		Los resultados con los datos de Vigitel sugieren la aplicabilidad de la PMM al conjunto de encuestas sanitarias.					5505645
1	doc25	Coyhaique (Southern Chile) is one of the most polluted cities in the Americas due to the burning of firewood.		Coyhaique (sur de Chile) es una de las ciudades más contaminadas de América debido a la quema de leña.					5505645
2	doc25	In 2016, a mass substitution of residential heating technology was launched to decrease the air concentrations of particulate matter in the winter.		En 2016, se lanzó una sustitución masiva de la tecnología de calefacción residencial para disminuir las concentraciones de partículas en el aire en el invierno.					5505645
3	doc25	Based on time series analyses, the article discusses the effect of this measure on PM2.5 levels and hospitalizations for acute respiratory conditions in individuals under 15 years of age.		Con base en análisis de series temporales, el artículo analiza el efecto de esta medida sobre los niveles de PM2,5 y las hospitalizaciones por afecciones respiratorias agudas en menores de 15 años.					5505645
1	doc32	The European Commission Initiative on Breast Cancer (ECIBC) has developed new recommendations on breast cancer screening and diagnosis.		La iniciativa de la Comisión Europea sobre el cáncer de mama (ECIBC, por sus siglas en inglés) ha elaborado nuevas recomendaciones sobre el cribado y el diagnóstico del cáncer de mama.					5505645
2	doc32	The objective of this work was to adapt these recommendations to Spanish in order to implement and guarantee the quality and success of breast cancer screening programmes (PCCM) throughout the Spanish territory.		El objetivo de este trabajo era adaptar estas recomendaciones al español para implementar y garantizar la calidad y el éxito de los programas de detección del cáncer de mama (PCCM) en todo el territorio español.					5505645
3	doc32	The new European Guidelines on Screening and Diagnosis of Breast Cancer have been prepared by a multidisciplinary panel of experts and patients (Guidelines Development Group, GDG).		Las nuevas directrices europeas sobre el cribado y el diagnóstico del cáncer de mama han sido elaboradas por un grupo multidisciplinar de expertos y pacientes (Grupo de Desarrollo de Directrices, GDG).					5505645
4	doc32	The recommendations inclu-ded are supported by systematic reviews of the evidence conducted by a team of researchers from the Ibero-American Cochrane Center.		Las recomendaciones incluidas están respaldadas por revisiones sistemáticas de la evidencia realizadas por un equipo de investigadores del Centro Cochrane Iberoamericano.					5505645
5	doc32	For its preparation, the European Commission's conflict of interest management rules were applied and the GRADE (Grading of Recommendations Assessment, Development and Evaluation) methodology was used.		Para su elaboración, se aplicaron las normas de gestión de conflictos de intereses de la Comisión Europea y se utilizó la metodología de calificación de análisis, desarrollo y evaluación de recomendaciones (Grading of Recommendations Assessment, Development and Evaluation, GRADE).					5505645
6	doc32	The GRADE evidence-to-decision (EtD) frameworks were used to minimize potential influence of interests on the recommendations.		Se utilizaron los marcos GRADE de toma de decisiones en función de evidencias (EtD) para minimizar la posible influencia de los intereses en las recomendaciones.					5505645
7	doc32	As a result of the systematic reviews carried out, the GDG published on the ECIBC website a list of recommendations as part of the guidelines for the screening and diagnosis of breast cancer, which were translated into Spanish in this work.		Como resultado de las revisiones sistemáticas realizadas, el GDG publicó en la web del ECIBC una lista de recomendaciones como parte de las guías para el cribado y el diagnóstico del cáncer de mama, que fueron traducidas al español en este trabajo.					5505645
8	doc32	The adaptation to Spanish of the new recommendations helps their implementation and the creation of a uniform PCCM throughout the Spanish territory.		La adaptación al español de las nuevas recomendaciones favorece su implementación y la creación de un PCCM uniforme en todo el territorio español.					5505645
9	doc32	All of this improves informed decision making and the success of PCCM.		Todo esto mejora la toma de decisiones informadas y el éxito del PCCM.					5505645
1	doc38	Introduction: during the COVID-19 crisis food habits have changed among the population as food consumption is now carried out totally at home, and visits to groceries or food centers have decreased considerably.		Introducción: durante la crisis causada por el COVID-19, los hábitos alimentarios han cambiado entre la población, ya que el consumo de alimentos ahora se lleva a cabo totalmente en el hogar y las visitas a los supermercados o centros de alimentos han disminuido considerablemente.					5505645
2	doc38	Likewise, other habits, such as physical activity or sleeping hours have also been modified.		Asimismo, también se han modificado otros hábitos, como la actividad física o las horas de sueño.					5505645
3	doc38	Objectives: the objective of this work was to evaluate the changes occurred in eating and lifestyle habits among the adult Galician population during the confinement period ordered in Spain during the COVID-19 pandemic.		Objetivos: el objetivo de este trabajo fue evaluar los cambios ocurridos en los hábitos alimentarios y vitales de la población adulta gallega durante el periodo de confinamiento ordenado en España durante la pandemia de COVID-19.		Objetivos: el objetivo de este trabajo fue evaluar los cambios ocurridos en los hábitos alimentarios y <tag>vitales</tag> de la población adulta gallega durante el periodo de confinamiento ordenado en España durante la pandemia de COVID-19.	Style - Non-fluent	Minor	5505645
3	doc38	Objectives: the objective of this work was to evaluate the changes occurred in eating and lifestyle habits among the adult Galician population during the confinement period ordered in Spain during the COVID-19 pandemic.		Objetivos: el objetivo de este trabajo fue evaluar los cambios ocurridos en los hábitos alimentarios y vitales de la población adulta gallega durante el periodo de confinamiento ordenado en España durante la pandemia de COVID-19.		Objetivos: el objetivo de este trabajo <tag>fue</tag> evaluar los cambios ocurridos en los hábitos alimentarios y vitales de la población adulta gallega durante el periodo de confinamiento ordenado en España durante la pandemia de COVID-19.	Linguistic Conventions - Grammar	Neutral	5505645
4	doc38	Methods: a survey was conducted using Microsoft Forms, and spread among the population using an instant messaging service for mobiles through the internet.		Métodos: se realizó una encuesta utilizando Microsoft Forms, y se promovió entre la población utilizando un servicio de mensajería instantánea para móviles a través de Internet.					5505645
5	doc38	Results: a total of 1350 Galician adults completed the questionnaire; mean of age was 63.2 ± 8.1 years, 30 % were men, and 70 % were women.		Resultados: un total de 1350 adultos gallegos completaron el cuestionario; la media de edad fue de 63,2 ± 8,1 años, el 30 % eran hombres y el 70 % eran mujeres.					5505645
6	doc38	The obtained data show a trend towards consumption of healthy foods such as fruits and vegetables, and a decrease in less healthy ones such as processed foods.		Los datos obtenidos muestran una tendencia hacia el consumo de alimentos saludables, como frutas y verduras, y una disminución de los menos saludables, como los alimentos procesados.					5505645
7	doc38	In total, 46 % of the population reported they were eating more than before the confinement, with an increase in snacking between meals		En total, el 46 % de la población afirmó comer más que antes del confinamiento, con un aumento de los refrigerios entre comidas					5505645
8	doc38	(54 %) and in anxiety about food due to situations of stress or nervousness bieng reported by 40 % of respondents.		(54 %) y en la ansiedad por la alimentación debido a situaciones de estrés o nerviosismo que señalaron el 40 % de los encuestados.					5505645
9	doc38	This has resulted in an increase in body weight, reported by 44 % of participants, with the average gain being 2.8 ± 1.5 kg.		Esto se ha traducido en un aumento en el peso corporal, declarado por el 44 % de los participantes, con una ganancia media de 2,8 ± 1,5 kg.					5505645
10	doc38	Conclusions: during confinement, the eating and lifestyle habits of the Galician population have been modified.		Conclusiones: durante el confinamiento se han modificado los hábitos alimentarios y de estilo de vida de la población gallega.					5505645
11	doc38	The weight gain observed in a population that already had a high level of overweight and obesity at confinement onset aggravates the present situation and may have a negative impact on the development of chronic, non-communicable.		El aumento de peso observado en una población que ya presentaba un alto nivel de sobrepeso y obesidad al inicio del confinamiento agrava la situación actual y puede tener un impacto negativo en el desarrollo de enfermedades crónicas no transmisibles.					5505645
1	doc40	Three-generation households that include parents and grandparents raising children together have become increasingly common in China.		En China son cada vez más frecuentes los hogares de tres generaciones, en los que padres y abuelos crían juntos a sus hijos.					5505645
2	doc40	This study examined the relations among depressive symptoms, parenting stress, and caregiver-child relationships in the mother-grandmother dyadic context.		Este estudio examinó las relaciones entre los síntomas depresivos, el estrés de los padres y las relaciones entre el cuidador y el niño en el contexto diádico madre-abuela.					5505645
