SEG_ID	Doc	Source	Tagged_Source	Target	MT	Tagged_Target	Error Category	Severity	Annotator_ID
1	doc10	Primary health care provides the framework for delivering the socially-informed, comprehensive and patient-centred care underlying robust health-care systems and is, therefore, central to achieving universal health coverage.		La atención sanitaria primaria proporciona el marco para la prestación de atención socialmente informada, integral y centrada en el paciente que subyace a los sólidos sistemas de atención sanitaria y, por lo tanto, es fundamental para lograr una cobertura sanitaria universal.					5505645
2	doc10	Family physicians are best placed to embody primary health care's dual focus on community and population health because they are often employed in rural or district hospitals with limited human resources, particularly a lack of specialists.		Los médicos de cabecera están en mejores condiciones para encarnar el doble enfoque de la atención sanitaria primaria en la salud de las comunidades y la población, porque a menudo trabajan en hospitales rurales o de distrito con recursos humanos limitados, en concreto con falta de especialistas.		Los médicos de cabecera están en mejores condiciones para <tag>encarnar</tag> el doble enfoque de la atención sanitaria primaria en la salud de las comunidades y la población, porque a menudo trabajan en hospitales rurales o de distrito con recursos humanos limitados, en concreto con falta de especialistas.	Style - Non-fluent	Neutral	5505645
2	doc10	Family physicians are best placed to embody primary health care's dual focus on community and population health because they are often employed in rural or district hospitals with limited human resources, particularly a lack of specialists.		Los médicos de cabecera están en mejores condiciones para encarnar el doble enfoque de la atención sanitaria primaria en la salud de las comunidades y la población, porque a menudo trabajan en hospitales rurales o de distrito con recursos humanos limitados, en concreto con falta de especialistas.		Los médicos de <tag>cabecera</tag> están en mejores condiciones para encarnar el doble enfoque de la atención sanitaria primaria en la salud de las comunidades y la población, porque a menudo trabajan en hospitales rurales o de distrito con recursos humanos limitados, en concreto con falta de especialistas.	Terminology - Wrong term	Neutral	5505645
3	doc10	Here we want to illustrate how additional training for family physicians, the key clinicians in primary care, can play a critical role in reducing disparities in access to surgical, obstetric and anaesthesia care in low- and middle-income countries and in rural or remote settings.		A continuación, queremos ilustrar cómo la formación adicional para médicos de cabecera, los profesionales sanitarios clave en la atención primaria, puede desempeñar un papel fundamental en la reducción de las disparidades en el acceso a la atención quirúrgica, obstétrica y anestésica en países de bajos y medianos ingresos y en entornos rurales o remotos.					5505645
4	doc10	Examples are given of how training programmes can be developed in low-resource settings to equip family physicians with life-saving surgical skills and of how family physicians in high-income countries can be trained in the surgical skills essential for working overseas in low-income settings.		Además, se proporcionan ejemplos de cómo se pueden desarrollar programas formativos en entornos de bajos recursos para que los médicos de cabecera desarrollen habilidades quirúrgicas que pueden salvar vidas y de cómo se puede formar a los médicos de cabecera en países de altos ingresos en las habilidades quirúrgicas esenciales para trabajar en el extranjero en entornos de bajos ingresos.					5505645
5	doc10	Policy-makers should promote surgical practice among family physicians by supporting family medicine programmes that include additional surgical skills training and by expanding opportunities and incentives for family physicians to serve in rural areas.		Los legisladores deben promover la práctica quirúrgica entre los médicos de cabecera fomentando programas de medicina familiar que incluyan formación adicional en habilidades quirúrgicas y ampliando las oportunidades y los incentivos para que los médicos de familia presten servicios en áreas rurales.					5505645
6	doc10	Moreover, national surgical plans should include a primary health care strategy for surgical care and, globally, family physicians should be considered in discussions of surgical care.		Además, los planes quirúrgicos nacionales deben incluir una estrategia de atención sanitaria primaria para la atención quirúrgica y, globalmente, los médicos de cabecera deben tenerse en cuenta en las discusiones sobre la atención quirúrgica.					5505645
7	doc10	Finally, surgeons, anaesthesiologists, obstetricians and family physicians should be encouraged to collaborate in ensuring that all patients, regardless of place of residence, receive safe and timely surgical care.		Por último, se debe alentar a los cirujanos, anestesiólogos, obstetras y médicos de cabecera a colaborar para garantizar que todos los pacientes, independientemente de su lugar de residencia, reciban atención quirúrgica segura y oportuna.					5505645
1	doc100	To analyze notifications of flu-like syndrome according to the time interval between onset of symptoms and testing for COVID-19.		Analizar las notificaciones de síndrome similar a la gripe de acuerdo con el intervalo de tiempo entre el inicio de los síntomas y la prueba de COVID-19.					5505645
2	doc100	This was a cross-sectional study using records of flu-like syndrome cases containing results of COVID-19 diagnostic tests in the Brazilian state capitals and Federal District, held on the e-SUS Notifica system, from March 1st, 2020 to August 18th, 2020.		Este fue un estudio transversal que utilizó registros de casos de síndrome similar a la gripe que contenían resultados de las pruebas de diagnóstico de COVID-19 en las capitales de los Estados brasileños y el Distrito Federal, realizado en el sistema e-SUS Notifica, del 1 de marzo de 2020 al 18 de agosto de 2020.					5505645
3	doc100	The time interval between symptom onset and testing was compared using the ANOVA test, classifying it according to test adequacy/timeliness.		El intervalo de tiempo entre el inicio de los síntomas y la prueba se comparó utilizando la prueba ANOVA, clasificándola de acuerdo con la idoneidad/oportunidad de la prueba.					5505645
4	doc100	Taking 1,942,514 notifications, average time between symptom onset and testing was 10.2 days (±17.1).		Teniendo en cuenta 1 942 514 notificaciones, el tiempo promedio entre el inicio de los síntomas y la prueba fue de 10,2 días (±17,1).					5505645
5	doc100	Among those tested, females (55.1%), people aged 20-39 years (43.8%), and the Southeast region of Brazil (43.0%) predominated.		Entre los pacientes evaluados, predominaron las mujeres (55,1 %), las personas de 20 a 39 años (43,8 %) y la región sudeste de Brasil (43,0 %).					5505645
6	doc100	58.8% of IgM ELISA tests were performed at an adequate time while 68.0% of rapid antigen tests were not performed at an adequate time.		El 58,8 % de las pruebas ELISA de IgM se realizaron en un momento adecuado, mientras que el 68,0 % de las pruebas rápidas de antígenos no se realizaron en un momento adecuado.					5505645
7	doc100	Inadequacy was found between symptom onset and time taken to test for COVID-19 in the Brazilian regions.		En las regiones brasileñas, se detectó una inadecuación entre el inicio de los síntomas y el tiempo necesario para realizar la prueba de detección del COVID-19.					5505645
1	doc12	The current study contributes to a sparse literature on moderators of Functional Family Therapy (FFT) by examining whether responsiveness to FFT, measured by a broad range of outcomes, varies by adolescent gender, age, and their interaction.		El estudio actual contribuye a una literatura escasa sobre moderadores de Terapia Familiar Funcional (FFT) al examinar si la capacidad de respuesta a FFT, medida por una amplia gama de resultados, varía según el sexo del adolescente, la edad y su interacción.					5505645
2	doc12	This study was informed by 687 families (n, adolescents = 581; n, caregivers = 933) and utilized a pre-post comparison design.		Este estudio se documentó por parte de 687 familias (n, adolescentes = 581; n, cuidadores = 933) y utilizó un diseño de comparación previa a las pruebas.					5505645
3	doc12	Fixed-effects regressions with gender, age, and their interaction included as explanatory variables were conducted to calculate the average change in youth mental health, callous-unemotional traits, academic outcomes, substance use, and family functioning.		Se realizaron regresiones de efectos fijos con género, edad y su interacción, incluyendo variables explicativas, para calcular el cambio promedio en salud mental juvenil, rasgos insensibles y no emocionales, resultados académicos, consumo de sustancias y funcionamiento familiar.					5505645
4	doc12	Moderation analyses revealed that according to parent report, girls had significantly greater improvements in peer problems and family functioning, and boys benefited more in increased liking of school.		Los análisis de moderación revelaron que, según el informe de los padres, las niñas habían tenido una mejora considerablemente superior de los problemas con los compañeros y el funcionamiento de la familia, y los niños se beneficiaban más de una mayor simpatía por parte de la escuela.					5505645
5	doc12	There were differential effects by age, such that older youth had less beneficial mental health outcomes and a smaller decrease in frequency of hash use.		Hubo efectos diferenciales por edad, de modo que los jóvenes de mayor edad tuvieron resultados de salud mental menos beneficiosos y una disminución menor en la frecuencia del uso de hachís.					5505645
6	doc12	The gender by age interaction was significant for adolescents' report of mental health and family functioning outcomes, which suggests that girls benefit from FFT less than boys during early adolescence, but benefit more than boys in late adolescence.		La interacción de género por edad fue significativa para los resultados de salud mental y funcionamiento familiar comunicados por los adolescentes, lo que sugiere que las niñas se benefician menos de la FFT que los niños durante la adolescencia temprana, pero se benefician más que los niños en la adolescencia tardía.					5505645
7	doc12	This finding adds to literature which has evidenced that family functioning is particularly important for girls by suggesting that FFT is important for improving older girls' mental health and family functioning in particular.		Este hallazgo se suma a la literatura que ha puesto en evidencia que el funcionamiento familiar es particularmente importante para las niñas, sugiriendo que la FFT es importante para mejorar la salud mental de las niñas mayores y el funcionamiento familiar en particular.					5505645
8	doc12	The study's results expand the examination of outcomes of FFT to include academic outcomes, and provide insight into key factors that should be considered in addressing adolescent behavioral problems and family functioning.		Los resultados del estudio amplían el examen de los resultados de FFT para incluir los resultados académicos y brindan información sobre los factores clave que deben considerarse al abordar los problemas de comportamiento de los adolescentes y el funcionamiento familiar.					5505645
1	doc16	This study aimed to elucidate the mechanism underlying the effect of parental attachment on post-traumatic growth (PTG) among adolescents.		Este estudio pretendía dilucidar el mecanismo subyacente al efecto del apego parental sobre el crecimiento postraumático (PTG) en adolescentes.					5505645
2	doc16	Nine and a half years after the Wenchuan earthquake, 872 adolescents in China were assessed using self-reported questionnaires.		Nueve años y medio después del terremoto de Wenchuan, se evaluó a 872 adolescentes de China mediante cuestionarios autoinformados.					5505645
3	doc16	The results showed that parental attachment had a direct association with PTG, two significant one-step indirect associations with PTG (through justice beliefs and cognitive reappraisal), two significant two-step indirect associations (through feelings of safety via justice beliefs and justice beliefs via cognitive reappraisal), and one significant three-step indirect association (through feelings of safety via justice beliefs by cognitive reappraisal).		Los resultados mostraron que el apego parental tenía una asociación directa con el PTG, dos asociaciones indirectas significativas de un paso con el PTG (a través de creencias de justicia y reevaluación cognitiva), dos asociaciones indirectas significativas de dos pasos (a través de sentimientos de seguridad a través de creencias de justicia y creencias de justicia a través de reevaluación cognitiva), y una asociación indirecta significativa de tres pasos (a través de sentimientos de seguridad a través de creencias de justicia por reevaluación cognitiva).					5505645
4	doc16	The results indicated that feelings of safety, justice beliefs, and cognitive reappraisal mediated the association between parental attachment and PTG.		Los resultados indicaron que los sentimientos de seguridad, las creencias de justicia y la revaloración cognitiva mediaron la asociación entre el apego parental y el PTG.					5505645
5	doc16	These findings highlight the importance of a family perspective and may help clinical psychologists to improve adolescents' PTG by helping them to build positive parental attachments.		Estos hallazgos resaltan la importancia de una perspectiva familiar y pueden ayudar a los psicólogos clínicos a mejorar el PTG de los adolescentes al ayudarlos a desarrollar vínculos parentales positivos.					5505645
1	doc17	Hypertension has been associated with worse outcomes in patients with COVID-19 infection, so concerns have been raised about the possibility that inhibitors of the renin-angiotensin system (RAS) could influence the prognosis of these patients.		La hipertensión se ha asociado con peores resultados en pacientes con infección por COVID-19, por lo que se ha planteado la posibilidad de que los inhibidores del sistema renina-angiotensina (SRA) puedan influir en el pronóstico de estos pacientes.					5505645
2	doc17	This is an observational study of 921 consecutive patients admitted with COVID-19 respiratory infection to Hospital General Universitario Ciudad Real from March 1 to April 30, 2020.		Se trata de un estudio observacional de 921 pacientes consecutivos ingresados con infección respiratoria por COVID-19 en el Hospital General Universitario Ciudad Real del 1 de marzo al 30 de abril de 2020.					5505645
3	doc17	Following data were collected including patient demographic information, medical history, clinical characteristics, laboratory data, therapeutic interventions during the hospitalization and clinical outcomes.		Se recolectaron datos que incluyeron información demográfica de los pacientes, historial clínico, características clínicas, datos de laboratorio, intervenciones terapéuticas durante la hospitalización y resultados clínicos.					5505645
4	doc17	The mean age was 78 years, and 59.2% of patients had a history of hypertension.		La edad media fue de 78 años y el 59,2 % de los pacientes tenían antecedentes de hipertensión.					5505645
5	doc17	Patients with previous treatment with RAS inhibitor (42.4%) showed lower risk of the primary composite endpoint (mortality or need for invasive mechanical ventilation).		Los pacientes con tratamiento previo con un inhibidor del SRA (42,4 %) mostraron un menor riesgo de la variable principal compuesta (mortalidad o necesidad de ventilación mecánica invasiva).					5505645
6	doc17	Treatment with RAS inhibitor (both outpatient treatment and during hospitalization) had neither effect on mortality nor need for invasive ventilation.		El tratamiento con un inhibidor del RAS (tanto en el tratamiento ambulatorio como durante la hospitalización) no tuvo ningún efecto sobre la mortalidad ni sobre la necesidad de ventilación invasiva.					5505645
7	doc17	There were no differences in time-to-event analysis between groups.		No hubo diferencias en el análisis del tiempo transcurrido hasta el evento entre los grupos.					5505645
8	doc17	RAS inhibitor treatment prior to admission in patients with COVID-19 respiratory infection was associated with lower risk of the primary composite endpoint and did not show neither impact on mortality nor need for invasive mechanical ventilation, even if these drugs were prescribed during hospitalization.		El tratamiento con inhibidores del SRA antes del ingreso en pacientes con infección respiratoria COVID-19 se asoció a un menor riesgo de la variable principal de valoración compuesta y no mostró impacto alguno sobre la mortalidad ni la necesidad de ventilación mecánica invasiva, aunque estos fármacos se prescribieran durante la hospitalización.					5505645
1	doc20	To analyze the limit-situations experienced by nurses in child health care practices, from the perspective of empowerment in health promotion.		Analizar las situaciones límite que experimentan las enfermeras en las prácticas de atención de la salud infantil, desde la perspectiva del empoderamiento en la promoción de la salud.		Analizar las situaciones límite que <tag>experimentan</tag> las enfermeras en las prácticas de atención de la salud infantil, desde la perspectiva del empoderamiento en la promoción de la salud.	Linguistic Conventions - Grammar	Minor	5505645
2	doc20	This is a qualitative approach Participatory Action Research, supported by Paulo Freire's Research Itinerary, developed through Culture Circles, consisting of three stages: thematic investigation, coding and decoding and critical unveiling.		Se trata de una investigación de acción participativa de enfoque cualitativo respaldada por el itinerario de investigación de Paulo Freire y desarrollada a través de círculos culturales, que consta de tres etapas: investigación temática, codificación y decodificación y desvelamiento crítico.					5505645
3	doc20	13 Culture Circles were held with nurses from the Family Health Strategy of five Basic Health Units in the city of Manaus, Amazonas.		Se realizaron 13 círculos culturales con enfermeras de la estrategia de salud familiar de cinco unidades sanitarias básicas en la ciudad de Manaos, Amazonas.		Se realizaron 13 círculos culturales con enfermeras de la <tag>estrategia de salud familiar</tag> de cinco unidades sanitarias básicas en la ciudad de Manaos, Amazonas.	Terminology - Inconsistent use of terminology	Minor	5505645
4	doc20	A total of 16 nurses participated and 20 generating themes emerged from the Culture Circles, six of which were considered limit-situations by the participants: accumulation of activities; difficulty monitoring and following-up children; work focused on productivity; lack of training; limited human resources; difficulty in reception.		Participaron un total de 16 enfermeras y surgieron 20 temas generadores de los círculos culturales, de los cuales seis fueron considerados situaciones límite por los participantes: acumulación de actividades, dificultad en la supervisión y el seguimiento de los niños, trabajo centrado en la productividad, falta de formación, recursos humanos limitados y dificultad en la recepción.					5505645
5	doc20	The study contributed to strengthening nurses through reflective dialogues on the realities experienced, increasing awareness and enabling interventions to transform their practices in child health care.		El estudio contribuyó a fortalecer a las enfermeras a través de diálogos reflexivos sobre las realidades vividas, aumentando la concienciación y posibilitando intervenciones para transformar sus prácticas en la atención sanitaria infantil.					5505645
1	doc21	Caries is one of the most prevalent and preventable conditions worldwide.		La caries es una de las afecciones más prevalentes y prevenibles en todo el mundo.					5505645
2	doc21	If identified early enough then non-invasive techniques can be applied, and therefore this review focusses on early caries involving the enamel surface of the tooth.		Si se identifican con la suficiente antelación, se pueden aplicar técnicas no invasivas y, por lo tanto, esta revisión se centra en las caries tempranas que afectan la superficie del esmalte del diente.					5505645
3	doc21	The cornerstone of caries detection is a visual and tactile dental examination, however alternative methods of detection are available, and these include fluorescence-based devices.		La piedra angular de la detección de caries es un examen dental visual y táctil; sin embargo, existen métodos alternativos de detección disponibles, entre los que incluyen los dispositivos basados en fluorescencia.					5505645
4	doc21	There are three categories of fluorescence-based device each primarily defined by the different wavelengths they exploit; we have labelled these groups as red, blue, and green fluorescence.		Hay tres categorías de dispositivos basados en fluorescencia, cada una definida principalmente por las diferentes longitudes de onda que emplean; hemos denominado estos grupos como fluorescencia roja, azul y verde.					5505645
5	doc21	These devices could support the visual examination for the detection and diagnosis of caries at an early stage of decay.		Estos dispositivos podrían respaldar el examen visual para la detección y el diagnóstico de la caries en una etapa temprana de la descomposición.					5505645
6	doc21	Our primary objectives were to estimate the diagnostic test accuracy of fluorescence-based devices for the detection and diagnosis of enamel caries in children or adults.		Nuestros objetivos principales fueron estimar la precisión de las pruebas de diagnóstico de dispositivos basados en fluorescencia para la detección y el diagnóstico de caries del esmalte en niños o adultos.					5505645
7	doc21	We planned to investigate the following potential sources of heterogeneity: tooth surface (occlusal, proximal, smooth surface or adjacent to a restoration); single point measurement devices versus imaging or surface assessment devices; and the prevalence of more severe disease in each study sample, at the level of caries into dentine.		Se planificó investigar las siguientes fuentes potenciales de heterogeneidad: superficie dental (oclusal, proximal, superficie lisa o adyacente a una restauración), dispositivos de medición de punto único frente a dispositivos de imagen o evaluación de superficies y la prevalencia de enfermedad más grave en cada muestra de estudio, a nivel de caries en dentina.					5505645
8	doc21	Cochrane Oral Health's Information Specialist undertook a search of the following databases: MEDLINE Ovid (1946 to 30 May 2019);		El especialista en información de Cochrane Oral Health realizó una búsqueda en las siguientes bases de datos: MEDLINE Ovid (del 1946 al 30 de mayo de 2019);					5505645
9	doc21	Embase Ovid (1980 to 30 May 2019);		Embase Ovid (del 1980 al 30 de mayo de 2019);					5505645
10	doc21	US National Institutes of Health Ongoing Trials Register (ClinicalTrials.gov, to 30 May 2019); and the World Health Organization International Clinical Trials Registry Platform (to 30 May 2019).		registro de ensayos en curso de los Institutos Nacionales de Salud de los Estados Unidos (ClinicalTrials.gov, hasta el 30 de mayo de 2019); y la plataforma internacional de registro de ensayos clínicos de la Organización Mundial de la Salud (hasta el 30 de mayo de 2019).		<tag>registro</tag> de ensayos en curso de los Institutos Nacionales de Salud de los Estados Unidos (ClinicalTrials.gov, hasta el 30 de mayo de 2019); y la plataforma internacional de registro de ensayos clínicos de la Organización Mundial de la Salud (hasta el 30 de mayo de 2019).	Linguistic Conventions - Punctuation	Minor	5505645
11	doc21	We studied reference lists as well as published systematic review articles.		Estudiamos las listas de referencias, así como los artículos de revisión sistemática publicados.					5505645
12	doc21	We included diagnostic accuracy study designs that compared a fluorescence-based device with a reference standard.		Incluimos diseños de estudios de precisión diagnóstica que comparaban un dispositivo basado en fluorescencia con un estándar de referencia.					5505645
13	doc21	This included prospective studies that evaluated the diagnostic accuracy of single index tests and studies that directly compared two or more index tests.		Esto incluyó estudios prospectivos que evaluaron la precisión diagnóstica de las pruebas de índice único y estudios que compararon directamente pruebas de dos o más índices.					5505645
14	doc21	Studies that explicitly recruited participants with caries into dentine or frank cavitation were excluded.		Se excluyeron los estudios explícitamente con participantes con caries en la dentina o cavidad franca.					5505645
15	doc21	Two review authors extracted data independently using a piloted study data extraction form based on the Quality Assessment of Diagnostic Accuracy Studies 2 (QUADAS-2).		Dos autores de la revisión extrajeron los datos de forma independiente mediante un formulario de extracción de datos de estudios piloto basado en la evaluación de la calidad de estudios de precisión diagnóstica 2 (Quality Assessment of Diagnostic Accuracy Studies 2, QUADAS-2).					5505645
