SEG_ID	Doc	Source	Tagged_Source	Target	MT	Tagged_Target	Error Category	Severity	Annotator_ID
8	doc49	Höhere Expressionen sind dabei insbesondere bei den prognostisch ungünstigeren Entitäten wie den Speichelgangkarzinomen und Adenokarzinomen NOS („not otherwise specified“) zu beobachten.		Higher expressions can be observed in particular in the prognostically less favourable entities such as salivary duct carcinomas and adenocarcinomas NOS ("not otherwise specified").	TMT_run1	Higher expressions can be observed in particular in the prognostically less <tag>favourable</tag> entities such as salivary duct carcinomas and adenocarcinomas NOS ("not otherwise specified").	Linguistic Conventions - Spelling	Minor	5367941
9	doc49	LAG3 ist insbesondere bei aggressiven Entitäten und fortgeschrittenen Tumoren nachzuweisen.		LAG3 can be detected especially in aggressive entities and advanced tumours.	TMT_run1	LAG3 can be detected especially in aggressive entities and advanced <tag>tumours</tag>.	Linguistic Conventions - Spelling	Minor	5367941
10	doc49	Folglich könnte eine Therapie mit LAG3-Inhibitoren eine Therapie bei fortgeschrittenen und metastasierten SGC unterstützen.		Consequently, LAG3 inhibitor therapy could support therapy in advanced and metastatic SGC.	TMT_run1				5367941
1	doc5	Die Primäre Ciliäre Dyskinesie (PCD, MIM 242650) ist eine seltene hereditäre Multisystemerkrankung mit klinisch heterogenem Phänotyp.		Primary Ciliary Dyskinesia (PCD, MIM 242650) is a rare hereditary multisystem disorder with a clinically heterogeneous phenotype.	TMT_run1				5367941
2	doc5	Leitsymptom ist eine chronische Sekretretention der oberen und unteren Atemwege, welche durch die Dysfunktion motiler respiratorischer Zilien entsteht.		The leading symptom is chronic secretion retention of the upper and lower respiratory tract, which results from the dysfunction of motile respiratory cilia.	TMT_run1	The leading symptom is chronic secretion retention of the upper and lower respiratory <tag>tract</tag>, which results from the dysfunction of motile respiratory cilia.	Linguistic Conventions - Grammar	Minor	5367941
3	doc5	In der Folge kommt es zur Ausbildung von Bronchiektasen, häufig zu einer Infektion durch Pseudomonas aeruginosa sowie einer abnehmenden Lungenfunktion bis hin zum Lungenversagen.		This leads to the development of bronchiectasis, often to infection by Pseudomonas aeruginosa and decreasing lung function up to lung failure.	TMT_run1				5367941
4	doc5	Bislang gibt es kaum evidenzbasierte Therapieempfehlungen, da randomisierte Langzeitstudien zur Behandlung der PCD fehlten.		To date, there are hardly any evidence-based treatment recommendations, as randomized long-term trials for the treatment of PCD were lacking.	TMT_run1				5367941
5	doc5	In diesem Jahr wurden die Daten einer ersten placebokontrollierten Medikamentenstudie bei PCD veröffentlicht.		This year, data from a first placebo-controlled drug trial in PCD were published.	TMT_run1				5367941
6	doc5	Anlässlich dieses Meilensteins im Management der PCD wurde der vorliegende Übersichtsartikel als Konsens von Patientenvertretern sowie Klinikern, die langjährige Erfahrung in der Behandlung der PCD haben, verfasst.		On the occasion of this milestone in the management of PCD, the present review article was written as a consensus of patient representatives as well as clinicians who have many years of experience in the treatment of PCD.	TMT_run1				5367941
7	doc5	Diese Arbeit bietet eine Zusammenfassung aktuell eingesetzter Behandlungsverfahren, die überwiegend auf persönlichen Erfahrungen und Expertenmeinungen beruhen oder von anderen Atemwegserkrankungen wie der Cystischen Fibrose (CF), COPD oder Bronchiektasen-Erkrankung abgeleitet werden.		This paper provides a summary of currently used treatments that are mainly based on personal experience and expert opinions or derived from other respiratory diseases such as cystic fibrosis (CF), COPD or bronchiectasis.	TMT_run1				5367941
8	doc5	Da es derzeit keine kurative Therapie für PCD gibt, stehen symptomatische Maßnahmen wie die regelmäßige Reinigung der Atemwege und die Behandlung von rezidivierenden Atemwegsinfektionen im Fokus.		As there is currently no curative therapy for PCD, the focus is on symptomatic measures such as regular cleansing of the airways and the treatment of recurrent respiratory infections.	TMT_run1				5367941
9	doc5	Nicht respiratorische Manifestationen werden organspezifisch behandelt.		Non respiratory manifestations are treated organ-specifically.	TMT_run1	<tag>Non respiratory</tag> manifestations are treated organ-specifically.	Linguistic Conventions - Punctuation	Neutral	5367941
10	doc5	Um neben der ersten Medikamentenstudie mehr evidenzbasiertes Wissen zu generieren, werden weitere Projekte etabliert, u. a. ein internationales PCD-Register.		To generate more evidence-based knowledge in addition to the first drug trial, further projects are being established, including an international PCD registry.	TMT_run1				5367941
11	doc5	Hierüber wird Patienten der Zugang zu klinischen und wissenschaftlichen Studien erleichtert und die Vernetzung behandelnder Zentren gefördert.		This makes it easier for patients to access clinical and scientific studies and promotes the networking of treating centres.	TMT_run1	This makes it easier for patients to access clinical and scientific studies and promotes the networking of treating <tag>centres.</tag>	Linguistic Conventions - Spelling	Minor	5367941
12	doc5	Des Weiteren können Erkenntnisse über eine Genotyp-spezifische Erkrankungsschwere erlangt werden, um folglich die therapeutische Versorgung der Patienten zu verbessern und somit zu individualisieren.		In addition, knowledge about genotype-specific disease severity can be obtained in order to improve the therapeutic care of patients and thus to individualize it.	TMT_run1				5367941
1	doc50	Seit Dezember 2019 hat sich das neuartige Coronavirus SARS-CoV‑2 („severe acute respiratory syndrome coronavirus 2“), das die Erkrankung COVID-19 („coronavirus disease 2019“) auslöst, mit rasanter Geschwindigkeit über die gesamte Welt ausgebreitet.		Since December 2019, the novel coronavirus SARS-CoV‐2 (severe acute respiratory syndrome coronavirus 2), which causes the disease COVID-19 (coronavirus disease 2019), has spread rapidly all over the world.	TMT_run1				5367941
2	doc50	Ausgehend von der chinesischen Provinz Hubei, wurden mittlerweile 29,4 Mio. Menschen weltweit infiziert, und es sind mehr als 930.000 an den Folgen der Erkrankung gestorben (Stand 15.09.2020).		Starting from Hubei, China, 29.4 million people worldwide have now been infected, and more than 930,000 have died as a result of the disease (as of September 15, 2020).	TMT_run1	Starting <tag>from</tag> Hubei, China, 29.4 million people worldwide have now been infected, and more than 930,000 have died as a result of the disease (as of September 15, 2020).	Linguistic Conventions - Grammar	Minor	5367941
2	doc50	Ausgehend von der chinesischen Provinz Hubei, wurden mittlerweile 29,4 Mio. Menschen weltweit infiziert, und es sind mehr als 930.000 an den Folgen der Erkrankung gestorben (Stand 15.09.2020).	Ausgehend von der chinesischen <tag>Provinz</tag> Hubei, wurden mittlerweile 29,4 Mio. Menschen weltweit infiziert, und es sind mehr als 930.000 an den Folgen der Erkrankung gestorben (Stand 15.09.2020).	Starting from Hubei, China, 29.4 million people worldwide have now been infected, and more than 930,000 have died as a result of the disease (as of September 15, 2020).	TMT_run1		Accuracy - Omission	Minor	5367941
3	doc50	Das Virus verbreitet sich durch Tröpfcheninfektion sowie über Aerosole.		The virus spreads by infection with droplets and aerosols.	TMT_run1				5367941
4	doc50	Enger Körperkontakt stellt daher ein deutlich erhöhtes Risiko für eine Übertragung dar.		Therefore, close physical contact poses a significantly increased risk of transmission.	TMT_run1				5367941
5	doc50	Insbesondere bei Untersuchungen mit engem Körperkontakt sollten daher zum Schutz nicht nur der Patienten, sondern auch des medizinischen Personals Maßnahmen ergriffen werden.		Measures should therefore be taken to protect not only patients but also medical personnel, particularly during examinations involving close physical contact.	TMT_run1				5367941
6	doc50	In diesem Artikel werden die aktuellen Empfehlungen von internationalen Fachgesellschaften zur Verwendung von persönlicher Schutzausrüstung sowie ihre lokale Implementierung dargestellt.		This article presents the current recommendations of international professional societies on the use of personal protective equipment as well as their local implementation.	TMT_run1				5367941
1	doc51	Elektrische Unfälle und insbesondere daraus resultierende Kompartmentsyndrome sind herausfordernde Verletzungen in der klinischen Behandlung.		Electrical accidents and especially resulting compartment syndromes are challenging injuries for clinical treatment.	TMT_run1				5367941
2	doc51	Kreatinkinase (CK) und Myoglobin sind bekannte Laborparameter zur Bestimmung eines Kompartmentsyndroms.		Creatine kinase (CK) and myoglobin are known laboratory parameters for determining compartment syndrome.	TMT_run1				5367941
3	doc51	Wir haben Patienten mit elektrischen Verletzungen zwischen 2006 und 2016 in unserer Verbrennungsklinik untersucht.		We studied patients with electrical injuries between 2006 and 2016 in our burn clinic.	TMT_run1				5367941
4	doc51	Wir wollten die Rolle von Myostatin als Marker für das Kompartmentsyndrom durch Serummessungen innerhalb von 24 h nach der Verletzung analysieren.		We sought to analyze the role of myostatin as marker for compartment syndrome by serum measurements within 24 h of injury.	TMT_run1				5367941
5	doc51	Wir haben Daten von 24 Patienten erhoben, die mit einer elektrischen Hochspannungsverletzung stationär behandelt wurden.		We collected data on 24 patients hospitalized with a high voltage electrical injury.	TMT_run1				5367941
6	doc51	Von diesen 24 Patienten konnten wir bei 14 Patienten Myostatinkonzentrationen messen.		Of these 24 patients, we were able to measure myostatin concentrations in 14 patients.	TMT_run1				5367941
7	doc51	Während CK-MB (Kreatinkinase Typ Muscle-Brain [MB]) keine signifikante Korrelation mit einem Kompartmentsyndrom zeigte, zeigten CK und Myostatin einen stark signifikanten Anstieg.		While CK-MB (creatine kinase type Muscle-Brain [MB]) showed no significant correlation with compartment syndrome, CK and myostatin showed a strongly significant increase.	TMT_run1				5367941
8	doc51	Interessanterweise war Myostatin bei elektrischen Verletzungen signifikant erhöht, jedoch nicht bei Verbrennungen, während CK keinen signifikanten Unterschied zeigte.		Interestingly, myostatin was significantly increased in electrical injury but not in burns, while CK did not show a significant difference.	TMT_run1				5367941
9	doc51	Neben CK kann Myostatin somit als zuverlässiger Frühmarker für das Kompartmentsyndrom bei elektrischen Verletzungen dienen.		In addition to CK, myostatin can thus serve as reliable early marker for compartment syndrome in electrical injuries.	TMT_run1				5367941
1	doc57	Der primäre Hyperaldosteronismus (PHA; Conn-Syndrom) ist der häufigste nachweisbare Grund für einen sekundären arteriellen Hypertonus.		Primary hyperaldosteronism (PHA; Conn's syndrome) is the most common detectable reason for secondary arterial hypertension.	TMT_run1				5367941
2	doc57	Primäre Ursachen hierfür sind das Aldosteron-produzierende Adenom (APA) oder eine bilaterale adrenale Hyperplasie (BAH) mit jeweils unterschiedlicher therapeutischer Konsequenz.		Primary causes are aldosterone-producing adenoma (APA) or bilateral adrenal hyperplasia (BAH) with different therapeutic consequences.	TMT_run1				5367941
3	doc57	Weder Screening- und Funktionstests noch die Schnittbildgebung können eine unilateral dominante Hormonproduktion nachweisen.		Neither screening and function tests nor cross-sectional imaging can detect unilaterally dominant hormone production.	TMT_run1				5367941
4	doc57	Neben einer klinischen Übersicht über Ätiologie, Diagnostik und Therapie des PHA werden in diesem Übersichtsartikel die Indikation, die Technik und der Stellenwert der selektiven Nebennierenvenenblutentnahme (NNVBE) ausführlich dargestellt und im Kontext aktueller Literatur diskutiert.		In addition to a clinical overview of the aetiology, diagnosis and treatment of PHA, this review article describes in detail the indication, the technique and the value of selective adrenal vein blood sampling (NNVBE) and discusses it in the context of current literature.	TMT_run1	In addition to a clinical overview of the <tag>aetiology</tag>, diagnosis and treatment of PHA, this review article describes in detail the indication, the technique and the value of selective adrenal vein blood sampling (NNVBE) and discusses it in the context of current literature.	Linguistic Conventions - Spelling	Minor	5367941
5	doc57	Die NNVBE kann mit hoher Erfolgsrate eine unilaterale Dominanz nachweisen oder ausschließen.		NNVBE can demonstrate or exclude unilateral dominance with a high success rate.	TMT_run1				5367941
6	doc57	Patienten mit PHA und unilateralem APA können kurativ durch eine Adrenalektomie behandelt werden.		Patients with PHA and unilateral APA can be treated curatively by adrenalectomy.	TMT_run1				5367941
7	doc57	Die NNVBE ist eine etablierte Intervention zur Subtypisierung des PHA in eine unilaterale oder bilaterale Erkrankung der Nebenniere.		NNVBE is an established intervention for subtyping the PHA into unilateral or bilateral disease of the adrenal gland.	TMT_run1				5367941
8	doc57	· Die Nebennierenvenenblutentnahme (NNVBE) ist eine sichere, zuverlässige und minimalinvasive Methode zur Detektion einer unilateralen oder bilateralen Erkrankung der Nebenniere..		· Adrenal vein blood sampling (NNVBE) is a safe, reliable and minimally invasive method to detect a unilateral or bilateral adrenal gland disease..	TMT_run1				5367941
9	doc57	· Der Nachweis einer Lateralisierung durch die NNVBE hat eine unmittelbare Relevanz für die kurative Therapie des primären Hyperaldosteronismus (PHA)..		· The detection of lateralization by the NNVBE has an immediate relevance for the curative treatment of primary hyperaldosteronism (PHA)..	TMT_run1				5367941
10	doc57	· Die NNVBE kann mit hoher Treffer- und Erfolgsrate ohne Kontrastmittelgabe und mit geringer Strahlenexposition in der Hand eines erfahrenen Untersuchers durchgeführt werden..		· NNVBE can be performed with high accuracy and success rate without contrast medium administration and with low radiation exposure in the hand of an experienced examiner..	TMT_run1				5367941
11	doc57	· Loberg C, Antoch G, Stegbauer J et al.		· Loberg C, Antoch G, Stegbauer J et al.	TMT_run1				5367941
12	doc57	Update: Selective adrenal venous sampling (AVS) – Indication, technique, and significance.		Update: Selective adrenal venous sampling (AVS) - Indication, technique, and significance.	TMT_run1				5367941
13	doc57	Fortschr Röntgenstr 2020;		Fortschr Röntgenstr 2020;	TMT_run1				5367941
14	doc57	DOI: 10.1055/a-1299-1878.		DOI: 10.1055/a-1299-1878.	TMT_run1				5367941
1	doc58	Im Fokus des außerordentlichen Symposium-Webinars der Arbeitsgruppe urologische Forschung (AuF) stand der Themenkomplex „Forschung im Kontext zwischen Universität und Pharma“.		The extraordinary symposium webinar of the working group on urological research (AuF) focused on the topic “Research in the Context between University and Pharmaceuticals”.	TMT_run1				5367941
2	doc58	Die virtuelle Tagung widmete sich damit der bedeutenden und bisweilen weniger beachteten Herausforderung, die Brücke von der Laborbank in die Anwendung zu schlagen und Erfolg versprechende Ergebnisse aus universitären Forschungsprojekten gemeinsam mit der pharmazeutischen und medizintechnischen Industrie umzusetzen.		The virtual conference thus addressed the important and sometimes less recognized challenge of building the bridge from the laboratory bank to application and implementing promising results from university research projects together with the pharmaceutical and medical technology industries.	TMT_run1	The virtual conference thus addressed the important and sometimes less recognized challenge of <tag>building the bridge</tag> from the laboratory bank to application and implementing promising results from university research projects together with the pharmaceutical and medical technology industries.	Style - Non-fluent	Minor	5367941
3	doc58	Dabei wurden verschiedene relevante Fragen und Problemstellungen definiert und diese sowohl aus der Perspektive von Projektleitern aus Kliniken und Laboren als auch von Managern der pharmazeutischen Industrie und aus dem Bereich des Patentrechts mit einem ebenso interdisziplinären Teilnehmerkreis aus Urologie, Pathologie und Naturwissenschaften erörtert.		Several relevant problems and issues were defined and discussed from the perspective of project managers from clinics and laboratories as well as managers of the pharmaceutical industry and from the field of patent law with an equally interdisciplinary group of participants from urology, pathology and natural sciences.	TMT_run1				5367941
1	doc59	Thoraxschmerzen sind ein häufiges Symptom, mit dem sich Patienten in der hausärztlichen Praxis vorstellen.		Chest pain is a common symptom that patients present with in primary care practice.	TMT_run1				5367941
2	doc59	Patienten mit akuten Brustschmerzen stellen eine diagnostische Herausforderung für den niedergelassenen Arzt dar, weil ein breites Spektrum von Diagnosen infrage kommt, vom lebensbedrohlichen akuten Myokardinfarkt und der Lungenarterienembolie bis hin zu wesentlich häufigeren Ursachen, wie einer harmlosen muskulären Verspannung aus der Gruppe der sogenannten Brustwandsyndrome oder gastrointestinalen Störungen, beispielsweise einer Refluxkrankheit.		Patients with acute chest pain represent a diagnostic challenge for the general practitioner, because a wide range of diagnoses are possible, from life-threatening acute myocardial infarction and pulmonary artery embolism to much more frequent causes, such as harmless muscular tension from the group of so-called chest wall syndromes or gastrointestinal disorders, for example reflux disease.	TMT_run1				5367941
3	doc59	Die klinische Evaluation von Patienten mit akuten Brustschmerzen folgt unabhängig vom Ort der Untersuchung dem Prinzip einer gründlichen klinischen Einschätzung durch den Arzt mit körperlicher Untersuchung und Anamnese.		The clinical evaluation of patients with acute chest pain follows the principle of a thorough clinical assessment by the physician with physical examination and anamnesis, regardless of the location of the examination.	TMT_run1				5367941
4	doc59	Darauf folgen weitere technische Untersuchungen wie ein 12-Kanal-Elektrokardiogramm und eine gezielte Labordiagnostik mit Point-of-care-Tests (unter anderem Troponin und D‑Dimere).		This is followed by further technical investigations such as a 12-lead electrocardiogram and targeted laboratory diagnostics with point-of-care tests (including troponin and D-dimers).	TMT_run1				5367941
5	doc59	Diagnostische Pfade und Score-Systeme wie der Marburger Herz-Score wurden eigens dafür entwickelt, in der hausärztlichen Praxis eine Einschätzung zu ermöglichen und Orientierung zu geben.		Diagnostic pathways and score systems such as the Marburger Herz Score have been specially developed to enable assessment and provide orientation in the general practice.	TMT_run1				5367941
1	doc63	Im vorliegenden Artikel wird auf die Rolle von Alkohol in unserer Gesellschaft sowie auf dessen Bedeutung für Jugendliche eingegangen.		This article discusses the role of alcohol in our society and its importance for young people.	TMT_run1				5367941
2	doc63	Spezifika der Wechselwirkung von Alkohol und dem adoleszenten Gehirn werden erläutert und die epidemiologische Entwicklung des Alkoholkonsums bei österreichischen Minderjährigen beschrieben.		Specifics of the interaction of alcohol and the adolescent brain are explained and the epidemiological development of alcohol consumption in Austrian minors is described.	TMT_run1				5367941
3	doc63	Es werden darüber hinaus relevanteRisiken für problematische Konsummuster und mögliche Wege zur Prävention erörtert.		Relevant risks for problematic patterns of consumption and possible ways of prevention are also discussed.	TMT_run1				5367941
1	doc64	Die thermische Ablation der Stammvarikose hat sich zu einem Standardverfahren in der Behandlung des Krampfaderleidens entwickelt.		Thermal ablation of stem varicose veins has become a standard procedure in the treatment of varicose veins.	TMT_run1				5367941
2	doc64	Der klinische Erfolg der endovenös-thermischen Verfahren ist vergleichbar mit der Stripping-Operation, ein signifikanter Unterschied zwischen diesen Gruppen konnte in Langzeitanalysen nicht nachgewiesen werden.		The clinical success of endovenous thermal procedures is comparable to stripping surgery. A significant difference between these groups could not be detected in long-term analyses.	TMT_run1				5367941
3	doc64	Lediglich in der Genese der mit Duplexultraschall-detektierten Krossenrezidive gibt es einen Unterschied: Eine Neoangiogenese tritt nach Stripping-Operation auf, ein Rezidiv über eine belassene V. saphena accessoria anterior vorwiegend nach endovenöser Ablation der Stammvene.		There is only a difference in the genesis of the goiter recurrences detected with duplex ultrasound: neoangiogenesis occurs after stripping surgery, recurrence via a left untreated anterior saphenous vein predominantly after endovenous ablation of the saphenous vein.	TMT_run1				5367941
4	doc64	Kosteneinsparungen durch vermehrt ambulant durchgeführte endovenöse Verfahren im Vergleich zur Stripping-Operation, die immer noch (im Vergleich zu anderen Ländern) in Deutschland oft stationär durchgeführt wird, sind inzwischen nachgewiesen.		Cost savings due to increased outpatient endovenous procedures in comparison to stripping surgery, which is still often performed inpatiently (in comparison to other countries) in Germany, have now been demonstrated.	TMT_run1				5367941
5	doc64	Eine endovenöse Krossektomie sollte angestrebt werden.		Endovenous crossectomy should be aimed for.	TMT_run1				5367941
6	doc64	Nichtthermische endoluminale Katheterverfahren sind vorwiegend der Behandlung der V. saphena parva vorbehalten.		Non-thermal endoluminal catheter procedures are primarily reserved for the treatment of the saphenous vein parva.	TMT_run1				5367941
1	doc7	Von den klinisch verfügbaren Biomarkern sind die natriuretischen Peptide (NP) die robustesten Prädiktoren für die Diagnose und Prognose bei Herzinsuffizienz (HI).		Of the clinically available biomarkers, natriuretic peptides (NP) are the most robust predictors of diagnosis and prognosis in heart failure (HF).	TMT_run1				5367941
2	doc7	Der prognostische Wert ist insbesondere bei serieller Bestimmung der NP hoch, sodass der klinische Einsatz in internationalen HI-Leitlinien mit höchster Evidenz und Empfehlung weiter in den Vordergrund gerückt ist.		The prognostic value is high, especially with serial determination of NP. Thus, clinical use in international HI guidelines with the highest evidence and recommendation has become more prominent.	TMT_run1				5367941
3	doc7	Das Konzept der sequenziellen NP-Messungen dient der Erfassung der Natrium- und Wasserüberladung zu klinisch definierten Zeitpunkten.		The concept of sequential NP measurements serves to record sodium and water overload at clinically defined time points.	TMT_run1				5367941
4	doc7	Ziel eines NP-unterstützten Behandlungsplans ist, nicht nur die Dynamik des klinischen Therapieansprechens zu objektivieren, sondern den individuellen Therapieverlauf klinischen Szenarien zuzuordnen, die ihrerseits eine wesentliche Rolle für die Risikostratifizierung, Prognose und Notwendigkeiten von Therapieoptimierung in der stationären, aber auch ambulanten Versorgung spielen.		The aim of an NP-supported treatment plan is not only to objectify the dynamics of the clinical treatment response, but also to assign the individual course of therapy to clinical scenarios, which in turn play an essential role for risk stratification, prognosis and necessities of therapy optimization in inpatient as well as outpatient care.	TMT_run1				5367941
1	doc70	HINTERGRUND: Die Versorgung von Patellafrakturen ist technisch anspruchsvoll.		BACKGROUND: Patellar fracture management is technically demanding.	TMT_run1				5367941
2	doc70	Auch wenn die radiologischen Ergebnisse zumeist zufriedenstellend sind, deckt sich dies häufig nicht mit der subjektiven Einschätzung der Patienten.		Although the radiological results are mostly satisfactory, this often does not coincide with the subjective assessment of the patients.	TMT_run1				5367941
3	doc70	Die klassische Versorgung mittels Drahtzuggurtung weist einige Komplikationen auf.		The classical restoration by means of wire-pull hardening has some complications.	TMT_run1				5367941
4	doc70	Die winkelstabile Plattenosteosynthese hat sich in den letzten Jahren biomechanisch als vorteilhaft erwiesen.		Angularly stable plate osteosynthesis has proven to be biomechanically advantageous in recent years.	TMT_run1				5367941
5	doc70	Von wem werden Patellafrakturen in Deutschland versorgt?		Who cares for patella fractures in Germany?	TMT_run1				5367941
6	doc70	Wie sieht der aktuelle Versorgungsstandard aus?		What is the current standard of care?	TMT_run1				5367941
7	doc70	Haben sich „moderne“ Osteosyntheseformen durchgesetzt?		Have "modern" forms of osteosynthesis prevailed?	TMT_run1				5367941
