SEG_ID	Doc	Source	Tagged_Source	Target	MT	Tagged_Target	Error Category	Severity	Annotator_ID
1	doc100	Neben der eigentlichen definitiven Therapie einer akuten Blutung (z. B. durch endoskopische/operative Blutstillung oder Angiografie mit Coiling) kommt in der Akut- und Intensivmedizin der Optimierung der Blutgerinnung eine Schlüsselrolle zu.		In addition to the actual definitive treatment of acute bleeding (e. g. by endoscopic/operative haemostasis or angiography with coiling), optimisation of blood coagulation plays a key role in acute and intensive care medicine.	TMT_run1				5367941
2	doc100	Dazu ist die Kenntnis der gängigen Gerinnungstests und ihrer Schwächen ebenso notwendig wie die korrekte Anwendung und Dosierung von Gerinnungsprodukten.		This requires knowledge of current coagulation tests and their weaknesses, as well as the correct use and dosage of coagulation products.	TMT_run1				5367941
3	doc100	Das Gerinnungsmanagement kann insbesondere bei Patienten mit Leberzirrhose, angeborenen und erworbenen Gerinnungsstörungen sowie bei Patienten unter Antikoagulation herausfordernd sein.		Coagulation management can be especially challenging in patients with with cirrhosis of the liver, congenital and acquired coagulation disorders, and in patients on anticoagulation.	TMT_run1	Coagulation management can be especially challenging in patients <tag>with</tag> with cirrhosis of the liver, congenital and acquired coagulation disorders, and in patients on anticoagulation.	Linguistic Conventions - Grammar	Major	5367941
4	doc100	Dieses Review beleuchtet die wichtigsten Elemente der Gerinnungsdiagnostik und -therapie in der gastroenterologischen Intensiv- und Notfallmedizin inklusive neuer Antidote und erweiterter Gerinnungsdiagnostik bei Patienten mit Leberzirrhose, wie z.		This review highlights the most important elements of coagulation diagnostics and therapy in gastroenterological intensive care and emergency medicine, including new antidotes and extended coagulation diagnostics in patients with liver cirrhosis, e.g.	TMT_run1				5367941
5	doc100	B. die Thrombelastometrie.		thrombelastometry, for example.	TMT_run1	<tag>thrombelastometry</tag>, for example.	Linguistic Conventions - Spelling	Minor	5367941
1	doc12	LABORCHEMISCHE GERINNUNGSAUFFäLLIGKEITEN BEI COVID-19: COVID-19-Patienten weisen häufig stark erhöhte D-Dimer-Werte auf.		LABORATORY CHEMICAL CLOTTING ABNORMALITIES IN COVID-19: COVID-19 patients often present severely elevated D-dimer levels.	TMT_run1				5367941
2	doc12	Die Höhe und der Verlauf scheinen mit dem Krankheitsverlauf und der Prognose zu korrelieren.		The level and course seem to correlate with disease progression and prognosis.	TMT_run1				5367941
3	doc12	Bei signifikanter Erhöhung sollte eine medikamentöse Thromboseprophylaxe erwogen werden.		Medicinal thrombosis prophylaxis should be considered in case of significant increase.	TMT_run1				5367941
4	doc12	Der Verlauf der Prothrombinfragmente F1 + F2 scheint ebenfalls mit dem klinischen Verlauf zu korrelieren und könnte bei Verfügbarkeit zur Verlaufsbeurteilung der Gerinnungsaktivierung mit herangezogen werden.		The course of prothrombin fragments F1 + F2 also appears to correlate with the clinical course and, if available, could be used to assess the course of coagulation activation.	TMT_run1				5367941
5	doc12	Thrombozytopenien bei COVID-19-Erkrankten sind häufig, sollten jedoch mittels weiterführender Diagnostik auf Differenzialdiagnosen geprüft werden.		Thrombocytopenia in COVID-19 patients is common, but should be evaluated for differential diagnoses by means of further diagnostics.	TMT_run1				5367941
6	doc12	RISIKO THROMBOEMBOLISCHER KOMPLIKATIONEN BEI COVID-19: COVID-19-Erkrankte haben ein deutlich erhöhtes Risiko für venöse und arterielle thromboembolische Ereignisse, und insbesondere intensivmedizinisch betreute Patienten bedürfen einer engmaschigen Kontrolle.		RISK OF THROMBOEMBOLIC COMPLICATIONS IN COVID-19: COVID-19 patients have a significantly increased risk of venous and arterial thromboembolic events, and especially intensive care patients require close monitoring.	TMT_run1				5367941
7	doc12	Bestehende Algorithmen zur Diagnostik einer Lungenarterienembolie können wegen der sehr häufigen Konstellation „pulmonale Symptome + erhöhte D-Dimere“ bei COVID-19 nur eingeschränkt angewendet werden und bedürfen einer Anpassung an diese Erkrankung.		Existing algorithms for the diagnosis of pulmonary artery embolism can only be used to a limited extent in COVID-19 due to the very common constellation of "pulmonary symptoms + elevated D-dimers" and require adaptation to this disease.	TMT_run1				5367941
8	doc12	Bei Lungenarterienembolien handelt es sich wahrscheinlich um lokal entstandene „Immunothrombosen“, was bei der Befundinterpretation einer pulmonalen Bildgebung zu beachten ist.		Pulmonary artery embolism is likely to be a locally occurring “immunothrombosis”, which should be taken into account when interpreting the findings of pulmonary imaging.	TMT_run1				5367941
9	doc12	EMPFEHLUNGEN ZUR THROMBOSEPROPHYLAXE BEI COVID-19: Aufgrund des überdurchschnittlich hohen VTE-Risikos hospitalisierter COVID-19-Patienten sollte eine leitliniengerechte Thromboseprophylaxe unbedingt durchgeführt werden – bei Patienten mit besonders hohem Basisrisiko sollten höhere Heparindosierungen, posthospitale Verlängerungen und ggf. sogar primär ambulante Thromboseprophylaxestrategien erwogen werden.		RECOMMENDATIONS FOR THROMBOSIS PROPHYLAXIS IN COVID-19: Due to the above-average risk of VTE in hospitalized COVID-19 patients, guideline-compliant thrombosis prophylaxis should be performed without fail – in patients with a particularly high basic risk, higher heparin doses, post-hospital extensions and possibly even primary outpatient thrombosis prophylaxis strategies should be considered.	TMT_run1				5367941
10	doc12	Eine bereits vor der COVID-19-Erkrankung etablierte Antikoagulationstherapie (bspw. für Vorhofflimmern oder frühere VTE) sollte fortgeführt werden.		Anticoagulant therapy (e.g., for atrial fibrillation or previous VTE) established prior to COVID-19 disease should be continued.	TMT_run1				5367941
1	doc13	Ziel der Medizininformatikinitiative und weiterer nationaler und lokaler Projekte zur digitalen Vernetzung im Gesundheitswesen ist die datenschutzkonforme Bereitstellung, der Austausch und die gemeinsame Nutzung von Patientendaten.		The aim of the Medical Informatics Initiative and other national and local projects for digital networking in healthcare sector is the provision, exchange and sharing of patient data in compliance with data protection regulations.	TMT_run1				5367941
2	doc13	Dies erfordert die Integration von Daten aus unterschiedlichen Quellen – beispielsweise aus digitalen Arbeitsplatzsystemen, Laborsystemen, PAC-Systemen („patient archieving and communication“) oder Tumorboards – in ein Data Warehouse oder Forschungsdatenbanken.		This requires the integration of data from different sources–such as from digital workplace systems, laboratory systems, PAC systems ("patient archieving and communication") or tumour boards–into a data warehouse or research database.	TMT_run1				5367941
3	doc13	Die zunehmende digitale Vernetzung von Leistungserbringern und Forschungseinrichtungen im Gesundheitswesen wird in Zukunft noch mehr Patienten den Zugang zu Hochleistungs- und Präzisionsmedizin (Stichwort virtuelle molekulare Tumorboards) öffnen und dabei Daten für Grundlagen- und Versorgungsforschung liefern.		The increasing digital networking of service providers and research institutions will open access to high-performance and precision medicine (keyword virtual molecular tumour boards) for even more patients in the future, thereby providing data for basic and healthcare research.	TMT_run1				5367941
4	doc13	Mit dieser Form der Netzwerkmedizin schaffen wir einerseits die Verbindung von Grundlagen- (z. B. Genomforschung) und Patientenversorgung, gleichermaßen kann mit den aufbereiteten Real-world-Daten die Behandlungsrealität und -qualität im Sinne einer integrierten Versorgungsforschung detailliert abgebildet werden.		With this form of network medicine, we create the connection between basic research (e.g. genome research) and patient care. Likewise, with the processed real-world data, treatment reality and quality can be mapped in detail in the sense of integrated health care research.	TMT_run1				5367941
1	doc14	In den vergangenen Jahren wurden zunehmend Systeme der künstlichen Intelligenz in der Medizin etabliert, die Pathologien oder Erkrankungen erkennen und schwer zu erfassende Zusammenhänge zwischen Eingangsgrößen beschreiben sollen.		In recent years, artificial intelligence systems have increasingly been established in medicine to detect pathologies or diseases and to describe difficult-to-understand correlations between input variables.	TMT_run1				5367941
2	doc14	Ziel der Studie ist es, anhand von biometrischen Messgrößen vor der Kataraktoperation die physikalische Position der Intraokularlinse nach der Operation mit Verfahren des maschinellen Lernens vorherzusagen. 249 Augen von Patienten, die sich zur elektiven Kataraktoperation an der Augenklinik Castrop-Rauxel vorstellten, wurden mit dem IOLMaster 700 (Carl Zeiss Meditec) und vor sowie nach der Operation mit dem Casia 2 (Tomey) untersucht.		The purpose of the study is to use biometric measures before cataract surgery to predict the physical position of the intraocular lens after surgery with machine learning procedures. 249 eyes of patients who presented for elective cataract surgery at the Castrop-Rauxel Ophthalmology Clinic were examined with the IOLMaster 700 (Carl Zeiss Meditec) and before and after surgery with the Casia 2 (Tomey).	TMT_run1				5367941
3	doc14	Aus den Effektgrößen Augenlänge, Hornhautdicke, interne Vorderkammertiefe, Linsendicke, mittlerer Hornhautradius und Hornhautdurchmesser wurde eine Auswahl von 17 Algorithmen des Maschinenlernens auf ihre Vorhersagequalität hin getestet für die Bestimmung der postoperativen internen Vorderkammertiefe (AQD_post) und der Lage des Linsenäquators relativ zum Hornhautscheitel (LEQ_post).		From the effect sizes eye length, corneal thickness, internal anterior chamber depth, lens thickness, mean corneal radius and corneal diameter, a selection of 17 machine learning algorithms were tested for prediction performance for determining the postoperative internal anterior chamber depth (AQD_post) and the position of the lens equator relative to the corneal apex (LEQ_post).	TMT_run1				5367941
4	doc14	Die 17 Modelle (4 Algorithmusfamilien) variierten im mittleren quadratischen/mittleren absoluten Vorhersagefehler zwischen 0,187/0,139 mm und 0,255/0,204 mm (AQD_post) und 0,183/0,135 mm und 0,253/0,206 mm (LEQ_post) bei einer Kreuzvalidierung (5-fold cross validation).		The 17 models (4 algorithm families) varied in mean square/mean absolute prediction error between 0.187/0.139 mm and 0.255/0.204 mm (AQD_post) and 0.183/0.135 mm and 0.253/0.206 mm (LEQ_post) on cross validation techniques (5-fold cross validation).	TMT_run1				5367941
5	doc14	Der Algorithmus mit der besten Performance war bei beiden Vorhersagen ein Gaussian Process Regression Model mit einem exponentiellen Kernel.		The best performance algorithm for both predictions was the Gaussian Process Regression Model using an exponential kernel.	TMT_run1				5367941
6	doc14	Prüft man am gesamten Datensatz (ohne Aufteilung in Trainings- und Validierungsdaten) ein einfaches multiples lineares Regressionsmodell gegen den Algorithmus mit der besten Performance, so ergibt sich bei der Vorhersage von AQD_post/LEQ_post ein mittlerer quadratischer Vorhersagefehler von 0,188/0,187 mm gegenüber dem Gaussian Process Regression Model mit 0,166/0,159 mm.		If a simple multiple linear regression model against the algorithm with the best performance is tested on the entire dataset (without division into training and validation data), a mean square prediction error of 0.188/0.187 mm results in the prediction of AQD_post/LEQ_post compared to the Gaussian Process Regression Model with 0.166/0.159 mm.	TMT_run1				5367941
7	doc14	In der Arbeit soll das Prinzip des überwachten Maschinenlernens in der Anwendung auf die Nachbildung der physikalisch gemessenen postoperativen axialen Position von Intraokularlinsen gezeigt werden.		The aim of this paper is to show the principles of supervised machine learning applied to the simulation of the physically measured postoperative axial position of the intraocular lenses.	TMT_run1				5367941
8	doc14	Bei den vorliegenden Daten ist der Gewinn durch die Verwendung von Algorithmen des maschinellen Lernens (bei den hier verwendeten Algorithmen) gegenüber einem multiplen linearen Regressionsansatz gering.		In the present data, the gain from using machine learning algorithms (in the algorithms used here) is small compared to a multiple linear regression approach.	TMT_run1				5367941
1	doc2	MEDIKAMENTöSE THERAPIE:  Die aktualisierte Dyslipidämie-Leitlinie der European Society of Cardiology senkt nochmals die LDL-Cholesterinzielwerte.		DRUG THERAPY: The updated dyslipidemia guideline of the European Society of Cardiology further reduces the LDL cholesterol target values.	TMT_run1				5367941
2	doc2	Zur Erreichung dieser Zielwerte werden hochpotente Statine und vermehrt Kombinationspartner wie Ezetimib und PCSK9-Hemmer nötig werden.		To achieve these targets, highly potent statins and more combination partners such as ezetimibe and PCSK9 inhibitors will be required.	TMT_run1				5367941
3	doc2	LIPIDAPHERESE:  Die Bestimmung von Lipoprotein(a) zur kardiovaskulären Risikostratifizierung ist nun eine Klasse-II(a)-Empfehlung.		LIPIDAPHERESIS: The determination of lipoprotein(a) for cardiovascular risk stratification is now a class II(a) recommendation.	TMT_run1				5367941
4	doc2	Momentan steht lediglich die Lipidapherese zur Senkung von Lipoprotein(a) zur Verfügung, neue medikamentöse Therapieansätze sind allerdings in der klinischen Erprobung.		Currently, lipid apheresis is only available to reduce lipoprotein(a), but new drug therapeutic approaches are in clinical trials.	TMT_run1				5367941
1	doc20	Persistierende, große oder chronische Makulaforamina sind nach wie vor eine chirurgische Herausforderung, die mit der hier dargestellten Technik angegangen werden kann.		Persistent, large or chronic macular holes are still a surgical challenge, which can be addressed with the technique presented here.	TMT_run1				5367941
2	doc20	Im Rahmen einer transkonjunktivalen, nahtlosen Pars-plana-Vitrektomie wird mittels subretinaler BSS(„balanced salt solution“)-Injektion am hinteren Pol die Makularegion eleviert und anschließend das Foramen während des Flüssigkeit-Luft-Austausches verschlossen, gefolgt von einer Gas- oder Öltamponade.		As part of a transconjunctival, sutureless pars plana vitrectomy, the macular region is elevated at the posterior pole by means of subretinal BSS (balanced salt solution) injection and the foramen is then closed during fluid-air exchange, followed by gas or oil tamponade.	TMT_run1				5367941
3	doc20	Damit lassen sich in vielen Fällen anatomische Verschlüsse bzw. deutliche Verkleinerungen des Loches mit anliegendem Rand erreichen.		In this way, anatomical closures or significant reductions in the size of the hole with adjacent edges can be achieved in many cases.	TMT_run1				5367941
4	doc20	Die genaue Aufklärung der Patienten über das zu erwartende chirurgische Ergebnis erscheint besonders wichtig.		The precise patient information about the expected surgical outcome appears to be particularly important.	TMT_run1				5367941
1	doc27	Trotz der hohen Effektivität der direkt antiviralen Therapie der chronischen Hepatitis C kommt es bei einem kleinen Teil der Patienten zu einem fehlenden virologischen Ansprechen auf die zugelassenen Therapieregime.		Despite the high effectiveness of direct antiviral therapy for chronic hepatitis C, a small proportion of patients experience a lack of virological response to the approved regimens.	TMT_run1				5367941
2	doc27	Die Kombinationstherapie aus Voxilaprevir, Velpatasvir, Sofosbuvir wurde kürzlich für die Therapie von Patienten mit Versagen auf eine NS5A-basierte Behandlung zugelassen.		The combination therapy of Voxilaprevir, Velpatasvir, Sofosbuvir was recently approved for the treatment of patients with failure to NS5A-based treatment.	TMT_run1				5367941
3	doc27	In der vorliegenden Deutschen Register-Kohorte wurde bei Patienten einschließlich solcher mit Zirrhose und vorangegangener Dekompensation bei einer Therapie mit VOX/VEL/SOF über 12 Wochen hohe SVR-Raten unabhängig von der Schwere der Erkrankung und vorheriger DAA-Therapien erreicht.		In the present German registry cohort, high SVR rates were achieved in patients treated with VOX/VEL/SOF for 12 weeks, regardless of disease severity and prior DAA therapies, including those with cirrhosis and prior decompensation.	TMT_run1				5367941
4	doc27	Dabei wurden lediglich geringe bis mäßige Nebenwirkungen beobachtet, die sich nicht von denen in den Zulassungsstudien unterschieden.		Only mild to moderate adverse reactions were observed, which did not differ from those observed in the pivotal studies.	TMT_run1				5367941
1	doc3	Hintergrund: Es wurde die Multicomponent-Multitarget-Therapie SUC (Solidago compositum ad us. vet., Ubichinon compositum und Coenzym compositum, Heel GmbH, Baden-Baden, Deutschland) mit dem bekannten Angiotensin-Converting-Enzym-Inhibitor (ACEI) Benazepril in einer prospektiven, nichtrandomisierten, zweiarmigen Kohortenstudie an Katzen mit chronischer Nierenerkrankung (CNE) untersucht.		Background: The multicomponent multitarget therapy SUC (Solidago compositum ad us. vet., Ubichinon compositum and Coenzym compositum, Heel GmbH, Baden-Baden, Germany) with the well-known angiotensin converting enzyme inhibitor (ACEI) benazepril was investigated in a prospective, nonrandomized, two-arm cohort study of cats with chronic kidney disease (CNE).	TMT_run1				5367941
2	doc3	Ziel war es, die Verträglichkeit und Wirksamkeit von SUC bei Katzen mit CNE zu beurteilen.		The objective was to assess the tolerability and effectiveness of SUC in cats with CKD.	TMT_run1				5367941
3	doc3	Material und Methoden: Einhundertsechsunddreißig Katzen mit Verdacht auf CNE wurden untersucht, bei 70 Katzen wurde eine CNE diagnostiziert und diese wurden in die Studie aufgenommen.		Material and methods: One hundred and thirty-six cats with suspected CKD were evaluated, 70 cats were diagnosed with CKD and these were included in the study.	TMT_run1				5367941
4	doc3	Dreiunddreißig Katzen wurden mit SUC therapiert und 35 Katzen erhielten Benazepril.		Thirty-three cats were treated with SUC and 35 cats received benazepril.	TMT_run1				5367941
5	doc3	Der Beobachtungszeitraum betrug 168 Tage.		The observation period was 168 days.	TMT_run1				5367941
6	doc3	Das Ansprechen auf die Therapie wurde definiert als ein verbessertes bzw. ein stabiles Serumkreatinin am Ende der Studie im Vergleich zum Ausgangswert.		Response to therapy was defined as improved or stable serum creatinine at the end of the study compared to baseline.	TMT_run1				5367941
7	doc3	Zusätzlich wurde zur Bewertung der Lebensqualität der Katzen ein klinischer Summenscore erfasst.		In addition, a clinical sum score was recorded to assess the quality of life of the cats.	TMT_run1				5367941
8	doc3	Ergebnisse: Das Kreatinin blieb in beiden Studiengruppen nahezu unverändert, mit geringgradig niedrigeren Werten in der SUC-Gruppe.		Results: Creatinine remained almost unchanged in both study groups, with slightly lower values in the SUC group.	TMT_run1				5367941
9	doc3	Der klinische Summenscore verbesserte sich in der SUC-Gruppe im Vergleich zur Benazepril-Gruppe signifikant an den Tagen 3, 28, 56 und 112, nicht aber am Tag 168.		The clinical summary score improved significantly in the SUC group compared to the benazepril group on days 3, 28, 56 and 112, but not on day 168.	TMT_run1				5367941
10	doc3	Schlussfolgerungen: Die Ergebnisse zeigen, dass SUC eine neuartige und gut verträgliche Behandlungsalternative zu ACEIs bei Katzen mit leichter bis mittelschwerer CNE darstellt.		Conclusions: The results show that SUC is a novel and well-tolerated treatment alternative to ACEIs in cats with mild to moderate CKD.	TMT_run1				5367941
11	doc3	Die Ergebnisse deuten darauf hin, dass eine zweimal wöchentliche Therapie mit SUC effektiver sein könnte als eine Dosierung einmal pro Woche.		The results suggest that twice weekly therapy with SUC may be more effective than once weekly dosing.	TMT_run1				5367941
1	doc30	HINTERGRUND: Die Pathogenese beim Plattenepithelkarzinom der Kopf- und Halsregion (HNSCC, „head and neck squamous cell carcinoma“) ist ein komplexer Mehrstufenprozess und resultiert aus der Interaktion von exogenen und endogenen zellulären Prozessen.		Background: The pathogenesis in squamous cell carcinoma of the head and neck region (HNSCC, "head and neck squamous cell carcinoma") is a complex and multistage process and results from the interaction of exogenous and endogenous cellular processes.	TMT_run1				5367941
2	doc30	Jeder Prozess hinterlässt ein charakteristisches Muster an Mutationen auf dem Tumorgenom, eine sog.		Each process leaves behind a characteristic pattern of mutations on the tumour genome, a so-called.	TMT_run1				5367941
3	doc30	Tumorsignatur.		Tumor signature.	TMT_run1				5367941
4	doc30	Gegenstand aktueller Studien ist es, spezifische Tumorsignaturen, die während der HNSCC-Pathogenese wirksam sind, zu finden und die prognostische Relevanz zu evaluieren.		The subject of current studies is to find specific tumor signatures that are effective during HNSCC pathogenesis and to evaluate the prognostic relevance.	TMT_run1				5367941
5	doc30	Mit Analysen von genomischen Sequenzierungsdaten durch The Cancer Genome Atlas (TCGA) wurden die häufigsten Mutationssignaturen beim HNSCC entschlüsselt, wobei die Signaturen 1, 2, 4, 5, 7 und 13 als hauptsächliche Akteure identifiziert werden konnten.		Analyses of genomic sequencing data by The Cancer Genome Atlas (TCGA) decoded the most common mutation signatures in HNSCC. Signatures 1, 2, 4, 5, 7 and 13 could be identified as the main actors.	TMT_run1				5367941
6	doc30	Die Signatur 16 wurde erstmalig bei humane Papillomaviren (HPV-)negativen oralen und oropharyngealen Plattenepithelkarzinomen entdeckt.		Signature 16 was first discovered in human papillomavirus (HPV)-negative oral and oropharyngeal squamous cell carcinomas.	TMT_run1				5367941
7	doc30	In vielen Studien wurde eine Assoziation der Signatur 16 mit dem Alkohol- und Tabakkonsum gezeigt sowie ein negativer Einfluss auf die Prognose der Patienten festgestellt.		In many studies, an association of the signature 16 with alcohol and tobacco consumption as well as a negative influence on the prognosis of the patients.	TMT_run1				5367941
1	doc34	GRUNDLAGEN: Fibroblast-Growth-Factor 21 (FGF21) wird in der Leber produziert und bindet an verschiedene komplexe Rezeptor/Corezeptor-Systeme.		Background: Fibroblast growth factor 21 (FGF21) is produced in the liver and binds to different complex receptor/coreceptor systems.	TMT_run1				5367941
2	doc34	FGF21 reguliert neben vielen anderen Prozessen die Aufnahme von einfachem Zucker und Alkohol.		FGF21 regulates the absorption of simple sugars and alcohol, among many other processes.	TMT_run1				5367941
3	doc34	Erhöhte FGF21-Spiegel verringern den schädlichen Alkoholkonsum bei Mäusen.		Increased FGF21 levels reduce harmful alcohol consumption in mice.	TMT_run1				5367941
4	doc34	Um die Beziehung zwischen FGF21 und Alkoholkonsum beim Menschen besser zu verstehen, wurden FGF21-Spiegel bei PatientInnen mit alkoholischer Leberzirrhose (ALC) im Vergleich zu PatientInnen mit nichtalkoholischer Leberzirrhose (NALC) und gesunden Personen gemessen und in Korrelation mit ihrem gegenwärtigen Alkoholkonsum analysiert.		To better understand the relationship between FGF21 and alcohol consumption in humans, FGF21 levels were measured in patients with alcoholic liver cirrhosis (ALC) in comparison to patients with nonalcoholic liver cirrhosis (NALC) and healthy individuals and analyzed in correlation with their current alcohol consumption.	TMT_run1				5367941
5	doc34	Der Alkoholkonsum wurde durch Ethylglukuronid(uETG)-Werte im Urin, das Ess- und Trinkverhalten durch einen Lebensmittelfrequenz-Fragebogen verifiziert, und die FGF21-Plasmaspiegel wurden mittels ELISA bei 96 Personen bestimmt (ALC n = 41; NALC n = 34; gesund n = 21).		Alcohol consumption was verified by urinary ethyl glucuronide (uETG) levels, eating and drinking behaviors were verified by a food frequency questionnaire, and FGF21 plasma levels were determined by ELISA in 96 individuals (ALC n = 41; NALC n = 34; healthy n = 21).	TMT_run1				5367941
6	doc34	ALC- und NALC-PatientInnen mit erhöhten ETG-Spiegeln (≥0,5 μg/ml; entspricht Alkoholkonsum in den letzten 12–72 h) zeigten signifikant höhere FGF21-Plasmaspiegel im Vergleich zu Patienten mit negativen ETG-Spiegeln.		Both ALC and NALC patients with elevated ETG levels (≥0.5 μg/ml; equivalent to alcohol consumption in the last 12–72 h) showed significantly higher FGF21 plasma levels in comparison to patients with negative ETG levels.	TMT_run1				5367941
7	doc34	Das Essverhalten hatte keinen Einfluss auf die FGF21-Plasmaspiegel.		Eating behaviour did not have an effect on FGF21 plasma levels.	TMT_run1	Eating <tag>behaviour</tag> did not have an effect on FGF21 plasma levels.	Linguistic Conventions - Spelling	Minor	5367941
