SEG_ID	Doc	Source	Tagged_Source	Target	MT	Tagged_Target	Error Category	Severity	Annotator_ID
2	doc12	This study aimed to investigate (a) the psychometric properties and the internal consistency reliability of the Italian version of SCORE-15, (b) clinical responsiveness, and (c) normative (Italian) criteria. 		本研究旨在研究（a）意大利版SCORE-15的心理测量学特性和内部一致性可靠性，（b）临床反应性和（c）规范性（意大利）标准。 	Huawei_AGI_run2	本研究旨在研究（a）意大利版SCORE-15的心理测量学特性和内部一致性可靠性，（b）临床反应性和（c）规范性（<tag>意大利</tag>）标准。 	Accuracy - Mistranslation	Major	215701
3	doc12	Furthermore, (d) the study sought to evaluate the participants' representation of both their family and their problems, analyzing open-ended questions included in the SCORE-15. 		此外，（d）该研究力求评估参与者对其家庭的代表性和他们的问题，分析SCORE-15中所包括的开放式问题。 	Huawei_AGI_run2				215701
4	doc12	Data were collected from two clinical centers for 208 families (n = 507). 		从两个临床中心收集了208个家庭（n=507）的数据。 	Huawei_AGI_run2				5225868
5	doc12	Results confirmed the three-factor structure (i.e., strengths, difficulties, and communication), a good internal consistency reliability, and indicated a cutoff threshold for the Italian version. 		结果证实了三因素结构（即优势、困难和沟通），良好的内部一致性可靠性，并表明意大利文版本的截止阈值。 	Huawei_AGI_run2				215701
6	doc12	Furthermore, results showed that SCORE-15 is a good instrument for clinical responsiveness and that it can be used to explore the way in which family members describe their families and problems. 		此外，研究结果显示SCORE-15是一种良好的临床反应工具，可用于探索家庭成员描述其家庭和问题的方式。 	Huawei_AGI_run2	此外，<tag>研究</tag>结果显示SCORE-15是一种良好的临床反应工具，可用于探索家庭成员描述其家庭和问题的方式。 	Accuracy - Addition	Minor	5133754
7	doc12	Overall, SCORE-15 is a brief, psychometrically robust family assessment instrument that may be used for both researchers and practitioners in several domains of clinical and social psychology.		总体而言，SCORE-15是一种简洁的、心理测量学上强健的家庭评估工具，可用于临床和社会心理学若干领域的研究人员和从业人员。 	Huawei_AGI_run2				215701
1	doc13	To estimate the magnitude of illicit cigarette consumption in India using a tax-gap approach. 		采用税收差距法估计印度非法卷烟消费量。 	Huawei_AGI_run2				215701
2	doc13	In the tax-gap analysis, illicit cigarette consumption in India was defined as the difference between total and legal consumption. 		在税收差距分析中，印度的非法卷烟消费被定义为总消费与合法消费之间的差异。 	Huawei_AGI_run2	在税收差距分析中，印度的非法卷烟消费<tag>被定义</tag>为总消费与合法消费之间的差异。 	Style - Non-fluent	Neutral	5133754
3	doc13	Data on total cigarette consumption came from two national Global Adult Tobacco Surveys carried out from 2009 to 2010 and from 2016 to 2017. 		卷烟总消费量的数据来自2009年至2010年和2016年至2017年进行的两次全国性全球成人烟草调查。 	Huawei_AGI_run2				5225868
4	doc13	Legal consumption was derived from Government of India data on domestic cigarette production and trade. 		合法消费来自印度政府关于国内卷烟生产和贸易的数据。 	Huawei_AGI_run2				215701
5	doc13	Estimated total cigarette consumption was 104.8 billion sticks in 2009 to 2010 and 94.2 billion sticks in 2016 to 2017, a decrease of 10.6 billion sticks, or of 10%, over the time period. 		预计2009-2010年卷烟总消费量为1048亿支，2016-2017年卷烟总消费量为942亿支，同比减少106亿支，减幅为10%。 	Huawei_AGI_run2				215701
6	doc13	Legal cigarette consumption fell from 99.4 to 88.5 billion sticks over the same period, a drop of 11%. 		同期合法卷烟消费量从994亿支下降到885亿支，下降了11%。 	Huawei_AGI_run2				215701
7	doc13	Estimated illicit cigarette consumption was, therefore, 5.4 billion sticks in 2009 to 2010 and 5.6 billion sticks in 2016 to 2017, and accounted for 5.1% and 6.0% of the market in these periods, respectively. 		因此，2009年至2010年估计的非法卷烟消费量为54亿支，2016年至2017年估计的非法卷烟消费量为56亿支，分别占这些时期市场的5.1%和6.0%。 	Huawei_AGI_run2	因此，2009年至2010年估计的非法卷烟消费量为54亿支，2016年至2017年估计的非法卷烟消费量为56亿支，分别占<tag>这些</tag>时期市场的5.1%和6.0%。 	Accuracy - Mistranslation	Minor	215701
8	doc13	Consequently, only about 1 in 20 cigarettes consumed in India was illicit. 		因此，在印度消费的香烟中只有1/20是非法的。 	Huawei_AGI_run2				215701
9	doc13	Between 2016 and 2017, the estimated equivalent retail sales value of illicit cigarettes was 49 billion Indian rupees (753 million United States dollars, US$) and the estimated tax revenue foregone was 25 billion Indian rupees (US$ 390 million). 		2016年至2017年期间，私烟的估计等值零售价值为490亿印度卢比（7.53亿美元，美元），估计损失的税收为250亿印度卢比（3.90亿美元）。 	Huawei_AGI_run2				215701
10	doc13	Illicit cigarette consumption is relatively modest in India by global standards. 		按全球标准来看，印度的非法卷烟消费量相对较少。 	Huawei_AGI_run2				215701
11	doc13	Nonetheless, India should strengthen its capacity to control the illicit tobacco market as part of a comprehensive tobacco control strategy, while also continuing to implement traditional demand reduction measures, such as tobacco taxation.		然而，印度应当加强其控制非法烟草市场的能力，作为全面烟草控制战略的一部分，同时还应当继续执行传统的减少需求措施，如烟草税。 	Huawei_AGI_run2				215701
1	doc14	Enhancer of zeste homolog 2(EZH2) is a histone methyltransferase which regulate gene expression through epigenetic machinery. 		Zeste同源增强子2（EZH2）是一种通过表观遗传机制调控基因表达的组蛋白甲基转移酶。 	Huawei_AGI_run2				215701
2	doc14	The abnormal expression of EZH2 has been described in many cancer types. 		EZH2的异常表达已被描述在许多癌症类型中。 	Huawei_AGI_run2				5225868
3	doc14	With in-depth study, it was found that EZH2 is involved in the occurrence and development in many kinds of malignant hematologic disease which may play a dual role of oncogenes and tumor suppressor genes. 		随着研究的深入，发现EZH2参与多种恶性血液病的发生、发展，可能发挥癌基因和抑癌基因的双重作用。 	Huawei_AGI_run2				215701
4	doc14	In recent years, the emergence of EZH2 inhibitors provide a new option for the future treatment of hematological malignancies. 		近年来，EZH2抑制剂的出现为未来血液系统恶性肿瘤的治疗提供了新的选择。 	Huawei_AGI_run2				215701
5	doc14	In this review, the expression and clinical significance of EZH2 in various of hematological tumors were summarized briefly.		本文就EZH2在多种血液肿瘤中的表达及临床意义作一综述。 	Huawei_AGI_run2	本文就EZH2在多种血液肿瘤中的<tag>表达</tag>及临床意义作一综述。 	Accuracy - Mistranslation	Major	215701
1	doc15	Ancient medical books have the names of drugs such as "xinghe" (, apricot pit), but there is only the name "xingren" (, almond) in modern medical books. 		古代医书有“杏核”（，杏核）等药物名称，但现代医书中只有“杏仁”（，杏仁）这一名称。 	Huawei_AGI_run2				215701
2	doc15	On the basis of checking Chinese dictionary, exegetical books and ancient literature, it is believed that the ancients could clearly distinguish the difference between "he" (, pit) and "ren" (, nut) in actual use, and realized that the pit and the nut are different parts. 		在查阅汉字词典、训诂书籍和古代文献的基础上，认为古人在实际使用中能够明确区分“他”（、坑）和“仁”（、坚果）的区别，并认识到坑和坚果是不同的部分。 	Huawei_AGI_run2	在查阅汉字词典、训诂书籍和古代文献的基础上，认为古人在实际使用中能够明确区分“<tag>他</tag>”（、坑）和“仁”（、坚果）的区别，并认识到坑和坚果是不同的部分。 	Terminology - Wrong term	Critical	215701
2	doc15	On the basis of checking Chinese dictionary, exegetical books and ancient literature, it is believed that the ancients could clearly distinguish the difference between "he" (, pit) and "ren" (, nut) in actual use, and realized that the pit and the nut are different parts. 		在查阅汉字词典、训诂书籍和古代文献的基础上，认为古人在实际使用中能够明确区分“他”（、坑）和“仁”（、坚果）的区别，并认识到坑和坚果是不同的部分。 	Huawei_AGI_run2	在查阅汉字词典、训诂书籍和古代文献的基础上，认为古人在实际使用中能够明确区分“他”（、<tag>坑</tag>）和“仁”（、坚果）的区别，并认识到坑和坚果是不同的部分。 	Terminology - Wrong term	Critical	215701
2	doc15	On the basis of checking Chinese dictionary, exegetical books and ancient literature, it is believed that the ancients could clearly distinguish the difference between "he" (, pit) and "ren" (, nut) in actual use, and realized that the pit and the nut are different parts. 		在查阅汉字词典、训诂书籍和古代文献的基础上，认为古人在实际使用中能够明确区分“他”（、坑）和“仁”（、坚果）的区别，并认识到坑和坚果是不同的部分。 	Huawei_AGI_run2	在查阅汉字词典、训诂书籍和古代文献的基础上，认为古人在实际使用中能够明确区分“他”（、坑）和“仁”（、坚果）的区别，并认识到<tag>坑</tag>和坚果是不同的部分。 	Terminology - Wrong term	Critical	215701
3	doc15	This article takes almonds as the center to explore the similarities and differences of concepts and essences between the "he" (, pit) and "ren" (, nut) in ancient prescriptions. 		本文以杏仁为中心，探讨古代方剂中“和”（、坑）与“仁”（、坚果）概念和本质的异同。 	Huawei_AGI_run2	本文以杏仁为中心，探讨古代方剂中“<tag>和</tag>”（、坑）与“仁”（、坚果）概念和本质的异同。 	Terminology - Wrong term	Critical	215701
3	doc15	This article takes almonds as the center to explore the similarities and differences of concepts and essences between the "he" (, pit) and "ren" (, nut) in ancient prescriptions. 		本文以杏仁为中心，探讨古代方剂中“和”（、坑）与“仁”（、坚果）概念和本质的异同。 	Huawei_AGI_run2	本文以杏仁为中心，探讨古代方剂中“和”（、<tag>坑</tag>）与“仁”（、坚果）概念和本质的异同。 	Terminology - Wrong term	Critical	215701
4	doc15	By investigating the usage of ancient medical literature, it can be seen that the actual medicinal part of the medicine "xinghe" (, apricot pit) means still almonds. 		通过考察古代医药文献的用法，可以看出，医药的实际药用部分“星河”（，杏核）意指仍为杏仁。 	Huawei_AGI_run2	通过考察古代医药文献的用法，可以看出，医药的实际药用部分“<tag>星河</tag>”（，杏核）意指仍为杏仁。 	Terminology - Wrong term	Critical	215701
5	doc15	And due to the imperfect market of ancient medicinal materials, there is no perfect medicinal materials processing industry, and it is necessary for doctors to remove part of the non-medicinal parts after obtaining the medicinal materials. 		而由于古代药材市场的不完善，没有完善的药材加工业，医生在获得药材后有必要将部分非药材部分去掉。 	Huawei_AGI_run2				215701
6	doc15	Therefore, in ancient times, the "xinghe" (, apricot pit) and "xingren" (, almond) are actually different names for the same medicinal part.		因此，在古代，“杏核”（、杏核）和“杏仁”（、杏仁）实际上是对同一药用部位的不同称谓。 	Huawei_AGI_run2				5225868
1	doc16	Faldaprevir analogue molecule (FAM) has been reported to effectively inhibit the catalytic activity of HCV NS3/4A protease, making it a potential lead compound against HCV. 		据报道，FAM可有效抑制HCV NS3/4A蛋白酶的催化活性，使其成为抗HCV的潜在先导化合物。 	Huawei_AGI_run2				215701
2	doc16	A series of HCV NS3/4A protease crystal structures were analyzed by bioinformatics methods, and the FAM-HCV NS3/4A protease crystal structure was chosen for this study. 		利用生物信息学方法分析了一系列HCV NS3/4A蛋白酶的晶体结构，选择FAM-HCV NS3/4A蛋白酶晶体结构进行研究。 	Huawei_AGI_run2				215701
3	doc16	A 20.4 ns molecular dynamics simulation of the complex consists of HCV NS3/4A protease and FAM was conducted. 		对由HCV NS3/4A蛋白酶和FAM组成的复合物进行了20.4 ns的分子动力学模拟。 	Huawei_AGI_run2				215701
4	doc16	The key amino acid residues for interaction and the binding driving force for the molecular recognition between the protease and FAM were identified from the hydrogen bonds and binding free energy analyses. 		通过氢键和结合自由能分析，确定了蛋白酶与FAM分子识别的关键氨基酸残基和结合驱动力。 	Huawei_AGI_run2				215701
5	doc16	With the driving force of hydrogen bonds and van der Waals, FAM specifically bind to the active pocket of HCV NS3/4A protease, including V130-S137, F152-D166, D77-D79 and V55, which agreed with the experimental data. 		在氢键和van der Waals的驱动下，FAM特异性结合HCV NS3/4A蛋白酶的活性口袋，包括V130-S137、F152-D166、D77-D79和V55，与实验数据一致。 	Huawei_AGI_run2	在氢键和<tag>van der Waals</tag>的驱动下，FAM特异性结合HCV NS3/4A蛋白酶的活性口袋，包括V130-S137、F152-D166、D77-D79和V55，与实验数据一致。 	Terminology - Wrong term	Critical	215701
6	doc16	The effect of R155K, D168E/V and V170T site-directed mutagenesis on FAM molecular recognition was analyzed for their effect on drug resistance, which provided the possible molecular explanation of FAM resistance. 		分析R155K、D168E/V和V170T定点突变对FAM分子识别的影响，为FAM耐药性提供可能的分子解释。 	Huawei_AGI_run2				215701
7	doc16	Finally, the system conformational change was explored by using free energy landscape and conformational cluster. 		最后，利用自由能景观和构象聚类对系统构象变化进行了探索。 	Huawei_AGI_run2	最后，利用自由能景观和<tag>构象</tag>聚类对系统构象变化进行了探索。 	Accuracy - Mistranslation	Major	215701
8	doc16	The result showed four kinds of dominant conformation, which provides theoretical basis for subsequent design of Faldaprevir analogue inhibitors based on the structure of HCV NS3/4A protease.		结果显示4种优势构象，为后续基于HCV NS3/4A蛋白酶结构设计Faldaprevir类似物抑制剂提供了理论依据。 	Huawei_AGI_run2	结果显示<tag>4</tag>种优势构象，为后续基于HCV NS3/4A蛋白酶结构设计Faldaprevir类似物抑制剂提供了理论依据。 	Locale Conventions - Number format	Major	215701
1	doc17	Objective To study the influence of halogenated hydroxyl-alkanes inhalation anesthetic on the determination of ethanol content in blood. 		目的研究卤代羟基烷烃吸入麻醉剂对血液中乙醇含量测定的影响。 	Huawei_AGI_run2				215701
2	doc17	Methods Halogenated hydroxyl-alkanes were analyzed by headspace gas chromatography with double column confirmatory detection method. 		方法采用顶空气相色谱法和双柱确证检测法对卤代羟基烷烃进行分析。 	Huawei_AGI_run2				215701
3	doc17	The influence of halogenated hydroxyl-alkanes on determination of ethanol content in blood sample by headspace gas chromatography was explored under the different detection conditions of KB-BAC1/ KB-BAC2 and J&W DB-ALC1/DB-ALC2 gas chromatographic column. 		在KB-BAC1/KB-BAC2和J&W DB-ALC1/DB-ALC2气相色谱柱的不同检测条件下，探讨了卤代羟基烷烃对顶空气相色谱法测定血样中乙醇含量的影响。 	Huawei_AGI_run2				215701
4	doc17	Results The retention time of sevoflurane and enflurane was similar to that of ethanol and tert butanol respectively when using the J&W DB-ALC1/DB-ALC2 gas chromatographic column, and interfered with the detection of ethanol content in blood; only J&W DB-ALC1 gas chromatographic column can separate the sevoflurane and ethanol components, so as to eliminate their influence on the detection of ethanol content in blood. 		结果使用J&W DB-ALC1/DB-ALC2气相色谱柱时，七氟醚和安氟醚的保留时间分别与乙醇和叔丁醇的保留时间相近，干扰了血液中乙醇含量的检测；只有J&W DB-ALC1气相色谱柱能分离出七氟醚和乙醇成分，从而消除其对血液中乙醇含量检测的影响。 	Huawei_AGI_run2				5225868
5	doc17	When using KB-BAC1/KB-BAC2 gas chromatographic column, the retention time of sevoflurane, isoflurane and ethanol is similar, especially that of sevoflurane and ethanol, and sevoflurane obviously interferes with the determination of ethanol content in blood. 		在使用KB-BAC1/KB-BAC2气相色谱柱时，七氟醚、异氟醚和乙醇的保留时间相似，特别是七氟醚和乙醇的保留时间相似，七氟醚明显干扰血液中乙醇含量的测定。 	Huawei_AGI_run2				215701
6	doc17	Conclusion Halogenated hydroxy-alkanes interfere with determination of ethanol content in blood by headspace gas chromatography. 		结论卤代羟基烷烃对顶空气相色谱法测定血液中乙醇含量有干扰作用。 	Huawei_AGI_run2				215701
7	doc17	The interference can be discriminated effectively by choosing the suitable chromatographic column and double column confirmatory detection.		通过选择合适的色谱柱和双柱验证检测方法，可以有效甄别干扰。 	Huawei_AGI_run2				215701
1	doc18	To investigate the method of treating tuberculosis in the craniovertebral junction and its effectiveness. 		探讨颅椎交界处结核的治疗方法及疗效。 	Huawei_AGI_run2				215701
2	doc18	The clinical data of 18 patients with tuberculosis in the craniovertebral junction between July 2010 and January 2019 was analyzed retrospectively. 		回顾性分析2010年7月至2019年1月收治的18例颅椎交界处结核患者的临床资料。 	Huawei_AGI_run2				5133754
3	doc18	There were 14 males and 4 females, aged 21 months to 75 years (median, 35 years). 		男14例，女4例，年龄21个月至75岁（中位数35岁）。 	Huawei_AGI_run2				215701
4	doc18	The disease duration ranged from 2 weeks to 60 months (median, 4 months), and the affected segment was C  All the patients were followed up 3 to 42 months (median, 12 months). 		病程2周~60个月（中位数4个月），患病节段为C，随访3~42个月（中位数12个月）。 	Huawei_AGI_run2				215701
5	doc18	At 3 months after treatment, the VAS score was 1.7±1.0, showing significant difference when compared with preoperative score (  On the premise of regular chemotherapy, if there is no huge abscess causing dysphagia or dyspnea, atlantoaxial instability, and neurological symptoms, patients can undergo conservative treatment. If not, however, the transoral approach can be used to completely remove the tuberculosis lesion in the craniovertebral junction. One-stage debridement via transoral approach combined with posterior cervical fusion and internal fixation can achieve satisfactory effectiveness.		治疗后3个月，VAS评分1.7±1.0，与术前评分比较差异有统计学意义（在常规化疗的前提下，若无巨大脓肿引起吞咽困难或呼吸困难、寰枢椎不稳及神经系统症状，可进行保守治疗；若无，可采用经口入路彻底清除颅椎交界处的结核病灶，经口入路一期清创联合后路颈椎融合内固定可取得满意疗效。 	Huawei_AGI_run2	治疗后3个月，VAS评分1.7±1.0，与术前评分比较差异有<tag>统计学意义</tag>（在常规化疗的前提下，若无巨大脓肿引起吞咽困难或呼吸困难、寰枢椎不稳及神经系统症状，可进行保守治疗；若无，可采用经口入路彻底清除颅椎交界处的结核病灶，经口入路一期清创联合后路颈椎融合内固定可取得满意疗效。 	Terminology - Wrong term	Major	215701
1	doc19	To evaluate the clinical characteristics, genetic abnormalities, treatment efficacy and prognostic factors in patients with plasma cell leukemia(PCL). 		评价浆细胞白血病（PCL）患者的临床特征、遗传异常、治疗效果及预后因素。 	Huawei_AGI_run2				215701
2	doc19	30 patients diagnosed as PCL in our hospital from January 1993 to December 2019 were enrolled, and the clinical characteristics, laboratory findings, therapeutic regimes, and survival data of the patients were retrospectively analyzed. 		选取1993年1月至2019年12月在我院确诊为PCL的30例患者，对其临床特点、实验室检查结果、治疗方案、生存资料进行回顾性分析。 	Huawei_AGI_run2				215701
3	doc19	The median age of the 30 patients was 56.5 (28-80) years old, among them, 25 patients were primary plasma cell leukemia, and 5 patients were secondary plasma cell leukemia. 		30例患者的中位年龄为56.5（28-80）岁，其中原发性浆细胞白血病25例，继发性浆细胞白血病5例。 	Huawei_AGI_run2				215701
4	doc19	Complex karyotypes and subdiploids were most common in cytogenetic abnormalities. 		复杂的核型和亚二倍体是最常见的细胞遗传学异常。 	Huawei_AGI_run2				215701
5	doc19	Among the 20 cases of chromosome G banding, 11 (55%) cases were complex karyotypes and 8 (40%) cases were hypodiploid. 		20例染色体G显带中，11例（55%）为复杂核型，8例（40%）为亚二倍体。 	Huawei_AGI_run2				215701
6	doc19	Fluorescent in situ hybridization (FISH) test showed that among 11 cases, 6 cases showed 17p13 deletion, 8 cases showed at least two kinds of abnormalities, which including t (14; 16), t (8; 14), t (11;14), 17p13 deletion, and 13q14 deletion. 		荧光原位杂交（FISH）检测显示，11例患者中，6例出现17p13缺失，8例出现至少两种异常，分别为t（14；16）、t（8；14）、t（11；14）、17p13缺失和13q14缺失。 	Huawei_AGI_run2				215701
7	doc19	The median overall survival (OS) time was 10.5 months for all patients. 		所有患者的中位总生存期（OS）为10.5个月。 	Huawei_AGI_run2				215701
8	doc19	The median OS time of the patients in ECOG score ≤ 2 group was 21.5 months, which was significantly longer than those in the ECOG score>2 group(1.2 months) (P=0.017). 		ECOG评分≤2组患者的中位OS时间为21.5个月，明显长于ECOG评分 > 2组（1.2个月）（P=0.017）。 	Huawei_AGI_run2				5225868
9	doc19	The median OS time of the patients treated with novel agents (including proteasome inhibitor and/or immunomodulator) was 24.9 months, which was significantly longer than the patients treated with traditional chemotherapy group(10.5 months) (P＜0.001). 		接受新型药物（包括蛋白酶体抑制剂和/或免疫调节剂）治疗的患者的中位OS时间为24.9个月，明显长于接受传统化疗的患者（10.5个月）（P<0.001）。 	Huawei_AGI_run2				215701
10	doc19	For the patients treated with novel agents, the median OS time of patients accepted two novel agents combination was 30.9 months, which was longer than those of single novel agent(11.5 months) (P=0.021). 		对于接受新药治疗的患者，接受两种新药联合治疗的患者中位OS时间为30.9个月，长于单一新药（11.5个月）（P=0.021）。 	Huawei_AGI_run2				215701
11	doc19	The effect of genetic abnormolity to the OS of the patients showed no statistical difference. 		遗传异常对患者OS的影响无统计学差异。 	Huawei_AGI_run2	遗传异常对患者OS的影响无<tag>统计学差异</tag>。 	Terminology - Wrong term	Major	215701
12	doc19	Multivariate statistical analysis showed that ECOG score>2 was the independent prognostic factor of plasma cell leukemia patients. 		多因素统计分析显示，ECOG评分 > 2是浆细胞白血病患者的独立预后因素。 	Huawei_AGI_run2				215701
13	doc19	There were two patients underwent allogeneic hematopoietic stem cell transplantation in the study,but died due to the pulmonary infection within 6 months after transplantation. 		研究中有2例患者接受了异基因造血干细胞移植，但在移植后6个月内因肺部感染死亡。 	Huawei_AGI_run2				215701
14	doc19	In the era of novel agents, ECOG score is an independent prognostic factor of plasma cell leukemia. 		在新药时代，ECOG评分是浆细胞白血病的独立预后因素。 	Huawei_AGI_run2				215701
15	doc19	Multiple novel agents treatment should be underwent as soon as possible to improve the prognosis of the patients. 		应尽早进行多种新药治疗，以改善患者预后。 	Huawei_AGI_run2				215701
16	doc19	Pulmonary infection is a common factor that cause the death of the patients after allogeneic hematopoietic stem cell transplantation.		肺部感染是导致异基因造血干细胞移植后患者死亡的常见因素。 	Huawei_AGI_run2				5133754
