SEG_ID	Doc	Source	Tagged_Source	Target	MT	Tagged_Target	Error Category	Severity	Annotator_ID
1	doc28	To investigate the effectiveness of anterolateral femoral flap in combination with fascia lata grafting in repair of large Achilles tendon and skin defects. 		探讨股前外侧皮瓣联合阔筋膜移植修复大跟腱及皮肤缺损的疗效。 	Huawei_AGI_run2				215701
2	doc28	The clinical data of 18 patients with large Achilles tendon and skin defects repaired with anterolateral femoral flap in combination with fascia lata grafting between January 2018 and January 2019 were retrospectively reviewed. 		回顾性分析2018年1月-2019年1月应用股前外侧皮瓣联合阔筋膜移植修复大跟腱及皮肤缺损18例患者的临床资料。 	Huawei_AGI_run2				215701
3	doc28	There were 14 males and 4 females; age ranged from 32 to 57 years (mean, 42.1 years). 		男14例，女4例；年龄32~57岁，平均42.1岁。 	Huawei_AGI_run2				215701
4	doc28	There were 9 cases of postoperative infection of Achilles tendon rupture, 1 case of traffic accident injury, and 8 cases of combined infection of skin and Achilles tendon defects after heel trauma. 		术后感染跟腱断裂9例，交通事故伤1例，足跟外伤后皮肤及跟腱缺损合并感染8例。 	Huawei_AGI_run2				215701
5	doc28	The length of Achilles tendon defect was 4-8 cm, with an average of 5.6 cm; the range of the skin defect was 14 cm×3 cm to 20 cm×5 cm. 		跟腱缺损长度为4~8cm，平均5.6cm；皮肤缺损范围为14cm×3cm~20cm×5cm。 	Huawei_AGI_run2				215701
6	doc28	Flap survival was observed, and ankle function recovery was evaluated according to McComis functional assessment criteria, and dorsal extension and plantar flexion mobility of the affected limb were measured at last follow-up and compared with those of the healthy side. 		观察皮瓣存活情况，根据McComis功能评价标准评价踝关节功能恢复情况，末次随访时测量患肢背伸和跖屈活动度，并与健侧进行比较。 	Huawei_AGI_run2				215701
7	doc28	Eighteen cases were followed up 8-24 months, with an average of 16.7 months. 		18例随访8~24个月，平均16.7个月。 	Huawei_AGI_run2				215701
8	doc28	All the flaps survived after operation, the flaps were soft and elastic, and the incisions healed by first intention. 		术后皮瓣全部成活，皮瓣柔软有弹性，切口均一期愈合。 	Huawei_AGI_run2				215701
9	doc28	At last follow-up, 15 cases were excellent, 2 cases were good, and 1 case was acceptable according to McComis functional evaluation criteria, with an excellent and good rate of 94.4%. 		末次随访，根据McComis功能评价标准，优15例，良2例，可接受1例，优良率94.4%。 	Huawei_AGI_run2				5225868
10	doc28	The two-point discrimination of the heel posterior region of the affected foot was 4-7 mm, with an average of 5.32 mm. 		患足足跟后区的两点辨别力为4-7mm，平均为5.32mm。 	Huawei_AGI_run2				215701
11	doc28	The heel-raise test was negative. 		后跟抬高试验阴性。 	Huawei_AGI_run2	<tag>后跟抬高</tag>试验阴性。 	Terminology - Wrong term	Major	215701
12	doc28	The dorsiflexion range of the affected side was (21.55±1.26)°, which was significantly different from that of the healthy side (25.23±1.45)° (  The application of anterolateral femoral flap in combination with fascia lata grafting for the repair of large Achilles tendon and skin defects can achieve good effectiveness.		患侧背屈范围为（21.55±1.26）°，与健侧背屈范围（25.23±1.45）°有显著差异（股前外侧皮瓣联合阔筋膜移植修复大跟腱及皮肤缺损可取得良好效果。 	Huawei_AGI_run2				215701
1	doc29	Chronic hepatitis B (CHB) poses a serious threat to the health of the Chinese people. 		慢性乙型肝炎（CHB）严重威胁着中国人民的健康。 	Huawei_AGI_run2				215701
2	doc29	Viral markers are of great significance during antiviral therapy and research and development of innovative drugs. 		病毒标志物在抗病毒治疗和创新药物研发过程中具有重要意义。 	Huawei_AGI_run2				215701
3	doc29	However, traditional serovirological markers such as HBV DNA and hepatitis B surface antigen (HBsAg) have certain limitations in assessing the efficacy of antiviral treatment and accurately reflecting the transcriptional activity of covalently closed circular DNA (cccDNA). 		然而，传统的血清学标志物如HBV DNA和乙型肝炎表面抗原（HBsAg）在评估抗病毒治疗的疗效和准确反映共价闭合环状DNA（cccDNA）的转录活性方面具有一定的局限性。 	Huawei_AGI_run2				215701
4	doc29	In recent years, the role of new viral markers such as HBV RNA, hepatitis B core-related antigen (HBcrAg) and quantitative anti-hepatitis B core protein (qAnti-HBc) have attracted more and more attention because of accurately reflecting the transcription activity of cccDNA, determining the therapeutic effect and predicting the risk of recurrence after drug discontinuation. 		近年来，HBV RNA、乙肝核心相关抗原（HBcrAg）和定量抗乙肝核心蛋白（qAnti-HBc）等新型病毒标志物因准确反映cccDNA的转录活性、确定治疗效果和预测停药后复发风险等作用越来越受到关注。 	Huawei_AGI_run2				215701
5	doc29	This article briefly introduces the application of new and old markers in various stages of antiviral therapy in CHB patients, and combines the application of new viral markers in the evaluation of drug efficacy, and expounds its possible role in the research and development of new antiviral therapy.		本文简要介绍了新旧标志物在慢性乙型肝炎患者抗病毒治疗各阶段中的应用，并结合新型病毒标志物在药物疗效评价中的应用，阐述了其在新型抗病毒治疗研发中的可能作用。 	Huawei_AGI_run2				215701
1	doc30	Canine atopic dermatitis (cAD) is a common inflammatory and pruritic skin disease, with various treatment options. 		犬特应性皮炎（cAD）是一种常见的炎症性和瘙痒性皮肤病，有多种治疗方案。 	Huawei_AGI_run2				215701
2	doc30	The use of topical products containing natural ingredients has proven increasingly popular. 		事实证明，使用含有天然成分的外用产品越来越受欢迎。 	Huawei_AGI_run2				5225868
3	doc30	To evaluate the effects of a spray solution containing heat-killed Lactobacillus rhamnosus and L. reuteri, on the clinical signs and cutaneous microbiota of atopic dogs. 		目的：评价热杀灭鼠李糖乳杆菌和路氏乳杆菌喷雾剂对特应性犬临床体征和皮肤微生物群的影响。 	Huawei_AGI_run2				5133754
4	doc30	Ten privately owned, mildly affected, nonseasonally atopic dogs. 		十只私人饲养，轻度感染，非季节性特应性犬。 	Huawei_AGI_run2				215701
5	doc30	The spray was applied to the ventrum every 24 h for 28 days. 		每24小时向腹侧喷洒一次，持续28天。 	Huawei_AGI_run2	每24小时向<tag>腹侧</tag>喷洒一次，持续28天。 	Terminology - Wrong term	Major	215701
6	doc30	Clinical scores, skin barrier function and owner assessment were evaluated on day (D)0, D14, D28 and D42. 		在（D）0、D14、D28和D42天评估临床评分、皮肤屏障功能和业主评估。 	Huawei_AGI_run2	在<tag>（D）0</tag>、D14、D28和D42天评估临床评分、皮肤屏障功能和业主评估。 	Accuracy - Untranslated	Major	215701
6	doc30	Clinical scores, skin barrier function and owner assessment were evaluated on day (D)0, D14, D28 and D42. 		在（D）0、D14、D28和D42天评估临床评分、皮肤屏障功能和业主评估。 	Huawei_AGI_run2	在（D）0、<tag>D14</tag>、D28和D42天评估临床评分、皮肤屏障功能和业主评估。 	Accuracy - Untranslated	Major	215701
6	doc30	Clinical scores, skin barrier function and owner assessment were evaluated on day (D)0, D14, D28 and D42. 		在（D）0、D14、D28和D42天评估临床评分、皮肤屏障功能和业主评估。 	Huawei_AGI_run2	在（D）0、D14、<tag>D28</tag>和D42天评估临床评分、皮肤屏障功能和业主评估。 	Accuracy - Untranslated	Major	215701
6	doc30	Clinical scores, skin barrier function and owner assessment were evaluated on day (D)0, D14, D28 and D42. 		在（D）0、D14、D28和D42天评估临床评分、皮肤屏障功能和业主评估。 	Huawei_AGI_run2	在（D）0、D14、D28和<tag>D42</tag>天评估临床评分、皮肤屏障功能和业主评估。 	Accuracy - Untranslated	Major	215701
6	doc30	Clinical scores, skin barrier function and owner assessment were evaluated on day (D)0, D14, D28 and D42. 		在（D）0、D14、D28和D42天评估临床评分、皮肤屏障功能和业主评估。 	Huawei_AGI_run2	在（D）0、D14、D28和D42天评估临床评分、皮肤屏障功能和<tag>业主</tag>评估。 	Accuracy - Mistranslation	Critical	215701
7	doc30	The cutaneous microbiota was analysed on D0 and D28. 		在D0和D28上分析皮肤微生物群落。 	Huawei_AGI_run2	在<tag>D0</tag>和D28上分析皮肤微生物群落。 	Accuracy - Untranslated	Major	215701
7	doc30	The cutaneous microbiota was analysed on D0 and D28. 		在D0和D28上分析皮肤微生物群落。 	Huawei_AGI_run2	在D0和<tag>D28</tag>上分析皮肤微生物群落。 	Accuracy - Untranslated	Major	215701
8	doc30	A reduction in the total clinical score was seen at each time point (D14, P = 0.03; D28, P = 0.04; D42, P = 0.001). 		各时间点临床总分降低（D14，P=0.03；D28，P=0.04；D42，P=0.001）。 	Huawei_AGI_run2	各时间点临床总分降低（<tag>D14</tag>，P=0.03；D28，P=0.04；D42，P=0.001）。 	Accuracy - Untranslated	Major	215701
8	doc30	A reduction in the total clinical score was seen at each time point (D14, P = 0.03; D28, P = 0.04; D42, P = 0.001). 		各时间点临床总分降低（D14，P=0.03；D28，P=0.04；D42，P=0.001）。 	Huawei_AGI_run2	各时间点临床总分降低（D14，P=0.03；<tag>D28</tag>，P=0.04；D42，P=0.001）。 	Accuracy - Untranslated	Major	215701
8	doc30	A reduction in the total clinical score was seen at each time point (D14, P = 0.03; D28, P = 0.04; D42, P = 0.001). 		各时间点临床总分降低（D14，P=0.03；D28，P=0.04；D42，P=0.001）。 	Huawei_AGI_run2	各时间点临床总分降低（D14，P=0.03；D28，P=0.04；<tag>D42</tag>，P=0.001）。 	Accuracy - Untranslated	Major	215701
9	doc30	A reduction in the regional clinical scores was seen after D28 (P = 0.01) and D42 (P = 0.003). 		D28（P=0.01）和D42（P=0.003）后出现区域临床评分降低。 	Huawei_AGI_run2				5225868
10	doc30	A significant reduction in the pruritus score was seen on D42 (P = 0.01). 		D42的瘙痒评分显著降低（P=0.01）。 	Huawei_AGI_run2	<tag>D42</tag>的瘙痒评分显著降低（P=0.01）。 	Accuracy - Untranslated	Major	215701
11	doc30	A lower hydration value was seen on D28 (P = 0.02) and D42 (P = 0.02) on the pinnae. 		耳廓D28（P=0.02）和D42（P=0.02）的水化值较低。 	Huawei_AGI_run2	耳廓<tag>D28</tag>（P=0.02）和D42（P=0.02）的水化值较低。 	Accuracy - Untranslated	Major	215701
11	doc30	A lower hydration value was seen on D28 (P = 0.02) and D42 (P = 0.02) on the pinnae. 		耳廓D28（P=0.02）和D42（P=0.02）的水化值较低。 	Huawei_AGI_run2	耳廓D28（P=0.02）和<tag>D42</tag>（P=0.02）的水化值较低。 	Accuracy - Untranslated	Major	215701
12	doc30	A good-to-excellent response and an easy-to-use administration was reported by owners. 		业主报告反应良好，使用方便。 	Huawei_AGI_run2	<tag>业主</tag>报告反应良好，使用方便。 	Accuracy - Mistranslation	Critical	215701
13	doc30	There were no significant changes in the cutaneous microbiota after 28 days. 		28天后皮肤微生物群无明显变化。 	Huawei_AGI_run2				215701
14	doc30	There was a significant and rapid decrease in the clinical signs associated with cAD after use of the spray. 		使用喷雾剂后，与cAD相关的临床体征显著且快速下降。 	Huawei_AGI_run2				215701
15	doc30	Future larger, randomized, controlled studies are needed to confirm these results and to assess the effects on the cutaneous immunity and microflora of atopic dogs.		未来需要更大、随机、对照研究来证实这些结果，并评估对特应性犬皮肤免疫和菌群的影响。 	Huawei_AGI_run2				215701
1	doc31	This review assessed the real-world evidence of the management of macular oedema secondary to branch retinal vein occlusion (BRVO). 		本综述评估了继发于视网膜分支静脉阻塞（BRVO）的黄斑水肿治疗的真实证据。 	Huawei_AGI_run2				215701
2	doc31	A meta-analysis of 2530 eyes from 48 real-world studies of therapies for macular oedema secondary to BRVO was conducted. 		对来自48项治疗BRVO继发黄斑水肿的真实世界研究的2530只眼睛进行了荟萃分析。 	Huawei_AGI_run2				5225868
3	doc31	Baseline characteristics, visual, anatomical and safety outcomes were recorded. 		记录基线特征、视觉、解剖和安全性结果。 	Huawei_AGI_run2				215701
4	doc31	The weighted mean and weighted estimates from random-effects models were calculated for visual acuity (VA) and central subfield thickness (CST) changes at 6, 12 and 24 months. 		计算6、12和24个月时随机效应模型中视力（VA）和中央亚视场厚度（CST）变化的加权平均值和加权估计值。 	Huawei_AGI_run2				215701
5	doc31	Primary outcome was change in VA (logMAR letters) at 12 months. 		主要结局为12个月时VA（logMAR字母）的变化。 	Huawei_AGI_run2				215701
6	doc31	Study quality was assessed using the quality appraisal checklist for case series developed by Institute of Health Economics. 		采用卫生经济研究所开发的病例系列质量评价清单对研究质量进行评价。 	Huawei_AGI_run2	采用卫生经济研究所<tag>开发</tag>的病例系列质量评价清单对研究质量进行评价。 	Terminology - Wrong term	Neutral	5133754
7	doc31	The mean baseline VA for the pooled data was 54.0 (51.5, 56.5) letters and the mean baseline CST was 501.3 (483.5, 519.1) µm. 		合并数据的平均基线VA为54.0（51.5，56.5）字母，平均基线CST为501.3（483.5，519.1）μm。 	Huawei_AGI_run2				5225868
8	doc31	The random-effects estimate for mean (95% CI) change in VA was 14.6 (12.5, 16.7) letters at 12 months (n = 1727). 		12个月时，VA平均变化（95%CI）的随机效应估计值为14.6（12.5，16.7）个字母（n=1727）。 	Huawei_AGI_run2				5225868
9	doc31	The random-effects estimate for mean (95% CI) change in CST was -181.7 (-230.7, -132.7) µm at 12 months (n = 1325). 		12个月时CST平均变化（95%CI）的随机效应估计值为-181.7（-230.7，-132.7）μm（n=1325）。 	Huawei_AGI_run2				5133754
10	doc31	The quality of studies varied considerably. 		研究的质量差别很大。 	Huawei_AGI_run2				5225868
11	doc31	Ocular and systemic adverse events were discussed in 79% and 42% of treatment arms respectively, with possible under-reporting. 		79%的治疗组讨论了眼部不良事件，42%的治疗组讨论了全身不良事件，可能存在漏报。 	Huawei_AGI_run2	<tag>79%的治疗组讨论了眼部不良事件，42%的治疗组讨论了全身不良事件</tag>，可能存在漏报。 	Linguistic Conventions - Grammar	Neutral	5133754
12	doc31	Visual and anatomical gains achieved in the real-world for anti-VEGF therapy were not as impressive as seminal RCTs, possibly due to reduced injection frequency in the real world and differences in baseline characteristics. 		真实世界中抗VEGF治疗所获得的视觉和解剖学效果不如精索RCT那么令人印象深刻，可能是由于真实世界中注射频率的降低和基线特征的差异。 	Huawei_AGI_run2				5225868
13	doc31	There is an urgent need for consensus on the minimum efficacy, treatment burden and safety data to collect to strengthen the real-world evidence base.		迫切需要就最低疗效、治疗负担和安全性数据达成共识，以收集更多真实世界证据。 	Huawei_AGI_run2	迫切需要就最低疗效、治疗负担和安全性数据达成共识，<tag>以收集</tag>更多真实世界证据。 	Accuracy - Mistranslation	Neutral	5133754
13	doc31	There is an urgent need for consensus on the minimum efficacy, treatment burden and safety data to collect to strengthen the real-world evidence base.	There is an urgent need for consensus on the minimum efficacy, treatment burden and safety data to collect to <tag>strengthen</tag> the real-world evidence base.	迫切需要就最低疗效、治疗负担和安全性数据达成共识，以收集更多真实世界证据。 	Huawei_AGI_run2		Accuracy - Omission	Neutral	5133754
1	doc32	Anti-vascular endothelial growth factors (anti-VEGF) have become the most common treatment modality for many retinal diseases. 		抗血管内皮生长因子（anti-VEGF）已成为许多视网膜疾病最常见的治疗方式。 	Huawei_AGI_run2				5225868
2	doc32	These include neovascular age-related macular degeneration (n-AMD), proliferative diabetic retinopathy (PDR) and retinal vein occlusions (RVO). 		包括新生血管性年龄相关性黄斑变性（n-AMD）、增生性糖尿病视网膜病变（PDR）和视网膜静脉阻塞（RVO）。 	Huawei_AGI_run2				5225868
3	doc32	However, these drugs are administered via intravitreal injections that are associated with sight-threatening complications. 		然而，这些药物是通过玻璃体腔注射给药的，这些药物与视力威胁的并发症有关。 	Huawei_AGI_run2				215701
4	doc32	The most feared of these complications is endophthalmitis, a severe infection of the eye with extremely poor visual outcomes. 		最令人担心的并发症是眼内炎，这是一种严重的眼部感染，视力极差。 	Huawei_AGI_run2				5225868
5	doc32	Patients with retinal diseases typically have to undergo multiple injections before achieving the desired therapeutic effect. 		视网膜疾病患者通常必须经历多次注射才能达到预期的治疗效果。 	Huawei_AGI_run2				5225868
6	doc32	Each injection incurs the risk of the sight-threatening complications. 	Each injection incurs the <tag>risk of</tag> the sight-threatening complications. 	每次注射都会产生危及视力的并发症。 	Huawei_AGI_run2		Accuracy - Omission	Neutral	5133754
7	doc32	As such, there has been great interest in developing sustained delivery platforms for anti-VEGF agents to the posterior segment of the eye. 		因此，开发抗VEGF药物持续递送至眼后段的平台已经引起了极大的兴趣。 	Huawei_AGI_run2				5225868
8	doc32	In recent years, there have been various strategies that have been conceptualised. 		近年来，已经有各种战略被概念化。 	Huawei_AGI_run2	近年来，已经有各种战略<tag>被概念化</tag>。 	Style - Non-fluent	Neutral	5133754
9	doc32	These include non-biodegradable implants, nano-formulations and hydrogels. 		这些包括不可生物降解的植入物、纳米制剂和水凝胶。 	Huawei_AGI_run2				5133754
10	doc32	In this review, the barriers of drug delivery to the posterior segment of the eye will be explained. 		在本综述中，将解释药物递送至眼后段的障碍。 	Huawei_AGI_run2	在本综述中，将解释药物<tag>递送</tag>至眼后段的障碍。 	Accuracy - Mistranslation	Minor	215701
11	doc32	The characteristics of an ideal sustained delivery platform will then be discussed. 		随后将讨论理想持续输送平台的特点。 	Huawei_AGI_run2				215701
12	doc32	Finally, the current available strategies will be analysed with the above-mentioned characteristics in mind to determine the advantages and disadvantages of each sustained drug delivery modality. 		最后，将结合上述特点对现有策略进行分析，以确定每种持续给药方式的优缺点。 	Huawei_AGI_run2				5225868
13	doc32	Through the above, this review attempts to provide an overview of the sustained delivery platforms in their various phases of development.		通过以上所述，本综述试图概述持续交付平台的各个开发阶段。 	Huawei_AGI_run2	通过以上所述，本综述试图概述持续<tag>交付</tag>平台的各个开发阶段。 	Accuracy - Mistranslation	Major	215701
1	doc33	To evaluate the effectiveness of cement-injectable cannulated pedicle screw combined with multiple level Schwab grade Ⅰ osteotomy for chronic thoracolumbar osteoporotic fractures with kyphosis. 		评价骨水泥注射空心椎弓根螺钉联合多节段SchwabI级截骨治疗慢性胸腰椎骨质疏松性骨折伴后凸畸形的疗效。 	Huawei_AGI_run2				5225868
2	doc33	The clinical data of 27 patients with symptomatic chronic thoracolumbar osteoporotic fractures combined with kyphosis treated between June 2015 and June 2017 were retrospectively analysed. 		回顾性分析2015年6月至2017年6月收治的27例症状性慢性胸腰椎骨质疏松性骨折合并后凸畸形患者的临床资料。 	Huawei_AGI_run2				215701
3	doc33	Among them, there were 8 males and 19 females, with an average age of 69.5 years (range, 56-81 years). 		其中男8例，女19例，平均年龄69.5岁（56-81岁）。 	Huawei_AGI_run2				215701
4	doc33	The damage segment (kyphosis vertex) included T  No complications related to pedicle screw and bone cement occurred. 		损伤节段（脊柱后凸）包括T型，未发生与椎弓根螺钉和骨水泥相关的并发症。 	Huawei_AGI_run2				215701
5	doc33	The incisions healed by first intention in 26 cases, and 1 incision healed after dressing change due to poor blood glucose control. 		26例切口一期愈合，1例因血糖控制不佳换药后愈合。 	Huawei_AGI_run2				215701
6	doc33	There were no complications such as bedsore, hypostatic pneumonia, or deep venous thrombosis. 		无褥疮、实体肺炎、深静脉血栓等并发症。 	Huawei_AGI_run2				215701
7	doc33	All patients were followed up 8-24 months, with an average of 16.6 months. 		术后随访8~24个月，平均16.6个月。 	Huawei_AGI_run2				215701
8	doc33	The VAS score, ODI score, Cobb angle, and SVA were significantly improved when compared with those before operation (  For the chronic thoracolumbar osteoporotic fractures combined with kyphosis, the cement-injectable cannulated pedicle screw and multiple level Schwab grade Ⅰ osteotomy has the advantages of less operation trauma, quick recovery, and remarkable effectiveness.		VAS评分、ODI评分、Cobb角、SVA均较术前明显改善（对于慢性胸腰椎骨质疏松性骨折合并后凸畸形，骨水泥注射空心椎弓根螺钉联合多节段SchwabI级截骨术具有手术创伤小、恢复快、疗效显著等优点。 	Huawei_AGI_run2				215701
1	doc34	Although the influence of neighborhood disadvantage on youth development of delinquent behavior is well established, findings from this research have yet to inform the development of family-centered prevention programming to protect youth from these erosive effects. The current paper examines the role of family integration in buffering the impact of social disadvantage in a sample of N = 298 families randomly assigned either to a control condition or to a family-based prevention program previously shown to enhance marriage and parenting. 	Although the influence of neighborhood disadvantage on youth development of delinquent behavior is well established, findings from this research have yet to inform the development of family-centered prevention programming to protect youth from these erosive effects. <tag>The current paper examines the role of family integration in buffering the impact of social disadvantage in a sample of N = 298 families randomly assigned either to a control condition or to a family-based prevention program previously shown to enhance marriage and parenting.</tag> 	虽然邻里劣势对青少年不良行为发展的影响已经确立，但本研究的发现尚未为制定以家庭为中心的预防方案提供依据，以保护青少年免受这些侵蚀性影响。 	Huawei_AGI_run2		Accuracy - Omission	Critical	215701
2	doc34	We first confirmed that neighborhood concentrated disadvantage predicted change in delinquent behaviors across the course of the study. 		我们首先证实了邻域集中劣势预测了整个研究过程中违法行为的改变。 	Huawei_AGI_run2				5225868
3	doc34	Additionally, replicating prior work, parents participating in the Protecting Strong African American Families (ProSAAF) program, relative to those randomly assigned to the control group, significantly improved their use of effective communication strategies with each other and reduced ineffective conflict in front of youth. 		此外，与随机分配到对照组的工作相比，参与保护强大非裔美国家庭（ProSAAF）计划的父母重复先前的工作，大大提高了他们彼此之间有效沟通策略的使用，并减少了青年面前的无效冲突。 	Huawei_AGI_run2				215701
4	doc34	This resulted in a significant indirect effect of ProSAAF on change in youth delinquent behaviors. 		这导致ProSAAF对青少年犯罪行为的改变有显著的间接影响。 	Huawei_AGI_run2				215701
