SEG_ID	Doc	Source	Tagged_Source	Target	MT	Tagged_Target	Error Category	Severity	Annotator_ID
1	doc1	To compare the effect of Sheng-Xue-Xiao-Ban Capsule (SXXBC) and indirubin to the peripheral platelets of the Idiopathic thrombocytopenic purpura (ITP) model mouse. 		比较生血消斑胶囊（SXXBC）和靛玉红对特发性血小板减少性紫癜（ITP）模型小鼠外周血小板的影响。 	Huawei_AGI_run2	比较<tag>生血消斑</tag>胶囊（SXXBC）和靛玉红对特发性血小板减少性紫癜（ITP）模型小鼠外周血小板的影响。 	Terminology - Wrong term	Critical	215701
2	doc1	The ITP mouse model was established by the method of passive immunization. 		采用被动免疫法建立ITP小鼠模型。 	Huawei_AGI_run2				215701
3	doc1	SXXBC and indirubin were used for intervention treatment. 		采用SXXBC和靛玉红进行干预治疗。 	Huawei_AGI_run2				215701
4	doc1	Then the hemorrhagic phenomena of ITP mice were observed and the numbers of peripheral platelets, hemoglobin and white blood cells, bone marrow megakaryocytes and their classification and coagulation function were detected and compared. 		观察ITP小鼠的出血现象，检测并比较外周血小板、血红蛋白和白细胞、骨髓巨核细胞的数量及其分类和凝血功能。 	Huawei_AGI_run2				215701
5	doc1	The improvement rate of hemorrhage in SXXBC group was 40% for small dose, 60% for medium dose and 80% for high dose, while the improvement rate of hemorrhage in indirubin group was 30% for small dose, 50% for medium dose and 60% for high dose. 		SXXBC组出血改善率小剂量为40%，中剂量为60%，高剂量为80%；靛玉红组出血改善率小剂量为30%，中剂量为50%，高剂量为60%。 	Huawei_AGI_run2				215701
6	doc1	There was no statistically significant difference in the improvement rate of hemorrhage between the two groups (P＞0.05). 		两组出血改善率比较，差异无统计学意义（P>0.05）。 	Huawei_AGI_run2	两组出血改善率比较，差异无<tag>统计学意义</tag>（P>0.05）。 	Terminology - Wrong term	Major	215701
7	doc1	Compared with the model control group, PLT and Hb increased in different doses of SXXBC and indirubin group 4th-8th day after drug intervention (P＜0.05, 0.01). 		与模型对照组比较，不同剂量SXXBC和靛玉红组在药物干预后第4~8天PLT和Hb均升高（P<0.05，0.01）。 	Huawei_AGI_run2				5225868
8	doc1	However, there was no significant difference between the different doses of SXXBC group and indirubin group (P＞0.05). 		而不同剂量SXXBC组与靛玉红组比较，差异无统计学意义（P>0.05）。 	Huawei_AGI_run2	而不同剂量SXXBC组与靛玉红组比较，差异无<tag>统计学意义</tag>（P>0.05）。 	Terminology - Wrong term	Major	215701
9	doc1	Compared with the model control group, the WBC in each group was significantly lower (P＜0.05, 0.01) on the 4th-8th day after drug intervention; However, there was no statistical significance between the two groups of SXXBC and indirubin (P＞0.05). 		与模型对照组比较，药物干预后第4~8天各组WBC均显著降低（P<0.05，0.01）；而两组SXXBC、靛玉红组间差异无统计学意义（P>0.05）。 	Huawei_AGI_run2	与模型对照组比较，药物干预后第4~8天各组WBC均显著降低（P<0.05，0.01）；而两组SXXBC、靛玉红组间差异无<tag>统计学意义</tag>（P>0.05）。 	Terminology - Wrong term	Major	215701
10	doc1	Compared with the model control group, the total number of megakaryocytes in each treatment group were decreased (P＜0.05, P＜0.01), in which the number of primary megakaryocytes in the large and medium dose groups of SXXBC and indirubin were decreased (P＜0.05, 0.01), and the number of juvenile megakaryocytes in the large dose group of SXXBC and indirubin were also decreased (P＜0.05). 		与模型对照组相比，各治疗组巨核细胞总数均减少（P<0.05，P<0.01），其中SXXBC、靛玉红大、中剂量组原代巨核细胞数减少（P<0.05，0.01），SXXBC、靛玉红大剂量组幼年巨核细胞数也减少（P<0.05）。 	Huawei_AGI_run2				215701
11	doc1	The number of granular megakaryocytes were decreased in each intervention groups (P＜0.05, 0.01), and the number of thromocytogenic megakaryocyte was increased in the high and medium dose groups of SXXBC and indirubin (P＜0.01). 		各干预组颗粒巨核细胞数均减少（P<0.05，0.01），SXXBC、靛玉红高、中剂量组致血小板巨核细胞数增加（P<0.01）。 	Huawei_AGI_run2				215701
12	doc1	The time of prothrombin was shortened in the high and medium dose groups of SXXBC and indirubin (P＜0.05), and the fibrinogen (FIB) content in the high and medium dose groups of SXXBC was close to that of the normal control group. 		SXXBC、靛玉红高、中剂量组凝血酶原时间缩短（P<0.05），SXXBC高、中剂量组纤维蛋白原（FIB）含量接近正常对照组。 	Huawei_AGI_run2				215701
13	doc1	Both of the SXXBC and the indirubin standard all show good hemostatic effects. 		SXXBC和靛玉红标准品均表现出良好的止血效果。 	Huawei_AGI_run2				215701
14	doc1	Indirubin shows a positive effect on increasing the peripheral platelet and hemoglobin in ITP model mice, regulating the immune response, reducing the total number of bone marrow megakaryocytes, increasing the thromocytogenic megakaryocyte, and increasing coagulation function.		靛玉红对增加 ITP 模型小鼠外周血小板和血红蛋白，调节免疫反应，减少骨髓巨核细胞总数，增加血小板生成巨核细胞，增加凝血功能具有积极作用。 	Huawei_AGI_run2				215701
1	doc2	A simplified grading system for trachoma was published by the World Health Organization (WHO) in 1987. 		世界卫生组织（卫生组织）于1987年公布了沙眼的简化分级制度。 	Huawei_AGI_run2				215701
2	doc2	Intended for use by non-specialist personnel working at community level, the system includes five signs, each of which can be present or absent in any eye: (i) trachomatous trichiasis; (ii) corneal opacity; (iii) trachomatous inflammation-follicular; (iv) trachomatous inflammation-intense; and (v) trachomatous scarring. 		该系统供在社区工作的非专业人员使用，包括5个征象，每个征象在任何一只眼睛中均可出现或消失：（i）沙眼倒睫；（ii）角膜混浊；（iii）沙眼性炎症-滤泡；（iv）沙眼性炎症-强烈；（v）沙眼性瘢痕。 	Huawei_AGI_run2				215701
3	doc2	Though neither perfectly sensitive nor perfectly specific for trachoma, these signs have been essential tools for identifying populations that need interventions to eliminate trachoma as a public health problem. 		虽然沙眼既不完全敏感，也不完全特异，但这些体征是确定需要干预措施消除沙眼这一公共卫生问题的基本工具。 	Huawei_AGI_run2				5225868
4	doc2	In 2018, at WHO's 4th global scientific meeting on trachoma, the definition of one of the signs, trachomatous trichiasis, was amended to exclude trichiasis that affects only the lower eyelid. 		2018年，在世界卫生组织第4次全球沙眼科学会议上，对其中一种标志沙眼倒睫的定义进行了修正，将仅影响下眼睑的倒睫排除在外。 	Huawei_AGI_run2	2018年，在世界卫生组织第<tag>4</tag>次全球沙眼科学会议上，对其中一种标志沙眼倒睫的定义进行了修正，将仅影响下眼睑的倒睫排除在外。 	Locale Conventions - Number format	Major	215701
5	doc2	This paper presents the amended system, updates its presentation, offers notes on its use and identifies areas of ongoing debate.		本文件介绍经修订的制度，更新其表述方式，提供使用说明，并确定正在辩论的领域。 	Huawei_AGI_run2	本文件介绍经修订的制度，更新其表述方式，提供使用说明，并确定正在<tag>辩论</tag>的领域。 	Accuracy - Mistranslation	Minor	215701
1	doc3	Influenza virus infection is a respiratory infectious disease that can seriously affect human health. 		流感病毒感染是一种严重影响人类健康的呼吸道传染病。 	Huawei_AGI_run2				215701
2	doc3	Influenza viruses can have frequent antigenic variation and changes, which can result in rapid and widespread transmission resulting in annual epidemics and outbreaks in places of public gathering such as schools, kindergartens and nursing homes. 		流感病毒可以有频繁的抗原变异和变化，这可以导致快速和广泛的传播，导致每年的流行和爆发在公众聚集地，如学校、幼儿园和养老院。 	Huawei_AGI_run2				215701
3	doc3	According to WHO estimation, seasonal influenza epidemics have caused an annually 3 to 5 million severe cases and 290 000 to 650 000 deaths globally. 		据世卫组织估计，季节性流感疫情每年在全球造成300万至500万重症病例和29万至65万人死亡。 	Huawei_AGI_run2				215701
4	doc3	Pregnant women, young children, the elderly, and persons with chronic illnesses are at high risk for severe illness and death associated with influenza virus infection. 		孕妇、幼儿、老人、慢性病患者是流感病毒感染相关严重疾病和死亡的高危人群。 	Huawei_AGI_run2				215701
5	doc3	Especially, COVID-19 pandemic might co-circulate with other respiratory infectious diseases such as influenza in the coming winter-spring season. 		尤其在即将到来的冬春季节，COVID-19大流行可能与流感等其他呼吸道传染病共同传播。 	Huawei_AGI_run2				215701
6	doc3	Seasonal influenza vaccination is the most effective way to prevent influenza virus infection and complications from infection. 		季节性流感疫苗接种是预防流感病毒感染和感染并发症最有效的方法。 	Huawei_AGI_run2				215701
7	doc3	Currently, China has licensed trivalent inactivated influenza vaccine (IIV3) which includes split-virus influenza vaccine and subunit vaccine, quadrivalent inactivated influenza vaccine (IIV4) which is split, and trivalent live attenuated influenza vaccine (LAIV3) which was newly licensed. 		目前，中国已获得三价流感灭活疫苗（IIV3）许可，包括裂解病毒流感疫苗和亚单位疫苗、裂解的四价流感灭活疫苗（IIV4）和新获得许可的三价流感减毒活疫苗（LAIV3）。 	Huawei_AGI_run2				215701
8	doc3	Except for a few major cities, influenza vaccine is a category Ⅱ vaccine, which means influenza vaccination is voluntary, and recipients must pay for it. 		除个别大城市外，流感疫苗属于II类疫苗，意味着流感疫苗接种是自愿的，接受者必须付费。 	Huawei_AGI_run2				215701
9	doc3	In 2018 and 2019, the China CDC issued the "Technical Guidelines for Seasonal Influenza Vaccination in China" . 		2018年和2019年，中国疾控中心发布了《中国季节性流感疫苗接种技术指南》。 	Huawei_AGI_run2				5225868
10	doc3	In the past year, new research evidences home and abroad have been published, and new seasonal influenza vaccine has been licensed in China. 		近一年来，国内外新的研究证据陆续发表，新型季节性流感疫苗在我国上市。 	Huawei_AGI_run2				215701
11	doc3	To strengthen the technical guidance for prevention and control of influenza and operational research on influenza vaccination in China, the National Immunization Advisory Committee (NIAC) Influenza Vaccination Technical Working Group (TWG), updated the 2019-2020 technical guidelines and compiled the "Technical guidelines for seasonal influenza vaccination in China (2020-2021)" . 		为加强我国流感防控技术指导和流感疫苗接种业务研究，国家免疫咨询委员会流感疫苗接种技术工作组（TWG）更新了2019-2020年技术指南，编制了《中国季节性流感疫苗接种技术指南（2020-2021年）》。 	Huawei_AGI_run2				215701
12	doc3	The main updates in this version include the following: First, new research evidences especially studies of China, including disease burden, effectiveness, Vaccine-avoidable disease burden, vaccine safety monitoring, and cost-effectiveness and cost-benefit. 		本版本主要更新内容如下：第一，新的研究证据，特别是中国的研究，包括疾病负担、有效性、疫苗可避免的疾病负担、疫苗安全监测、成本效益和成本效益。 	Huawei_AGI_run2				215701
13	doc3	Second, policies and measures for influenza prevention and control issued by National Health Commission (PRC) in the past year. 		二、国家卫生健康委员会过去一年发布的流感防控政策措施。 	Huawei_AGI_run2	<tag>二</tag>、国家卫生健康委员会过去一年发布的流感防控政策措施。 	Other	Minor	215701
14	doc3	Thirdly, new type seasonal influenza vaccine licensed and issued in 2020-2021 in China. 		第三，新型季节性流感疫苗在2020-2021年在中国上市和上市。 	Huawei_AGI_run2	第三，新型季节性流感疫苗在2020-2021年在中国<tag>上市</tag>和上市。 	Accuracy - Mistranslation	Critical	215701
15	doc3	Fourth, northern hemisphere influenza vaccination composition for the 2020-2021 season which included trivalent and quadrivalent influenza vaccine. 		第四，2020-2021年季节北半球流感疫苗接种组成，包括三价和四价流感疫苗。 	Huawei_AGI_run2				215701
16	doc3	Fifth, Influenza vaccination recommendations for 2020-2021 influenza season. 		第五，2020-2021流感季节流感疫苗接种建议。 	Huawei_AGI_run2				215701
17	doc3	The recommendations described in this report include the following: Points of Vaccination clinics (PoVs) should provide influenza vaccination to all persons aged 6 months and above who are willing to be vaccinated and do not have contraindications. 		本报告所述建议包括以下内容：预防接种门诊点应向所有6个月及以上愿意接种疫苗且无禁忌症的人群提供流感疫苗接种。 	Huawei_AGI_run2				215701
18	doc3	No preferential recommendation is made for one influenza vaccine product over another for persons for whom more than one licensed, recommended, and appropriate product is available. 		对于有多个许可、推荐和合适产品可供使用的人员，不会对一种流感疫苗产品优先推荐另一种。 	Huawei_AGI_run2	对于有多个许可、推荐和合适产品可供使用的人员，不会<tag>对一种流感疫苗产品优先推荐另一种</tag>。 	Accuracy - Mistranslation	Major	215701
19	doc3	Considering the situation of globally pandemic of COVID-19, to decrease the risk of influenza virus infection and minimize the impact on COVID-19 prevention and control, we recommend the following priority for seasonal influenza vaccination: healthcare workers, including clinical doctors and nurses, public health professionals, quarantine professionals; vulnerable groups living in nursing homes or welfare homes and staffs who take care those vulnerable groups; people work or stay in high population density places, such as teachers and students in kindergartens, primary and secondary school, prisoners and staffs of prisons; other high risk group of influenza, including adults ≥60 years of age, children aged 6-59 months, persons with specific chronic diseases, the family members and caregivers of infants <6 months of age, and pregnant women or women who plan to become pregnant during the influenza season. 		考虑到COVID-19全球大流行形势，为降低流感病毒感染风险，最大限度减少对COVID-19防控的影响，建议优先接种季节性流感疫苗：医护人员，包括临床医生和护士、公共卫生专业人员、检疫专业人员；居住在养老院或福利院的弱势群体和照顾这些弱势群体的工作人员；幼儿园、中小学、监狱的教师和学生等高人口密度场所工作或留宿；其他流感高危群体，包括60岁以上成人、6个月以上儿童、患6个月以上慢性病者、患儿家属和6个月以下的照顾者；孕妇、孕期妇女、孕期妇女、孕期妇女、孕期计划成为流感高危人群。 	Huawei_AGI_run2	<tag>考虑到COVID-19全球大流行形势，为降低流感病毒感染风险，最大限度减少对COVID-19防控的影响，建议优先接种季节性流感疫苗：医护人员，包括临床医生和护士、公共卫生专业人员、检疫专业人员；居住在养老院或福利院的弱势群体和照顾这些弱势群体的工作人员；幼儿园、中小学、监狱的教师和学生等高人口密度场所工作或留宿；其他流感高危群体，包括60岁以上成人、6个月以上儿童、患6个月以上慢性病者、患儿家属和6个月以下的照顾者；孕妇、孕期妇女、孕期妇女、孕期妇女、孕期计划成为流感高危人群。</tag>	Unintelligible	Critical	5225868
20	doc3	Children aged 6 months through 8 years require 2 doses of influenza vaccine administered a minimum of 4 weeks apart during their first season of vaccination for optimal protection. 		6个月至8岁的儿童在接种第一季疫苗时至少需要间隔4周接种2剂流感疫苗，以获得最佳保护。 	Huawei_AGI_run2				215701
21	doc3	People whoever get IIV or LAIV all apply to the principle. 		凡是得了IIV或LAIV的人都适用这一原则。 	Huawei_AGI_run2	凡是<tag>得了IIV</tag>或LAIV的人都适用这一原则。 	Accuracy - Mistranslation	Minor	215701
22	doc3	If they were vaccinated in 2019-2020 influenza season or a prior season, 1 dose is recommended. 		如果在2019-2020年流感季节或之前的季节接种疫苗，建议接种1剂。 	Huawei_AGI_run2				215701
23	doc3	People more than 8 years old require 1 dose of influenza vaccine. 		8岁以上人群需接种1剂流感疫苗。 	Huawei_AGI_run2				215701
24	doc3	It is recommended that people receive their influenza vaccination by the end of October. 		建议民众在10月底前接种流感疫苗。 	Huawei_AGI_run2				215701
25	doc3	Influenza vaccination should be offered as soon as the vaccination is available. 		接种疫苗后，应尽快提供流感疫苗接种。 	Huawei_AGI_run2	<tag>接种</tag>疫苗后，应尽快提供流感疫苗接种。 	Accuracy - Mistranslation	Critical	215701
26	doc3	For the people unable to be vaccinated before the end of October, influenza vaccination will continue to be offered for the whole season. 		对于10月底前无法接种疫苗的群众，将继续开展全季流感疫苗接种。 	Huawei_AGI_run2				5225868
27	doc3	Influenza vaccine is also recommended for use in pregnant women during any trimester. 		流感疫苗也建议孕妇在任何孕期使用。 	Huawei_AGI_run2	<tag>流感疫苗也建议孕妇在任何孕期使用。</tag>	Unintelligible	Critical	5225868
28	doc3	These guidelines are intended for use by staff members of the CDCs at all levels who work on influenza control and prevention, PoVs staff members, healthcare workers from the departments of pediatrics, internal medicine, and infectious diseases, and staff members of maternity and child care institutions at all levels. 		本指南供从事流感防控工作的各级疾控中心工作人员、PoVs工作人员、儿科、内科、传染科等科室的医护人员以及各级妇幼保健机构工作人员使用。 	Huawei_AGI_run2				215701
29	doc3	These guidelines will be updated periodically as new evidence becomes available.		随着新证据的出现，这些指南将定期更新。 	Huawei_AGI_run2				215701
1	doc4	Very high-resolution (VHR) satellite sensors can be used to estimate the size of animal populations, a critical factor in wildlife management, and acquire animal spatial distributions in an economical, easy, and precise way. 		极高分辨率（VHR）卫星传感器可用于估计动物种群规模，这是野生动物管理的关键因素，并以经济、简便和精确的方式获取动物的空间分布。 	Huawei_AGI_run2				215701
2	doc4	We developed a method for satellite population size estimation that includes a noninvasive photogrammetry, from which the animal's average orthographic area is calculated, and an imagery interpretation method that estimates population size based on the ratio of an observed animal population area to the average individual area. 		我们开发了一种卫星种群大小估算方法，该方法包括无创摄影测量，从中计算动物的平均正射面积，以及一种图像判读方法，该方法根据观察到的动物种群面积与平均个体面积的比率估算种群大小。 	Huawei_AGI_run2	我们开发了一种卫星种群大小估算方法，该方法包括<tag>无创</tag>摄影测量，从中计算动物的平均正射面积，以及一种图像判读方法，该方法根据观察到的动物种群面积与平均个体面积的比率估算种群大小。 	Accuracy - Mistranslation	Major	215701
3	doc4	As a proof of concept, we used this method to estimate the population size of Whooper Swans (Cygnus cygnus) in a national nature reserve in China. 		作为概念的证明，我们利用该方法估计了中国国家级自然保护区的天鹅（Whooper Swans，Cygnus）的种群规模。 	Huawei_AGI_run2				5225868
4	doc4	To reduce errors, the reserve was subdivided into regions of interest based on locations of Whooper Swan and background brightness. 		为了减少误差，根据大天鹅的位置和背景亮度将保留区细分为感兴趣区域。 	Huawei_AGI_run2	为了减少误差，根据<tag>大天鹅</tag>的位置和背景亮度将保留区细分为感兴趣区域。 	Terminology - Wrong term	Major	215701
5	doc4	Estimates from the satellite pixels were compared with manual counts made over 2 years, at 3 locations, and in 3 land-cover types. 		对卫星像素的估计值与2年多来在3个地点和3种土地覆盖类型的人工计数进行了比较。 	Huawei_AGI_run2	对卫星像素的估计值与<tag>2</tag>年多来在3个地点和3种土地覆盖类型的人工计数进行了比较。 	Locale Conventions - Number format	Major	215701
5	doc4	Estimates from the satellite pixels were compared with manual counts made over 2 years, at 3 locations, and in 3 land-cover types. 		对卫星像素的估计值与2年多来在3个地点和3种土地覆盖类型的人工计数进行了比较。 	Huawei_AGI_run2	对卫星像素的估计值与2年多来在<tag>3</tag>个地点和3种土地覆盖类型的人工计数进行了比较。 	Locale Conventions - Number format	Major	215701
5	doc4	Estimates from the satellite pixels were compared with manual counts made over 2 years, at 3 locations, and in 3 land-cover types. 		对卫星像素的估计值与2年多来在3个地点和3种土地覆盖类型的人工计数进行了比较。 	Huawei_AGI_run2	对卫星像素的估计值与2年多来在3个地点和<tag>3</tag>种土地覆盖类型的人工计数进行了比较。 	Locale Conventions - Number format	Major	215701
6	doc4	Our results showed 1124 Whooper Swans occupied a national nature reserve on 15 February 2013, and the average percent error was 3.16% (SE = 1.37). 		结果表明，2013年2月15日，1124只天鹅占据了国家级自然保护区，平均误差为3.16%（SE=1.37）。 	Huawei_AGI_run2				215701
7	doc4	These results demonstrate that our method produced robust data for population size estimation that were indistinguishable from manual count data. 		这些结果表明，我们的方法产生的人群规模估计的鲁棒数据，是不可区分的人工计数数据。 	Huawei_AGI_run2	这些结果表明，我们的方法产生的<tag>人群</tag>规模估计的鲁棒数据，是不可区分的人工计数数据。 	Accuracy - Mistranslation	Major	215701
7	doc4	These results demonstrate that our method produced robust data for population size estimation that were indistinguishable from manual count data. 		这些结果表明，我们的方法产生的人群规模估计的鲁棒数据，是不可区分的人工计数数据。 	Huawei_AGI_run2	这些结果表明，我们的方法产生的人群规模估计的鲁棒数据，<tag>是不可区分的</tag>人工计数数据。 	Accuracy - Mistranslation	Major	215701
8	doc4	Our method may be used generally to estimate population sizes of visible and gregarious animals that exhibit high contrast relative to their environments and may inform estimations of populations in complex backgrounds.		我们的方法通常可以用来估计可见和群居动物的数量，这些动物相对于其环境表现出高对比度，并且可以作为复杂背景下的种群估计的依据。 	Huawei_AGI_run2				5225868
1	doc5	Kenya's Constitution of 2010 triggered a cascade of reforms across all sectors to align with new constitutional standards, including devolution and a comprehensive bill of rights. 		肯尼亚2010年宪法引发了所有部门的一连串改革，以符合新的宪法标准，包括权力下放和全面的权利法案。 	Huawei_AGI_run2				215701
2	doc5	The constitution acts as a platform to advance health rights and to restructure policy, legal, institutional and regulatory frameworks towards reversing chronic gaps and improving health outcomes. 		宪法是一个平台，可促进健康权利，并调整政策、法律、体制和监管框架，以扭转长期存在的差距，改善卫生成果。 	Huawei_AGI_run2				215701
3	doc5	These constitutionally mandated health reforms are complex. 		这些由宪法授权的医疗改革是复杂的。 	Huawei_AGI_run2				215701
4	doc5	All parts of the health system are transforming concurrently, with several new laws enacted and public health bodies established. 		卫生系统的所有部分都在同时进行改革，颁布了若干新的法律，并建立了公共卫生机构。 	Huawei_AGI_run2				215701
