SEG_ID	Doc	Source	Tagged_Source	Target	MT	Tagged_Target	Error Category	Severity	Annotator_ID
12	doc28	The dorsiflexion range of the affected side was (21.55±1.26)°, which was significantly different from that of the healthy side (25.23±1.45)° (  The application of anterolateral femoral flap in combination with fascia lata grafting for the repair of large Achilles tendon and skin defects can achieve good effectiveness.		患侧背屈范围为（21.55±1.26）°，与健侧背屈范围（25.23±1.45）°比较，差异有统计学意义（P<0.05）；应用股前外侧皮瓣联合阔筋膜移植修复大跟腱及皮肤缺损，可取得良好疗效。 	Huawei_AGI_run3				197645
1	doc29	Chronic hepatitis B (CHB) poses a serious threat to the health of the Chinese people. 		慢性乙型肝炎（CHB）严重威胁着中国人民的健康。 	Huawei_AGI_run3				197645
2	doc29	Viral markers are of great significance during antiviral therapy and research and development of innovative drugs. 		病毒标志物在抗病毒治疗和创新药物研发过程中具有重要意义。 	Huawei_AGI_run3				197645
3	doc29	However, traditional serovirological markers such as HBV DNA and hepatitis B surface antigen (HBsAg) have certain limitations in assessing the efficacy of antiviral treatment and accurately reflecting the transcriptional activity of covalently closed circular DNA (cccDNA). 		然而，传统的血清学标志物如HBV DNA和乙肝表面抗原（HBsAg）在评估抗病毒治疗的疗效和准确反映共价闭合环状DNA（cccDNA）的转录活性方面存在一定的局限性。 	Huawei_AGI_run3				197645
4	doc29	In recent years, the role of new viral markers such as HBV RNA, hepatitis B core-related antigen (HBcrAg) and quantitative anti-hepatitis B core protein (qAnti-HBc) have attracted more and more attention because of accurately reflecting the transcription activity of cccDNA, determining the therapeutic effect and predicting the risk of recurrence after drug discontinuation. 		近年来，HBV RNA、乙肝核心相关抗原（HBcrAg）、定量抗乙肝核心蛋白（qAnti-HBc）等新型病毒标志物因能准确反映cccDNA的转录活性、确定治疗效果和预测停药后复发风险而备受关注。 	Huawei_AGI_run3				197645
5	doc29	This article briefly introduces the application of new and old markers in various stages of antiviral therapy in CHB patients, and combines the application of new viral markers in the evaluation of drug efficacy, and expounds its possible role in the research and development of new antiviral therapy.		本文简要介绍新旧标志物在CHB患者抗病毒治疗各阶段中的应用，并结合新型病毒标志物在药物疗效评价中的应用，阐述其在新型抗病毒治疗研发中的可能作用。 	Huawei_AGI_run3	本文简要介绍新旧标志物在CHB患者抗病毒治疗各阶段中的应用，并结合新型病毒标志物在药物疗效评价中的应用，阐述其在新型抗病毒治疗研发中的<tag>可能</tag>作用。 	Style - Non-fluent	Neutral	197645
1	doc30	Canine atopic dermatitis (cAD) is a common inflammatory and pruritic skin disease, with various treatment options. 		犬特应性皮炎（cAD）是一种常见的炎性和瘙痒性皮肤病，有多种治疗方案。 	Huawei_AGI_run3				197645
2	doc30	The use of topical products containing natural ingredients has proven increasingly popular. 		事实证明，使用含有天然成分的外用产品越来越受欢迎。 	Huawei_AGI_run3				197645
3	doc30	To evaluate the effects of a spray solution containing heat-killed Lactobacillus rhamnosus and L. reuteri, on the clinical signs and cutaneous microbiota of atopic dogs. 		目的：探讨热灭活鼠李氏乳杆菌（Lactobacillus rhamnosus）和路氏乳杆菌（L.reuteri）喷雾液对特应性犬临床症状和皮肤微生物群的影响。 	Huawei_AGI_run3	<tag>目的：</tag>探讨热灭活鼠李氏乳杆菌（Lactobacillus rhamnosus）和路氏乳杆菌（L.reuteri）喷雾液对特应性犬临床症状和皮肤微生物群的影响。 	Accuracy - Addition	Neutral	197645
4	doc30	Ten privately owned, mildly affected, nonseasonally atopic dogs. 		十只私人饲养的轻微受影响的非季节性特应性犬	Huawei_AGI_run3	十只私人饲养的轻微受影响的非季节性特应性<tag>犬</tag>	Linguistic Conventions - Punctuation	Minor	197645
4	doc30	Ten privately owned, mildly affected, nonseasonally atopic dogs. 		十只私人饲养的轻微受影响的非季节性特应性犬	Huawei_AGI_run3	十只私人饲养的轻微<tag>受影响的</tag>非季节性特应性犬	Accuracy - Mistranslation	Minor	197645
5	doc30	The spray was applied to the ventrum every 24 h for 28 days. 		每24 h喷一次，持续28 d。 	Huawei_AGI_run3	每<tag>24 h</tag>喷一次，持续28 d。 	Accuracy - Untranslated	Minor	197645
5	doc30	The spray was applied to the ventrum every 24 h for 28 days. 		每24 h喷一次，持续28 d。 	Huawei_AGI_run3	每24 h喷一次，持续<tag>28 d</tag>。 	Accuracy - Untranslated	Minor	197645
6	doc30	Clinical scores, skin barrier function and owner assessment were evaluated on day (D)0, D14, D28 and D42. 		在（D）0、D14、D28和D42天评估临床评分、皮肤屏障功能和责任者评估。 	Huawei_AGI_run3	在<tag>（D）</tag>0、D14、D28和D42天评估临床评分、皮肤屏障功能和责任者评估。 	Accuracy - Mistranslation	Major	197645
7	doc30	The cutaneous microbiota was analysed on D0 and D28. 		皮肤菌群在D0和D28上进行分析。 	Huawei_AGI_run3	<tag>皮肤菌群在D0和D28上进行分析。</tag>	Accuracy - Mistranslation	Minor	197645
8	doc30	A reduction in the total clinical score was seen at each time point (D14, P = 0.03; D28, P = 0.04; D42, P = 0.001). 		临床总评分在各时间点均降低（D14，P=0.03；D28，P=0.04；D42，P=0.001）。 	Huawei_AGI_run3				197645
9	doc30	A reduction in the regional clinical scores was seen after D28 (P = 0.01) and D42 (P = 0.003). 		D28（P=0.01）和D42（P=0.003）后，区域临床评分降低。 	Huawei_AGI_run3				197645
10	doc30	A significant reduction in the pruritus score was seen on D42 (P = 0.01). 		D42评分显著降低（P=0.01）。 	Huawei_AGI_run3				197645
11	doc30	A lower hydration value was seen on D28 (P = 0.02) and D42 (P = 0.02) on the pinnae. 		耳廓的D28（P=0.02）和D42（P=0.02）的水化值更低。 	Huawei_AGI_run3				197645
12	doc30	A good-to-excellent response and an easy-to-use administration was reported by owners. 		业主报告了良好到极好的反应和易于使用的给药。 	Huawei_AGI_run3	<tag>业主</tag>报告了良好到极好的反应和易于使用的给药。 	Accuracy - Mistranslation	Major	197645
12	doc30	A good-to-excellent response and an easy-to-use administration was reported by owners. 		业主报告了良好到极好的反应和易于使用的给药。 	Huawei_AGI_run3	业主报告了良好到极好的反应和<tag>易于使用的给药</tag>。 	Style - Non-fluent	Neutral	197645
13	doc30	There were no significant changes in the cutaneous microbiota after 28 days. 		28 d后皮肤菌群无明显变化。 	Huawei_AGI_run3	<tag>28 d</tag>后皮肤菌群无明显变化。 	Terminology - Inconsistent use of terminology	Neutral	197645
14	doc30	There was a significant and rapid decrease in the clinical signs associated with cAD after use of the spray. 		使用喷雾剂后，与cAD相关的临床体征显著且快速下降。 	Huawei_AGI_run3				197645
15	doc30	Future larger, randomized, controlled studies are needed to confirm these results and to assess the effects on the cutaneous immunity and microflora of atopic dogs.		未来需要更大范围、随机、对照研究来证实这些结果，并评估对特应性犬皮肤免疫和菌群的影响。 	Huawei_AGI_run3				197645
1	doc31	This review assessed the real-world evidence of the management of macular oedema secondary to branch retinal vein occlusion (BRVO). 		这篇综述评估了视网膜分支静脉阻塞（BRVO）继发黄斑水肿治疗的真实世界证据。 	Huawei_AGI_run3	这篇综述评估了视网膜分支静脉阻塞（BRVO）继发黄斑水肿治疗的<tag>真实世界</tag>证据。 	Accuracy - Mistranslation	Neutral	197645
2	doc31	A meta-analysis of 2530 eyes from 48 real-world studies of therapies for macular oedema secondary to BRVO was conducted. 		对来自48项治疗BRVO继发黄斑水肿的真实世界研究的2530只眼进行了Meta分析。 	Huawei_AGI_run3	对来自48项治疗BRVO继发黄斑水肿的<tag>真实世界</tag>研究的2530只眼进行了Meta分析。 	Accuracy - Mistranslation	Major	197645
3	doc31	Baseline characteristics, visual, anatomical and safety outcomes were recorded. 		记录基线特征、视觉、解剖学及安全性结果。 	Huawei_AGI_run3				197645
4	doc31	The weighted mean and weighted estimates from random-effects models were calculated for visual acuity (VA) and central subfield thickness (CST) changes at 6, 12 and 24 months. 		计算6、12和24个月的随机效应模型中视力（VA）和中央亚区厚度（CST）变化的加权平均值和加权估计值。 	Huawei_AGI_run3				197645
5	doc31	Primary outcome was change in VA (logMAR letters) at 12 months. 		主要转归是12个月时VA（logMAR字母）的变化。 	Huawei_AGI_run3	主要<tag>转归</tag>是12个月时VA（logMAR字母）的变化。 	Accuracy - Mistranslation	Minor	197645
6	doc31	Study quality was assessed using the quality appraisal checklist for case series developed by Institute of Health Economics. 		采用卫生经济研究所制定的病例系列质量评价清单对研究质量进行评价。 	Huawei_AGI_run3				197645
7	doc31	The mean baseline VA for the pooled data was 54.0 (51.5, 56.5) letters and the mean baseline CST was 501.3 (483.5, 519.1) µm. 		合并数据的平均基线VA为54.0（51.5，56.5）个字母，平均基线CST为501.3（483.5，519.1）μm。 	Huawei_AGI_run3	合并数据的平均基线VA为54.0（51.5，56.5）个字母，平均基线CST为501.3（483.5，519.1）<tag>μm</tag>。 	Accuracy - Untranslated	Minor	197645
8	doc31	The random-effects estimate for mean (95% CI) change in VA was 14.6 (12.5, 16.7) letters at 12 months (n = 1727). 		12个月时，VA平均变化（95%CI）的随机效应估计值为14.6（12.5，16.7）个字母（n=1727）。 	Huawei_AGI_run3				197645
9	doc31	The random-effects estimate for mean (95% CI) change in CST was -181.7 (-230.7, -132.7) µm at 12 months (n = 1325). 		12个月时CST平均变化（95%CI）的随机效应估计值为-181.7（-230.7，-132.7）μm（n=1325）。 	Huawei_AGI_run3	12个月时CST平均变化（95%CI）的随机效应估计值为-181.7（-230.7，-132.7）<tag>μm</tag>（n=1325）。 	Accuracy - Untranslated	Minor	197645
10	doc31	The quality of studies varied considerably. 		研究的质量差别很大。 	Huawei_AGI_run3				197645
11	doc31	Ocular and systemic adverse events were discussed in 79% and 42% of treatment arms respectively, with possible under-reporting. 		79%的治疗组和42%的治疗组讨论了眼部不良事件和全身不良事件，可能存在漏报。 	Huawei_AGI_run3				197645
12	doc31	Visual and anatomical gains achieved in the real-world for anti-VEGF therapy were not as impressive as seminal RCTs, possibly due to reduced injection frequency in the real world and differences in baseline characteristics. 		真实世界中抗VEGF治疗的视觉和解剖学效果不如精准RCTs那么令人印象深刻，这可能是由于真实世界中注射频率降低和基线特征的差异。 	Huawei_AGI_run3	<tag>真实世界</tag>中抗VEGF治疗的视觉和解剖学效果不如精准RCTs那么令人印象深刻，这可能是由于真实世界中注射频率降低和基线特征的差异。 	Accuracy - Mistranslation	Neutral	197645
12	doc31	Visual and anatomical gains achieved in the real-world for anti-VEGF therapy were not as impressive as seminal RCTs, possibly due to reduced injection frequency in the real world and differences in baseline characteristics. 		真实世界中抗VEGF治疗的视觉和解剖学效果不如精准RCTs那么令人印象深刻，这可能是由于真实世界中注射频率降低和基线特征的差异。 	Huawei_AGI_run3	真实世界中抗VEGF治疗的视觉和解剖学效果不如精准RCTs那么令人印象深刻，这可能是由于<tag>真实世界</tag>中注射频率降低和基线特征的差异。 	Accuracy - Mistranslation	Neutral	197645
12	doc31	Visual and anatomical gains achieved in the real-world for anti-VEGF therapy were not as impressive as seminal RCTs, possibly due to reduced injection frequency in the real world and differences in baseline characteristics. 		真实世界中抗VEGF治疗的视觉和解剖学效果不如精准RCTs那么令人印象深刻，这可能是由于真实世界中注射频率降低和基线特征的差异。 	Huawei_AGI_run3	真实世界中抗VEGF治疗的视觉和解剖学效果不如<tag>精准</tag>RCTs那么令人印象深刻，这可能是由于真实世界中注射频率降低和基线特征的差异。 	Terminology - Wrong term	Major	197645
13	doc31	There is an urgent need for consensus on the minimum efficacy, treatment burden and safety data to collect to strengthen the real-world evidence base.		迫切需要就最低疗效、治疗负担和安全性数据达成共识以加强真实世界证据基础。 	Huawei_AGI_run3	迫切需要就最低疗效、治疗负担和安全性数据达成共识以<tag>加强真实世界证据基础</tag>。 	Style - Non-fluent	Neutral	197645
1	doc32	Anti-vascular endothelial growth factors (anti-VEGF) have become the most common treatment modality for many retinal diseases. 		抗血管内皮生长因子（anti-VEGF）已成为许多视网膜疾病最常见的治疗方式。 	Huawei_AGI_run3				197645
2	doc32	These include neovascular age-related macular degeneration (n-AMD), proliferative diabetic retinopathy (PDR) and retinal vein occlusions (RVO). 		这些包括新生血管性年龄相关性黄斑变性（n-AMD）、增殖性糖尿病视网膜病变（PDR）和视网膜静脉阻塞（RVO）。 	Huawei_AGI_run3				197645
3	doc32	However, these drugs are administered via intravitreal injections that are associated with sight-threatening complications. 		然而，这些药物是通过玻璃体腔注射给药的，这些药物与威胁视力的并发症相关。 	Huawei_AGI_run3				197645
4	doc32	The most feared of these complications is endophthalmitis, a severe infection of the eye with extremely poor visual outcomes. 		最令人担心的并发症是眼内炎，这是一种视觉效果极差的眼部严重感染。 	Huawei_AGI_run3	最令人担心的并发症是眼内炎，这是一种视觉<tag>效果</tag>极差的眼部严重感染。 	Accuracy - Mistranslation	Minor	197645
5	doc32	Patients with retinal diseases typically have to undergo multiple injections before achieving the desired therapeutic effect. 		视网膜疾病患者通常必须经过多次注射才能达到预期的治疗效果。 	Huawei_AGI_run3				197645
6	doc32	Each injection incurs the risk of the sight-threatening complications. 		每次注射都可能引起危及视力的并发症。 	Huawei_AGI_run3				197645
7	doc32	As such, there has been great interest in developing sustained delivery platforms for anti-VEGF agents to the posterior segment of the eye. 		因此，开发抗VEGF药物持续递送平台至眼后段一直备受关注。 	Huawei_AGI_run3	因此，开发抗VEGF药物持续<tag>递送</tag>平台至眼后段一直备受关注。 	Accuracy - Mistranslation	Minor	197645
8	doc32	In recent years, there have been various strategies that have been conceptualised. 		近年来，已有各种战略被概念化。 	Huawei_AGI_run3	近年来，已有各种<tag>战略被概念化</tag>。 	Style - Non-fluent	Neutral	197645
9	doc32	These include non-biodegradable implants, nano-formulations and hydrogels. 		这些包括不可生物降解的植入物、纳米制剂和水凝胶。 	Huawei_AGI_run3				197645
10	doc32	In this review, the barriers of drug delivery to the posterior segment of the eye will be explained. 		在本综述中，将解释药物递送至眼后段的障碍。 	Huawei_AGI_run3	在本综述中，将解释药物<tag>递送</tag>至眼后段的障碍。 	Accuracy - Mistranslation	Neutral	197645
11	doc32	The characteristics of an ideal sustained delivery platform will then be discussed. 		随后将讨论理想持续输送平台的特点。 	Huawei_AGI_run3	随后将讨论理想持续输送<tag>平台</tag>的特点。 	Style - Non-fluent	Neutral	197645
12	doc32	Finally, the current available strategies will be analysed with the above-mentioned characteristics in mind to determine the advantages and disadvantages of each sustained drug delivery modality. 		最后，将结合上述特点分析目前可用的策略，以确定每种持续给药方式的优缺点。 	Huawei_AGI_run3				197645
13	doc32	Through the above, this review attempts to provide an overview of the sustained delivery platforms in their various phases of development.		通过上述内容，本综述试图概述各个开发阶段的持续交付平台。 	Huawei_AGI_run3	通过上述内容，本综述试图概述各个开发阶段的持续<tag>交付平台</tag>。 	Accuracy - Mistranslation	Minor	197645
1	doc33	To evaluate the effectiveness of cement-injectable cannulated pedicle screw combined with multiple level Schwab grade Ⅰ osteotomy for chronic thoracolumbar osteoporotic fractures with kyphosis. 		评价骨水泥型空心椎弓根螺钉联合多节段SchwabI级截骨治疗慢性胸腰椎骨质疏松性骨折伴后凸畸形的疗效。 	Huawei_AGI_run3				197645
2	doc33	The clinical data of 27 patients with symptomatic chronic thoracolumbar osteoporotic fractures combined with kyphosis treated between June 2015 and June 2017 were retrospectively analysed. 		回顾性分析2015年6月至2017年6月27例症状性慢性胸腰椎骨质疏松性骨折合并后凸畸形患者的临床资料。 	Huawei_AGI_run3				197645
3	doc33	Among them, there were 8 males and 19 females, with an average age of 69.5 years (range, 56-81 years). 		其中男8例，女19例；年龄56	Huawei_AGI_run3	其中男8例，女19例；年龄<tag>56</tag>	Accuracy - Untranslated	Major	197645
4	doc33	The damage segment (kyphosis vertex) included T  No complications related to pedicle screw and bone cement occurred. 		伤椎（后凸节段）包括T型。 未出现与椎弓根螺钉和骨水泥相关的并发症。 	Huawei_AGI_run3				197645
5	doc33	The incisions healed by first intention in 26 cases, and 1 incision healed after dressing change due to poor blood glucose control. 		26例切口一期愈合，1例切口因血糖控制不佳换药后愈合。 	Huawei_AGI_run3				197645
6	doc33	There were no complications such as bedsore, hypostatic pneumonia, or deep venous thrombosis. 		无褥疮、实体肺炎、下肢深静脉血栓等并发症发生。 	Huawei_AGI_run3				197645
7	doc33	All patients were followed up 8-24 months, with an average of 16.6 months. 	All patients were followed up <tag>8-24 months, with an average of 16.6 months.</tag> 	术后随访8	Huawei_AGI_run3		Accuracy - Omission	Critical	197645
8	doc33	The VAS score, ODI score, Cobb angle, and SVA were significantly improved when compared with those before operation (  For the chronic thoracolumbar osteoporotic fractures combined with kyphosis, the cement-injectable cannulated pedicle screw and multiple level Schwab grade Ⅰ osteotomy has the advantages of less operation trauma, quick recovery, and remarkable effectiveness.		VAS评分、ODI评分、Cobb角、SVA均较术前明显改善（对于慢性胸腰椎骨质疏松性骨折合并后凸畸形，骨水泥注射空心椎弓根螺钉联合多节段SchwabI级截骨具有手术创伤小、恢复快、疗效显著等优点。 	Huawei_AGI_run3				197645
1	doc34	Although the influence of neighborhood disadvantage on youth development of delinquent behavior is well established, findings from this research have yet to inform the development of family-centered prevention programming to protect youth from these erosive effects. The current paper examines the role of family integration in buffering the impact of social disadvantage in a sample of N = 298 families randomly assigned either to a control condition or to a family-based prevention program previously shown to enhance marriage and parenting. 		虽然邻里劣势对青少年犯罪行为发展的影响已得到充分证实，但本研究的发现尚未为制定以家庭为中心的预防方案提供依据，以保护青少年免受这些侵蚀性影响。 	Huawei_AGI_run3	虽然<tag>邻里劣势</tag>对青少年犯罪行为发展的影响已得到充分证实，但本研究的发现尚未为制定以家庭为中心的预防方案提供依据，以保护青少年免受这些侵蚀性影响。 	Style - Non-fluent	Neutral	197645
1	doc34	Although the influence of neighborhood disadvantage on youth development of delinquent behavior is well established, findings from this research have yet to inform the development of family-centered prevention programming to protect youth from these erosive effects. The current paper examines the role of family integration in buffering the impact of social disadvantage in a sample of N = 298 families randomly assigned either to a control condition or to a family-based prevention program previously shown to enhance marriage and parenting. 		虽然邻里劣势对青少年犯罪行为发展的影响已得到充分证实，但本研究的发现尚未为制定以家庭为中心的预防方案提供依据，以保护青少年免受这些侵蚀性影响。 	Huawei_AGI_run3	虽然邻里劣势对青少年犯罪行为发展的影响已得到充分证实，但本研究的发现尚未为制定以家庭为中心的预防方案提供依据，以保护青少年免受这些<tag>侵蚀性</tag>影响。 	Accuracy - Mistranslation	Minor	197645
1	doc34	Although the influence of neighborhood disadvantage on youth development of delinquent behavior is well established, findings from this research have yet to inform the development of family-centered prevention programming to protect youth from these erosive effects. The current paper examines the role of family integration in buffering the impact of social disadvantage in a sample of N = 298 families randomly assigned either to a control condition or to a family-based prevention program previously shown to enhance marriage and parenting. 		虽然邻里劣势对青少年犯罪行为发展的影响已得到充分证实，但本研究的发现尚未为制定以家庭为中心的预防方案提供依据，以保护青少年免受这些侵蚀性影响。 	Huawei_AGI_run3	虽然邻里劣势对青少年犯罪行为发展的影响已得到充分证实，但本研究的发现尚未为制定以家庭为中心的预防方案提供依据，以保护青少年免受这些侵蚀性影响<tag>。</tag>	Accuracy - Untranslated	Critical	197645
2	doc34	We first confirmed that neighborhood concentrated disadvantage predicted change in delinquent behaviors across the course of the study. 		我们首先证实了邻域集中劣势预测了整个研究过程中少年犯行为的改变。 	Huawei_AGI_run3	我们首先证实了<tag>邻域集中劣势</tag>预测了整个研究过程中少年犯行为的改变。 	Accuracy - Mistranslation	Minor	197645
2	doc34	We first confirmed that neighborhood concentrated disadvantage predicted change in delinquent behaviors across the course of the study. 		我们首先证实了邻域集中劣势预测了整个研究过程中少年犯行为的改变。 	Huawei_AGI_run3	我们首先证实了邻域集中劣势预测了整个研究过程中<tag>少年犯</tag>行为的改变。 	Terminology - Inconsistent use of terminology	Neutral	197645
3	doc34	Additionally, replicating prior work, parents participating in the Protecting Strong African American Families (ProSAAF) program, relative to those randomly assigned to the control group, significantly improved their use of effective communication strategies with each other and reduced ineffective conflict in front of youth. 		此外，与随机分配到对照组的家长相比，参加保护强大的非裔美国人家庭（ProSAAF）计划的家长重复先前的工作，大大提高了他们彼此之间有效沟通策略的使用，并减少了青年面前的无效冲突。 	Huawei_AGI_run3	此外，与随机分配到对照组的家长相比，参加保护强大的非裔美国人家庭（ProSAAF）计划的家长<tag>重复先前的工作</tag>，大大提高了他们彼此之间有效沟通策略的使用，并减少了青年面前的无效冲突。 	Accuracy - Addition	Minor	197645
3	doc34	Additionally, replicating prior work, parents participating in the Protecting Strong African American Families (ProSAAF) program, relative to those randomly assigned to the control group, significantly improved their use of effective communication strategies with each other and reduced ineffective conflict in front of youth. 		此外，与随机分配到对照组的家长相比，参加保护强大的非裔美国人家庭（ProSAAF）计划的家长重复先前的工作，大大提高了他们彼此之间有效沟通策略的使用，并减少了青年面前的无效冲突。 	Huawei_AGI_run3	此外，与随机分配到对照组的家长相比，参加保护强大的非裔美国人家庭（ProSAAF）计划的家长重复先前的工作，大大提高了他们彼此之间有效沟通策略的使用，并减少了青年<tag>面前的</tag>无效冲突。 	Style - Non-fluent	Neutral	197645
