SEG_ID	Doc	Source	Tagged_Source	Target	MT	Tagged_Target	Error Category	Severity	Annotator_ID
2	doc21	A total of 39 hematopenia patients with suspected myeloid malignamies in Department of Hematology of The Affiliated Huai'an No.1 People's Hospital of Nanjing Medical University from January 2018 to April 2019 were treated, 20 hot spot genes of myelodysplastic syndrome (MDS) were detected. 		治疗2018年1月至2019年4月南京医科大学附属淮安第一人民医院血液科血液科疑似髓样恶性肿瘤的血细胞减少患者共39例，检出骨髓增生异常综合征(Mds)热点基因20个。 	ZengHuiMT_run1	治疗2018年1月至2019年4月南京医科大学附属淮安第一人民医院血液科血液科疑似髓样恶性肿瘤的血细胞<tag>减少</tag>患者共39例，检出骨髓增生异常综合征(Mds)热点基因20个。 	Accuracy - Addition	Critical	5133754
3	doc21	Regarding the diagnostic type, there were 7 cases of idiopathic cytopenia of undetermined significance (ICUS), 8 cases of clonal cytopenias of undetermined significance (CCUS) and 24 cases of myeloid myeloid malignancies which included 18 cases of MDS, 4 cases of myelodysplastic/myeloproliferative neoplasms (MDS/MPN) and 2 cases of acute myeloid leukemia. 		关于诊断类型，有7例意义不明的特发性血细胞减少症（Icus)，8例意义不明的克隆性血细胞减少症（Ccus）和24例髓系恶性肿瘤，包括18例Mds、4例骨髓增生异常/骨髓增殖性肿瘤(Mds/Mpn)和2例急性髓系白血病。 	ZengHuiMT_run1	关于诊断类型，有7例意义不明的特发性血细胞减少症（<tag>Icus</tag>)，8例意义不明的克隆性血细胞减少症（Ccus）和24例髓系恶性肿瘤，包括18例Mds、4例骨髓增生异常/骨髓增殖性肿瘤(Mds/Mpn)和2例急性髓系白血病。 	Linguistic Conventions - Spelling	Major	5133754
3	doc21	Regarding the diagnostic type, there were 7 cases of idiopathic cytopenia of undetermined significance (ICUS), 8 cases of clonal cytopenias of undetermined significance (CCUS) and 24 cases of myeloid myeloid malignancies which included 18 cases of MDS, 4 cases of myelodysplastic/myeloproliferative neoplasms (MDS/MPN) and 2 cases of acute myeloid leukemia. 		关于诊断类型，有7例意义不明的特发性血细胞减少症（Icus)，8例意义不明的克隆性血细胞减少症（Ccus）和24例髓系恶性肿瘤，包括18例Mds、4例骨髓增生异常/骨髓增殖性肿瘤(Mds/Mpn)和2例急性髓系白血病。 	ZengHuiMT_run1	关于诊断类型，有7例意义不明的特发性血细胞减少症（Icus)，8例意义不明的克隆性血细胞减少症（<tag>Ccus</tag>）和24例髓系恶性肿瘤，包括18例Mds、4例骨髓增生异常/骨髓增殖性肿瘤(Mds/Mpn)和2例急性髓系白血病。 	Linguistic Conventions - Spelling	Major	5133754
3	doc21	Regarding the diagnostic type, there were 7 cases of idiopathic cytopenia of undetermined significance (ICUS), 8 cases of clonal cytopenias of undetermined significance (CCUS) and 24 cases of myeloid myeloid malignancies which included 18 cases of MDS, 4 cases of myelodysplastic/myeloproliferative neoplasms (MDS/MPN) and 2 cases of acute myeloid leukemia. 		关于诊断类型，有7例意义不明的特发性血细胞减少症（Icus)，8例意义不明的克隆性血细胞减少症（Ccus）和24例髓系恶性肿瘤，包括18例Mds、4例骨髓增生异常/骨髓增殖性肿瘤(Mds/Mpn)和2例急性髓系白血病。 	ZengHuiMT_run1	关于诊断类型，有7例意义不明的特发性血细胞减少症（Icus)，8例意义不明的克隆性血细胞减少症（Ccus）和24例髓系恶性肿瘤，包括18例<tag>Mds</tag>、4例骨髓增生异常/骨髓增殖性肿瘤(Mds/Mpn)和2例急性髓系白血病。 	Linguistic Conventions - Spelling	Major	5133754
3	doc21	Regarding the diagnostic type, there were 7 cases of idiopathic cytopenia of undetermined significance (ICUS), 8 cases of clonal cytopenias of undetermined significance (CCUS) and 24 cases of myeloid myeloid malignancies which included 18 cases of MDS, 4 cases of myelodysplastic/myeloproliferative neoplasms (MDS/MPN) and 2 cases of acute myeloid leukemia. 		关于诊断类型，有7例意义不明的特发性血细胞减少症（Icus)，8例意义不明的克隆性血细胞减少症（Ccus）和24例髓系恶性肿瘤，包括18例Mds、4例骨髓增生异常/骨髓增殖性肿瘤(Mds/Mpn)和2例急性髓系白血病。 	ZengHuiMT_run1	关于诊断类型，有7例意义不明的特发性血细胞减少症（Icus)，8例意义不明的克隆性血细胞减少症（Ccus）和24例髓系恶性肿瘤，包括18例Mds、4例骨髓增生异常/骨髓增殖性肿瘤(<tag>Mds/Mpn</tag>)和2例急性髓系白血病。 	Linguistic Conventions - Spelling	Major	5133754
4	doc21	Positive mutation was detected in 70.8% (17/24) of myeloid malignancy patients , and 72.7% (16/22) in MDS and MDS/MPN patients. 		70.8% (17/24 )髓系恶性肿瘤患者检出阳性突变Mds和Mds/Mpn患者检出阳性突变72.7% (16/22 )。 	ZengHuiMT_run1				5225868
5	doc21	The main mutation types were ASXL1, TET2 and RUNX1. 		主要突变类型为ASXL1、TET2和RUNX1。 	ZengHuiMT_run1				5225868
6	doc21	Compared with gene negative group, there were no significant differences in sex, age (＜60 years old or ≥60 years old), proportion of bone marrow blast cells (＜5% or≥5%) and cytogenetics (good, medium and poor) (P＞0.05). 		与基因阴性组相比，性别、年龄（≤ 60岁或≥ 60岁）、骨髓原始细胞比例（≤ 5%或≥ 5%）和细胞遗传学（良、中、低）（P< 0.05）无显著差异。 	ZengHuiMT_run1	与基因阴性组相比，性别、年龄（<tag>≤ 60</tag>岁或≥ 60岁）、骨髓原始细胞比例（≤ 5%或≥ 5%）和细胞遗传学（良、中、低）（P< 0.05）无显著差异。 	Accuracy - Mistranslation	Critical	5133754
6	doc21	Compared with gene negative group, there were no significant differences in sex, age (＜60 years old or ≥60 years old), proportion of bone marrow blast cells (＜5% or≥5%) and cytogenetics (good, medium and poor) (P＞0.05). 		与基因阴性组相比，性别、年龄（≤ 60岁或≥ 60岁）、骨髓原始细胞比例（≤ 5%或≥ 5%）和细胞遗传学（良、中、低）（P< 0.05）无显著差异。 	ZengHuiMT_run1	与基因阴性组相比，性别、年龄（≤ 60岁或≥ 60岁）、骨髓原始细胞比例（<tag>≤</tag> 5%或≥ 5%）和细胞遗传学（良、中、低）（P< 0.05）无显著差异。 	Accuracy - Mistranslation	Critical	5133754
6	doc21	Compared with gene negative group, there were no significant differences in sex, age (＜60 years old or ≥60 years old), proportion of bone marrow blast cells (＜5% or≥5%) and cytogenetics (good, medium and poor) (P＞0.05). 		与基因阴性组相比，性别、年龄（≤ 60岁或≥ 60岁）、骨髓原始细胞比例（≤ 5%或≥ 5%）和细胞遗传学（良、中、低）（P< 0.05）无显著差异。 	ZengHuiMT_run1	与基因阴性组相比，性别、年龄（≤ 60岁或≥ 60岁）、骨髓原始细胞比例（≤ 5%或≥ 5%）和细胞遗传学（良、中、低）（P<tag><</tag> 0.05）无显著差异。 	Accuracy - Mistranslation	Critical	5133754
7	doc21	Furthermore, all 8 CCUS patients showed positive mutation, and the incidence of double or multiple mutation in CCUS group was significantly lower than that of the MDS and MDS/MPN group (37.5% vs 54.5%) (P=0.002). 		再者，所有8例Ccus患者均表现出阳性突变，Ccus组双突变或多突变的发生率显著低于Mds和Mds/Mpn组(37.5% vs 54.5%) (P=0.002 )。 	ZengHuiMT_run1	再者，所有8例<tag>Ccus</tag>患者均表现出阳性突变，Ccus组双突变或多突变的发生率显著低于Mds和Mds/Mpn组(37.5% vs 54.5%) (P=0.002 )。 	Linguistic Conventions - Spelling	Major	5133754
7	doc21	Furthermore, all 8 CCUS patients showed positive mutation, and the incidence of double or multiple mutation in CCUS group was significantly lower than that of the MDS and MDS/MPN group (37.5% vs 54.5%) (P=0.002). 		再者，所有8例Ccus患者均表现出阳性突变，Ccus组双突变或多突变的发生率显著低于Mds和Mds/Mpn组(37.5% vs 54.5%) (P=0.002 )。 	ZengHuiMT_run1	再者，所有8例Ccus患者均表现出阳性突变，<tag>Ccus</tag>组双突变或多突变的发生率显著低于Mds和Mds/Mpn组(37.5% vs 54.5%) (P=0.002 )。 	Linguistic Conventions - Spelling	Major	5133754
7	doc21	Furthermore, all 8 CCUS patients showed positive mutation, and the incidence of double or multiple mutation in CCUS group was significantly lower than that of the MDS and MDS/MPN group (37.5% vs 54.5%) (P=0.002). 		再者，所有8例Ccus患者均表现出阳性突变，Ccus组双突变或多突变的发生率显著低于Mds和Mds/Mpn组(37.5% vs 54.5%) (P=0.002 )。 	ZengHuiMT_run1	再者，所有8例Ccus患者均表现出阳性突变，Ccus组双突变或多突变的发生率显著低于<tag>Mds</tag>和Mds/Mpn组(37.5% vs 54.5%) (P=0.002 )。 	Linguistic Conventions - Spelling	Major	5133754
7	doc21	Furthermore, all 8 CCUS patients showed positive mutation, and the incidence of double or multiple mutation in CCUS group was significantly lower than that of the MDS and MDS/MPN group (37.5% vs 54.5%) (P=0.002). 		再者，所有8例Ccus患者均表现出阳性突变，Ccus组双突变或多突变的发生率显著低于Mds和Mds/Mpn组(37.5% vs 54.5%) (P=0.002 )。 	ZengHuiMT_run1	再者，所有8例Ccus患者均表现出阳性突变，Ccus组双突变或多突变的发生率显著低于Mds和<tag>Mds/Mpn</tag>组(37.5% vs 54.5%) (P=0.002 )。 	Linguistic Conventions - Spelling	Major	5133754
8	doc21	The mutation types between the two groups were similar, and there was no significant difference in variant allele frequency (P＞0.05). 		两组突变类型相似，变异等位基因频率无显著差异(P＞ 0.05 )。 	ZengHuiMT_run1				5133754
9	doc21	Our results suggest that there are high rates of double or multiple mutations in myeloid malignancies, especially in patients with MDS and MDS/MPN. 		我们的研究结果表明，骨髓恶性肿瘤的双突变或多突变率较高，尤其是Mds和Mds/Mpn患者。 	ZengHuiMT_run1				5225868
10	doc21	Targeted sequencing assay can improve the diagnosis of myeloid malignancies, and guide clinical treatment.		靶向测序测定可提高髓系恶性肿瘤的诊断，指导临床治疗。 	ZengHuiMT_run1				5225868
1	doc22	Agreement and correlation are widely-used concepts that assess the association between variables. 		协议和相关性是广泛使用的评估变量之间关联的概念。 	ZengHuiMT_run1	<tag>协议</tag>和相关性是广泛使用的评估变量之间关联的概念。 	Terminology - Wrong term	Neutral	5133754
2	doc22	Although similar and related, they represent completely different notions of association. 		虽然相似和相关，但它们代表了完全不同的联想观念。 	ZengHuiMT_run1				5225868
3	doc22	Assessing agreement between variables assumes that the variables measure the same construct, while correlation of variables can be assessed for variables that measure completely different constructs. 		评估变量之间的一致性假设变量衡量同一结构，而变量的相关性可以评估测量完全不同结构的变量。 	ZengHuiMT_run1	<tag>评估变量之间的一致性假设变量衡量同一结构，而变量的相关性可以评估测量完全不同结构的变量。</tag>	Unintelligible	Critical	5225868
4	doc22	This conceptual difference requires the use of different statistical methods, and when assessing agreement or correlation, the statistical method may vary depending on the distribution of the data and the interest of the investigator. 		这种概念差异需要使用不同的统计方法，在评估协议或相关性时，统计方法可能根据数据的分布和研究者的利益而有所不同。 	ZengHuiMT_run1				5133754
5	doc22	For example, the Pearson correlation, a popular measure of correlation between continuous variables, is only informative when applied to variables that have linear relationships; it may be non-informative or even misleading when applied to variables that are not linearly related. 		例如，应用于具有线性关系的变量时，作为连续变量之间相关性的流行度量指标的培生相关只有信息； 当应用于非线性关联的变量时，可能是非信息性的，甚至是误导性的。 	ZengHuiMT_run1	例如，应用于具有线性关系的变量时，作为连续变量之间相关性的流行度量指标的培生相关只有<tag>信息</tag>； 当应用于非线性关联的变量时，可能是非信息性的，甚至是误导性的。 	Terminology - Wrong term	Major	5133754
5	doc22	For example, the Pearson correlation, a popular measure of correlation between continuous variables, is only informative when applied to variables that have linear relationships; it may be non-informative or even misleading when applied to variables that are not linearly related. 		例如，应用于具有线性关系的变量时，作为连续变量之间相关性的流行度量指标的培生相关只有信息； 当应用于非线性关联的变量时，可能是非信息性的，甚至是误导性的。 	ZengHuiMT_run1	例如，应用于具有线性关系的变量时，作为连续变量之间相关性的<tag>流行度量指标的培生</tag>相关只有信息； 当应用于非线性关联的变量时，可能是非信息性的，甚至是误导性的。 	Terminology - Wrong term	Major	5133754
6	doc22	Likewise, the intraclass correlation, a popular measure of agreement between continuous variables, may not provide sufficient information for investigators if the nature of poor agreement is of interest. 		同样，如果不一致性的性质令人感兴趣，类内相关性（连续变量之间一致性的流行度量指标）可能无法为研究者提供足够的信息。 	ZengHuiMT_run1				5225868
7	doc22	This report reviews the concepts of agreement and correlation and discusses differences in the application of several commonly used measures. 		本报告回顾了协议和相关性的概念，并讨论了几种常用措施在应用上的差异。 	ZengHuiMT_run1				5225868
1	doc23	Child welfare systems (CWSs) worldwide show increased interest in adopting empirically informed clinical strategies to increase treatment effectiveness. 		全球儿童福利系统(CWSs)对采用经验性知情的临床策略以提高治疗效果越来越感兴趣。 	ZengHuiMT_run1				5225868
2	doc23	Many empirically supported treatments (ESTs) exist, but little is known about EST implementation barriers and facilitators in CWS. 		许多经验支持的治疗(Ests)存在，但对Est实施障碍和Cws的促进者知之甚少。 	ZengHuiMT_run1				5225868
3	doc23	This study explored CWS providers' experiences of implementing attachment-based family therapy (ABFT) in home-based services of the Flemish CWS (in Belgium). 		本研究探讨了Cws提供者在佛兰芒Cws的家庭基础治疗(Abft)中实施附件型家庭治疗（比利时）的经验。 	ZengHuiMT_run1				5225868
4	doc23	Sixteen CWS providers (twelve counselors and four supervisors) involved in three home-based services were interviewed. 		参与三个家庭服务的16名Cws提供者（12名辅导员和4名监工）接受了采访。 	ZengHuiMT_run1				5225868
5	doc23	The Consolidated Framework for Implementation Research (CFIR) was used to guide collection, coding, and analysis of interview data. 		合并实施研究框架（实施框架）用于指导采访数据的收集、编码和分析。 	ZengHuiMT_run1				5225868
6	doc23	Findings revealed that implementation success was related to ABFT's fit with the CWS's mission, philosophy, and existing practices. 		结果表明，实施成功与阿布夫特符合Cws的使命、哲学和现有的做法有关。 	ZengHuiMT_run1				5225868
7	doc23	CWS providers' belief in the compatibility between ABFT and CWS increased investment in implementation efforts and persistence to overcome challenges and setbacks. 		提供者对Abft和Cws兼容性的信念增加了对实施努力的投入，并坚持克服挑战和挫折。 	ZengHuiMT_run1				5225868
8	doc23	Some barriers pertained to the learning of ABFT and some barriers pertained to systems level challenges such as lack of leadership and support, poor coordination with referral sources and other youth care partners, and lack of policy support. 		有些障碍与Abft的学习有关，有些障碍与系统级别的挑战有关，如缺乏领导和支持，与转诊来源和其他青年护理伙伴协调不良，以及缺乏政策支持。 	ZengHuiMT_run1				5225868
9	doc23	For successful expansion of ESTs into CWS settings, various barriers at multiple systemic levels need to be addressed.		为了成功地将ESTs扩展到Cws设置中，需要解决多个全身水平的各种障碍。 	ZengHuiMT_run1				5225868
1	doc24	To evaluate all simulation models for ophthalmology technical and non-technical skills training and the strength of evidence to support their validity and effectiveness. 		评估眼科技术和非技术技能培训的所有模拟模型以及支持其有效性和有效性的证据。 	ZengHuiMT_run1				5225868
2	doc24	A systematic search was performed using PubMed and Embase for studies published from inception to 01/07/2019. 		使用PubMed和Embase对从发病至201/07/2019年发表的研究进行系统检索。 	ZengHuiMT_run1				5225868
3	doc24	Studies were analysed according to the training modality: virtual reality; wet-lab; dry-lab models; e-learning. 		根据训练方式：虚拟现实进行分析研究； 湿实验室； 干实验室模型； 电子学习。 	ZengHuiMT_run1				5225868
4	doc24	The educational impact of studies was evaluated using Messick's validity framework and McGaghie's model of translational outcomes for evaluating effectiveness. 		研究的教育效果评价采用麦西克的有效性框架和麦加吉的翻译结果模型来评价效果。 	ZengHuiMT_run1	研究的教育效果评价采用麦西克的有效性框架和麦加吉的<tag>翻译</tag>结果模型来评价效果。 	Accuracy - Mistranslation	Major	215701
5	doc24	One hundred and thirty-one studies were included in this review, with 93 different simulators described. 		本综述纳入了131项研究，描述了93种不同的模拟器。 	ZengHuiMT_run1				215701
6	doc24	Fifty-three studies were based on virtual reality tools; 47 on wet-lab models; 26 on dry-lab models; 5 on e-learning. 		53项研究基于虚拟现实工具； 湿实验室模型的47个； 干实验室模型26； 5关于电子学习。 	ZengHuiMT_run1	53项研究基于虚拟现实工具； 湿实验室模型的47个； 干实验室模型<tag>26</tag>； 5关于电子学习。 	Accuracy - Mistranslation	Major	215701
6	doc24	Fifty-three studies were based on virtual reality tools; 47 on wet-lab models; 26 on dry-lab models; 5 on e-learning. 		53项研究基于虚拟现实工具； 湿实验室模型的47个； 干实验室模型26； 5关于电子学习。 	ZengHuiMT_run1	53项研究基于虚拟现实工具； 湿实验室模型的47个； 干实验室模型26； <tag>5</tag>关于电子学习。 	Accuracy - Mistranslation	Major	215701
7	doc24	Only two studies provided evidence for all five sources of validity assessment. 		只有两项研究为所有五个有效性评估来源提供了证据。 	ZengHuiMT_run1				215701
8	doc24	Models with the strongest validity evidence were the Eyesi Surgical, Eyesi Direct Ophthalmoscope and Eye Surgical Skills Assessment Test. 		有效证据最有效的模型是Eyesi外科手术、Eyesi直接检眼镜和眼外科技能评估试验。 	ZengHuiMT_run1				215701
9	doc24	Effectiveness ratings for simulator models were mostly limited to level 2 (contained effects) with the exception of the Sophocle vitreoretinal surgery simulator, which was shown at level 3 (downstream effects), and the Eyesi at level 5 (target effects) for cataract surgery. 		除Sophocle玻璃体视网膜手术模拟器（显示为3级（下游效应））和Eyesi（白内障手术的5级（目标效应））外，模拟器模型的有效性评级大多仅限于2级（所含效应）。 	ZengHuiMT_run1				215701
10	doc24	A wide range of models have been described but only the Eyesi has undergone comprehensive investigation. 		已经描述了各种各样的模型，但只有Eyesi进行了全面的研究。 	ZengHuiMT_run1				215701
11	doc24	The main weakness is in the poor quality of study design, with a predominance of descriptive reports showing limited validity evidence and few studies investigating the effects of simulation training on patient outcomes. 		主要的缺点是研究设计质量较差，大量描述性报告显示有效证据有限，很少有研究调查模拟训练对患者结局的影响。 	ZengHuiMT_run1				215701
12	doc24	More robust research is needed to enable effective implementation of simulation tools into current training curriculums.		需要进行更有力的研究，以便将模拟工具有效地实施到当前的培训课程中。 	ZengHuiMT_run1				215701
1	doc25	Scarce qualitative literature has focused on understanding the perspective of parents of adolescents involved in crime, and no prior literature has examined how the status of being a parent of an adolescent who is involved in delinquency intersects with being an immigrant parent. 		稀薄的质的文献集中在了解青少年的父母对参与犯罪的看法，没有先前的文献研究过参与犯罪的青少年的父母地位是如何与移民父母相交的。 	ZengHuiMT_run1				5225868
2	doc25	The current phenomenological study examined, through the eyes of immigrant parents, how they comprehend their children's involvement in delinquent behavior. 		当前的现象学研究，通过移民父母的眼光，他们如何理解孩子参与不良行为。 	ZengHuiMT_run1	当前的现象学研究，通过移民父母的<tag>眼光</tag>，他们如何理解孩子参与不良行为。 	Accuracy - Mistranslation	Major	215701
3	doc25	This study examined in-depth semistructured interviews conducted with fourteen immigrant parents (10 mothers and 4 fathers) from the former Soviet Union in Israel of children treated in rehabilitation facilities for delinquent youth. 		这项研究调查了在以色列对来自前苏联的14名移民父母(10名母亲和4名父亲)进行的半结构化的深入访谈，访问的对象是在因青年不良康复设施中接受治疗的儿童。 	ZengHuiMT_run1	这项研究调查了在以色列对来自前苏联的14名移民父母(10名母亲和4名父亲)进行的半结构化的深入访谈，访问的对象是在因青年不良康复设施中接受治疗的<tag>儿童</tag>。 	Accuracy - Mistranslation	Critical	215701
4	doc25	Data analysis revealed a gradual decline in children's behavior ascribed to the developmental stage of adolescence, the pressures of immigration, and cultural conflict. 		数据分析显示，儿童的行为逐渐下降，归因于青春期的发展阶段、移民的压力和文化冲突。 	ZengHuiMT_run1				215701
5	doc25	These three factors are interwoven together to create a fabric within which they see their children turning to crime. 		这三个因素交织在一起，形成了一个组织，他们看到自己的孩子变成犯罪。 	ZengHuiMT_run1	这三个因素交织在一起，形成了一个<tag>组织</tag>，他们看到自己的孩子变成犯罪。 	Accuracy - Mistranslation	Major	215701
5	doc25	These three factors are interwoven together to create a fabric within which they see their children turning to crime. 		这三个因素交织在一起，形成了一个组织，他们看到自己的孩子变成犯罪。 	ZengHuiMT_run1	这三个因素交织在一起，形成了一个组织，他们看到自己的孩子<tag>变成</tag>犯罪。 	Accuracy - Mistranslation	Major	215701
6	doc25	Parents' gradual loss of control is balanced by attempts to idealize the parent-child relationship and to minimize the severity of the offenses committed. 		父母逐渐失去控制是通过试图理想化亲子关系和尽量减少犯罪的严重程度来平衡的。 	ZengHuiMT_run1				215701
7	doc25	They describe various differing and even contradictory experiences of themselves as parents and their struggles to piece together incohesive, alternating experiences of themselves as parents. 		他们描述了自己作为父母的各种不同甚至矛盾的经历，以及他们努力将自己作为父母的不拘束、交替的经历拼凑在一起的努力。 	ZengHuiMT_run1				5225868
8	doc25	Despite the critical role they can play in their children's rehabilitation, as well as the distress that they themselves experience, parents of children involved in delinquent behavior have often been ignored in research. 		尽管他们在孩子康复中能够发挥关键作用，以及他们自己遭遇的痛苦，但在研究中往往忽视了参与不良行为的儿童家长。 	ZengHuiMT_run1				215701
9	doc25	Acknowledging parents' perspectives and experiences can allow development of appropriate therapeutic strategies to support them and maximize their abilities to support their children.		承认父母的观点和经验可以使适当的治疗策略得到支持，并最大限度地发挥他们支持孩子的能力。 	ZengHuiMT_run1				215701
