SEG_ID	Doc	Source	Tagged_Source	Target	MT	Tagged_Target	Error Category	Severity	Annotator_ID
7	doc32	As such, there has been great interest in developing sustained delivery platforms for anti-VEGF agents to the posterior segment of the eye. 		因此，人们非常感兴趣的是为抗Vegf制剂开发持续递送平台到眼后节。 	ZengHuiMT_run1	因此，人们非常感兴趣的是为抗<tag>Vegf</tag>制剂开发持续递送平台到眼后节。 	Linguistic Conventions - Spelling	Major	215701
8	doc32	In recent years, there have been various strategies that have been conceptualised. 		近年来，有各种各样的策略被概念化。 	ZengHuiMT_run1				215701
9	doc32	These include non-biodegradable implants, nano-formulations and hydrogels. 		其中包括非生物降解植入物、纳米制剂和水凝胶。 	ZengHuiMT_run1				5225868
10	doc32	In this review, the barriers of drug delivery to the posterior segment of the eye will be explained. 		在本综述中，将解释药物给药到眼后节的障碍。 	ZengHuiMT_run1	在本综述中，将解释<tag>药物给药</tag>到眼后节的障碍。 	Style - Non-fluent	Minor	215701
11	doc32	The characteristics of an ideal sustained delivery platform will then be discussed. 		然后讨论一个理想的持续递送平台的特点。 	ZengHuiMT_run1	然后讨论一个理想的持续<tag>递送</tag>平台的特点。 	Accuracy - Mistranslation	Minor	215701
12	doc32	Finally, the current available strategies will be analysed with the above-mentioned characteristics in mind to determine the advantages and disadvantages of each sustained drug delivery modality. 		最后，将结合上述特点分析目前可用的策略，以确定每种持续给药方式的利弊。 	ZengHuiMT_run1				215701
13	doc32	Through the above, this review attempts to provide an overview of the sustained delivery platforms in their various phases of development.		通过以上内容，本次审查试图概述持续交付平台在其各个发展阶段的持续交付平台。 	ZengHuiMT_run1				5225868
1	doc33	To evaluate the effectiveness of cement-injectable cannulated pedicle screw combined with multiple level Schwab grade Ⅰ osteotomy for chronic thoracolumbar osteoporotic fractures with kyphosis. 		目的评价骨水泥注射空心椎弓根螺钉联合多节段施瓦布I级截骨术治疗慢性胸腰椎骨质疏松性骨折合并脊柱后凸的有效性。 	ZengHuiMT_run1				215701
2	doc33	The clinical data of 27 patients with symptomatic chronic thoracolumbar osteoporotic fractures combined with kyphosis treated between June 2015 and June 2017 were retrospectively analysed. 		回顾性分析2015年6月至2017年6月期间治疗的27例症状性慢性胸腰椎骨质疏松性骨折合并脊柱后凸患者的临床资料。 	ZengHuiMT_run1				215701
3	doc33	Among them, there were 8 males and 19 females, with an average age of 69.5 years (range, 56-81 years). 		其中男性8例，女性19例，平均年龄69.5岁(56 ～ 81岁)。 	ZengHuiMT_run1				215701
4	doc33	The damage segment (kyphosis vertex) included T  No complications related to pedicle screw and bone cement occurred. 		损伤节段（脊柱后凸顶点）包括T，未发生与椎弓根螺钉和骨水泥相关的并发症。 	ZengHuiMT_run1				215701
5	doc33	The incisions healed by first intention in 26 cases, and 1 incision healed after dressing change due to poor blood glucose control. 		一期愈合切口26例，换药后1切口因血糖控制不佳愈合。 	ZengHuiMT_run1				215701
6	doc33	There were no complications such as bedsore, hypostatic pneumonia, or deep venous thrombosis. 		无褥疮、间叶性肺炎、深静脉血栓形成等并发症。 	ZengHuiMT_run1	无褥疮、<tag>间叶</tag>性肺炎、深静脉血栓形成等并发症。 	Terminology - Wrong term	Minor	215701
7	doc33	All patients were followed up 8-24 months, with an average of 16.6 months. 		全部患者随访8-24个月，平均16.6个月。 	ZengHuiMT_run1				215701
8	doc33	The VAS score, ODI score, Cobb angle, and SVA were significantly improved when compared with those before operation (  For the chronic thoracolumbar osteoporotic fractures combined with kyphosis, the cement-injectable cannulated pedicle screw and multiple level Schwab grade Ⅰ osteotomy has the advantages of less operation trauma, quick recovery, and remarkable effectiveness.		与术前相比，Vas评分、Odi评分、Cobb角和Sva明显改善（对于慢性胸腰椎骨质疏松性骨折合并后凸畸形，骨水泥注入式空心椎弓根螺钉和多节段SchwabⅠ级截骨术具有手术创伤小、恢复快、疗效显著等优点。 	ZengHuiMT_run1	与术前相比，<tag>Vas</tag>评分、Odi评分、Cobb角和Sva明显改善（对于慢性胸腰椎骨质疏松性骨折合并后凸畸形，骨水泥注入式空心椎弓根螺钉和多节段SchwabⅠ级截骨术具有手术创伤小、恢复快、疗效显著等优点。 	Linguistic Conventions - Spelling	Major	215701
8	doc33	The VAS score, ODI score, Cobb angle, and SVA were significantly improved when compared with those before operation (  For the chronic thoracolumbar osteoporotic fractures combined with kyphosis, the cement-injectable cannulated pedicle screw and multiple level Schwab grade Ⅰ osteotomy has the advantages of less operation trauma, quick recovery, and remarkable effectiveness.		与术前相比，Vas评分、Odi评分、Cobb角和Sva明显改善（对于慢性胸腰椎骨质疏松性骨折合并后凸畸形，骨水泥注入式空心椎弓根螺钉和多节段SchwabⅠ级截骨术具有手术创伤小、恢复快、疗效显著等优点。 	ZengHuiMT_run1	与术前相比，Vas评分、<tag>Odi</tag>评分、Cobb角和Sva明显改善（对于慢性胸腰椎骨质疏松性骨折合并后凸畸形，骨水泥注入式空心椎弓根螺钉和多节段SchwabⅠ级截骨术具有手术创伤小、恢复快、疗效显著等优点。 	Linguistic Conventions - Spelling	Major	215701
8	doc33	The VAS score, ODI score, Cobb angle, and SVA were significantly improved when compared with those before operation (  For the chronic thoracolumbar osteoporotic fractures combined with kyphosis, the cement-injectable cannulated pedicle screw and multiple level Schwab grade Ⅰ osteotomy has the advantages of less operation trauma, quick recovery, and remarkable effectiveness.		与术前相比，Vas评分、Odi评分、Cobb角和Sva明显改善（对于慢性胸腰椎骨质疏松性骨折合并后凸畸形，骨水泥注入式空心椎弓根螺钉和多节段SchwabⅠ级截骨术具有手术创伤小、恢复快、疗效显著等优点。 	ZengHuiMT_run1	与术前相比，Vas评分、Odi评分、<tag>Cobb</tag>角和Sva明显改善（对于慢性胸腰椎骨质疏松性骨折合并后凸畸形，骨水泥注入式空心椎弓根螺钉和多节段SchwabⅠ级截骨术具有手术创伤小、恢复快、疗效显著等优点。 	Linguistic Conventions - Spelling	Major	215701
8	doc33	The VAS score, ODI score, Cobb angle, and SVA were significantly improved when compared with those before operation (  For the chronic thoracolumbar osteoporotic fractures combined with kyphosis, the cement-injectable cannulated pedicle screw and multiple level Schwab grade Ⅰ osteotomy has the advantages of less operation trauma, quick recovery, and remarkable effectiveness.		与术前相比，Vas评分、Odi评分、Cobb角和Sva明显改善（对于慢性胸腰椎骨质疏松性骨折合并后凸畸形，骨水泥注入式空心椎弓根螺钉和多节段SchwabⅠ级截骨术具有手术创伤小、恢复快、疗效显著等优点。 	ZengHuiMT_run1	与术前相比，Vas评分、Odi评分、Cobb角和<tag>Sva</tag>明显改善（对于慢性胸腰椎骨质疏松性骨折合并后凸畸形，骨水泥注入式空心椎弓根螺钉和多节段SchwabⅠ级截骨术具有手术创伤小、恢复快、疗效显著等优点。 	Linguistic Conventions - Spelling	Major	215701
1	doc34	Although the influence of neighborhood disadvantage on youth development of delinquent behavior is well established, findings from this research have yet to inform the development of family-centered prevention programming to protect youth from these erosive effects. The current paper examines the role of family integration in buffering the impact of social disadvantage in a sample of N = 298 families randomly assigned either to a control condition or to a family-based prevention program previously shown to enhance marriage and parenting. 		尽管邻里劣势对青少年违法行为发展的影响已经明确，但这项研究的结果尚未为开展以家庭为中心的预防规划以保护青少年免受这些侵蚀效应的影响。 本文研究了家庭融合在缓解社会缺陷影响方面的作用，这个样本被随机分配到一个控制条件或以前显示增强婚姻和育儿的家庭为基础的预防项目。 	ZengHuiMT_run1	<tag>尽管邻里劣势对青少年违法行为发展的影响已经明确，但这项研究的结果尚未为开展以家庭为中心的预防规划以保护青少年免受这些侵蚀效应的影响。 本文研究了家庭融合在缓解社会缺陷影响方面的作用，这个样本被随机分配到一个控制条件或以前显示增强婚姻和育儿的家庭为基础的预防项目。</tag>	Unintelligible	Critical	5225868
2	doc34	We first confirmed that neighborhood concentrated disadvantage predicted change in delinquent behaviors across the course of the study. 		我们首先证实，在整个研究过程中，邻里集中劣势预测了违法行为的变化。 	ZengHuiMT_run1				215701
3	doc34	Additionally, replicating prior work, parents participating in the Protecting Strong African American Families (ProSAAF) program, relative to those randomly assigned to the control group, significantly improved their use of effective communication strategies with each other and reduced ineffective conflict in front of youth. 		此外，与随机分配给对照组的人相比，参与保护强大非洲裔美国家庭(ProSAAF)项目的父母复制之前的工作，显著改善了他们相互使用有效的沟通策略，减少了年轻人面前的无效冲突。 	ZengHuiMT_run1				215701
4	doc34	This resulted in a significant indirect effect of ProSAAF on change in youth delinquent behaviors. 		这导致了前卫卫队对青少年违法行为变化的显著间接影响。 	ZengHuiMT_run1	这导致了<tag>前卫卫队</tag>对青少年违法行为变化的显著间接影响。 	Accuracy - Mistranslation	Critical	215701
5	doc34	Furthermore, using mediated moderation analysis, the study tested the buffering effect of greater family integration, showing that experimentally produced change in interparental communication skills and the resulting reduction in youth exposure to parental conflict buffered the effect of neighborhood disadvantage on change in youth delinquent behaviors, supporting a mediated moderation model in which family environments buffer neighborhood effects.		再者，使用中介调节分析，该研究测试了更大家庭融合的缓冲效果，表明实验性产生的父母间交际技能的变化和由此导致青少年暴露于父母冲突的减少缓冲了邻里不利对青少年犯罪行为变化的影响，支持了中介调节模式，其中家庭环境缓冲邻里效应。 	ZengHuiMT_run1				215701
1	doc35	To summarize the research progress of the effects of high glucose microenvironment on the biological activity of adipose-derived stem cells (ADSCs). 		总结高葡萄糖微环境对脂肪干细胞生物活性影响的研究进展。 	ZengHuiMT_run1				215701
2	doc35	The literature on the high glucose microenvironment and ADSCs at home and abroad in recent years was reviewed, and the effects of high glucose microenvironment on the general characteristics, differentiation potential, angiogenesis, and nerve regeneration of ADSCs were summarized. 		综述了近年来国内外关于高葡萄糖微环境和高葡萄糖微环境和高葡萄糖微环境对高葡萄糖微环境和高葡萄糖微环境的影响，总结了高葡萄糖微环境对高葡萄糖微环境中高葡萄糖微环境的总体特征、分化潜能、血管生成和神经再生的影响。 	ZengHuiMT_run1				215701
3	doc35	The accumulation of advanced glycosylation end products (AGEs) in the high glucose microenvironment led to changes in the biological activities of ADSCs through various pathways, including cell surface markers, proliferation, migration, multi-lineage differentiation, secretory function, and tissue repair ability. 		高级糖基化终产物(AGEs)在高葡萄糖微环境中的蓄积通过多种途径导致ADSCs生物活性的变化，包括细胞表面标记物、增殖、迁移、多系分化、分泌功能和组织修复能力。 	ZengHuiMT_run1				215701
4	doc35	The ability of ADSCs to promote angiogenesis and nerve regeneration in high glucose microenvironment is still controversial. 		ADSCs在高葡萄糖微环境中促进血管生成和神经再生的能力仍存在争议。 	ZengHuiMT_run1				5225868
5	doc35	High glucose microenvironment can affect the biological activity of ADSCs, and the effect and mechanism of ADSCs on angiogenesis and nerve regeneration in high glucose microenvironment need to be further studied.		高葡萄糖微环境会影响ADSCs的生物活性，高葡萄糖微环境中ADSCs对血管生成和神经再生的影响和机制有待进一步研究。 	ZengHuiMT_run1				215701
1	doc36	Emergent medical rescue for major disaster accidents and severe war trauma are the state demand. 		重大灾害事故和严重战争创伤的紧急医疗救援是国家的要求。 	ZengHuiMT_run1				215701
2	doc36	The fast and effective emergent medical rescue depends on the establishment of integrated emergent medical rescue system. 		快速有效的急救有赖于建立一体化的急救医疗救助体系。 	ZengHuiMT_run1				215701
3	doc36	We discuss the importance and necessity of establishment of integrated emergent medical rescue system with Chinese characteristics and its main contents in very important regional strategy of China.		论述了建立中国特色一体化急救系统的重要性和必要性及其在中国十分重要的区域战略中的主要内容。 	ZengHuiMT_run1				215701
1	doc37	Complex kinship analysis refers to a kind of special kinship analysis taken for the purpose of personal identification or other issues in civil or criminal cases because the father or （and） mother is dead, or cannot participate in the analysis for other reasons. 		复杂的亲属关系分析是指父亲或（和（和）母亲已经死亡，或因其他原因不能参与分析，用于民事或刑事案件中个人身份或其他问题的一种特殊亲属关系分析。 	ZengHuiMT_run1	复杂的亲属关系分析是指父亲或（和（和）母亲已经死亡，或因<tag>其他</tag>原因不能参与分析，用于民事或刑事案件中个人身份或其他问题的一种特殊亲属关系分析。 	Accuracy - Mistranslation	Major	215701
2	doc37	Due to the absence of significant appraised persons in this kind of kinship analysis, grandparents, siblings or collateral relatives are required to participate in the analysis. 		由于此类血缘关系分析中没有重要的被评价者，因此需要祖父母、兄弟姐妹或亲属参与分析。 	ZengHuiMT_run1				215701
3	doc37	Complex kinship analysis is widely used and the demand is increasing year by year. 		复杂的亲属关系分析被广泛应用，需求逐年增长。 	ZengHuiMT_run1				215701
4	doc37	This paper analyzes the main types of complex kinships, the genetic markers of complex kinship analysis and their advantages and disadvantages and the calculation methods for complex kinship analysis by referring to the relevant literatures at home and abroad in recent years. 		本文结合近年来国内外有关文献，分析了复杂亲属关系的主要类型、复杂亲属关系分析的遗传标记及其优缺点，分析了复杂亲属关系分析的计算方法。 	ZengHuiMT_run1	本文结合近年来国内外有关文献，分析了复杂亲属关系的主要类型<tag>、</tag>复杂亲属关系分析的遗传标记及其优缺点，分析了复杂亲属关系分析的计算方法。 	Linguistic Conventions - Punctuation	Minor	215701
5	doc37	At the same time, the shortcomings of the present research on complex kinship and its future development are prospected.		同时，对目前研究复杂血缘关系的不足及其未来发展进行了展望。 	ZengHuiMT_run1				5225868
1	doc38	This article analyzes the clinical manifestations and magnetic resonance imaging (MRI) data of 2 patients with hypoxic encephalopathy after simple asphyxia gas poisoning. 		本文分析了2例单纯窒息气体中毒后缺氧性脑病患者的临床表现及磁共振(Mri)资料。 	ZengHuiMT_run1	本文分析了2例单纯窒息气体中毒后缺氧性脑病患者的临床表现及磁共振(<tag>Mri</tag>)资料。 	Linguistic Conventions - Spelling	Major	215701
2	doc38	Both patients were in a moderate coma after being poisoned, and the arterial blood lactic acid level and carbon dioxide partial pressure were higher than the normal range within 1 week after poisoning. 		2例患者中毒后均处于中度昏迷状态，中毒后1周内动脉血乳酸水平及二氧化碳分压均高于正常范围。 	ZengHuiMT_run1				215701
3	doc38	Two patients were cured and discharged after being treated with oxygen therapy and glucocorticoids. 		2例经氧疗、糖皮质激素治疗后痊愈出院。 	ZengHuiMT_run1	2例经氧疗<tag>、</tag>糖皮质激素治疗后痊愈出院。 	Linguistic Conventions - Punctuation	Minor	215701
4	doc38	The prognosis was good.		预后良好。 	ZengHuiMT_run1				215701
1	doc39	Chronic hepatitis B virus (HBV) infection remains a major world public health problem. 		慢性乙型肝炎病毒(Hbv)感染仍然是一个主要的世界公共卫生问题。 	ZengHuiMT_run1	慢性乙型肝炎病毒(<tag>Hbv</tag>)感染仍然是一个主要的世界公共卫生问题。 	Linguistic Conventions - Punctuation	Major	215701
2	doc39	Current guidelines of chronic hepatitis B (CHB) suggest the clinical cure as the ideal thearapeutic goal. 		目前慢性乙型肝炎(Chb)的指南认为临床治愈是理想的提前治疗目标。 	ZengHuiMT_run1	目前慢性乙型肝炎(<tag>Chb</tag>)的指南认为临床治愈是理想的提前治疗目标。 	Linguistic Conventions - Punctuation	Major	215701
3	doc39	Although the optimization of the existing antiviral treatment can make some patients achieve clinical cure, but for most patients with chronic hepatitis B, it is difficult to achieve clinical cure according to the existing antiviral treatment plan. 		虽然对现有抗病毒治疗的优化可以使部分患者获得临床治愈，但对于大多数慢性乙肝患者来说，很难按照现有的抗病毒治疗方案实现临床治愈。 	ZengHuiMT_run1				5225868
4	doc39	The medical community has begun to work together to seek new treatment strategies, especially the immune intervention measures aimed at restoring the immune response in the liver microenvironment. 		医学界开始共同努力寻求新的治疗策略，特别是旨在恢复肝脏微环境中免疫应答的免疫干预措施。 	ZengHuiMT_run1				215701
5	doc39	Notably, immune antiviral response plays a crucial role in HBV clearance, and the clinical cure of chronic hepatitis B is finally achieved through the optimized combination of antiviral and immunomodulatory drugs.		值得注意的是，免疫抗病毒应答在Hbv清除中起着至关重要的作用，慢性乙型肝炎的临床治愈最终通过抗病毒和免疫调节药物的优化联合治疗实现。 	ZengHuiMT_run1	值得注意的是，免疫抗病毒应答在<tag>Hbv</tag>清除中起着至关重要的作用，慢性乙型肝炎的临床治愈最终通过抗病毒和免疫调节药物的优化联合治疗实现。 	Linguistic Conventions - Punctuation	Major	215701
1	doc40	Pancreatic cancer(PC) remains one of the most challenging malignant tumor in gastrointestinal cancer, and the incidence and mortality rates are significantly increased in the past decades. 		胰腺癌（Pc）仍是胃肠道癌中最具挑战性的恶性肿瘤之一，近几十年发病率和死亡率显著增加。 	ZengHuiMT_run1	胰腺癌（<tag>Pc</tag>）仍是胃肠道癌中最具挑战性的恶性肿瘤之一，近几十年发病率和死亡率显著增加。 	Linguistic Conventions - Spelling	Major	215701
2	doc40	The 5-years survival rate of PC is less than 8% since its dormant clinical symptoms and lacking of sensibility and specificity markers in early diagnosis. 		由于Pc在早期诊断中缺乏敏感性和特异性标志物，其5年生存率低于8%。 	ZengHuiMT_run1	由于<tag>Pc</tag>在早期诊断中缺乏敏感性和特异性标志物，其5年生存率低于8%。 	Linguistic Conventions - Spelling	Major	215701
3	doc40	The early diagnosis of pancreatic cancer is a worldwide problem, and the early diagnosis rate is only 5%. 		胰腺癌的早期诊断是一个世界性的问题，早期诊断率仅为5%。 	ZengHuiMT_run1				215701
4	doc40	Increasing early diagnosis rate is the key to improve the overall prognosis of pancreatic cancer. 		提高早期诊断率是提高胰腺癌总体预后的关键。 	ZengHuiMT_run1				215701
5	doc40	The key of early diagnosis and treatment of pancreatic cancer is to identify the high-risk population of pancreatic cancer, improve the sensitivity and specificity of early diagnosis technology, standardize the process of early diagnosis of pancreatic cancer, and standardize the treatment of early pancreatic cancer. 		胰腺癌早期诊断和治疗的关键是要明确胰腺癌的高危人群，提高早期诊断技术的敏感性和特异性，规范胰腺癌早期诊断过程，规范早期胰腺癌的治疗。 	ZengHuiMT_run1				215701
6	doc40	To this end, this expert consensus is formulated.		为此，制定了这一专家共识。 	ZengHuiMT_run1				215701
1	doc41	To analyze the gene mutations of children with juvenile myelomonocytic leukemia (JMML) and their correlation with clinical characteristics. 	To analyze the gene mutations of children with juvenile myelomonocytic leukemia <tag>(JMML)</tag> and their correlation with clinical characteristics. 	分析青少年粒单核细胞白血病患儿的基因突变及其与临床特点的相关性。 	ZengHuiMT_run1		Accuracy - Omission	Minor	215701
2	doc41	The genetic mutation results and clinical data of 19 children with JMML in Fujian from January 2015 to December 2018 were collected and analyzed retrospectively. 		回顾性收集2015年1月至2018年12月福建19例Jmml患儿的基因突变结果和临床资料。 	ZengHuiMT_run1				5225868
3	doc41	According to the results of gene mutation, they were divided into PTPN11 gene mutation group and non-PTPN11 gene mutation group, and the clinical characteristics and prognosis of children with JMML between two groups were compared. 		根据基因突变结果分为PTPN11基因突变组和非PTPN11基因突变组，比较两组间Jmml患儿的临床特点及预后。 	ZengHuiMT_run1	根据基因突变结果分为PTPN11基因突变组和非PTPN11基因突变组，比较两组间<tag>Jmml</tag>患儿的临床特点及预后。 	Linguistic Conventions - Spelling	Major	215701
4	doc41	Among the 19 children with JMML, 14 cases were male and 5 cases were female, and male/female ratio was 2.8∶1. 		19例Jmml患儿中，男14例，女5例，男女比例为2.8 ∶ 1。 	ZengHuiMT_run1	19例<tag>Jmml</tag>患儿中，男14例，女5例，男女比例为2.8 ∶ 1。 	Linguistic Conventions - Spelling	Major	215701
5	doc41	The median age at diagnosis was 13(3-48) months, and 14 cases (73.68%) were less than 2 years old. 		诊断时的中位年龄为13 (3-48 )个月，14例(73.68%)小于2岁。 	ZengHuiMT_run1				215701
6	doc41	Abdominal distension and pyrexia were the common initial symptoms, and all the children with JMML had splenomegaly. 		腹胀和发热是常见的初始症状，所有的Jmml患儿都有脾肿大。 	ZengHuiMT_run1	腹胀和发热是常见的初始症状，所有的<tag>Jmml</tag>患儿都有脾肿大。 	Linguistic Conventions - Spelling	Major	215701
7	doc41	The median white blood cell count was 39.82(4.53-103.4)×10 JMML is more common in male infancy and toddlerhood, and the main gene mutation types are PTPN11 and Ras mutations. 		中位白细胞计数为39.82 (4.53-103.4 )×10 Jmml多见于男婴幼儿，主要基因突变类型为PTPN11和Ras突变。 	ZengHuiMT_run1	中位白细胞计数为39.82 (4.53-103.4 )×10 <tag>Jmml</tag>多见于男婴幼儿，主要基因突变类型为PTPN11和Ras突变。 	Linguistic Conventions - Spelling	Major	215701
8	doc41	Because the JMML children with PTPN11 mutations show particularly rapid disease progression, if there is no timely intervention, most children die in a short period of time. 		由于携带PTPN11突变的Jmml儿童表现出特别快的疾病进展，如果没有及时的干预，大多数儿童在短时间内死亡。 	ZengHuiMT_run1	由于携带PTPN11突变的<tag>Jmml</tag>儿童表现出特别快的疾病进展，如果没有及时的干预，大多数儿童在短时间内死亡。 	Linguistic Conventions - Spelling	Major	215701
9	doc41	Therefore, early HSCT may improve the prognosis of the children with JMML.		因此，早期Hsct可能改善Jmml患儿的预后。 	ZengHuiMT_run1				5225868
