SEG_ID	Doc	Source	Tagged_Source	Target	MT	Tagged_Target	Error Category	Severity	Annotator_ID
1	doc5	Die Primäre Ciliäre Dyskinesie (PCD, MIM 242650) ist eine seltene hereditäre Multisystemerkrankung mit klinisch heterogenem Phänotyp.		Primary Ciliary Dyskinesia (PCD, MIM 242650) is a rare hereditary multisystem disease with a clinically heterogeneous phenotype.					5367941
2	doc5	Leitsymptom ist eine chronische Sekretretention der oberen und unteren Atemwege, welche durch die Dysfunktion motiler respiratorischer Zilien entsteht.		The main symptom is a chronic secretion of the upper and lower airways, which is caused by the dysfunction of motile respiratory cilia.					184933
3	doc5	In der Folge kommt es zur Ausbildung von Bronchiektasen, häufig zu einer Infektion durch Pseudomonas aeruginosa sowie einer abnehmenden Lungenfunktion bis hin zum Lungenversagen.		This leads to the development of bronchiectasis, often to an infection by Pseudomonas aeruginosa and a decrease in lung function up to lung failure.					5367941
4	doc5	Bislang gibt es kaum evidenzbasierte Therapieempfehlungen, da randomisierte Langzeitstudien zur Behandlung der PCD fehlten.		To date, there are few evidence-based treatment recommendations due to the lack of randomized long-term trials for the treatment of PCD.					184933
5	doc5	In diesem Jahr wurden die Daten einer ersten placebokontrollierten Medikamentenstudie bei PCD veröffentlicht.		Data from a first placebo-controlled drug trial in PCD were published this year.					184933
6	doc5	Anlässlich dieses Meilensteins im Management der PCD wurde der vorliegende Übersichtsartikel als Konsens von Patientenvertretern sowie Klinikern, die langjährige Erfahrung in der Behandlung der PCD haben, verfasst.		On the occasion of this milestone in the management of PCD, the present review article was written as a consensus of patient representatives and clinicians with many years of experience in the treatment of PCD.					184933
7	doc5	Diese Arbeit bietet eine Zusammenfassung aktuell eingesetzter Behandlungsverfahren, die überwiegend auf persönlichen Erfahrungen und Expertenmeinungen beruhen oder von anderen Atemwegserkrankungen wie der Cystischen Fibrose (CF), COPD oder Bronchiektasen-Erkrankung abgeleitet werden.		This work provides a summary of currently used treatment methods, which are mainly based on personal experience and expert opinions or are derived from other respiratory diseases such as cystic fibrosis (CF), COPD or bronchiectasis.					5367941
8	doc5	Da es derzeit keine kurative Therapie für PCD gibt, stehen symptomatische Maßnahmen wie die regelmäßige Reinigung der Atemwege und die Behandlung von rezidivierenden Atemwegsinfektionen im Fokus.		As there is currently no curative treatment for PCD, the focus will be on symptomatic measures such as regular respiratory cleansing and treatment of recurrent respiratory infections.					184933
9	doc5	Nicht respiratorische Manifestationen werden organspezifisch behandelt.		Non-respiratory manifestations are treated on an organ-specific basis.					184933
10	doc5	Um neben der ersten Medikamentenstudie mehr evidenzbasiertes Wissen zu generieren, werden weitere Projekte etabliert, u. a. ein internationales PCD-Register.		In order to generate more evidence-based knowledge in addition to the first drug study, further projects are established, e.g. an international PCD register.					184933
11	doc5	Hierüber wird Patienten der Zugang zu klinischen und wissenschaftlichen Studien erleichtert und die Vernetzung behandelnder Zentren gefördert.		This facilitates patients' access to clinical and scientific studies and promotes the networking of treatment centers.					184933
12	doc5	Des Weiteren können Erkenntnisse über eine Genotyp-spezifische Erkrankungsschwere erlangt werden, um folglich die therapeutische Versorgung der Patienten zu verbessern und somit zu individualisieren.		Furthermore, insights into genotype-specific disease severity can be obtained in order to improve and thus individualize the therapeutic care of patients.					184933
1	doc50	Seit Dezember 2019 hat sich das neuartige Coronavirus SARS-CoV‑2 („severe acute respiratory syndrome coronavirus 2“), das die Erkrankung COVID-19 („coronavirus disease 2019“) auslöst, mit rasanter Geschwindigkeit über die gesamte Welt ausgebreitet.		Since December 2019, the novel coronavirus SARS-CoV-2 (“severe acute respiratory syndrome coronavirus 2”), which causes COVID-19 (“coronavirus disease 2019”), has spread across the entire world at a rapid rate.					5367941
2	doc50	Ausgehend von der chinesischen Provinz Hubei, wurden mittlerweile 29,4 Mio. Menschen weltweit infiziert, und es sind mehr als 930.000 an den Folgen der Erkrankung gestorben (Stand 15.09.2020).		Starting from the Chinese province of Hubei, 29.4 million people have now been infected worldwide, and more than 930,000 have died as a result of the disease (as of 15/09/2020).					184933
3	doc50	Das Virus verbreitet sich durch Tröpfcheninfektion sowie über Aerosole.		The virus spreads through droplets and aerosols.					184933
4	doc50	Enger Körperkontakt stellt daher ein deutlich erhöhtes Risiko für eine Übertragung dar.		Close contact with the body therefore presents a significantly increased risk of transmission.					5367941
5	doc50	Insbesondere bei Untersuchungen mit engem Körperkontakt sollten daher zum Schutz nicht nur der Patienten, sondern auch des medizinischen Personals Maßnahmen ergriffen werden.		Measures should therefore be taken to protect not only patients but also medical staff, particularly in the case of examinations involving close physical contact.					184933
6	doc50	In diesem Artikel werden die aktuellen Empfehlungen von internationalen Fachgesellschaften zur Verwendung von persönlicher Schutzausrüstung sowie ihre lokale Implementierung dargestellt.		This article presents the current recommendations of international professional associations on the use of personal protective equipment and their local implementation.					184933
1	doc51	Elektrische Unfälle und insbesondere daraus resultierende Kompartmentsyndrome sind herausfordernde Verletzungen in der klinischen Behandlung.		Electrical accidents, and in particular resulting compartment syndromes, are challenging injuries in clinical treatment.					184933
2	doc51	Kreatinkinase (CK) und Myoglobin sind bekannte Laborparameter zur Bestimmung eines Kompartmentsyndroms.		Creatine kinase (CK) and myoglobin are known laboratory parameters for determining compartment syndrome.					184933
3	doc51	Wir haben Patienten mit elektrischen Verletzungen zwischen 2006 und 2016 in unserer Verbrennungsklinik untersucht.		We examined patients with electrical injuries in our burn clinic between 2006 and 2016.					184933
4	doc51	Wir wollten die Rolle von Myostatin als Marker für das Kompartmentsyndrom durch Serummessungen innerhalb von 24 h nach der Verletzung analysieren.		We aimed to analyze the role of myostatin as a marker of compartment syndrome by serum measurements within 24 h after injury.					184933
5	doc51	Wir haben Daten von 24 Patienten erhoben, die mit einer elektrischen Hochspannungsverletzung stationär behandelt wurden.		We collected data from 24 patients, who were hospitalized with a high-voltage electrical injury.					184933
6	doc51	Von diesen 24 Patienten konnten wir bei 14 Patienten Myostatinkonzentrationen messen.		Of these 24 patients, we were able to measure myostatin concentrations in 14 patients.					5367941
7	doc51	Während CK-MB (Kreatinkinase Typ Muscle-Brain [MB]) keine signifikante Korrelation mit einem Kompartmentsyndrom zeigte, zeigten CK und Myostatin einen stark signifikanten Anstieg.		While CK-MB (creatine kinase type muscle-brain [MB]) showed no significant correlation with compartment syndrome, CK and myostatin showed a strongly significant increase.					184933
8	doc51	Interessanterweise war Myostatin bei elektrischen Verletzungen signifikant erhöht, jedoch nicht bei Verbrennungen, während CK keinen signifikanten Unterschied zeigte.		Interestingly, myostatin was significantly increased in electrical injuries but not in burns, while CK showed no significant difference.					184933
9	doc51	Neben CK kann Myostatin somit als zuverlässiger Frühmarker für das Kompartmentsyndrom bei elektrischen Verletzungen dienen.		Thus, in addition to CK, myostatin can serve as a reliable early marker for compartment syndrome in electrical injuries.					5367941
1	doc57	Der primäre Hyperaldosteronismus (PHA; Conn-Syndrom) ist der häufigste nachweisbare Grund für einen sekundären arteriellen Hypertonus.		Primary hyperaldosteronism (PHA; Conn's syndrome) is the most common cause of secondary arterial hypertension.					184933
2	doc57	Primäre Ursachen hierfür sind das Aldosteron-produzierende Adenom (APA) oder eine bilaterale adrenale Hyperplasie (BAH) mit jeweils unterschiedlicher therapeutischer Konsequenz.		The primary causes of this are aldosterone-producing adenoma (APA) or bilateral adrenal hyperplasia (BAH), each with different therapeutic consequences.					184933
3	doc57	Weder Screening- und Funktionstests noch die Schnittbildgebung können eine unilateral dominante Hormonproduktion nachweisen.		Neither screening and functional tests nor sectional imaging can detect unilaterally dominant hormone production.					184933
4	doc57	Neben einer klinischen Übersicht über Ätiologie, Diagnostik und Therapie des PHA werden in diesem Übersichtsartikel die Indikation, die Technik und der Stellenwert der selektiven Nebennierenvenenblutentnahme (NNVBE) ausführlich dargestellt und im Kontext aktueller Literatur diskutiert.		In addition to a clinical overview of the etiology, diagnosis and treatment of PHA, this review article presents in detail the indication, technology and significance of selective adrenal venous sampling (AVS) and discusses them in the context of current literature.					184933
5	doc57	Die NNVBE kann mit hoher Erfolgsrate eine unilaterale Dominanz nachweisen oder ausschließen.		AVS can prove or exclude unilateral dominance with a high success rate.					5367941
6	doc57	Patienten mit PHA und unilateralem APA können kurativ durch eine Adrenalektomie behandelt werden.		Patients with PHA and unilateral APA may be treated curatively by an adrenalectomy.					5367941
7	doc57	Die NNVBE ist eine etablierte Intervention zur Subtypisierung des PHA in eine unilaterale oder bilaterale Erkrankung der Nebenniere.		AVS is an established intervention for subtyping PHA into unilateral or bilateral adrenal disease.					5367941
8	doc57	· Die Nebennierenvenenblutentnahme (NNVBE) ist eine sichere, zuverlässige und minimalinvasive Methode zur Detektion einer unilateralen oder bilateralen Erkrankung der Nebenniere..		· Adrenal venous sampling (AVS) is a safe, reliable and minimally invasive method for detecting unilateral or bilateral disease of the adrenal gland.					5367941
9	doc57	· Der Nachweis einer Lateralisierung durch die NNVBE hat eine unmittelbare Relevanz für die kurative Therapie des primären Hyperaldosteronismus (PHA)..		· The detection of lateralization by AVS has an immediate relevance to the curative therapy of primary hyperaldosteronism (PHA).					184933
10	doc57	· Die NNVBE kann mit hoher Treffer- und Erfolgsrate ohne Kontrastmittelgabe und mit geringer Strahlenexposition in der Hand eines erfahrenen Untersuchers durchgeführt werden..		· AVS can be performed with high hit and success rates without contrast administration and with low radiation exposure in the hands of an experienced examiner..					184933
11	doc57	· Loberg C, Antoch G, Stegbauer J et al.		· Loberg C, Antoch G, Stegbauer J et al.					184933
12	doc57	Update: Selective adrenal venous sampling (AVS) – Indication, technique, and significance.		Update: Selective adrenal venous sampling (AVS) – Indication, technique, and significance.					184933
13	doc57	Fortschr Röntgenstr 2020;		X-ray Advancements 2020;					5367941
14	doc57	DOI: 10.1055/a-1299-1878.		DOI: 10.1055/a-1299-1878.					184933
1	doc58	Im Fokus des außerordentlichen Symposium-Webinars der Arbeitsgruppe urologische Forschung (AuF) stand der Themenkomplex „Forschung im Kontext zwischen Universität und Pharma“.		The extraordinary symposium webinar by the Urological Research Task Force (AuF) focused on the topic “Research in the Context between University and Pharma.”					184933
2	doc58	Die virtuelle Tagung widmete sich damit der bedeutenden und bisweilen weniger beachteten Herausforderung, die Brücke von der Laborbank in die Anwendung zu schlagen und Erfolg versprechende Ergebnisse aus universitären Forschungsprojekten gemeinsam mit der pharmazeutischen und medizintechnischen Industrie umzusetzen.		The virtual conference was dedicated to the important and sometimes less-noticed challenge of building the bridge from the laboratory bench to application and implementing promising results from university research projects together with the pharmaceutical and medical technology industry.					5367941
3	doc58	Dabei wurden verschiedene relevante Fragen und Problemstellungen definiert und diese sowohl aus der Perspektive von Projektleitern aus Kliniken und Laboren als auch von Managern der pharmazeutischen Industrie und aus dem Bereich des Patentrechts mit einem ebenso interdisziplinären Teilnehmerkreis aus Urologie, Pathologie und Naturwissenschaften erörtert.		Several relevant problems were defined and discussed from the perspective of project managers from clinics and laboratories as well as managers from the pharmaceutical industry and from the field of patent law with an equally interdisciplinary group of participants from urology, pathology and natural sciences.					184933
1	doc59	Thoraxschmerzen sind ein häufiges Symptom, mit dem sich Patienten in der hausärztlichen Praxis vorstellen.		Chest pains are a common symptom that patients present with in primary care practice.					5367941
2	doc59	Patienten mit akuten Brustschmerzen stellen eine diagnostische Herausforderung für den niedergelassenen Arzt dar, weil ein breites Spektrum von Diagnosen infrage kommt, vom lebensbedrohlichen akuten Myokardinfarkt und der Lungenarterienembolie bis hin zu wesentlich häufigeren Ursachen, wie einer harmlosen muskulären Verspannung aus der Gruppe der sogenannten Brustwandsyndrome oder gastrointestinalen Störungen, beispielsweise einer Refluxkrankheit.		Patients with acute chest pain pose a diagnostic challenge for the resident physician because a wide range of diagnoses can be considered, from life-threatening acute myocardial infarction and pulmonary artery embolism to much more common causes, such as harmless muscular tension from the group of so-called chest wall syndromes or gastrointestinal disorders Disorders, such as reflux disease.					184933
3	doc59	Die klinische Evaluation von Patienten mit akuten Brustschmerzen folgt unabhängig vom Ort der Untersuchung dem Prinzip einer gründlichen klinischen Einschätzung durch den Arzt mit körperlicher Untersuchung und Anamnese.		Regardless of the location of the examination, the clinical evaluation of patients with acute chest pain follows the principle of a thorough clinical assessment by the physician with a physical examination and anamnesis.					5367941
4	doc59	Darauf folgen weitere technische Untersuchungen wie ein 12-Kanal-Elektrokardiogramm und eine gezielte Labordiagnostik mit Point-of-care-Tests (unter anderem Troponin und D‑Dimere).		This is followed by further technical tests, such as a 12-channel electrocardiogram and targeted laboratory diagnostics with point-of-care tests (including troponin and D‑dimers).		This is followed by further technical tests, such as a <tag>12-channel electrocardiogram</tag> and targeted laboratory diagnostics with point-of-care tests (including troponin and D‑dimers).	Terminology - Wrong term	Minor	184933
5	doc59	Diagnostische Pfade und Score-Systeme wie der Marburger Herz-Score wurden eigens dafür entwickelt, in der hausärztlichen Praxis eine Einschätzung zu ermöglichen und Orientierung zu geben.		Diagnostic pathways and score systems such as the Marburg Heart Score were developed specifically to provide assessment and orientation in primary care practice.					184933
1	doc63	Im vorliegenden Artikel wird auf die Rolle von Alkohol in unserer Gesellschaft sowie auf dessen Bedeutung für Jugendliche eingegangen.		This article discusses the role of alcohol in our society and its importance to young people.					184933
2	doc63	Spezifika der Wechselwirkung von Alkohol und dem adoleszenten Gehirn werden erläutert und die epidemiologische Entwicklung des Alkoholkonsums bei österreichischen Minderjährigen beschrieben.		Specifics of the interaction between alcohol and the adolescent brain are explained and the epidemiological development of alcohol consumption in Austrian minors is described.					184933
3	doc63	Es werden darüber hinaus relevanteRisiken für problematische Konsummuster und mögliche Wege zur Prävention erörtert.		Relevant risks for problematic consumption patterns and possible paths to prevention are also discussed.					5367941
1	doc64	Die thermische Ablation der Stammvarikose hat sich zu einem Standardverfahren in der Behandlung des Krampfaderleidens entwickelt.		Thermal ablation of saphenous varicosis has become a standard procedure in the treatment of varicose vein disease.					184933
2	doc64	Der klinische Erfolg der endovenös-thermischen Verfahren ist vergleichbar mit der Stripping-Operation, ein signifikanter Unterschied zwischen diesen Gruppen konnte in Langzeitanalysen nicht nachgewiesen werden.		The clinical success of the endovenous-thermal procedures is comparable to the stripping operation, a significant difference between these groups could not be demonstrated in long-term analyses.					184933
3	doc64	Lediglich in der Genese der mit Duplexultraschall-detektierten Krossenrezidive gibt es einen Unterschied: Eine Neoangiogenese tritt nach Stripping-Operation auf, ein Rezidiv über eine belassene V. saphena accessoria anterior vorwiegend nach endovenöser Ablation der Stammvene.		There is only a difference in the genesis of crossus recurrences detected with duplex ultrasound: Neoangiogenesis occurs after stripping surgery, a recurrence of an untreated anterior saphenous vein, primarily after endovenous ablation of the saphenous vein.		There is only a difference in the <tag>genesis of crossus recurrences</tag> detected with duplex ultrasound: Neoangiogenesis occurs after stripping surgery, a recurrence of an untreated anterior saphenous vein, primarily after endovenous ablation of the saphenous vein.	Accuracy - Mistranslation	Critical	184933
4	doc64	Kosteneinsparungen durch vermehrt ambulant durchgeführte endovenöse Verfahren im Vergleich zur Stripping-Operation, die immer noch (im Vergleich zu anderen Ländern) in Deutschland oft stationär durchgeführt wird, sind inzwischen nachgewiesen.		Cost savings from endovenous procedures increasingly performed on an outpatient basis compared to stripping surgery, which is still often performed as an inpatient procedure in Germany (compared to other countries), have now been demonstrated.					5367941
5	doc64	Eine endovenöse Krossektomie sollte angestrebt werden.		An endovenous crossectomy should be sought.					184933
6	doc64	Nichtthermische endoluminale Katheterverfahren sind vorwiegend der Behandlung der V. saphena parva vorbehalten.		Non-thermal endoluminal catheter procedures are primarily reserved for the treatment of the small saphenous vein.					5367941
1	doc7	Von den klinisch verfügbaren Biomarkern sind die natriuretischen Peptide (NP) die robustesten Prädiktoren für die Diagnose und Prognose bei Herzinsuffizienz (HI).		Of the clinically available biomarkers, natriuretic peptides (NP) are the most robust predictors of heart failure (HF) diagnosis and prognosis.					5367941
2	doc7	Der prognostische Wert ist insbesondere bei serieller Bestimmung der NP hoch, sodass der klinische Einsatz in internationalen HI-Leitlinien mit höchster Evidenz und Empfehlung weiter in den Vordergrund gerückt ist.		The prognostic value is high, especially with serial determination of the NP, so that the clinical use in international HIV guidelines with the highest degree of evidence and recommendation has come to the fore.					5367941
3	doc7	Das Konzept der sequenziellen NP-Messungen dient der Erfassung der Natrium- und Wasserüberladung zu klinisch definierten Zeitpunkten.		The concept of sequential NP measurements is used to measure sodium and water overload at clinically defined time points.					5367941
4	doc7	Ziel eines NP-unterstützten Behandlungsplans ist, nicht nur die Dynamik des klinischen Therapieansprechens zu objektivieren, sondern den individuellen Therapieverlauf klinischen Szenarien zuzuordnen, die ihrerseits eine wesentliche Rolle für die Risikostratifizierung, Prognose und Notwendigkeiten von Therapieoptimierung in der stationären, aber auch ambulanten Versorgung spielen.		The goal of an NP-supported treatment plan is not only to objectify the dynamics of clinical response, but also to assign clinical scenarios to the individual course of therapy, which in turn play an essential role in the risk stratification, prognosis and necessities of therapy optimization in both inpatient and outpatient care.					5367941
1	doc70	HINTERGRUND: Die Versorgung von Patellafrakturen ist technisch anspruchsvoll.		BACKGROUND: The treatment of patellar fractures is technically demanding.					184933
2	doc70	Auch wenn die radiologischen Ergebnisse zumeist zufriedenstellend sind, deckt sich dies häufig nicht mit der subjektiven Einschätzung der Patienten.		Even if the radiological results are mostly satisfactory, this often does not correspond to the subjective assessment of the patients.					184933
3	doc70	Die klassische Versorgung mittels Drahtzuggurtung weist einige Komplikationen auf.		The classic restoration by means of wire tension strapping has some complications.					5367941
4	doc70	Die winkelstabile Plattenosteosynthese hat sich in den letzten Jahren biomechanisch als vorteilhaft erwiesen.		Fixed-angle plate osteosynthesis has proven to be biomechanically beneficial in recent years.					184933
5	doc70	Von wem werden Patellafrakturen in Deutschland versorgt?		Who treats patellar fractures in Germany?					5367941
6	doc70	Wie sieht der aktuelle Versorgungsstandard aus?		What is the current standard of care?					184933
7	doc70	Haben sich „moderne“ Osteosyntheseformen durchgesetzt?		Have "modern" forms of osteosynthesis prevailed?					184933
8	doc70	Was sind die häufigsten Komplikationen?		What are the most common complications?					184933
9	doc70	Die Mitglieder der Deutschen Gesellschaft für Orthopädie und Unfallchirurgie sowie der Deutschen Kniegesellschaft wurden aufgefordert, an einer Onlinebefragung teilzunehmen.		The members of the German Society for Orthopedics and Trauma Surgery and the German Knee Society were invited to participate in an online survey.					184933
10	doc70	Insgesamt wurden 511 komplett ausgefüllte Fragebogen ausgewertet.		A total of 511 completed questionnaires were evaluated.					184933
11	doc70	Die Befragten sind zum größten Teil auf Unfallchirurgie spezialisiert		Most of the respondents specialize in trauma surgery					184933
12	doc70	(51,5 %) und verfügen über langjährige Berufserfahrung in Traumazentren.		(51.5%) and have many years of professional experience in trauma centers.					184933
13	doc70	Die Hälfte der Operateure versorgt ≤5 Patellafrakturen jährlich.		Half of the surgeons treat ≤5 patellar fractures annually.					184933
14	doc70	In knapp 40 % der Fälle wird die präoperative Bildgebung um eine Computertomographie ergänzt.		In almost 40% of cases, preoperative imaging is supplemented by computed tomography.					184933
15	doc70	Die klassische Zuggurtung ist noch die bevorzugte Osteosyntheseform bei allen Frakturtypen		The classic tension band is still the preferred form of osteosynthesis for all fracture types					5367941
16	doc70	(Querfraktur 52 %, Mehrfragmentfrakturen 40 %). Bei Mehrfragmentfrakturen entscheiden sich 30 % der Operateure für eine winkelstabile Plattenosteosynthese.		(Transverse fracture 52%, multi-fragment fractures 40%). In the case of multi-fragment fractures, 30% of surgeons opt for fixed-angle plate osteosynthesis.					184933
17	doc70	Bei Beteiligung des kaudalen Pols dient als zusätzliche Sicherung die McLaughlin-Schlinge		If the caudal pole is involved, the McLaughlin sling serves as an additional fuse					184933
18	doc70	(60 %). Der Versorgungsstandard von Patellafrakturen in Deutschland entspricht weitgehend der aktualisierten S2e-Leitlinie.		(60%). The standard of care for patellar fractures in Germany is largely in line with the updated S2e guideline.					184933
19	doc70	Nach wie vor wird die klassische Zuggurtungsosteosynthese als Verfahren der Wahl genutzt.		Traditional tension-band wiring technique is still used as a method of choice.					5367941
20	doc70	Weitere klinische (Langzeit‑)Studien werden benötigt, um die Vorteile der winkelstabilen Plattenosteosynthese zu verifizieren.		Further clinical (long-term) studies are needed to verify the advantages of fixed-angle plate osteosynthesis.					5367941
1	doc71	Rückenschmerzen gehen mit erheblichen Beeinträchtigungen der Teilhabe einher, denen die medizinische Rehabilitation entgegenwirken soll.		Back pain is accompanied by significant impairment of participation, which medical rehabilitation is intended to counteract.					5367941
2	doc71	Es ist evident, dass das in Deutschland übliche Setting nicht für alle Zielgruppen effektiv ist.		It is evident that the setting commonly used in Germany is not effective for all target groups.					5367941
